,Poem Title,line
1654,I,"that the gods are a jealous race, and will not suffer one of their"
1655,I,kind to wed with a mortal mate. Therefore Orion fell by the unseen
1656,I,"arrows of Artemis, when fair Aurora chose him for her lord; and"
1657,I,"therefore Zeus slew Iasion with his lightning, because he was loved of"
1658,I,Demeter. Is not Odysseus mine? Did I not save him and cherish him when
1659,I,he was flung naked and helpless on these shores? But since no other
1660,I,"deity may evade or frustrate the will of Zeus, let him go, and I will"
1661,I,"show him how he may reach his own country without scathe."""
1662,I,
1663,I,"When he had heard Calypso's answer, Hermes took leave of her, and"
1664,I,"returned to Olympus, and the nymph went down to the part of the shore"
1665,I,where she knew Odysseus was accustomed to sit. There he would remain
1666,I,"all day, gazing tearfully over the barren waste of waters, and wearing"
1667,I,out his soul with ceaseless lamentation. For he had long grown weary
1668,I,"of his soft slavery in Calypso's cave, and yearned with exceeding"
1669,I,"great desire for the familiar hills of Ithaca, so rugged, but so dear."
1670,I,"And there Calypso found him now, sitting on a rock with dejected mien."
1671,I,"She sat down at his side, and said: ""A truce to thy complaints, thou"
1672,I,man of woes! Thou hast thy wish; I will let thee go with all
1673,I,"good-will, and I will show thee how to build a broad raft, which"
1674,I,shall bear thee across the misty deep. I will victual her with corn
1675,I,"and wine, and clothe thee in new garments, and send a breeze behind"
1676,I,"thee to waft thee safe. Thus am I commanded by the gods, whose"
1677,I,"dwelling is in the wide heaven, and their will I do. Up now and fell"
1678,I,"me yon tall trees for timber to make the raft."""
1679,I,
1680,I,"Odysseus was by nature a very shrewd and cautious man, and he feared"
1681,I,"that Calypso was contriving some mischief against him, in revenge for"
1682,I,"his coldness. He looked at her doubtfully, and answered: ""I fear thee,"
1683,I,"nymph, and I mistrust thy purpose. How shall a man cross this dreadful"
1684,I,"gulf, where no ship is ever seen, on a raft? And though that were"
1685,I,"possible, I will never leave thee against thy will. Swear to me now"
1686,I,"that thou intendest me no harm."""
1687,I,
1688,I,"Calypso smiled at his suspicions, and patted him on the shoulder as"
1689,I,"she answered: ""Thou art a sad rogue, and very deep of wit, as anyone"
1690,I,"may see by these words of thine. Now hear me swear: Witness, thou"
1691,I,"earth, and the wide heaven above us, and the dark waterfall of Styx,"
1692,I,"the greatest and most awful thing by which a god may swear, that I"
1693,I,"intend no ill, but only good, to this man."""
1694,I,
1695,I,"Having sworn that oath Calypso rose, and bidding Odysseus follow led"
1696,I,"the way to her cave. There she set meat before him, such as mortal men"
1697,I,"eat, and wine to drink; but she herself was served by her handmaids"
1698,I,"with immortal food, and nectar, the wine of the gods. When they had"
1699,I,"supped, Calypso looked at Odysseus and said: ""And wilt thou indeed"
1700,I,"leave me, thou strange man? Am I not tall and fair, and worthy to be"
1701,I,"called a daughter of heaven? And is thy Penelope so rare a dame, that"
1702,I,thou preferrest her to me! Ah! if thou knewest all the toils which
1703,I,"await thee before thou reachest thy home, and all the perils prepared"
1704,I,"for thee there, thou wouldst renounce thy purpose, and dwell for ever"
1705,I,"with me. Nevertheless go, if go thou must, and my blessing go with"
1706,I,"thee."""
1707,I,
1708,I,"Her words were kind, but some anger lurked in her tone, which Odysseus"
1709,I,"hastened to appease. ""Fair goddess,"" he answered, ""be not wroth with"
1710,I,me. I know that thou art more lovely far than my wife Penelope; for
1711,I,"thou art divine, and she is but a mortal woman. Nevertheless I long"
1712,I,"day and night to see her face, and to sit beneath the shadow of my own"
1713,I,rooftree. And if I be stricken again by the hand of Heaven on the
1714,I,"purple sea, I will bear it, for I have a very patient heart. Long have"
1715,I,"I toiled, and much have I suffered, amid waves and wars. If more"
1716,I,"remains, I will endure that also."""
1717,I,
1718,II,II
1719,II,
1720,II,"At early dawn, when the eastern wave was just silvered by the dim"
1721,II,"light, Calypso roused Odysseus, and equipped him for the task of the"
1722,II,"day. First she gave him a weighty two-edged axe, well balanced on its"
1723,II,"haft of olive-wood, and an adze, freshly ground; then she showed him"
1724,II,"where the tall trees grew, and bade him fall to work with the axe."
1725,II,"Twenty great trees fell beneath his sturdy strokes, and he trimmed the"
1726,II,"trunks with the axe, and stripped off the bark. Meanwhile Calypso had"
1727,II,"brought him an augur, and he bored the timbers, and fitted them"
1728,II,"together, and fastened them with bolts and cross-pieces. So the raft"
1729,II,"grew under his hands, broad as the floor of a stout merchantship. And"
1730,II,"he fenced her with bulwarks, piling up blocks of wood to steady them."
1731,II,Last of all he made mast and sail and rigging; and when all was ready
1732,II,he thrust the frail vessel with rollers and levers down to the sea.
1733,II,
1734,II,Four times the sun had risen and set before his labour was ended; and
1735,II,"on the fifth day Calypso brought him provisions for the voyage, a"
1736,II,"great goatskin bottle full of water, and a smaller one of wine, and a"
1737,II,"sack of corn, with other choice viands as a relish to his bread."
1738,II,
1739,II,"A joyful man was Odysseus when he spread his sail, and took his place"
1740,II,"at the helm, and waved a last farewell to his gentle friend. A fair"
1741,II,"breeze wafted him swiftly from the shore, and ere long that lovely"
1742,II,"island, at once his home and his prison for seven long years, became a"
1743,II,"mere shadow in the distance. All night he sat sleepless, tiller in"
1744,II,"hand, watching the pilot stars, the Pleiades, and Boötes, and the"
1745,II,"Bear, named also the Wain, which turns on one spot, and watches Orion,"
1746,II,and never dips into the ocean stream. For the goddess Calypso had
1747,II,bidden him keep that star on the left hand as he sailed the seas. Thus
1748,II,"he voyaged for seventeen days, and on the eighteenth he saw afar off,"
1749,II,"dimly outlined, a range of hills, rising, like the back of a shield,"
1750,II,above the horizon's verge.
1751,II,
1752,II,"Now Poseidon, his great enemy, had been absent for many days on a far"
1753,II,"journey, and thus had taken no part in the council at Olympus when"
1754,II,Zeus had issued his order for the release of Odysseus. Just at this
1755,II,"time he was on his way back to Olympus, and caught sight of the bold"
1756,II,"voyager steering towards the nearest land. ""Ha! art thou there?"" said"
1757,II,"the implacable god, shaking his head; ""and have the other powers"
1758,II,"plotted against me in my absence, to frustrate my just anger? Thy"
1759,II,"wanderings are well-nigh over, poor wretch! But thou shalt taste once"
1760,II,"more of my vengeance, before thou reachest yonder shore."""
1761,II,
1762,II,So saying the lord of ocean took his trident and stirred up the deep;
1763,II,"and the clouds came trooping at his call, covering the sky with a"
1764,II,"black curtain. Soon a great tempest broke loose, blowing in violent"
1765,II,and fitful blasts from all the four quarters of heaven. Then pale fear
1766,II,"got hold of Odysseus, as he saw the great curling billows heaving"
1767,II,"round his frail craft. ""Woe is me!"" he cried, ""when shall my troubles"
1768,II,"have an end? Surely the goddess spoke truth, when she foretold me that"
1769,II,"I should perish amid the waves, and never see my home again. Here I"
1770,II,"lie helpless, given over to destruction, the sport of all the winds of"
1771,II,"heaven. Happy, thrice happy, were my comrades who fell fighting"
1772,II,bravely and found honourable burial in the soil of Troy! Would that I
1773,II,had died on that great day when the battle raged fiercest over the
1774,II,"body of Pelides; then should I have found death with honour, but now I"
1775,II,"am doomed to a miserable and dishonoured end."""
1776,II,
1777,II,The words were hardly uttered when a huge toppling wave struck the
1778,II,"raft with tremendous force, carrying away mast and sail, and hurling"
1779,II,"Odysseus into the sea. Deep down he sank, and the waters darkened over"
1780,II,"his head, for he was encumbered by the weight of his clothes. At last"
1781,II,"he rose to the surface, gasping, and spitting out the brine, and"
1782,II,"though sore spent, he swam towards the raft, and hauled himself on"
1783,II,"board. There he sat clinging to the dismasted and rudderless vessel,"
1784,II,"which was tossed to and fro from wave to wave, as the winds of autumn"
1785,II,sport with the light thistledown and drive it hither and thither.
1786,II,
1787,II,"But help was at hand. There was a certain ocean nymph, named Ino,"
1788,II,"daughter of Cadmus, who had once been a mortal woman, but now was"
1789,II,"numbered among the immortal powers. She saw and pitied Odysseus, and"
1790,II,"boarding the raft addressed him in this wise: ""Poor man, why is"
1791,II,Poseidon so wroth with thee that he maltreats thee thus? Yet shall he
1792,II,"not destroy thee, for all his malice. Only do as I bid thee, and thou"
1793,II,"shalt get safely to land: take this veil, and when thou hast stripped"
1794,II,"off thy garments, bind it across thy breast. Then leave the raft to"
1795,II,"its fate, and swim manfully to land; and when thou art safe fling the"
1796,II,"veil back into the sea, and go thy way."""
1797,II,
1798,II,"So saying the goddess sank beneath the waves, leaving Odysseus with"
1799,II,her veil in his hand. But that cautious veteran did not at once act on
1800,II,"her advice, for he feared that some treachery was intended against"
1801,II,him. He resolved therefore to remain on the raft as long as her
1802,II,"timbers held together, and only to have recourse to the veil in the"
1803,II,last extremity.
1804,II,
1805,II,"He had just taken this prudent resolution, when another wave, more"
1806,II,"huge than the last, thundered down on the raft, scattering her"
1807,II,"timbers, as the wind scatters a heap of chaff. Odysseus clung fast to"
1808,II,"one beam and, mounting it, sat astride as on a horse, until he had"
1809,II,"stripped off his clothes. Then he bound the veil round him, flung"
1810,II,"himself head foremost into the billows, and swam lustily towards land."
1811,II,
1812,II,"The storm was now subsiding, and a steady breeze succeeded, blowing"
1813,II,"from the north, which helped that much-tried hero in his struggle for"
1814,II,"life. Yet for two days and two nights he battled with the waves, and"
1815,II,when day broke on the third day he found himself close under a
1816,II,"frowning wall of cliffs, at whose foot the sea was breaking with a"
1817,II,"noise like thunder. Odysseus ceased swimming, and trod the water,"
1818,II,looking anxiously round for an opening in the cliffs where he might
1819,II,"land. While he hesitated, a great foaming wave came rushing landward,"
1820,II,threatening to sweep him against that rugged shore; but Odysseus saw
1821,II,"his danger in time, and succeeded in gaining a rocky mass which stood"
1822,II,"above the surface just before him, and clutching it with hands and"
1823,II,"knees, contrived to keep his hold until the huge billow was past. In"
1824,II,"another moment he was caught by the recoil of the wave, and flung back"
1825,II,"into the boiling surf, with fingers torn and bleeding. With desperate"
1826,II,"exertions he fought his way out into the comparatively calm water,"
1827,II,"outside the line of breakers, and swam parallel to the shore, until he"
1828,II,"saw with delight a sheltered inlet, whence a river flowed into the"
1829,II,"sea. Murmuring a prayer to the god of the river he steered for land,"
1830,II,"and a few strokes brought him to a smooth sandy beach, where he lay"
1831,II,for a long time without sense or motion. All his flesh was swollen by
1832,II,"his long immersion in the water, the skin was stripped from his hands,"
1833,II,and when his breath came back to him he felt as weak as a child. Then
1834,II,"a deadly nausea came over him, and the water which he had swallowed"
1835,II,"gushed up through his mouth and nostrils. Somewhat relieved by this,"
1836,II,"he rose to his feet, and tottering to the river's brink loosed the"
1837,II,"veil from his waist, and dropped it into the flowing water. For he"
1838,II,"remembered the request of Ino, to whom he owed his life."
1839,II,
1840,II,He had indeed escaped the sea; but his position seemed almost
1841,II,"hopeless. There he lay, naked, and more dead than alive, without food"
1842,II,"or shelter, in a strange land, without a sign of human habitation in"
1843,II,view. Crawling painfully to a bed of rushes he lay down and considered
1844,II,"what was best for him to do. He could not remain where he was, for it"
1845,II,"was an exposed place, with no protection from the dew, and open to the"
1846,II,"chill breeze from the river, which blows at early dawn. A few hours of"
1847,II,"such a vigil would certainly kill him in his exhausted state. If, on"
1848,II,"the other hand, he sought the shelter of the woods, he feared that he"
1849,II,would fall a prey to some prowling beast.
1850,II,
1851,II,"At last he determined to face the less certain peril, and made his way"
1852,II,into a thicket not far from the river side. Searching for a place
1853,II,"where he might lie he soon came upon two dense bushes of olive, whose"
1854,II,leaves and branches were so closely interwoven that they formed a sort
1855,II,"of natural arbour, impenetrable by sun, or rain, or wind. ""In good"
1856,II,"time!"" murmured Odysseus, as he crept beneath that green roof, and"
1857,II,scooped out a deep bed for himself in the fallen leaves. There he lay
1858,II,"down, and piled the leaves high over him. And as a careful housewife"
1859,II,"in some remote farmhouse, where there are no neighbours near, covers"
1860,II,"up a burning brand among the ashes, so that it may last all night, and"
1861,II,"preserve the seed of fire; so lay Odysseus, nursing the spark of life,"
1862,II,in his deep bed of leaves. And soon he forgot all his troubles in a
1863,II,deep and dreamless sleep.
1864,II,
1865,II,
1866,II,
1867,II,
1868,II,Odysseus among the Phæacians
1869,II,
1870,II,
1871,I,I
1872,I,
1873,I,The land on which Odysseus had thus been cast like a piece of broken
1874,I,"wreckage was called Phæacia, and derived its name from the Phæacians,"
1875,I,"a race of famous mariners, who had settled there some fifty years"
1876,I,"before, having been driven from their former seat by the Cyclopes, a"
1877,I,"savage tribe, who dwelt on their borders. The Phæacians were an"
1878,I,"unwarlike people, and being in no condition to resist the fierce"
1879,I,"assaults of these lawless neighbours, they abandoned their homes and"
1880,I,"built a new city on a little peninsula, connected with the mainland by"
1881,I,a narrow isthmus. Defended by strong walls they were now safe against
1882,I,"all attacks, and they soon grew rich and prosperous in the exercise of"
1883,I,a thriving trade.
1884,I,
1885,I,"At this time the king of the Phæacians was Alcinous, who had a fair"
1886,I,"daughter, named Nausicaä. On the night when Odysseus lay couched in"
1887,I,"his bed of leaves Nausicaä was sleeping in her bower, and with her"
1888,I,"were two handmaids, whose beds were set on either side of the door."
1889,I,"And in a dream she seemed to hear one of her girlish friends, the"
1890,I,"daughter of a neighbouring house, speaking to her thus: ""Nausicaä, why"
1891,I,art thou grown so careless as to suffer all the raiment in thy
1892,I,"father's house to remain unwashen, when thy bridal day is so near?"
1893,I,"Wouldst thou be wedded in soiled attire, and have all thy friends clad"
1894,I,"unseemly, to put thee to shame? These are a woman's cares, by which"
1895,I,"she wins a good report among men, and gladdens her mother's heart."
1896,I,"Arise, therefore, at break of day, and beg thy father to let harness"
1897,I,"the mules to the wain, that thou mayest take the linen to the place of"
1898,I,"washing, far away by the river's side. I will go with thee, and help"
1899,I,"thee in the work."""
1900,I,
1901,I,"So dreamed Nausicaä, and so spake the vision. But the voice which"
1902,I,seemed the voice of her friend came from no mortal lips; it was Athene
1903,I,"herself who had visited the maiden's bower, in her care for Odysseus,"
1904,I,that he might get safe conduct to the city of the Phæacians. And when
1905,I,"she had done her errand the goddess went back to Olympus, where is the"
1906,I,"steadfast, everlasting seat of the blessed gods, not shaken of any"
1907,I,"wind, nor wet with rain, nor chilled by snow, but steeped for ever in"
1908,I,"cloudless, sunny air. There the gods abide for ever and take their"
1909,I,delight.
1910,I,
1911,I,"Nausicaä rose betimes, with her mind full of the dream, and went down"
1912,I,"to the hall, where she found her mother sitting by the hearth with her"
1913,I,"women, spinning the bright sea-purple thread. Inquiring for her father"
1914,I,she learnt that he had but that moment gone forth to attend the
1915,I,"council of elders, and hastening after him she found him before the"
1916,I,doors of the house.
1917,I,
1918,I,"""Father,"" she said, ""may I have the waggon to take the household"
1919,I,raiment to the place of washing? Thou thyself hast ever need of clean
1920,I,"garments when thou goest to the council, and my brothers will reproach"
1921,I,"me if they lack clean raiment when they go to the dance."""
1922,I,
1923,I,"Thus spake the maiden, being ashamed to make mention of her own"
1924,I,"marriage. But Alcinous knew, and smiled to himself, as he ordered his"
1925,I,"thralls to prepare the waggon. So when they had harnessed the mules,"
1926,I,"Nausicaä and her handmaids brought the soiled garments, and bestowed"
1927,I,them behind the seat. And her mother brought a basket with food for
1928,I,the midday meal and oil for her daughter and the other maidens when
1929,I,"they took their bath. Then they took their seats, Nausicaä grasped the"
1930,I,"reins, and they went off at a sharp trot towards the riverside."
1931,I,
1932,I,"After a pleasant drive, they came to the place where stood a row of"
1933,I,"cisterns on the river's bank. There they unharnessed the mules, and"
1934,I,left them to crop the sweet clover in the water-meadows. Then they
1935,I,"unloaded the waggon, threw the garments into washing-troughs, and trod"
1936,I,"them with their feet until they were thoroughly cleansed, and having"
1937,I,"wrung them out, they spread them on the white pebbly beach to dry."
1938,I,"While the garments were bleaching in the wholesome sun and air, they"
1939,I,"took their bath, and afterwards sat down to the midday meal. When that"
1940,I,"was ended, they threw off their veils, and stood up to play at ball."
1941,I,
1942,I,"It was a pretty and graceful sight; they were all comely maidens,"
1943,I,glowing with youth and health. Their sport was accompanied by dance
1944,I,"and song, and as they chased the flying ball, keeping time with hand"
1945,I,"and foot and voice, they seemed like a choir of mountain nymphs, led"
1946,I,"by Artemis, when she goes forth to the chase, in the wild valleys of"
1947,I,"Arcady or Lacedæmon. Tallest and fairest of them all was Nausicaä, who"
1948,I,"led the sport, moving like a queen among her vassals."
1949,I,
1950,I,"Presently they grew tired of their sport, and Nausicaä flung the ball"
1951,I,"for the last time to one of her handmaids. The girl missed the ball,"
1952,I,"and it fell into the middle of the river, whereupon the whole company"
1953,I,"set up a sharp cry. The sound came to the ears of Odysseus, and woke"
1954,I,him from his long slumber. He sat up in his bed of leaves and communed
1955,I,"with himself: ""Behold I hear the shrill cry of women, or perhaps of"
1956,I,the nymphs who haunt this wild place. Now may I learn of what sort are
1957,I,"the natives of this land, whether they be fierce and inhospitable, or"
1958,I,"gentle and kind to strangers."" Plucking a leafy bough, and holding it"
1959,I,"before him to cover himself, he stepped forth from the thicket, and"
1960,I,"came in sight of that gentle company. Grim and dreadful he looked,"
1961,I,"like a hungry lion, buffeted by rain and wind, who goes forth in a"
1962,I,"tempest to seek his prey; for he was haggard with long fasting, and"
1963,I,sore disfigured by his battle with the sea; his eyes glared with
1964,I,"famine, and his hair and beard hung ragged and unkempt about his face."
1965,I,At this fearful apparition the maidens fled shrieking along the river
1966,I,"bank, all but Nausicaä, who stood her ground, and gazed fearlessly,"
1967,I,"though in wonder, while Odysseus came slowly forward. When he was"
1968,I,"still some way off he stopped, fearing to offend her delicacy if he"
1969,I,"came nearer. Then with a gesture of entreaty he began to speak, and"
1970,I,Nausicaä knew at once that it was no common man who stood before her.
1971,I,
1972,I,"""Have pity on me, O queen!"" he began, in soft and insinuating tones."
1973,I,"""Art thou a goddess, or a mortal woman? If thou art a goddess, thou"
1974,I,"seemest to me most like to Artemis, daughter of great Zeus, both in"
1975,I,"face, and in stature, and in form. But if thou art mortal, then thrice"
1976,I,"blessed are thy father and mother, and thrice blessed thy brethren,"
1977,I,"and their spirits are refreshed because of thee, when thou goest, a"
1978,I,"very rose of beauty, to the dance. Happy the man who wins thee for his"
1979,I,bride! Never yet have I seen the like of thee among all the children
1980,I,"of men. Only once have I beheld aught to compare unto thee, a young"
1981,I,palm-tree which I saw growing tall and straight by the altar of Apollo
1982,I,"at Delos. I saw it, and was amazed, for it was wondrous fair; and even"
1983,I,"so is my soul filled with wonder and dread when I look upon thy face,"
1984,I,"so that I am afraid to draw near unto thee, though sore is my need."
1985,I,"Yesterday I was flung naked on thy coast, after a voyage of twenty"
1986,I,"days. Many things have I suffered, and more, I ween, remains for me in"
1987,I,"store; for I am a man of many woes. Have compassion on me, dread lady!"
1988,I,"I am thy suppliant, and to thee first I address my prayer. Show me the"
1989,I,"way to the city, and give me a cloth to wrap round me, that I may go"
1990,I,"among the people without shame. And may the gods give thee all,"
1991,I,"whatsoever thy heart desireth, a husband and a home, and happy wedded"
1992,I,"love, shedding warmth in thine house, and a strong defence against all"
1993,I,"ills from without, but above all a sacred treasure in thy husband's"
1994,I,"heart, and in thine."""
1995,I,
1996,I,"""Whatever be thy misfortunes,"" answered Nausicaä, ""I am sure they are"
1997,I,not the fruit of thine own folly or wickedness. And since thou art
1998,I,"come as a suppliant to this land of ours, thou shalt want nothing,"
1999,I,"whether it be raiment, or aught else that befits thy state. I will"
2000,I,"show thee our city, and tell thee the name of the people. Know that"
2001,I,"thou hast come to the country of the Phæacians, whose ruler and king"
2002,I,"is Alcinous, and I am his daughter."""
2003,I,
2004,I,"Then she called to her handmaids, who were looking on, half"
2005,I,"frightened, half curious, from behind rocks and trees, a long way off,"
2006,I,"ready to resume their flight at the slightest alarm: ""Come hither, and"
2007,I,fear not the man; neither he nor any other shall ever come to this
2008,I,land with thoughts of harm; for we are very dear to the immortal gods.
2009,I,"Far away we dwell amidst the rolling seas, remote from the haunts of"
2010,I,"men. But this is some hapless wanderer, driven by chance to our"
2011,I,"shores, and we must cherish him, for from Zeus come all strangers and"
2012,I,"beggars, and a little gift is a great thing to them. Take the stranger"
2013,I,"to a sheltered place, where he may wash and dress him, and give him"
2014,I,"wherewithal to clothe himself, and after that, meat and drink."""
2015,I,
2016,I,When they heard the words of their mistress the girls came stealing
2017,I,"timidly back, one by one. And they gave Odysseus clean raiment, and"
2018,I,"when he had washed and clothed himself, he came back to the place"
2019,I,where Nausicaä was waiting. Wonderful was the change which had been
2020,I,made in his appearance by the refreshing bath and fitting apparel.
2021,I,"Instead of the squalid, battered wretch who had begged for countenance"
2022,I,"and shelter, Nausicaä saw before her a stalwart, stately man,"
2023,I,"broad-shouldered, and deep of chest, with dark clustering hair and"
2024,I,"beard, like the curling hyacinth, and an air of majesty and command."
2025,I,
2026,I,"""Hear me, friends,"" whispered Nausicaä, as she saw him coming,"
2027,I,"""methinks some god hath wrought a miracle on this man, who but now was"
2028,I,so hideous to behold. Would that we might prevail with him to make his
2029,I,abode among us! She would be a proud maiden who should wed with such
2030,I,"as him. Now give the stranger food and drink."" And they did so, and"
2031,I,"Odysseus ate and drank with keen appetite, having tasted nothing for"
2032,I,"many days. While he was eating, the maidens folded the garments and"
2033,I,"placed them in the waggon, and when he had finished, Nausicaä mounted"
