,Poem Title,line
4786,III,"sat, and taken food and drink from his hand. Therefore I love"
4787,III,"Telemachus as a brother, and I swear to thee that none of the wooers"
4788,III,"shall do him any harm."""
4789,III,
4790,III,
4791,III,
4792,III,
4793,III,The Home-coming of Odysseus
4794,III,
4795,III,
4796,I,I
4797,I,
4798,I,"When Eumæus came back from his errand, Odysseus, who in the meantime"
4799,I,"had resumed his disguise, was helping Telemachus to prepare the"
4800,I,evening meal. Telemachus questioned him about the ship which the
4801,I,"wooers had sent out to waylay him on his return from Pylos, but Eumæus"
4802,I,had been in such haste to get back to his farm that he had not stopped
4803,I,"to inquire about the matter. ""But thus much I can tell thee,"" he said:"
4804,I,"""as I was crossing the hill which overlooks the town I saw a galley,"
4805,I,"bristling with spear and helm, entering the harbour; and I believe"
4806,I,"that this was the ship of which thou speakest"""
4807,I,
4808,I,"""No doubt of it,"" answered Telemachus, with a significant glance at"
4809,I,"his father. Then they all fell to their suppers with hearty appetite,"
4810,I,and soon afterwards retired to rest.
4811,I,
4812,I,The first chill of dawn was still in the air when Telemachus roused
4813,I,"the swineherd, and announced his intention of proceeding at once to"
4814,I,"the town. ""I know,"" he said, ""that my mother will have no peace until"
4815,I,"she sees me with her own eyes. Now as to this stranger, I charge thee"
4816,I,"to take him with thee into the town, that he may beg his bread from"
4817,I,"house to house. Burdened as I am already, and full of care, I cannot"
4818,I,"provide for him. If he thinks it hard, all the worse for him."""
4819,I,
4820,I,"""Thou sayest well,"" answered Odysseus; ""I have no mind to remain here."
4821,I,"I am too old to take orders from a master, and it is better to beg my"
4822,I,"living in the town than in the fields. Therefore I will go, when I"
4823,I,"have warmed me at the fire, and the sun is up; for I am ill equipped"
4824,I,"to face the frosts of morning."""
4825,I,
4826,I,"Away went Telemachus, covering the ground with rapid strides, his mind"
4827,I,occupied all the way with thoughts of vengeance against the wooers.
4828,I,The first who saw him when he crossed the threshold of his home was
4829,I,"his old nurse, Eurycleia, who was just then spreading fleeces on the"
4830,I,seats in the great hall. With a cry of joy she ran and fell on his
4831,I,"neck, and kissed him; and all the faithful handmaids of Penelope"
4832,I,crowded round to welcome their young master home. The sound of their
4833,I,"voices reached the ears of Penelope, and with swift steps she came"
4834,I,"gliding into the hall, fair as Artemis, or golden Aphrodite. When she"
4835,I,saw Telemachus she flung her arms round his neck and covered his face
4836,I,"with kisses. ""Welcome,"" she sobbed, ""Telemachus, my heart's darling,"
4837,I,"restored to me beyond all hope! Say, hast thou brought any news of thy"
4838,I,"father?"""
4839,I,
4840,I,But Telemachus was too full of the stern task which lay before him to
4841,I,leave room for softer emotions. Gently extricating himself from his
4842,I,"mother's embrace he said: ""Dear mother, thou shalt hear all in due"
4843,I,"season; at present I have other work to do. Go thou to thy chamber,"
4844,I,"and put on clean raiment, and when thou hast purified thyself pray to"
4845,I,all the immortal gods to hasten the day of atonement for those who
4846,I,"have wronged our house. I will return presently, when I have done my"
4847,I,"business in the town."""
4848,I,
4849,I,"The gentle Penelope went to do her son's bidding, and Telemachus"
4850,I,"started for the town, with two hounds following close at his heels. He"
4851,I,"seemed taller and manlier after his short absence, and many an eye"
4852,I,followed him with wonder as he passed through the streets. Presently
4853,I,"he came to the place where the wooers were assembled, and they came"
4854,I,crowding about him with false words of welcome. But he turned his back
4855,I,"on them with scorn, and seeing a little group of his father's friends,"
4856,I,"among whom were Mentor and the aged Halitherses, he went and sat down"
4857,I,"among them. While they were questioning him about his travels, Peiræus"
4858,I,"came up, bringing with him the seer, Theoclymenus, whom Telemachus had"
4859,I,"left in his charge the day before. ""I restore to thee thy guest,"" said"
4860,I,"Peiræus, ""who has been entertained in all honour at my house; and if"
4861,I,"thou wilt send thy handmaids, I will deliver unto them the treasure"
4862,I,"which thou hast brought with thee from Pylos."""
4863,I,
4864,I,"""I thank thee,"" answered Telemachus; ""Theoclymenus shall go with me;"
4865,I,"but as to the treasure, do thou keep it for me until these evil days"
4866,I,"are passed. If aught untoward befall me, I had rather it remained with"
4867,I,"thee than that it should fall into the hands of the wooers."""
4868,I,
4869,I,"Having taken leave of his friends, he returned to the house, taking"
4870,I,Theoclymenus with him. And when they had bathed and put on fresh
4871,I,"raiment, they sat down to meat. The meal proceeded in silence, and at"
4872,I,"last Penelope, who was sitting near, busy with her distaff, and"
4873,I,"longing impatiently to hear her son's news, said in a tone of"
4874,I,"displeasure: ""Hast thou no word for thy mother, Telemachus? Or art"
4875,I,thou keeping thy tidings until the wooers return? Surely I thought in
4876,I,this rare interval of quiet to hear how thou hast fared and what thou
4877,I,"hast learnt on this journey. But if thou hast naught to tell me, I"
4878,I,"will go to my widowed bed, and weep away the hours until dawn."""
4879,I,
4880,I,"Roused from his reverie by his mother's reproaches, Telemachus gave a"
4881,I,"brief account of his visit to Nestor and Menelaus, and of what they"
4882,I,"had told him. Penelope was musing on her son's report, when"
4883,I,"Theoclymenus, the second-sighted man, started up from his seat, and"
4884,I,"cried: ""I see him, I see him! He is landed in Ithaca, he is coming"
4885,I,"hither, he is here! Woe unto the suitors! Their hour is at hand, and"
4886,I,"not one of them shall escape."""
4887,I,
4888,I,Penelope had heard such prophecies too often to pay much heed to the
4889,I,"seer's vision. ""Ah! my friend,"" she said, with a sad smile, ""I can but"
4890,I,"pray that thy words will be fulfilled; if ever they are, it shall be a"
4891,I,"happy day for thee."""
4892,I,
4893,I,"At this moment the wooers came trooping in, filling the house with"
4894,I,riot and uproar; and there was an end of all quiet converse for that
4895,I,day.
4896,I,
4897,II,II
4898,II,
4899,II,It was past noon before Odysseus and Eumæus set out for the town; for
4900,II,"Eumæus had conceived a great liking for his guest, and listened with"
4901,II,"delight to his wonderful tales of adventure. ""Come,"" he said at last,"
4902,II,"when Odysseus had finished one of his long stories. ""It is time to be"
4903,II,"going, though I would willingly have kept thee here. But my young lord"
4904,II,"has spoken and we must obey."" ""Lead on,"" said Odysseus, ""I know what"
4905,II,"thou wouldst say; but first give me a staff to lean on, for I heard"
4906,II,"thee say that the path was rough."""
4907,II,
4908,II,"So saying he threw his tattered wallet over his shoulder, and taking a"
4909,II,"stout staff, which Eumæus offered him, started with his friend across"
4910,II,the hills. After a toilsome walk they reached the top of the hill
4911,II,"which overlooked the town, and descending the slope they came to a"
4912,II,"copious spring of water, well fenced with stones, and shaded by a"
4913,II,grove of alders. The water descended into a basin from the face of a
4914,II,rock in a cool and copious stream; and on either side stood an altar
4915,II,"to the nymphs. ""It is the common fountain of the townspeople,"""
4916,II,"explained Eumæus. ""The altars and the basin which receives the water"
4917,II,"are the work of our ancient kings."""
4918,II,
4919,II,"Odysseus paused a moment, lost in the memories which were awakened by"
4920,II,that familiar scene. But his reverie was rudely interrupted. While he
4921,II,"stood gazing at the fountain, he heard a rude voice hailing them from"
4922,II,"the road, and looking round he saw a man leading a pair of fine goats"
4923,II,"towards the town. It was Melanthius, his own goatherd, who was"
4924,II,bringing the best of his flock to make savoury meat for the wooers.
4925,II,
4926,II,"""Here are two birds of a feather!"" shouted the fellow, in jeering"
4927,II,"tones--""that wretched swineherd, and a ravenous beggar. A fine guest"
4928,II,"thou art bringing to our young masters, and a fair welcome, without"
4929,II,"doubt, they will give him. Were it not better that I took him with me"
4930,II,"to my farm? He could sweep out the pens, and gather green shoots for"
4931,II,"the kids; and we would give him whey to drink, and put some flesh on"
4932,II,these shrunk shanks[1] of his. But the lazy knave will do no work; he
4933,II,"would rather rub his shoulders against every door-post, begging for"
4934,II,"broken meat. Broken bones will be his portion, if the wooers see him"
4935,II,"near the house of Odysseus."""
4936,II,
4937,II,"[Footnote 1: ""A world too wide for his shrunk shanks,""--Shakespeare:"
4938,II,"""As You Like It.""]"
4939,II,
4940,II,While he uttered these taunts Melanthius had gradually come close to
4941,II,"Odysseus, and with the last word he lifted up his foot and kicked him"
4942,II,"with all his force on the hip. Odysseus stood like a rock, and stirred"
4943,II,not an inch from his ground; his first impulse was to seize the
4944,II,"ruffian by the ankles, and dash out his brains on the road; but he"
4945,II,"checked himself with a great effort, and said not a word."
4946,II,
4947,II,"But Eumæus rebuked the goatherd, and invoked the vengeance of heaven"
4948,II,"against him. ""Would that our noble master were here!"" he cried, ""he"
4949,II,"would soon make an end of thee, thou braggart! Unfaithful herdsman,"
4950,II,"that rovest ever about the town, leaving thy flock to underlings!"""
4951,II,
4952,II,"""Go to, thou dog!"" retorted Melanthius, with a savage laugh. ""Wilt"
4953,II,thou be ever harping on that string? Thy noble master is dust long
4954,II,"ago, and I would that Telemachus were lying with him. As for thee, I"
4955,II,"will one day cast thee bound into a ship, and sell thee across the"
4956,II,"seas for a great price."""
4957,II,
4958,II,"With that he left them, and stepped briskly out towards the house,"
4959,II,while Odysseus and Eumæus followed more slowly. Presently they came to
4960,II,"an extensive enclosure, standing conspicuously on a high level plateau"
4961,II,overlooking the town. Behind the fence towered the roof of a great
4962,II,"timber house. They passed through the outer gates, and as they entered"
4963,II,"the courtyard they heard the sounds of a harp, and the steam of roast"
4964,II,flesh was borne to their nostrils.
4965,II,
4966,II,"""Take heed now,"" said Eumæus, lowering his voice, as they approached"
4967,II,"the door of the house. ""I will go in first, and do thou follow me"
4968,II,"close, lest anyone find thee outside and do thee some hurt."""
4969,II,
4970,II,"""Fear nothing for me,"" answered Odysseus, ""I am no stranger to blows,"
4971,II,for I have been sore buffeted on land and sea. The belly is a stern
4972,II,"taskmaster, which compels us to face both wounds and death."""
4973,II,
4974,II,"So saying he stepped aside to let Eumæus pass, then checked him with a"
4975,II,hasty exclamation; for he had seen something which sent a pang of
4976,II,sorrow to his heart. Heaped up against the wall by the doorway was a
4977,II,"great pile of refuse, left there until the thralls should carry it"
4978,II,"away and lay it on the fields; and there, grievously neglected, and"
4979,II,"almost blind with age, lay a great gaunt hound, to all seeming more"
4980,II,dead than alive. What was the emotion of Odysseus when he recognised
4981,II,"in that poor creature his old favourite, Argus, whom he had reared"
4982,II,"with his own hand, and trained to the chase, in the old days before he"
4983,II,sailed to Troy! As he stooped down with a caressing gesture the hound
4984,II,"feebly raised his head; a strange light came into his eyes, he drooped"
4985,II,"his ears, and wagged his tail, but was too weak to stir from the place"
4986,II,"where he lay. Odysseus brushed away a tear, and said to Eumæus: ""'Tis"
4987,II,strange that so fine a hound should lie thus uncared for in his old
4988,II,"age. Or do his looks belie his qualities? Handsome he must have been,"
4989,II,as I can see still; but perhaps his beauty was all he had to boast
4990,II,"of."""
4991,II,
4992,II,"""He was my master's favourite hound,"" answered Eumæus, ""and there was"
4993,II,none swifter or keener of scent in all the land. Formerly the young
4994,II,men would take him with them to hunt the wild goat or the hare or the
4995,II,deer; but now that he is sore stricken with years not one of the women
4996,II,"will bring him a morsel to eat, or a little water to drink. So it ever"
4997,II,is when the master is absent; for a slave has no conscience when his
4998,II,"owner's eye is not upon him."""
4999,II,
5000,II,"When Eumæus had entered the house, Odysseus lingered awhile, gazing"
5001,II,"sadly at the faithful Argus. The old hound raised himself, and"
5002,II,struggled painfully to drag himself to his master's feet; but the
5003,II,"effort was too much for him, and he sank back on his sorry bed, and"
5004,II,breathed his last.
5005,II,
5006,II,"With a heavy heart Odysseus turned away, and passing into the hall sat"
5007,II,down on the threshold and laid his scrip beside him. Telemachus was
5008,II,"the first to notice him, and calling the swineherd, who was sitting"
5009,II,"near, he gave him a loaf of bread and a good handful of meat, and bade"
5010,II,"him carry it to the beggar. ""And tell him to go round and beg of all"
5011,II,"the wooers,"" he said: ""want and modesty agree ill together."" Eumæus"
5012,II,"brought the gift and the message, which Odysseus received with a"
5013,II,blessing on the giver. And when he had eaten he rose and went round
5014,II,"the hall, begging of the wooers. All gave him something until he came"
5015,II,"to Antinous, who stared at him insolently and asked who he was."
5016,II,
5017,II,"""I saw the fellow,"" answered Melanthius, ""a little while ago. Eumæus"
5018,II,"brought him hither, but who he is I know not."""
5019,II,
5020,II,"""Ah! thou rogue,"" said Antinous to the swineherd, ""we know thy ways!"
5021,II,Why didst thou bring this caitiff to the town? Are there not beggars
5022,II,enough here already to mar our pleasure when we sit down to meat? 'Tis
5023,II,"nought to thee, it seems, that these palmer-worms come swarming round"
5024,II,"the house to devour thy master's living."""
5025,II,
5026,II,[Illustration: The Return of Odysseus]
5027,II,
5028,II,"""He is no guest of my inviting,"" answered Eumæus. ""I would not invite"
5029,II,"to this house any wandering stranger, unless he were a prophet, or"
5030,II,"leech, or shipwright, or minstrel; and he is none of these. But thou"
5031,II,"art ever hard on the servants of Odysseus, and especially on me; yet I"
5032,II,"care not, so long as I satisfy Penelope and my young lord,"
5033,II,"Telemachus."""
5034,II,
5035,II,"""Eumæus, thou art overbold of speech,"" said Telemachus; then turning"
5036,II,"to Antinous he added: ""I thank thee for thy fatherly care, but we are"
5037,II,not so poor that we need to drive the stranger from our doors--heaven
5038,II,forbid! Give him something; 'tis I that bid thee: but thou art ever
5039,II,"better at taking than at giving."""
5040,II,
5041,II,"""I will give him something, thou malapert boy,"" answered Antinous,"
5042,II,"grinding his teeth with rage, ""something which will keep him from the"
5043,II,"house for three months to come."" As he spoke he thrust forward a heavy"
5044,II,"footstool from under the table, and placed it ready at hand."
5045,II,
5046,II,"Meanwhile, Odysseus, having filled his wallet, was preparing to return"
5047,II,"to his place on the threshold. But first he came to Antinous, and"
5048,II,addressed to him a long harangue in the common style of the
5049,II,"professional beggar, who had seen better days and been brought to want"
5050,II,by the malice of fortune. He concluded with a fragment of the story
5051,II,which he had already told to Eumæus.
5052,II,
5053,II,"Antinous heard him to the end with ill-disguised impatience, and then"
5054,II,"broke out in angry tones: ""Who brought this wretched fellow here to"
5055,II,"vex us? Stand off from my table, thou shameless varlet! Egypt, sayest"
5056,II,"thou? I will send thee to Egypt, and with a vengeance, too! It is a"
5057,II,"shame to see how they have squandered good meat on a dog like thee"";"
5058,II,"and he pointed to the wallet, now filled with the cheap bounty of the"
5059,II,wooers.
5060,II,
5061,II,"Odysseus drew back and made for the door, saying as he went: ""Of a"
5062,II,"truth, I wonder to find so princely a presence wedded to so mean a"
5063,II,"temper."""
5064,II,
5065,II,"When he heard that Antinous began to curse and to swear, and lifting"
5066,II,the footstool he hurled it with all his force at the retreating figure
5067,II,"of Odysseus. It struck him on the shoulder, with a crash that vibrated"
5068,II,"through the hall; but Odysseus heeded it not, but passed on without a"
5069,II,pause or a stumble to his place on the threshold. When he was seated
5070,II,"he complained loudly of the brutal conduct of Antinous. ""Accursed be"
5071,II,"he,"" he said, ""who lifts up his hand against a helpless beggar; may"
5072,II,"Heaven requite him for this foul deed!"""
5073,II,
5074,II,"""Thou hadst best be quiet,"" said Antinous, ""or we will drag thee by"
5075,II,"the heels through the hall, until we have stripped the flesh off thy"
5076,II,"bones."""
5077,II,
5078,II,"But this was too much even for the wooers. ""Antinous,"" said one of"
5079,II,"them, ""it was ill done of thee to strike the hapless wanderer. Take"
5080,II,"heed that thou bring not a curse upon thyself, if there be gods in"
5081,II,heaven to see such deeds. And what if a god should visit this house in
5082,II,"some strange disguise, to make trial of our hearts? It were no new"
5083,II,"thing."""
5084,II,
5085,II,A chill seemed to have fallen on the company after this shameful
5086,II,"incident. The wooers had ceased their clamour, and sat talking in low"
5087,II,"tones together; Odysseus and Telemachus sat silent in their places,"
5088,II,"brooding gloomily on the outrage; Antinous alone remained unmoved,"
5089,II,"being hardened, within and without, against all reproach."
5090,II,
5091,II,"When Penelope, who was sitting among her maidens in her chamber, heard"
5092,II,"how the stranger had been ill-treated, she cried: ""So may Apollo smite"
5093,II,"thee, Antinous, thou godless man!"" ""Ay,"" said Eurycleia, ""if prayers"
5094,II,"could slay them, not one of these men would see to-morrow's dawn."""
5095,II,
5096,II,"""Go, one of you,"" said Penelope, ""and bring hither the swineherd. I"
5097,II,would fain speak with this stranger; who knows but he may have
5098,II,"somewhat to tell me of Odysseus, my lord?"" Eumæus was summoned, and"
5099,II,"having heard the desire of Penelope, he answered: ""My queen, there is"
5100,II,a rare pleasure awaiting thee. This man hath a tongue to charm thy
5101,II,"very soul. Three days and nights he abode with me, and all that time"
5102,II,he kept us spellbound by the tale of his adventures. It was as if we
5103,II,"were listening to the lay of some rare minstrel, a god-gifted man, who"
5104,II,sways all hearts as he will by the magic of his voice. And he brings
5105,II,"sure tidings of Odysseus too, if we may believe what he says."""
5106,II,
5107,II,"""Call him hither,"" answered Penelope, ""that he may speak to me face to"
5108,II,"face. If his news be true, we may yet see the day when these men shall"
5109,II,"pay a heavy price for their plunder of our house."""
5110,II,
5111,II,"As she spoke, a loud sneeze was heard in the room below. ""It was my"
5112,II,"son,"" said Penelope, laughing, ""I know it by the sound; and it is a"
5113,II,"sign that my words will be fulfilled. Make haste now, and bring the"
5114,II,"stranger to me."""
5115,II,
5116,II,"Eumæus went, and presently returned with a message from the supposed"
5117,II,"beggar, to say that he feared fresh violence from the wooers, if he"
5118,II,left his place by the door and passed through them again. The truth
5119,II,was that Odysseus feared recognition if he appeared before his wife in
5120,II,broad daylight; so he affected to complain of the indifference of
5121,II,"Telemachus, who had allowed the savage deed of Antinous to go"
5122,II,"unpunished, and begged permission to wait until the evening, when the"
5123,II,"wooers would be gone home, and he could tell his story unmolested."
5124,II,
5125,II,"""He says well,"" answered Penelope, when she had heard the message."
5126,II,"""And he seems to be a man of sense. We will wait until evening, as he"
5127,II,"desires."""
5128,II,
5129,II,"The day was waning when Eumæus returned to the hall, and the wooers"
5130,II,had already begun their evening pastimes. The swineherd went up to
5131,II,"Telemachus, and said to him in a low tone: ""It is time for me to"
5132,II,"return to my farm, that I may give an eye to the things which I have"
5133,II,"in charge. I leave thee to look to the house, and all that it"
5134,II,"contains; but above all be careful of thyself, for there are many here"
5135,II,"who wish thee ill."""
5136,II,
5137,II,
5138,II,
5139,II,
5140,II,The Beggar Irus
5141,II,
5142,II,
5143,II,"Just after Eumæus had left, a huge, ungainly fellow came slouching up"
5144,II,"to the place where Odysseus was sitting, and eyed him with a look of"
5145,II,"great disfavour. He was the town beggar, known far and wide in Ithaca"
5146,II,as the greediest and laziest knave in the whole island. His real name
5147,II,"was Arnæus, but from being employed to run errands about the place he"
5148,II,had received the nickname of Irus. Highly indignant at finding his
5149,II,"rights usurped by a new-comer, and thinking to find in that battered"
5150,II,"old man an easy victim, he began to rate his supposed rival in a big,"
5151,II,"blustering voice: ""Give place, old man, to thy betters, and force me"
5152,II,"not to use my hands upon thee. Begone, and that quickly, or it shall"
5153,II,"be the worse for thee; out of the way, I say!"""
5154,II,
5155,II,"With a stern look Odysseus answered him, and said: ""What possesses"
5156,II,"thee, fellow, that thou seekest a quarrel with me? Thou art, as I"
5157,II,"perceive, a beggar like me, and I grudge thee not anything which thou"
5158,II,mayest receive in the way of alms from those who sit here. There is
5159,II,room on this threshold for us both. But I warn thee not to provoke me
5160,II,"to blows, for old as I am I will set a mark upon thee which thou wilt"
5161,II,"carry to thy death."""
5162,II,
5163,II,"Trusting in his size, and encouraged by the nods and winks of the"
5164,II,"wooers who sat near, Irus was only too ready to take up the challenge."
5165,II,"""Hark to the old starveling cur!"" he shouted. ""How glib of tongue he"
5166,II,"is, like any scolding hag! Get thee to thy fists then, since thou wilt"
5167,II,"have it so, and I will knock all thy teeth out, if thou hast any"
5168,II,"left""; and he thrust Odysseus with his foot."
5169,II,
5170,II,"All the wooers now came running up, and crowded round the exasperated"
5171,II,"beggars, hoping to see fine sport. Antinous took the lead, such a"
5172,II,"scene being exactly to his taste. ""Here is matter for mirth,"" he"
5173,II,"cried, laughing, ""for many a day. Make a ring quickly, and let them"
5174,II,"fight it out."""
5175,II,
5176,II,"In the courtyard there was a red smouldering fire, on which two huge"
5177,II,"sausages were roasting, a sort of haggis made by filling the belly of"
5178,II,a goat with fat and blood. It was determined to give one of these
5179,II,messes to the winner in the fight; and he also was henceforth to have
5180,II,the sole right to receive the broken meats at the wooers' feasts.
5181,II,
5182,II,"Odysseus now pretended to draw back, as if he feared an encounter with"
5183,II,"a man younger than himself; but at last he consented to the match, on"
5184,II,condition that the wooers would swear an oath not to strike him a foul
5185,II,"blow while he was fighting with Irus. To this they all agreed, and"
5186,II,"forthwith Odysseus stripped to the waist, and girded his rags about"
5187,II,his loins. By some strange magic his limbs seemed to have filled out;
5188,II,and when the wooers saw his mighty chest and broad shoulders they
5189,II,"cried out in amazement ""Methinks Irus will pay dearly for his ire,""[1]"
5190,II,"said one. ""Look what a brawny thigh the old carle shows under his"
5191,II,"rags!"""
5192,II,
5193,II,[Footnote 1: The pun is an attempt to reproduce a similar word-play in
5194,II,the original.]
5195,II,
5196,II,"Irus himself was not less astonished than dismayed, so that they were"
5197,II,obliged to use force to make him face his opponent; and as he stood
5198,II,"there quaking with fear Antinous reviled him bitterly, and threatened,"
5199,II,"if he were defeated, to carry him to the mainland, and hand him over"
5200,II,"to a robber chieftain, nicknamed the Mutilator, and notorious for his"
5201,II,"cruelties. ""He will carve thee into collops and fling them to his"
5202,II,"dogs,"" said the ferocious prince."
