,Poem Title,line
3194,IV,"before thee, even to the very ends of the earth, and not until that is"
3195,IV,past canst thou set thy sail for home. To the halls of Hades thou must
3196,IV,"go, and consult the spirit of Theban Teiresias, who alone among all"
3197,IV,"the dead hath an understanding heart, while the rest are but flitting"
3198,IV,"shadows. Now hearken, and I will tell thee all that thou must do. When"
3199,IV,"thou leavest these shores thou shalt sail ever southward, until thou"
3200,IV,"hast reached the farther side of the River Oceanus, and come to the"
3201,IV,shadowy grove which stands at the confines of the realm of Persephone.
3202,IV,"There thou shalt land with thy company, and dig a trench a cubit in"
3203,IV,"length and breadth, and pour about it a libation of mead and water and"
3204,IV,"wine; and after that thou shalt offer a sacrifice of black sheep, in"
3205,IV,such wise that the blood thereof shall flow into the trench and fill
3206,IV,"it. Thither will flock the whole multitude of departed spirits, to"
3207,IV,"drink of the blood; but do thou draw thy sword, and hold it over the"
3208,IV,"trench, nor suffer any of the other spirits to draw near until thou"
3209,IV,"hast seen Teiresias and hearkened to his lore."""
3210,IV,
3211,IV,"All that night Odysseus remained in deep conference with Circe, and as"
3212,IV,soon as day dawned he went to rouse his men who were sleeping in the
3213,IV,"outer chamber. ""Up, comrades!"" he cried, ""all is prepared, and we must"
3214,IV,"embark without delay."" His loud summons proved fatal to one of the"
3215,IV,"company, a certain Elpenor, the youngest of them all, who, the night"
3216,IV,"before, had lain down to sleep on the housetop, for the sake of the"
3217,IV,"coolness, being heated with wine. Roused suddenly by the voice of"
3218,IV,"Odysseus, he staggered to his feet, and, still half asleep, stumbled"
3219,IV,"over the parapet in his haste, and fell headlong from the roof."
3220,IV,
3221,IV,"In the hurry of their departure the body was left where it lay, and"
3222,IV,"Odysseus, when they reached the ship, did not notice his absence. They"
3223,IV,"found that Circe had been there before them, and left the victims for"
3224,IV,sacrifice bound to the vessel's side. She herself was nowhere to be
3225,IV,"seen, and so without another word of farewell they launched their"
3226,IV,galley and put out into the deep.
3227,IV,
3228,IV,
3229,IV,
3230,IV,
3231,IV,The Visit to Hades
3232,IV,
3233,IV,
3234,I,I
3235,I,
3236,I,"A clear, strong wind came down from the north, sent by the favour of"
3237,I,"the mighty enchantress Circe, and over the trackless sea they sped,"
3238,I,where never furrow of mortal ship was seen before. After a long day's
3239,I,"sail they came to the farther shore of the ocean stream, which"
3240,I,surrounds the earth as with a girdle. There is the abode of the people
3241,I,"called the Cimmerians, wrapped in shadow and mist; for never doth the"
3242,I,"sun look down upon them with his rays, neither when he climbs the"
3243,I,"starry sky, nor yet when he goeth down unto the place of his rest. And"
3244,I,thus they dwell miserably under the curse of perpetual night.
3245,I,
3246,I,As they peered through the gloom they saw what seemed a grove of dusky
3247,I,"trees, in shape like the poplar and willow, fringing the shore. ""It is"
3248,I,"the sign which Circe gave me,"" whispered Odysseus to his awestruck"
3249,I,"comrades; ""we are at the very gates of Hades."" Landing in silence,"
3250,I,"they carried the victims for sacrifice to the verge of the grove, and"
3251,I,"Odysseus with his sword dug a trench, a cubit in length and breadth,"
3252,I,and poured about it a libation of mead and water and wine. Then the
3253,I,"sheep were slaughtered, and the trench was filled to the brim with"
3254,I,"their blood. When the solemn rite was ended, Odysseus called in a loud"
3255,I,"voice to the spirits of the dead, and waited in breathless expectation"
3256,I,with his men.
3257,I,
3258,I,"Presently a rustling sound was heard, like the sound of the autumn"
3259,I,"wind in the dry leaves of the forest; it grew louder and louder, and"
3260,I,"out of the gloom the ghosts came flocking, youths and maidens cut off"
3261,I,"in their bloom, old men with all their burden of sorrow, and warriors"
3262,I,"slain in battle, still wearing the bloodstained armour.[1] With a wild"
3263,I,"unearthly cry they came crowding to the trench, eager to drink of the"
3264,I,"blood. But Odysseus, though quaking with fear, stood his ground"
3265,I,"firmly, and held his drawn sword over the trench to keep off the"
3266,I,"multitude, until he had seen and spoken with Teiresias."
3267,I,
3268,I,"[Footnote 1: Compare ""Stories from the Æneid,"" p. 119.]"
3269,I,
3270,I,"Among the hosts of spirits there was one who lingered near the trench,"
3271,I,and seemed by his beseeching gestures and earnest looks to desire
3272,I,speech with Odysseus. When his first fears were over Odysseus
3273,I,"recognised the features of Elpenor, who had come to an untimely end on"
3274,I,"the morning of their journey, and whose body still lay unburied in the"
3275,I,house of Circe. Registering a mental vow to perform all due rites to
3276,I,"that poor spirit on his homeward voyage, Odysseus warned him back, and"
3277,I,stood waiting for the coming of the seer.
3278,I,
3279,I,"At last came one with tottering footsteps, leaning on a golden"
3280,I,"sceptre, and halted on the farther edge of the trench. It seemed a"
3281,I,"very aged man, with flowing white beard, and sightless eyes; and"
3282,I,"Odysseus knew by these signs that he was in the presence of Teiresias,"
3283,I,"the famous prophet of Thebes, who alone among departed spirits"
3284,I,"preserves his understanding, while the rest are flitting phantoms,"
3285,I,"with no sense at all. ""What wouldst thou of me, Odysseus, son of"
3286,I,"Laertes,"" said the spectre in faltering tones, ""and wherefore hast"
3287,I,thou left the glad light of day to visit this drear and joyless realm
3288,I,"of the dead? Draw back from the trench, and put up thy sword in its"
3289,I,"sheath, that I may drink of the blood and tell thee all that thou"
3290,I,"wouldst know."""
3291,I,
3292,I,"Thereupon Odysseus fell back, and sheathed his sword; and Teiresias,"
3293,I,"when he had drunk of the blood, spoke again in firmer and clearer"
3294,I,"tones: ""Thou art fain to hear of thy home-coming, illustrious hero;"
3295,I,"but thy path to Ithaca shall be beset with sorrows, because of the"
3296,I,"wrath of Poseidon, whose son, Polyphemus, thou hast blinded."
3297,I,"Nevertheless thou and all thy company shall return safe to Ithaca, if"
3298,I,"only ye leave untouched the sacred flocks and herds of Helios,[1] when"
3299,I,ye come to the island of Thrinacia. But if harm befall them at your
3300,I,"hands, from that hour thy ship and all her crew are doomed and forfeit"
3301,I,"to destruction: and though thou thyself escape, yet thou shalt return"
3302,I,"after many days, in evil plight, to a house of woe.[2] And now learn"
3303,I,how thou mayest at last appease the anger of the god who pursues thee
3304,I,with his vengeance. When thou art once more master in thine own house
3305,I,"thou shalt go on a far journey, carrying with thee an oar of thy"
3306,I,"vessel, until thou comest to a people that dwell far from the sea, and"
3307,I,know naught of ships or the mariner's art. And there shalt meet thee
3308,I,by the way a man who shall say that thou bearest a winnowing shovel[3]
3309,I,"on thy shoulder; and this shall be a sign unto thee, whereby thou"
3310,I,shalt know that thou hast reached the end of thy journey. Then plant
3311,I,"thy oar in the ground, and offer sacrifice to Poseidon. This shall be"
3312,I,"the end of thy toils, and death shall come softly upon thee where thou"
3313,I,"dwellest in a green old age among thy happy people."""
3314,I,
3315,I,[Footnote 1: The sun god.]
3316,I,
3317,I,"[Footnote 2: The very words of Polyphemus, p. 93.]"
3318,I,
3319,I,[Footnote 3: The oar.]
3320,I,
3321,I,When he had thus spoken Teiresias vanished into the darkness; and one
3322,I,"by one the spirits came up to the trench, as Odysseus suffered them,"
3323,I,and having drunk of the blood obtained strength to speak and answer
3324,I,"his questions. First among them was the spirit of his mother,"
3325,I,"Anticleia, daughter of Autolycus, who had been hovering near during"
3326,I,"his conference with Teiresias. When she had drunk she said: ""Whence"
3327,I,"comest thou, my son? Art thou still wandering on thy long voyage from"
3328,I,"Troy, or hast thou been in Ithaca, and seen thy wife?"""
3329,I,
3330,I,"""Nay, mother,"" answered Odysseus, ""I am wandering still, still"
3331,I,"treading the path of woe, since the day when I followed Agamemnon to"
3332,I,"Troy. But tell me now, and answer me truly, what was the manner of thy"
3333,I,"death? Came it slowly, by long disease, or did Artemis lay thee low in"
3334,I,a moment with a painless arrow from her bow?[1] And tell me of my
3335,I,father and my son whom I left in Ithaca; do they still hold my
3336,I,"possessions, or hath some other thrust them with violence from my"
3337,I,"seat? Tell me also of Penelope, my wedded wife, whether she abides"
3338,I,"steadfast and guards my goods, or whether she is gone to cheer some"
3339,I,"other man's heart."""
3340,I,
3341,I,[Footnote 1: Sudden death was ascribed to Artemis or Apollo.]
3342,I,
3343,I,"""Steadfast indeed she is,"" replied Anticleia, ""and wondrous patient of"
3344,I,heart; all her thoughts are ever of thee. No one has yet usurped thy
3345,I,"place in Ithaca, but Telemachus still reaps thy fields and sits down"
3346,I,"to meat with the noblest in the land. As to thy father, he comes no"
3347,I,"more to the town, but dwells continually on his farm. He lives not"
3348,I,"delicately, as princes use, but is clad in sorry raiment, and sleeps"
3349,I,"in the winter among the ashes of the hearth with his thralls, and in"
3350,I,"summer on a bed of dry leaves in his vineyard. There he lies forsaken,"
3351,I,"heavy with years and sorrows, mourning for thee. And in such wise also"
3352,I,"death came upon me, neither by wasting sickness nor by the gentle"
3353,I,"shafts of Artemis, but my sore longing for thee, Odysseus, and for thy"
3354,I,"sweet counsels, at last broke my heart."""
3355,I,
3356,I,"A flood of tenderness overpowered Odysseus at these sad words, and he"
3357,I,sprang forward with arms outstretched to clasp his mother to his
3358,I,"breast. Thrice he essayed to embrace her, and thrice his arms closed"
3359,I,"on emptiness,[1] while that ghostly presence still flitted before him"
3360,I,"like a shadow or a dream. ""O my mother,"" cried Odysseus in deep"
3361,I,"distress, ""why dost thou mock me thus? Come to my heart, dear mother;"
3362,I,"let me hold thee in mine arms once more, and mingle my tears with"
3363,I,"thine. Or art thou but the shadow of a shade, a phantom sent by"
3364,I,"Persephone to deceive me?"""
3365,I,
3366,I,"[Footnote 1: Compare ""Stories from the Æneid,"" p. 24.]"
3367,I,
3368,I,"""Persephone deceives thee not,"" answered the ghost, ""but this is the"
3369,I,fashion of mortals when they die. Flesh and bone and sinew are
3370,I,"consumed by the might of fire, but the spirit takes flight and hovers"
3371,I,ever like a winged dream. But make haste and get thee back to the
3372,I,"daylight, and keep all that thou hast seen in memory that thou mayest"
3373,I,"tell it to thy wife."""
3374,I,
3375,I,"When the spirit of Anticleia was gone, a shadowy throng pressed"
3376,I,"forward to the trench, all the ghosts of noble dames, wives and"
3377,I,"daughters of princes. And Odysseus kept his place, sword in hand,"
3378,I,"suffering them only to drink one by one, that he might question them"
3379,I,"and learn their story. There he saw Alcmene, the mother of Hercules,"
3380,I,"and Leda, to whose twin sons, Castor and Pollux, a strange destiny was"
3381,I,allotted; for after their death they rose to life again on alternate
3382,I,"days, one lying in the tomb, while the other walked the earth as a"
3383,I,"living man. There too was Iphimedeia, mother of the giants Otus and"
3384,I,"Ephialtes, who at nine years of age were nine fathoms in height and"
3385,I,"nine cubits in breadth. Haughty were they, and presumptuous in their"
3386,I,"youth; for they made war on the gods, and piled Ossa on Olympus, and"
3387,I,"Pelion on Ossa, that they might scale the sky. But they perished in"
3388,I,"their impiety, shot down by the bolts of Apollo's golden bow. Last"
3389,I,"came Eriphyle, the false wife, who sold her husband's life for a"
3390,I,glittering bribe.
3391,I,
3392,I,That dream of fair women melted away and another ghostly band
3393,I,"succeeded, the souls of great captains and mighty men of war. Foremost"
3394,I,"among these was seen one of regal port, around whom was gathered a"
3395,I,"choice company of veteran warriors, all gored and gashed with recent"
3396,I,wounds. He who seemed their leader stretched out his hands towards
3397,I,"Odysseus with a piteous gesture, and tears such as spirits weep[1]"
3398,I,gushed from his eyes. Instantly Odysseus recognised in that stricken
3399,I,"spirit his great commander Agamemnon, once the proud captain of a"
3400,I,"thousand ships, now wandering, forlorn and feeble, with all his glory"
3401,I,faded.
3402,I,
3403,I,"[Footnote 1: ""Tears such as _angels_ weep,"" Milton, ""Paradise Lost,"""
3404,I,i. 619.]
3405,I,
3406,I,"""Royal son of Atreus,"" he said, in a voice broken with weeping, ""is it"
3407,I,"here that I find thee, great chieftain of the embattled Greeks? Say,"
3408,I,"how comest thou hither, and what arm aimed the stroke which laid thee"
3409,I,"low?"" ""Not in honour's field did I fall,"" answered Agamemnon, ""nor yet"
3410,I,"amid the waves. It was a traitor's hand that cut me off, the hand of"
3411,I,"Ægisthus, and the guile of my accursed wife. He feasted me at his"
3412,I,"board, and slaughtered me as one slaughters a stalled ox; and all my"
3413,I,company fell with me in that den of butchery. It was pitiful to see
3414,I,all that brave band of veterans writhing in their death agony among
3415,I,"the tables loaded with good cheer, and goblets brimming with wine. But"
3416,I,"that which gave me my sorest pang was the dying shriek of Cassandra,"
3417,I,"daughter of Priam, who was struck down at my side by the dagger of"
3418,I,Clytæmnestra. Then the murderess turned away and left me with staring
3419,I,"eyes and mouth gaping in death. For naught is so vile, naught so"
3420,I,"cruel, as a woman who hath hardened her heart to tread the path of"
3421,I,"crime. Even so did she break her marriage vows, and afterwards slew"
3422,I,the husband of her youth. I thought to have found far other welcome
3423,I,when I passed under the shadow of mine own roof-tree. But this
3424,I,"demon-wife imagined evil against me, and brought infamy on the very"
3425,I,"name of woman."""
3426,I,
3427,I,"""Strange ordinance of Zeus!"" said Odysseus musingly, ""which hath"
3428,I,"turned the choicest blessing of man's life, the love of woman, into"
3429,I,"the bitterest of curses for thee and for thy house. Yea, and upon all"
3430,I,the land of Hellas hath woe been brought by the deed of a
3431,I,"woman--Helen, thy brother's wife."""
3432,I,
3433,I,"""Ay, trust them not,"" replied Agamemnon bitterly, ""Never give thy"
3434,I,"heart into a woman's keeping; she will rifle thy very soul's flower,"
3435,I,and then laugh thee to scorn. But why do I speak thus to thee? Thou
3436,I,"hast indeed a treasure in thy wife; no wiser head, no truer heart,"
3437,I,"than hers. Happy art thou, and sweet the refuge which is prepared for"
3438,I,"thee after all thy toils, Well I remember the day when we set sail"
3439,I,"from Greece, and how fondly thou spakest of her, thy young bride, with"
3440,I,"her babe at her breast. Now he will be a tall youth, and with what joy"
3441,I,"will he look into the eyes of his father, whom he was then too young"
3442,I,"to know!"""
3443,I,
3444,I,"After that Odysseus was silent, his mind full of sweet and anxious"
3445,I,"thoughts. Meanwhile other familiar forms had drawn near, the spirits"
3446,I,"of warriors renowned, whose very names were as a battle-cry when they"
3447,I,"dwelt on earth: Achilles, Patroclus, and Antilochus, and farther off,"
3448,I,"looming dimly in the darkness, the gigantic shade of Ajax. Achilles"
3449,I,"was the first to speak. ""Son of Laertes,"" he said, ""thou man of"
3450,I,"daring, hast thou reached the limit of thy rashness, or wilt thou go"
3451,I,yet further? Are there no perils left for thee in the land of the
3452,I,"living that thou must invade the very realm of Hades, the sunless"
3453,I,"haunts of the dead?"""
3454,I,
3455,I,"""I came to inquire of Teiresias,"" answered Odysseus, ""concerning my"
3456,I,return to Ithaca. All my life I am a bondslave to toil and woe; but
3457,I,"thou, Achilles, wast happy in thy life, honoured as a god by all the"
3458,I,"sons of Hellas; and now thou art happy, even in death, for honour"
3459,I,"waits on thy footsteps still."""
3460,I,
3461,I,"""Tell me not of comfort in death,"" replied Achilles. ""Rather would I"
3462,I,"breathe the air of heaven, yea, though I were thrall to a man of"
3463,I,"little substance, than reign as king over all the shades of the dead."
3464,I,"But give me some news of my son, Neoptolemus. Came he to fight with"
3465,I,"the Trojans after I was gone, and did he acquit him well? And knowest"
3466,I,"thou aught of my father, Peleus? Lives he still in honour and comfort"
3467,I,"among my people, or has he been driven into beggary by violent men,"
3468,I,"now that he is old and I am not near to aid him? Oh, for an hour of"
3469,I,"life, with such might as was mine when I fought in the van for Greece?"
3470,I,"Then should they pay a bitter reckoning, whosoever they be that wrong"
3471,I,"him and keep him from his own."""
3472,I,
3473,I,"""Of Peleus,"" answered Odysseus, ""I have heard nothing, but of thy son,"
3474,I,"Neoptolemus, I can tell thee much, for I myself brought him from"
3475,I,"Scyros to fight in Helen's cause, and thereafter my eye was ever upon"
3476,I,"him, to mark how he bore himself. In council none could vie with him,"
3477,I,save only Nestor and myself; ne'er saw I so rare a wit in so young a
3478,I,head. And when the Greeks were arrayed in battle against the Trojans
3479,I,"he was never seen to hang back, but fought ever in the van among the"
3480,I,"foremost champions, like a mighty man of war. Nor was it only in the"
3481,I,clamour and heat of war that he proved his mettle; for in that
3482,I,"perilous hour when we lay ambushed in the wooden horse, when the"
3483,I,"stoutest hearts among us quailed, he never changed colour, but sat"
3484,I,"fingering his spear and sword, waiting for the signal to go forth to"
3485,I,the assault. And after we had sacked the lofty towers of Troy he
3486,I,"received a goodly portion of the spoil, and a special prize of honour,"
3487,I,"and so departed, untouched by point or blade, to his father's house."""
3488,I,
3489,I,"When he heard these brave tidings of his son, Achilles rejoiced in"
3490,I,"spirit, and strode with lofty gait along the plain of asphodel."
3491,I,
3492,I,"So one by one the spirits came up, and inquired of Odysseus of their"
3493,I,"dear ones at home. Only the soul of Ajax, son of Telamon, stood"
3494,I,sullenly aloof; for between him and Odysseus there was an old quarrel.
3495,I,After the death of Achilles a dispute arose among the surviving
3496,I,chieftains for the possession of his armour. It was decided to refer
3497,I,"the matter to the Trojan captives in the camp, and they were asked who"
3498,I,of all the Greeks had done them most harm. They answered in favour of
3499,I,"Odysseus, who accordingly received the armour. Thereupon Ajax fell"
3500,I,"into a frenzy of rage, and slew himself. When Odysseus saw him, and"
3501,I,"marked his unforgiving mood, he was filled with remorse and pity, and"
3502,I,"strove to soften his resentment with gentle words. ""Ah! son of"
3503,I,"Telamon,"" he said, ""canst thou not forgive me, even here? Sorely the"
3504,I,"Argives mourned thee, and heavy was the loss brought on them by thy"
3505,I,"rash act. Thou wast a very tower of strength to the host, and we wept"
3506,I,"for thee as for a second Achilles. Draw near, great prince, subdue thy"
3507,I,"haughty spirit, and speak to me as thou wast wont to speak before the"
3508,I,"will of heaven set enmity between us."""
3509,I,
3510,I,"Thus earnestly Odysseus pleaded, but there was no reply, and the angry"
3511,I,spirit passed away into the gloom of Erebus.[1]
3512,I,
3513,I,"[Footnote 1: Compare the silence of Dido, ""Stories from the Æneid,"" p."
3514,I,123.]
3515,I,
3516,II,II
3517,II,
3518,II,"Odysseus still lingered, hoping yet to have speech with other souls of"
3519,II,heroes who had once rivalled him in valour and wisdom while they dwelt
3520,II,in the flesh. But he was destined to see another and more awful
3521,II,vision. Suddenly the pall of darkness which shrouded the secrets of
3522,II,"the nether abyss was lifted, and the whole realm of Hades was exposed"
3523,II,"to view. There he saw the place of torment, where great malefactors"
3524,II,"atone for their crime, and Minos, the infernal judge, sitting at the"
3525,II,"gates, passing sentence, and giving judgment among the shades. Within"
3526,II,"appeared the gigantic form of Tityos, stretched at full length along"
3527,II,"the ground, and two vultures sat ever at his side, tearing his liver."
3528,II,"This was his punishment for violence offered to Leto, the mother of"
3529,II,"Apollo and Artemis. Not far from him appeared Tantalus, plunged up to"
3530,II,"the neck in a cool stream; the water lapped against his chin, but he"
3531,II,"had not power to drink it, though he was tormented with a burning"
3532,II,"thirst. As often as he stooped to drink, the water was swallowed up,"
3533,II,and the earth lay dry as the desert sand at his feet. And nodding
3534,II,"boughs of trees drooped, heavy with delicious fruit, over his head;"
3535,II,"but when he put forth his hand to pluck the fruit, a furious gust of"
3536,II,wind swept it away far beyond his reach. And yet another famous
3537,II,"criminal he saw, Sisyphus, the most cunning and most covetous of the"
3538,II,"sons of men. He was toiling painfully up a steep mountain's side,"
3539,II,"heaving a weighty stone before him, and straining with hands and feet"
3540,II,"to push it to the summit. But every time he approached the top, the"
3541,II,"stone slipped through his hands, and thundered and smoked down the"
3542,II,mountain's side till it reached the plain.
3543,II,
3544,II,"Other wonders and terrors might still have been revealed, but as that"
3545,II,hardy watcher stood at his post a great tumult and commotion arose in
3546,II,"that populous city of the dead, and the whole multitude of its ghostly"
3547,II,"denizens came rushing towards the trench, as if resolved to expel the"
3548,II,daring intruder. Odysseus' heart failed him when he saw the air thick
3549,II,"with hovering spectres, who glared with dreadful eyes, and filled the"
3550,II,air with the sound of their unearthly voices. Turning his back on that
3551,II,"place of horror he made his way slowly towards the shore, where he"
3552,II,found his men anxiously awaiting him.
3553,II,
3554,II,
3555,II,
3556,II,
3557,II,The Sirens; Scylla and Charybdis; Thrinacia
3558,II,
3559,II,
3560,I,I
3561,I,
3562,I,"Following the same course as on his outward voyage, Odysseus put in"
3563,I,"again at the island of Circe, where his first duty was to bury the"
3564,I,"body of the young Elpenor, whose ghost he had seen in an attitude of"
3565,I,mute reproach at the threshold of Hades. They were again received with
3566,I,all hospitality by Circe.
3567,I,
3568,I,"After the evening meal Circe drew Odysseus apart, and questioned him"
3569,I,"on all that he had seen and heard on that strange journey, from which"
3570,I,"he had returned, as she said, like one ransomed from death. And when"
3571,I,he had told his story she instructed him as to the course which he had
3572,I,"to steer on leaving the island, and warned him against the manifold"
3573,I,perils of the voyage.
3574,I,
3575,I,"""First,"" said she, ""thou wilt come to the rocks of the Sirens, maidens"
3576,I,"of no mortal race, who beguile the ears of all that hear them. Woe to"
3577,I,him who draws near to listen to their song! He shall never see the
3578,I,"faces of his wife and children again, or feel their arms about his"
3579,I,"neck, but there he shall perish, and there his bones shall rot."
3580,I,"Therefore take heed, and when thou drawest near the place stop the"
3581,I,"ears of thy men with wax, and bid them bind thee fast with cords, that"
3582,I,thou mayest hear the song of the Sirens. And when that seducing melody
3583,I,"fills thine ears, thou wilt beg and implore thy comrades to set thee"
3584,I,"free, that thou mayest draw near and have speech of the Sirens. Then"
3585,I,"let them bind thee more firmly to the mast, and take to their oars,"
3586,I,and fly the enchanted rocks.
3587,I,
3588,I,"""This peril past, thou hast the choice of two different routes. One of"
3589,I,"these will bring thee to the Wandering Isles, which stand, front to"
3590,I,"front, with steep slippery sides of rock, running sheer down to the"
3591,I,"sea. Between them lies a narrow way, which is the very gate of death."
3592,I,"For if aught living attempts to pass between, those rocky jaws close"
3593,I,upon it and grind it to powder. Only the doves which bear ambrosia to
3594,I,"Father Zeus can pass that awful strait, and one of these pays toll"
3595,I,"with her life as she passes, but Zeus sends another to fill her place."
