,Poem Title,line
8058,ARGUMENT,request and receive a refusal--for what gossip there would have been among
8059,ARGUMENT,"the gentry, if they had known that I, Jacek----"
8060,ARGUMENT,
8061,ARGUMENT,* * * * * * * *
8062,ARGUMENT,
8063,ARGUMENT,"""The Horeszkos refuse a wench to a Soplica! They serve me, Jacek, with"
8064,ARGUMENT,black soup!
8065,ARGUMENT,
8066,ARGUMENT,"""Finally, not knowing myself what way to turn, I bethought me of gathering"
8067,ARGUMENT,"together a little company of gentry, and of leaving forever this district"
8068,ARGUMENT,"and my Fatherland; of going off somewhere or other, to Moscow or to the"
8069,ARGUMENT,"land of the Tatars, and beginning a war. I rode over to bid the Pantler"
8070,ARGUMENT,"farewell, in the hope that when he saw his faithful partisan, his former"
8071,ARGUMENT,"friend, a man almost of his own household, with whom he had caroused and"
8072,ARGUMENT,"made war for so many long years, now bidding him farewell and riding off"
8073,ARGUMENT,to the ends of the earth--that the old man might be moved and show me at
8074,ARGUMENT,"least a trace of a human soul, as a snail shows its horns!"
8075,ARGUMENT,
8076,ARGUMENT,"""Ah! if one has at the bottom of his heart the faintest spark of feeling"
8077,ARGUMENT,"for a friend, that spark will break forth when he bids him farewell, like"
8078,ARGUMENT,"the last flame of life before a man expires! The coldest eye, when for the"
8079,ARGUMENT,"last time it touches the brow of a friend, will often shed a tear!"
8080,ARGUMENT,
8081,ARGUMENT,* * * * * * * *
8082,ARGUMENT,
8083,ARGUMENT,"""The poor girl, hearing that I was about to leave the country, turned"
8084,ARGUMENT,"pale, and fell in a swoon, almost dead; she could not speak, but from her"
8085,ARGUMENT,eyes there streamed a flood of tears--I learned how dear I was to her.
8086,ARGUMENT,
8087,ARGUMENT,* * * * * * * *
8088,ARGUMENT,
8089,ARGUMENT,"""I remember that for the first time in my life I shed tears, for joy and"
8090,ARGUMENT,"for despair; I forgot myself, I went mad; I was ready once more to fall at"
8091,ARGUMENT,"her father's feet, to cling like a serpent about his knees, to cry out,"
8092,ARGUMENT,"'Dear father, take me for your son or slay me!' Then the Pantler, sullen,"
8093,ARGUMENT,"cold as a pillar of salt, polite and indifferent, began a discourse--of"
8094,ARGUMENT,"what? of what? Of his daughter's wedding! At that moment? O Gerwazy, dear"
8095,ARGUMENT,"friend, consider; you have a human heart!"
8096,ARGUMENT,
8097,ARGUMENT,"""The Pantler said: 'Pan Soplica, a wooer has just come to me on behalf of"
8098,ARGUMENT,"the Castellan's175 son; you are my friend, what do you say to that? You"
8099,ARGUMENT,"know, sir, that I have a daughter, fair and rich--and the Castellan of"
8100,ARGUMENT,"Witepsk! That is a low, parvenu seat in the Senate; what do you advise me,"
8101,ARGUMENT,"brother?' I have entirely forgotten what I said in reply to that, probably"
8102,ARGUMENT,"nothing at all--I mounted my horse and fled!"""
8103,ARGUMENT,
8104,ARGUMENT,* * * * * * * *
8105,ARGUMENT,
8106,ARGUMENT,"""Jacek!"" cried the Warden, ""you are clever at finding excuses! Well? They"
8107,ARGUMENT,do not lessen your guilt! For it has happened many a time ere now that a
8108,ARGUMENT,"man has fallen in love with the daughter of a lord or king, and has tried"
8109,ARGUMENT,to capture her by force; has planned to steal her away or to avenge
8110,ARGUMENT,"himself openly--but so stealthily to kill him! a Polish lord, in Poland,"
8111,ARGUMENT,"and in league with the Muscovites!"""
8112,ARGUMENT,
8113,ARGUMENT,"""I was not in league with them,"" answered Jacek in a voice full of sorrow."
8114,ARGUMENT,"""Seize her by force? I might have; from behind gratings and locks I would"
8115,ARGUMENT,have snatched her; I would have shattered this castle of his into dust! I
8116,ARGUMENT,"had behind me Dobrzyn and four other hamlets. Ah, would that she had been"
8117,ARGUMENT,"such as our plain gentlewomen, strong and vigorous! Would that she had not"
8118,ARGUMENT,dreaded flight and the pursuit and could have borne the sound of clashing
8119,ARGUMENT,arms! But the poor child! Her parents had shielded her so carefully that
8120,ARGUMENT,she was frail and timid! She was but a little spring caterpillar--the larva
8121,ARGUMENT,"of a butterfly! And to snatch her thus, to touch her with an armed hand,"
8122,ARGUMENT,would have been to kill her. I could not! No!
8123,ARGUMENT,
8124,ARGUMENT,"""To avenge myself openly, and tumble the castle into ruins by an assault,"
8125,ARGUMENT,"I was ashamed, for they would have said that I was avenging myself for my"
8126,ARGUMENT,"rejection! Warden, your honest heart cannot feel what hell there is in"
8127,ARGUMENT,wounded pride.
8128,ARGUMENT,
8129,ARGUMENT,"""The demon of pride began to suggest to me better plans: to take a bloody"
8130,ARGUMENT,"revenge, but to hide the reason for my vengeance; to frequent the castle"
8131,ARGUMENT,no more and to root out my love from my heart; to dismiss Eva from my
8132,ARGUMENT,memory and to marry another; and then later to find some pretext for a
8133,ARGUMENT,"quarrel, and to take vengeance."
8134,ARGUMENT,
8135,ARGUMENT,"""At first I thought that I had succeeded in overcoming my heart, and I was"
8136,ARGUMENT,"glad of that fancied change, and--I married the first poor girl that I met!"
8137,ARGUMENT,"I did evil, and how cruelly was I punished for it! I loved her not,"
8138,ARGUMENT,"Thaddeus's poor mother, my most devoted wife and the most upright soul--but"
8139,ARGUMENT,I was strangling in my heart my former love and my anger. I was like a
8140,ARGUMENT,madman; in vain I forced myself to work at farming or at business; all was
8141,ARGUMENT,"of no avail. Possessed by the demon of vengeance, morose and passionate, I"
8142,ARGUMENT,could find no comfort in anything in the world--and thus I passed from one
8143,ARGUMENT,sin to another; I began to drink.
8144,ARGUMENT,
8145,ARGUMENT,"""And so in no long time my wife died of grief, leaving me that child; and"
8146,ARGUMENT,despair consumed me!
8147,ARGUMENT,
8148,ARGUMENT,* * * * * * * *
8149,ARGUMENT,
8150,ARGUMENT,"""How ardently I must have loved that poor girl! for so many years! Where"
8151,ARGUMENT,"have I not been! And yet I have never been able to forget her, and still"
8152,ARGUMENT,"does her belovèd form stand before mine eyes as if painted! I drank, but I"
8153,ARGUMENT,have not been able to drink down her memory for one instant; nor to free
8154,ARGUMENT,"myself from it, though I have traversed so many lands! Now I am in the"
8155,ARGUMENT,"dress of God's servant, on my bed, and bleeding--I have spoken of her so"
8156,ARGUMENT,long--at this moment to speak of such things! God will forgive me! You must
8157,ARGUMENT,learn now in what sorrow and despair I committed----
8158,ARGUMENT,
8159,ARGUMENT,"""That was but a short time after her betrothal. Everywhere the talk was of"
8160,ARGUMENT,nothing but her betrothal; they said that when Eva took the ring from the
8161,ARGUMENT,"hand of the Wojewoda she swooned, that she had been seized with a fever,"
8162,ARGUMENT,"that she had symptoms of consumption, that she sobbed continually; they"
8163,ARGUMENT,conjectured that she was secretly in love with some one else. But the
8164,ARGUMENT,"Pantler, calm and gay as ever, gave balls in his castle and assembled his"
8165,ARGUMENT,friends; me he no longer invited--in what way could I be useful to him? My
8166,ARGUMENT,"scandalous life at home, my misery, my disgraceful habits had brought upon"
8167,ARGUMENT,"me the contempt and mockery of the world! Me, who once, I may say, had"
8168,ARGUMENT,"made all the district tremble! Me, whom Radziwill had called 'my dear'!"
8169,ARGUMENT,"Me, who, when I rode forth from my hamlet, had led with me a train more"
8170,ARGUMENT,"numerous than a prince's! And when I drew my sabre, then many thousand"
8171,ARGUMENT,"sabres had glittered round about, striking terror to the lords'"
8172,ARGUMENT,"castles,--But now the very children of the peasant boors laughed at me! So"
8173,ARGUMENT,paltry had I quickly made myself in the eyes of men! Jacek Soplica! He who
8174,ARGUMENT,"knows the feeling of pride----"""
8175,ARGUMENT,
8176,ARGUMENT,"Here the Bernardine grew weak and fell back on the bed, and the Warden"
8177,ARGUMENT,"said, deeply moved:--"
8178,ARGUMENT,
8179,ARGUMENT,"""Great are the judgments of God! It is the truth! the truth! So is it you?"
8180,ARGUMENT,and are you Jacek? the Soplica? in a monk's cowl? Have you been living a
8181,ARGUMENT,"beggar's life! You, whom I remember when you were strong and rosy, a"
8182,ARGUMENT,"handsome gentlemen, when lords flattered you, when women went mad over"
8183,ARGUMENT,you! The mustachioed champion! That was not so long ago! it is grief that
8184,ARGUMENT,"has aged you thus! How could I fail to recognise you from that shot, when"
8185,ARGUMENT,you hit the bear with so sure an aim? For our Lithuania had no better
8186,ARGUMENT,"marksman than you, and next to Maciek you were also the foremost"
8187,ARGUMENT,swordsman! It is the truth! Once the gentlewomen sang of you:--
8188,ARGUMENT,
8189,ARGUMENT,"When Jacek twirls his whisker, men tremble far and near;"
8190,ARGUMENT,"'Gainst whom he knots his whisker, that man feels mortal fear--"
8191,ARGUMENT,"Though he be Prince Radziwill, to fight he will not dare."
8192,ARGUMENT,
8193,ARGUMENT,You tied a knot against my lord! Unhappy man! And is it you? Fallen to
8194,ARGUMENT,such a state! The mustachioed Jacek a monkish alms-gatherer! Great are the
8195,ARGUMENT,judgments of God! And now! ha! you cannot escape the penalty; I have
8196,ARGUMENT,"sworn, he who has shed a drop of the Horeszkos' blood----"""
8197,ARGUMENT,
8198,ARGUMENT,Meanwhile the Monk had raised himself to a sitting posture on the bed; and
8199,ARGUMENT,he thus concluded:--
8200,ARGUMENT,
8201,ARGUMENT,"""I rode around the castle; who can tell the names of all the devils that"
8202,ARGUMENT,filled my head and heart! The Pantler? Is he slaying his own child as he
8203,ARGUMENT,has already slain and ruined me?--I rode up to the gate; a demon enticed me
8204,ARGUMENT,there. Look how he revels! Every day a drinking bout in the castle! How
8205,ARGUMENT,"many candles there are in the windows, what music peals through the halls!"
8206,ARGUMENT,And shall not this castle crash down upon his bald head?
8207,ARGUMENT,
8208,ARGUMENT,"""Think of vengeance, and a demon will at once furnish you a weapon. Hardly"
8209,ARGUMENT,"had I thought of it, when the demon sent the Muscovites. I stood gazing;"
8210,ARGUMENT,you know how they stormed your castle.
8211,ARGUMENT,
8212,ARGUMENT,* * * * * * * *
8213,ARGUMENT,
8214,ARGUMENT,"""For it is false that I was in any league with the Muscovites."
8215,ARGUMENT,
8216,ARGUMENT,* * * * * * * *
8217,ARGUMENT,
8218,ARGUMENT,"""I gazed; various thoughts passed through my head: at first with a stupid"
8219,ARGUMENT,laugh I gazed as a child upon a burning house; then I felt a murderous
8220,ARGUMENT,"joy, expecting that speedily it would begin to blaze and totter; at times"
8221,ARGUMENT,I was prompted to leap in and save her--even the Pantler----
8222,ARGUMENT,
8223,ARGUMENT,* * * * * * * *
8224,ARGUMENT,
8225,ARGUMENT,"""Your defence, as you know, was vigorous and prompt. I was amazed; the"
8226,ARGUMENT,Muscovites kept falling close by me; the beasts aimed poorly.--At the sight
8227,ARGUMENT,of their overthrow hatred again overcame me.--That Pantler a victor! And
8228,ARGUMENT,shall he prosper thus in his every purpose? And shall he triumph even over
8229,ARGUMENT,"this fearful assault? I was riding away, smitten with shame.--Day was just"
8230,ARGUMENT,dawning; suddenly I beheld him and recognised him; he stepped out on the
8231,ARGUMENT,balcony and his diamond buckle glittered in the sun; proudly he twirled
8232,ARGUMENT,his mustache and proudly gazed around; and it seemed to me that he mocked
8233,ARGUMENT,"at me above all others, that he had recognised me and that thus he pointed"
8234,ARGUMENT,"his hand at me, scoffing and threatening,--I seized a carbine from a"
8235,ARGUMENT,"Muscovite; I barely raised it to my shoulder, scarcely aimed--it went off!"
8236,ARGUMENT,You know the rest!
8237,ARGUMENT,
8238,ARGUMENT,"""Cursed firearms! He who slays with the sword must take his stand and"
8239,ARGUMENT,press on; he parries and flourishes; he may disarm his enemy and check his
8240,ARGUMENT,sword halfway. But with these firearms it is enough to hold the gun; an
8241,ARGUMENT,"instant, a single spark----"
8242,ARGUMENT,
8243,ARGUMENT,* * * * * * * *
8244,ARGUMENT,
8245,ARGUMENT,"""Did I flee when you aimed at me from above? I levelled my eyes at the two"
8246,ARGUMENT,barrels of your gun. What despair! A strange grief pinned me to the earth!
8247,ARGUMENT,"Why, Gerwazy, ah why did you miss at that time? You would have done me a"
8248,ARGUMENT,"kindness!--evidently as a penance for my sin I must needs----"""
8249,ARGUMENT,
8250,ARGUMENT,Here his breath failed him once more.
8251,ARGUMENT,
8252,ARGUMENT,"""God knows,"" said the Warden, ""I sincerely wished to hit you! How much"
8253,ARGUMENT,blood did you shed by your one shot! How many disasters have fallen upon
8254,ARGUMENT,"us and upon your family, and all of them through your guilt alone, Pan"
8255,ARGUMENT,"Jacek! And yet to-day, when the yagers aimed at the Count (the last of the"
8256,ARGUMENT,"Horeszkos, though in the female line), you preserved him; and when the"
8257,ARGUMENT,"Muscovites shot at me you threw me on the ground, so that you have been"
8258,ARGUMENT,"the saviour of us both. If it is true that you are a monk, in holy orders,"
8259,ARGUMENT,"then your habit shields you from my penknife. Farewell, I will set foot no"
8260,ARGUMENT,more upon your threshold; our account is clear--let us leave the rest to
8261,ARGUMENT,"the Lord."""
8262,ARGUMENT,
8263,ARGUMENT,Jacek stretched out his hand--but Gerwazy started back.
8264,ARGUMENT,
8265,ARGUMENT,"""Without dishonour to my noble blood,"" he said, ""I cannot touch a hand"
8266,ARGUMENT,"denied by such a murder, committed for private vengeance, and not _pro"
8267,ARGUMENT,"publico bono_."""
8268,ARGUMENT,
8269,ARGUMENT,"But Jacek, sinking from the pillows into the bed, turned to the Judge and"
8270,ARGUMENT,"grew more and more pale; he eagerly asked for the parish priest, and cried"
8271,ARGUMENT,to the Warden:--
8272,ARGUMENT,
8273,ARGUMENT,"""I implore you to remain; in a moment more I shall finish; hardly have I"
8274,ARGUMENT,"strength to conclude--Warden--I shall die this night."""
8275,ARGUMENT,
8276,ARGUMENT,"""What, brother?"" cried the Judge, ""I have seen your wound; it is trifling:"
8277,ARGUMENT,why do you say this? Send for the priest! Perhaps it has been ill tended:
8278,ARGUMENT,"I will send for the doctor; he is at the apothecary's."""
8279,ARGUMENT,
8280,ARGUMENT,"""It is too late, brother,"" interrupted the Monk. ""In the same place I have"
8281,ARGUMENT,"an earlier gunshot wound; I received it at Jena. It was ill healed, and"
8282,ARGUMENT,now it has been irritated--there is gangrene there already. I am familiar
8283,ARGUMENT,"with wounds; see how black the blood is, like soot; a doctor could do"
8284,ARGUMENT,nothing. But this is a trifle; we die but once; to-morrow or to-day we
8285,ARGUMENT,"must yield up our souls. Warden, thou wilt forgive me; I must die!"
8286,ARGUMENT,
8287,ARGUMENT,* * * * * * * *
8288,ARGUMENT,
8289,ARGUMENT,"""There is merit in refusing to betray your country, though your own people"
8290,ARGUMENT,proclaim you a traitor! Especially for a man who had such pride as mine!
8291,ARGUMENT,
8292,ARGUMENT,* * * * * * * *
8293,ARGUMENT,
8294,ARGUMENT,"""The name of traitor clove to me like a pestilence. The neighbours turned"
8295,ARGUMENT,"their faces from me, my former friends fled from me, the timid greeted me"
8296,ARGUMENT,"from afar and turned aside; even a mere peasant boor or a Jew, though he"
8297,ARGUMENT,"bowed, would, as he passed by, smite me with a sneering laugh. The word"
8298,ARGUMENT,'traitor' rang in my ears and echoed through my house and over my fields;
8299,ARGUMENT,that word from morn till dark hovered before me like a spot before a sick
8300,ARGUMENT,man's eye. And yet I was _not_ a traitor to my country.
8301,ARGUMENT,
8302,ARGUMENT,"""The Muscovites showed by acts of violence that they regarded me as one of"
8303,ARGUMENT,their partisans: they gave the Soplicas a considerable part of the dead
8304,ARGUMENT,man's estates; later the Targowica confederates wished to bestow an office
8305,ARGUMENT,upon me.176 If I had then consented to turn Muscovite!--Satan counselled
8306,ARGUMENT,it--I was already influential and rich; but if I had become a
8307,ARGUMENT,Muscovite?--The foremost magnates would have sought my favour; even my
8308,ARGUMENT,"brother gentlemen--even the mob, which is so ready to disparage those of"
8309,ARGUMENT,"its own number, is prone to forgive those happier men who serve the"
8310,ARGUMENT,"Muscovites! I knew this, and yet--I could not."
8311,ARGUMENT,
8312,ARGUMENT,* * * * * * * *
8313,ARGUMENT,
8314,ARGUMENT,"""I fled from my country! Where have I not been! what have I not suffered!"
8315,ARGUMENT,
8316,ARGUMENT,* * * * * * * *
8317,ARGUMENT,
8318,ARGUMENT,"""At last God deigned to reveal to me the one true remedy: I must reform"
8319,ARGUMENT,myself and repair as much as possible what----
8320,ARGUMENT,
8321,ARGUMENT,* * * * * * * *
8322,ARGUMENT,
8323,ARGUMENT,"""The Pantler's daughter and her husband the Wojewoda had been transported"
8324,ARGUMENT,"to some place in Siberia; there she died young, leaving here behind her a"
8325,ARGUMENT,"daughter, little Zosia. I had her brought up."
8326,ARGUMENT,
8327,ARGUMENT,* * * * * * * *
8328,ARGUMENT,
8329,ARGUMENT,"""Perchance I slew him more through stupid arrogance than through"
8330,ARGUMENT,"disappointed love; so I humbly became a monk. I, once proud of my birth, I"
8331,ARGUMENT,"who was once a warlike hero, I bowed my head, I became a gatherer of alms,"
8332,ARGUMENT,"and took the name of Robak, the Worm, since like a worm in the dust----"
8333,ARGUMENT,
8334,ARGUMENT,"""The evil example that I had set my countrymen, that invitation to"
8335,ARGUMENT,"treason, I must redeem by setting a good example, by blood and by"
8336,ARGUMENT,self-sacrifice.
8337,ARGUMENT,
8338,ARGUMENT,"""I have fought for my country: where? how? I shall never tell; not for"
8339,ARGUMENT,earthly glory have I run so often upon shot and steel. I like better to
8340,ARGUMENT,"remember, instead of my famous, warlike exploits, my quiet, useful acts,"
8341,ARGUMENT,"and my sufferings, which no one----"
8342,ARGUMENT,
8343,ARGUMENT,"""Often have I succeeded in penetrating into this land, bearing orders from"
8344,ARGUMENT,"the generals, or collecting information, or concluding agreements--the men"
8345,ARGUMENT,of Galicia know this monkish cowl--and in Great Poland they know it too!
8346,ARGUMENT,"For a year I toiled in a Prussian fortress, chained to a wheelbarrow;"
8347,ARGUMENT,"thrice the Muscovites have cut up my back with stripes, and once they had"
8348,ARGUMENT,me on the road to Siberia; later the Austrians buried me in the dungeons
8349,ARGUMENT,"of Spielberg, at hard labour, in _carcer durum_--but by a miracle the Lord"
8350,ARGUMENT,"God delivered me and granted that I should die among my own people, with"
8351,ARGUMENT,the sacraments.
8352,ARGUMENT,
8353,ARGUMENT,"""Perchance even now, who knows? Perchance I have sinned anew! Perchance I"
8354,ARGUMENT,"have hastened too much the insurrection, exceeding the commands of my"
8355,ARGUMENT,generals. The thought that the house of the Soplicas should be the first
8356,ARGUMENT,"to take up arms, and that my kindred should raise the first banner of the"
8357,ARGUMENT,Warhorse in Lithuania!--That thought {~HORIZONTAL ELLIPSIS~} seems pure.----
8358,ARGUMENT,
8359,ARGUMENT,"""You have longed for vengeance? You have it now, for you have been the"
8360,ARGUMENT,instrument of God's punishment! With your sword God cut short my plans.
8361,ARGUMENT,You have tangled the thread of the plot that had been spun for so many
8362,ARGUMENT,"years! The great aim that absorbed my whole life, my last worldly feeling"
8363,ARGUMENT,"upon earth, which I fondled and cherished like my dearest child--that you"
8364,ARGUMENT,"have slain before the father's eyes, and I have forgiven you I You!----"""
8365,ARGUMENT,
8366,ARGUMENT,"""Even so may God forgive you too!"" interrupted the Warden. ""Father Jacek,"
8367,ARGUMENT,"if you are now about to take the sacrament, remember that I am no Lutheran"
8368,ARGUMENT,or schismatic! I know that whoever saddens the last moments of a dying
8369,ARGUMENT,"man, commits sin. I will tell you something that will surely comfort you."
8370,ARGUMENT,"When my late master had fallen wounded, and I was kneeling by him, bending"
8371,ARGUMENT,"over his breast; when, wetting my sword in his wound, I vowed vengeance,"
8372,ARGUMENT,"my lord shook his head and stretched out his hand towards the door,"
8373,ARGUMENT,"towards the place where you were standing, and drew a cross in the air; he"
8374,ARGUMENT,"could not speak, but he made a sign that he forgave his murderer. I"
8375,ARGUMENT,"understood well, but I was so furious with rage that I have never said"
8376,ARGUMENT,"even a word of that cross."""
8377,ARGUMENT,
8378,ARGUMENT,Here the sufferings of the sick man made further speech impossible and a
8379,ARGUMENT,long hour of silence followed. They were awaiting the priest. The thunder
8380,ARGUMENT,"of hoofs was heard, and the Tavern-Keeper, out of breath, knocked at the"
8381,ARGUMENT,"chamber door; he brought an important letter, which he showed to Jacek."
8382,ARGUMENT,Jacek gave it to his brother and bade him read it aloud. The letter was
8383,ARGUMENT,"from Fiszer,177 who was then Chief of Staff of the Polish army under"
8384,ARGUMENT,Prince Joseph. It brought the news that in the Privy Council of the
8385,ARGUMENT,"Emperor war had been declared, and that the Emperor was already"
8386,ARGUMENT,proclaiming it over the whole world; that a General Diet had been convoked
8387,ARGUMENT,"in Warsaw, and that the assembled representatives of Masovia would"
8388,ARGUMENT,solemnly decree the union of Lithuania with the Grand Duchy.
8389,ARGUMENT,
8390,ARGUMENT,"Jacek, as he listened, repeated prayers in a low voice, and, clasping to"
8391,ARGUMENT,"his breast the consecrated candle, raised to Heaven his eyes, now kindled"
8392,ARGUMENT,"with hope, and shed a flood of last joyous tears. ""Now, O Lord,"" he said,"
8393,ARGUMENT,"""let thy servant depart in peace!"" All kneeled; and then a bell rang at"
8394,ARGUMENT,"the door, a token that the priest had arrived with the body of our Lord."
8395,ARGUMENT,
8396,ARGUMENT,"Night was just departing, and across the milky sky were streaming the"
8397,ARGUMENT,first rosy beams of the sun: they entered through the window panes like
8398,ARGUMENT,"diamond arrows, and fell upon the bed; they surrounded the head of the"
8399,ARGUMENT,"sick man, wreathing with gold his face and his temples, so that he shone"
8400,ARGUMENT,like a saint in a fiery crown.
8401,ARGUMENT,
8402,ARGUMENT,
8403,ARGUMENT,
8404,ARGUMENT,
8405,ARGUMENT,
8406,BOOK XI.--THE YEAR 1812,BOOK XI.--THE YEAR 1812
8407,BOOK XI.--THE YEAR 1812,
8408,BOOK XI.--THE YEAR 1812,
8409,ARGUMENT,ARGUMENT
8410,ARGUMENT,
8411,ARGUMENT,Spring omens--The entrance of the armies--Religious
8412,ARGUMENT,services--Official rehabilitation of the late Jacek Soplica--From
8413,ARGUMENT,the talk between Gerwazy and Protazy a speedy ending of the
8414,ARGUMENT,lawsuit may be inferred--A love affair between an uhlan and a
8415,ARGUMENT,girl--The quarrel over Bobtail and Falcon is at last
8416,ARGUMENT,settled--Thereupon the guests gather for the banquet--The
8417,ARGUMENT,presentation of the betrothed couples to the generals.
8418,ARGUMENT,
8419,ARGUMENT,
8420,ARGUMENT,MEMORABLE year! Happy is he who beheld thee in our land! The folk still
8421,ARGUMENT,"call thee the year of harvest, but the soldiers the year of war; old men"
8422,ARGUMENT,still love to tell tales of thee and poets still dream of thee. Thou hadst
8423,ARGUMENT,long been heralded by the marvel in the sky and preceded by a vague rumour
8424,ARGUMENT,among the folk; with the coming of the spring sun the hearts of the
8425,ARGUMENT,"Lithuanians were seized with a certain strange foreboding, as if the end"
8426,ARGUMENT,of the world were approaching--by a certain yearning and joyous
8427,ARGUMENT,expectation.
8428,ARGUMENT,
8429,ARGUMENT,"In the spring, when the cattle were driven forth for the first time, men"
8430,ARGUMENT,"noticed that, though famished and lean, they did not run to the young"
8431,ARGUMENT,"corn179 that already made gay the fields, but lay down on the ploughed"
8432,ARGUMENT,"land, and, drooping their heads, either lowed or chewed the cud of their"
8433,ARGUMENT,winter food.
8434,ARGUMENT,
8435,ARGUMENT,"The villagers too, as they ploughed for the spring grain, did not show"
8436,ARGUMENT,"their wonted joy in the end of the long winter; they did not sing songs,"
8437,ARGUMENT,"but worked lazily, as though forgetful of the sowing and the harvest. As"
8438,ARGUMENT,"they harrowed, at every step they checked their oxen and their nags, and"
8439,ARGUMENT,"gazed anxiously towards the west, as though from this direction some"
8440,ARGUMENT,"marvel were about to appear. And they regarded anxiously the birds, which"
8441,ARGUMENT,were returning home; for already the stork had flown back to its native
8442,ARGUMENT,"pine and had spread its white wings, the early standard of spring; and"
8443,ARGUMENT,"after it the swallows, coming on in noisy regiments, gathered above the"
8444,ARGUMENT,"waters, and from the frozen earth collected mud for their tiny houses. At"
