,Poem Title,line
2791,ARGUMENT,"you are in love with painting, why do you not paint our own trees, among"
2792,ARGUMENT,"which you are sitting? Really, the neighbours will laugh at you, since,"
2793,ARGUMENT,"though you live in the fertile plain of Lithuania, you paint only crags"
2794,ARGUMENT,"and deserts."""
2795,ARGUMENT,
2796,ARGUMENT,"""Friend,"" said the Count, ""beautiful nature is the form, the ground, the"
2797,ARGUMENT,"material, but the soul is inspiration, which rises on the wings of"
2798,ARGUMENT,"imagination, is polished by taste, and is supported by rules. Nature is"
2799,ARGUMENT,"not enough, enthusiasm is not enough; the artist must fly away into the"
2800,ARGUMENT,spheres of the ideal! Not everything that is beautiful can be painted! You
2801,ARGUMENT,will learn all this from books in the course of time. As for painting: for
2802,ARGUMENT,"a picture one requires viewpoints, grouping, ensemble--and sky, the Italian"
2803,ARGUMENT,"sky! Hence in landscape art Italy was, is, and will be the country of"
2804,ARGUMENT,"painters. Hence also, except for Breughel--not Van der Helle, but the"
2805,ARGUMENT,"landscapist, for there are two Breughels55--and except for Ruysdael, in the"
2806,ARGUMENT,whole north where has there been a landscape artist of the first rank? The
2807,ARGUMENT,"sky, the sky is necessary."""
2808,ARGUMENT,
2809,ARGUMENT,"""Our painter Orlowski,""56 interrupted Telimena, ""had a Soplica's taste."
2810,ARGUMENT,"(You must know that this is the malady of the Soplicas, not to like"
2811,ARGUMENT,"anything except their own country.) Orlowski, who spent his life in St."
2812,ARGUMENT,"Petersburg, a famous painter (I have some of his sketches in my desk),"
2813,ARGUMENT,"dwelt close by the Emperor, in his court, as in paradise; and, Count, you"
2814,ARGUMENT,"cannot believe how homesick he was, he loved constantly to call to mind"
2815,ARGUMENT,"the days of his youth; he glorified everything in Poland, land, sky,"
2816,ARGUMENT,"forests."""
2817,ARGUMENT,
2818,ARGUMENT,"""And he was right,"" cried Thaddeus warmly; ""that Italian sky of yours, so"
2819,ARGUMENT,"far as I have heard of it, is blue and clear, but yet is like frozen"
2820,ARGUMENT,"water: are not wind and storm a hundred times more beautiful? In our land,"
2821,ARGUMENT,"if you merely raise your head, how many sights meet your eye! how many"
2822,ARGUMENT,scenes and pictures from the very play of the clouds! For each cloud is
2823,ARGUMENT,"different; for instance, in spring they crawl like lazy tortoises, heavy"
2824,ARGUMENT,"with showers, and send down from the sky to the earth long streamers like"
2825,ARGUMENT,loose tresses: those are the streams of rain. The hail cloud flies swiftly
2826,ARGUMENT,"on the wind like a balloon; it is round and dark-blue, with a glint of"
2827,ARGUMENT,yellow in the centre; around it may be heard a mighty uproar. Even these
2828,ARGUMENT,"white cloudlets of every day, just see how rapidly they change! At first"
2829,ARGUMENT,"they are like a flock of wild geese or swans; and from behind, the wind,"
2830,ARGUMENT,"like a falcon, drives them into a dense throng; they crowd together, grow"
2831,ARGUMENT,"and increase; new marvels! They gain curved necks, send forth manes, shoot"
2832,ARGUMENT,"out rows of legs, and over the vault of the skies they fly like a herd of"
2833,ARGUMENT,chargers across the steppe. All are white as silver; they have fallen into
2834,ARGUMENT,"confusion; suddenly masts grow from their necks, and from their manes"
2835,ARGUMENT,"broad sails; the herd changes into a ship, and majestically floats slowly"
2836,ARGUMENT,"and quietly across the blue plain of the skies!"""
2837,ARGUMENT,
2838,ARGUMENT,The Count and Telimena looked up; Thaddeus with one hand pointed out a
2839,ARGUMENT,"cloud to them, while with the other he squeezed Telimena's dainty fingers."
2840,ARGUMENT,The quiet scene lasted for several minutes; the Count spread a sheet of
2841,ARGUMENT,"paper on his hat and took out his pencil; then, unwelcome to their ears,"
2842,ARGUMENT,"the house bell resounded, and straightway the quiet wood was full of cries"
2843,ARGUMENT,and uproar.
2844,ARGUMENT,
2845,ARGUMENT,"The Count, nodding his head, said in an impressive tone:--"
2846,ARGUMENT,
2847,ARGUMENT,"""Thus fate is wont to end all in this world by the sound of a bell. The"
2848,ARGUMENT,"calculations of mighty minds, the plans of imagination, the sports of"
2849,ARGUMENT,"innocence, the joys of friendship, the outpourings of feeling hearts! when"
2850,ARGUMENT,"the bronze roars from afar all is confused, shattered, perturbed--and"
2851,ARGUMENT,"vanishes!"""
2852,ARGUMENT,
2853,ARGUMENT,"Then, turning a feeling glance on Telimena, he added, ""What remains?"" and"
2854,ARGUMENT,"she said to him, ""Remembrance""; and, desiring somewhat to relieve the"
2855,ARGUMENT,"Count's sadness, she gave him a forget-me-not that she had plucked. The"
2856,ARGUMENT,Count kissed it and pinned it on his bosom. Thaddeus on the other side
2857,ARGUMENT,"separated the branches of a shrub, seeing that through the greenery"
2858,ARGUMENT,something white was stealing towards him. This was a little hand white as
2859,ARGUMENT,"a lily; he seized it, kissed it, and silently buried his lips in it as a"
2860,ARGUMENT,bee in the cup of a lily. On his lips he felt something cold; he found a
2861,ARGUMENT,key and a bit of white paper curled up in the hole of it; this was a
2862,ARGUMENT,little note. He seized it and hid it in his pocket; he did not know what
2863,ARGUMENT,"the key meant, but that little white note would explain."
2864,ARGUMENT,
2865,ARGUMENT,"The bell still pealed, and, as an echo, from the depths of the quiet woods"
2866,ARGUMENT,there resounded a thousand cries and shouts; this was the uproar of people
2867,ARGUMENT,"searching for one another and calling, the signal that the"
2868,ARGUMENT,mushroom-gathering was over for the day: the uproar was not at all gloomy
2869,ARGUMENT,"or funereal, as it had seemed to the Count, but a dinner uproar.57 Every"
2870,ARGUMENT,"noon this bell, calling from the gable, invited the guests and servants"
2871,ARGUMENT,"home to dinner; such had been the custom on many old estates, and in the"
2872,ARGUMENT,Judge's house it had been preserved. So from the wood there came a throng
2873,ARGUMENT,"carrying boxes, and baskets, and handkerchiefs with their ends tied up--all"
2874,ARGUMENT,"full of mushrooms; each young lady carried in one hand, like a folded fan,"
2875,ARGUMENT,"a large _pine-lover_; in the other _tree-fungi_ tied together in a bunch,"
2876,ARGUMENT,"like field flowers, and _leaf-mushrooms_ of various colours. The Seneschal"
2877,ARGUMENT,"had his _fly-bane_. With empty hands came Telimena, and after her the"
2878,ARGUMENT,young gentlemen.
2879,ARGUMENT,
2880,ARGUMENT,The guests entered in order and stood about the table. The Chamberlain
2881,ARGUMENT,took his place at the head; this honour befitted him from his age and his
2882,ARGUMENT,"office; advancing to it he bowed to the ladies, the old men, and the young"
2883,ARGUMENT,"men. By him the Monk took his station, and next the Bernardine was the"
2884,ARGUMENT,"Judge. The Bernardine pronounced a short grace in Latin, brandy was passed"
2885,ARGUMENT,"around; thereupon all sat down, and in silence and with relish they ate"
2886,ARGUMENT,the cold Lithuanian salad of beet leaves.
2887,ARGUMENT,
2888,ARGUMENT,"The dinner was more quiet than usual; no one talked, despite the host's"
2889,ARGUMENT,entreaties. The factions involved in the mighty strife over the dogs were
2890,ARGUMENT,thinking of the morrow's contest and the wager; great thought is wont to
2891,ARGUMENT,"constrain the lips to silence. Telimena, though she talked constantly with"
2892,ARGUMENT,"Thaddeus, was forced to turn now and then to the Count, and even now and"
2893,ARGUMENT,then to glance at the Assessor; thus a hunter gazes at the same time at
2894,ARGUMENT,"the net into which he is coaxing goldfinches, and at the snare for"
2895,ARGUMENT,"sparrows. Thaddeus and the Count were both content with themselves, both"
2896,ARGUMENT,"happy, both full of hopes, and therefore not inclined to chatter. The"
2897,ARGUMENT,"Count would cast a proud look at the flower, and Thaddeus would stealthily"
2898,ARGUMENT,"gaze into his pocket, to see whether that little key had not run away; he"
2899,ARGUMENT,would even reach in his hand and finger the note which he had not yet
2900,ARGUMENT,"read. The Judge, pouring out Hungarian wine and champagne for the"
2901,ARGUMENT,"Chamberlain, served him diligently, and often pressed his knees; but he"
2902,ARGUMENT,"had no zest for conversation with him, and it was evident that he felt"
2903,ARGUMENT,certain secret cares.
2904,ARGUMENT,
2905,ARGUMENT,They changed the plates and the viands in silence; at last the tiresome
2906,ARGUMENT,"routine of the dinner was interrupted by an unexpected guest. A forester,"
2907,ARGUMENT,"rushing in, did not even observe that it was dinner time, but ran up to"
2908,ARGUMENT,his master; from his bearing and his expression it was clear that he was
2909,ARGUMENT,the bringer of important and unwonted tidings. On him the whole company
2910,ARGUMENT,"turned their gaze; recovering his breath somewhat, he said: ""A bear, sir!"""
2911,ARGUMENT,"All guessed the rest, that the beast had come out from the _jungle_,58"
2912,ARGUMENT,that it was slipping through to the wilderness beyond the Niemen; all
2913,ARGUMENT,"immediately recognised that it must be pursued at once, although they had"
2914,ARGUMENT,not consulted together or thought the matter over. The common thought was
2915,ARGUMENT,"evident from the clipped words, the lively gestures, the various orders"
2916,ARGUMENT,"that were issued, which, though they came tumultuously and at one time"
2917,ARGUMENT,"from so many lips, still all tended to a like aim."
2918,ARGUMENT,
2919,ARGUMENT,"""To the village!"" shouted the Judge, ""on horseback, for the headman of the"
2920,ARGUMENT,"peasants! To-morrow at daybreak let the beaters be ready, but volunteers!"
2921,ARGUMENT,Whoever comes with a pike I will release from two days' work on the roads
2922,ARGUMENT,"and five days' field-service for myself."""
2923,ARGUMENT,
2924,ARGUMENT,"""Hurry,"" cried the Chamberlain, ""saddle my grey, and gallop full speed to"
2925,ARGUMENT,"my house; get quickly my two bulldogs,59 which are famous all over the"
2926,ARGUMENT,"district; the male is named Sprawnik, and the bitch Strapczyna.60 Gag"
2927,ARGUMENT,"them, tie them in a sack, and to save time bring them here on horseback."""
2928,ARGUMENT,
2929,ARGUMENT,"""Vanka,"" cried the Assessor in Russian to his boy, ""draw my Sanguszko"
2930,ARGUMENT,"hunting knife over the whetstone; you know, the knife that the prince"
2931,ARGUMENT,"presented to me; and look to my belt, to see whether there is a bullet in"
2932,ARGUMENT,"every cartridge."""
2933,ARGUMENT,
2934,ARGUMENT,"""Get the guns ready!"" shouted everybody."
2935,ARGUMENT,
2936,ARGUMENT,"The Assessor kept calling: ""Lead, lead! I have a bullet mould in my game"
2937,ARGUMENT,"bag."""
2938,ARGUMENT,
2939,ARGUMENT,"""Tell the parish priest,"" added the Judge, ""to serve mass early to-morrow"
2940,ARGUMENT,"in the forest chapel; a very short offertory for hunters, the usual mass"
2941,ARGUMENT,"of St. Hubert."""
2942,ARGUMENT,
2943,ARGUMENT,After the orders had been given a silence followed. All were deep in
2944,ARGUMENT,thought and cast their eyes around as if looking for some one; slowly the
2945,ARGUMENT,Seneschal's venerable face attracted and united all eyes. This was a sign
2946,ARGUMENT,that they were seeking a leader for their future expedition and that they
2947,ARGUMENT,"offered the staff of office to the Seneschal. The Seneschal rose,"
2948,ARGUMENT,"understood the will of his comrades, and, rapping impressively on the"
2949,ARGUMENT,"table, he drew from his bosom a golden chain, on which hung a watch large"
2950,ARGUMENT,as a pear.
2951,ARGUMENT,
2952,ARGUMENT,"""To-morrow,"" he said, ""at half past four, the gentlemen hunters and the"
2953,ARGUMENT,"beaters will present themselves at the forest chapel."""
2954,ARGUMENT,
2955,ARGUMENT,"He spoke, and moved from the table; after him went the Forester. These two"
2956,ARGUMENT,had to plan and arrange the chase.
2957,ARGUMENT,
2958,ARGUMENT,"Even so act generals, when they ordain a battle for the morrow--the"
2959,ARGUMENT,"soldiers throughout the camp clean their arms and eat, or sleep on cloaks"
2960,ARGUMENT,"or saddles, free from care, but the generals consult within the quiet"
2961,ARGUMENT,tent.
2962,ARGUMENT,
2963,ARGUMENT,"Dinner was interrupted, the day passed in the shoeing of horses, the"
2964,ARGUMENT,"feeding of dogs, the gathering and cleaning of arms; at supper hardly any"
2965,ARGUMENT,one came to the table. Even the faction of Bobtail ceased to be agitated
2966,ARGUMENT,by its long and weighty quarrel with the party of Falcon; the Notary and
2967,ARGUMENT,"the Assessor went arm in arm to look for lead. The rest, wearied with"
2968,ARGUMENT,"toil, went early to sleep, in order to rise in good season."
2969,ARGUMENT,
2970,ARGUMENT,"[To-day Thaddeus had been given a room in an out-building. Going in, he"
2971,ARGUMENT,"closed the door and hid the candle in the fireplace, pretending that he"
2972,ARGUMENT,had already gone to sleep--but he did not close his eyes. He evidently
2973,ARGUMENT,"awaited the night, and to him the time seemed long. He stood by the window"
2974,ARGUMENT,and through the opening cut in the shutter observed the doings of the
2975,ARGUMENT,"watchman, who was continually walking about the yard. When he saw him far"
2976,ARGUMENT,"away, at one bound he leapt out, closed the window, and bending to the"
2977,ARGUMENT,ground crept along like a pointer. His further steps the autumn night
2978,ARGUMENT,shrouded in thick darkness.61]
2979,ARGUMENT,
2980,ARGUMENT,
2981,ARGUMENT,
2982,ARGUMENT,
2983,ARGUMENT,
2984,BOOK IV--DIPLOMACY AND THE CHASE,BOOK IV--DIPLOMACY AND THE CHASE
2985,BOOK IV--DIPLOMACY AND THE CHASE,
2986,BOOK IV--DIPLOMACY AND THE CHASE,
2987,ARGUMENT,ARGUMENT
2988,ARGUMENT,
2989,ARGUMENT,A vision in curl papers awakes Thaddeus--Belated discovery of a
2990,ARGUMENT,mistake--The tavern--The emissary--The skilful use of a snuffbox
2991,ARGUMENT,turns discussion into the proper channel--The jungle--The
2992,ARGUMENT,bear--Danger of Thaddeus and the Count--Three shots--The dispute of
2993,ARGUMENT,the Sagalas musket with the Sanguszko musket settled in favour of
2994,ARGUMENT,the single-barrelled Horeszko carbine--Bigos--The Seneschal's tale
2995,ARGUMENT,"of the duel of Dowejko and Domejko, interrupted by hunting the"
2996,ARGUMENT,hare--End of the tale of Dowejko and Domejko.
2997,ARGUMENT,
2998,ARGUMENT,
2999,ARGUMENT,"Ye comrades of the Grand Dukes of Lithuania, trees of Bialowieza, Switez,"
3000,ARGUMENT,"Ponary, and Kuszelewo! whose shade once fell upon the crowned heads of the"
3001,ARGUMENT,"dread Witenes and the great Mindowe, and of Giedymin, when on the height"
3002,ARGUMENT,"of Ponary, by the huntsmen's fire, he lay on a bear skin, listening to the"
3003,ARGUMENT,"song of the wise Lizdejko; and, lulled by the sight of the Wilia and the"
3004,ARGUMENT,"murmur of the Wilejko, he dreamed of the iron wolf;62 and awakened, by the"
3005,ARGUMENT,"clear command of the gods, he built the city of Wilno, which sits among"
3006,ARGUMENT,"the forests as a wolf amid bison, wild boars, and bears. From this city of"
3007,ARGUMENT,"Wilno, as from the she-wolf of Rome, went forth Kiejstut and Olgierd and"
3008,ARGUMENT,"his sons,63 as mighty hunters as they were famous knights, in pursuit now"
3009,ARGUMENT,of their enemies and now of wild beasts. A hunter's dream disclosed to us
3010,ARGUMENT,"the secrets of the future, that Lithuania ever needs iron and wooded"
3011,ARGUMENT,lands.
3012,ARGUMENT,
3013,ARGUMENT,Ye forests! the last to come hunting among you was the last king who wore
3014,ARGUMENT,"the cap of Witold,64 the last fortunate warrior of the Jagiellos, and the"
3015,ARGUMENT,last huntsman among the rulers of Lithuania. Trees of my Fatherland! if
3016,ARGUMENT,"Heaven grants that I return to behold you, old friends, shall I find you"
3017,ARGUMENT,"still? Do ye still live? Ye, among whom I once crept as a child--does great"
3018,ARGUMENT,"Baublis65 still live, in whose bulk, hollowed by ages, as in a goodly"
3019,ARGUMENT,"house, twelve could sup at table? Does the grove of Mendog66 still bloom"
3020,ARGUMENT,"by the village church? And there in the Ukraine, does there still rise on"
3021,ARGUMENT,"the banks of the Ros, before the mansion of the Holowinskis, that linden"
3022,ARGUMENT,tree so far-spreading that beneath its shade a hundred youths and a
3023,ARGUMENT,hundred maidens were wont to join as partners in the dance?
3024,ARGUMENT,
3025,ARGUMENT,Monuments of our fathers! how many of you each year are destroyed by the
3026,ARGUMENT,"axes of the merchants, or of the Muscovite government! These vandals leave"
3027,ARGUMENT,"no refuge either for the forest warblers or for the bards, to whom your"
3028,ARGUMENT,"shade was as dear as to the birds. Yet the linden of Czarnolas, responsive"
3029,ARGUMENT,"to the voice of Jan Kochanowski, inspired in him so many rimes!67 Yet that"
3030,ARGUMENT,prattling oak still sings of so many marvels to the Cossack bard!68
3031,ARGUMENT,
3032,ARGUMENT,"How much do I owe to you, trees of my Homeland! A wretched huntsman,"
3033,ARGUMENT,"fleeing from the mockery of my comrades, in exchange for the game that I"
3034,ARGUMENT,"missed how many fancies did I capture beneath your calm, when in the wild"
3035,ARGUMENT,"thicket, forgetful of the chase, I sat me down amid a clump of trees!"
3036,ARGUMENT,"Around me here the greybearded moss showed silver, streaked with the blue"
3037,ARGUMENT,"of dark, crushed berries; there heathery hillocks shone red, decked with"
3038,ARGUMENT,cowberries as with rosaries of coral.--All about was darkness: over me the
3039,ARGUMENT,"branches hung like low, thick, green clouds; somewhere above the"
3040,ARGUMENT,"motionless vault the wind played with a wailing, roaring, howling,"
3041,ARGUMENT,"crashing thunder; a strange, deafening uproar! It seemed to me that there"
3042,ARGUMENT,above my head rolled a hanging sea.
3043,ARGUMENT,
3044,ARGUMENT,"Below, the crumbling remains of cities meet the eye. Here an overthrown"
3045,ARGUMENT,"oak protrudes from the ground, like an immense ruin; on it seem to rest"
3046,ARGUMENT,"fragments of walls and columns; on this side are branching stumps, on that"
3047,ARGUMENT,"half-rotted beams, enclosed with a hedge of grass. Within the barricade it"
3048,ARGUMENT,"is terrible to look: there dwell the lords of the forest, wild boars,"
3049,ARGUMENT,"bears, and wolves; at the gate lie the half-gnawed bones of some unwary"
3050,ARGUMENT,"guests. Sometimes there rise up through the green of the grass, like two"
3051,ARGUMENT,"jets of water, a pair of stag's antlers; and a beast flits between the"
3052,ARGUMENT,"trees like a yellow streak, as when a sunbeam falls between the forest"
3053,ARGUMENT,trees and dies.
3054,ARGUMENT,
3055,ARGUMENT,And again there is quiet below. A woodpecker on a fir tree raps lightly
3056,ARGUMENT,"and flies farther on and vanishes; it has hidden, but does not cease to"
3057,ARGUMENT,"tap with its beak, like a child when it has hidden and wishes to be sought"
3058,ARGUMENT,"for. Nearer sits a squirrel, holding a nut in its paws and gnawing it; its"
3059,ARGUMENT,tail hangs over its eyes like the plume over a cuirassier's helmet: even
3060,ARGUMENT,"though thus protected, it keeps glancing about; perceiving the guest, this"
3061,ARGUMENT,dancer of the woods skips from tree to tree and flashes like lightning;
3062,ARGUMENT,"finally it slips into an invisible opening of a stump, like a Dryad"
3063,ARGUMENT,returning to her native tree. Again all is quiet.
3064,ARGUMENT,
3065,ARGUMENT,"Now a branch shakes from the touch of some one's hand, and between the"
3066,ARGUMENT,parted clusters of the service berries shines a face more fair than they.
3067,ARGUMENT,It is a maiden gathering berries or nuts; in a basket of simple bark she
3068,ARGUMENT,"offers you freshly gathered cowberries, rosy as her lips. By her side"
3069,ARGUMENT,walks a youth who bends down the branches of the hazel tree; the girl
3070,ARGUMENT,catches the nuts as they flash by her.
3071,ARGUMENT,
3072,ARGUMENT,Now they have heard the peal of the horns and the baying of the hounds;
3073,ARGUMENT,they guess that a hunt is drawing near them; and between the dense mass of
3074,ARGUMENT,"boughs, full of alarm, they vanish suddenly from the eye, like deities of"
3075,ARGUMENT,the forest.
3076,ARGUMENT,
3077,ARGUMENT,In Soplicowo there was a great commotion; but neither the barking of the
3078,ARGUMENT,"dogs, nor the neighing of the horses and the creaking of the carts, nor"
3079,ARGUMENT,the blare of the horns that gave the signal for the hunt could stir
3080,ARGUMENT,"Thaddeus from his bed; falling fully dressed on his couch, he had slept"
3081,ARGUMENT,like a marmot in its burrow. None of the young men thought of looking for
3082,ARGUMENT,him in the yard; every one was occupied with his own affairs and was
3083,ARGUMENT,hurrying to his appointed place; they entirely forgot their sleeping
3084,ARGUMENT,comrade.
3085,ARGUMENT,
3086,ARGUMENT,He was snoring. Through the heart-shaped opening that was cut in the
3087,ARGUMENT,"shutter the sun poured into the darkened room like a fiery column,"
3088,ARGUMENT,straight on the brow of the sleeping lad. He wanted to doze longer and
3089,ARGUMENT,"twisted about, trying to avoid the light; suddenly he heard a knocking and"
3090,ARGUMENT,awoke; cheerful was his awakening. He felt blithe as a bird and breathed
3091,ARGUMENT,freely and lightly; he felt himself happy and smiled to himself. Thinking
3092,ARGUMENT,"of all that had happened to him the day before, he blushed and sighed, and"
3093,ARGUMENT,his heart beat fast.
3094,ARGUMENT,
3095,ARGUMENT,"He looked at the window. Marvellous to say, in the sunlit aperture, within"
3096,ARGUMENT,"that heart, there shone two bright eyes, opened wide, as is wont to be the"
3097,ARGUMENT,case when one gazes from daylight into darkness; he saw also a little
3098,ARGUMENT,"hand, raised like a fan on the side towards the sun, to shield the gaze;"
3099,ARGUMENT,"the tiny fingers, turned towards the rosy light, reddened clear through,"
3100,ARGUMENT,"as if made of rubies; he beheld curious lips, slightly parted, and little"
3101,ARGUMENT,"teeth that shone like pearls among corals; and the face, though it was"
3102,ARGUMENT,"protected from the sun by a rosy palm, itself glowed all over like the"
3103,ARGUMENT,rose.
3104,ARGUMENT,
3105,ARGUMENT,"Thaddeus was sleeping beneath the window; himself hidden in the shade,"
3106,ARGUMENT,"lying on his back, he wondered at the marvellous apparition, which was"
3107,ARGUMENT,"directly above him, almost touching his face. He did not know whether he"
3108,ARGUMENT,"was awake, or whether he was imagining one of those dear, bright childish"
3109,ARGUMENT,faces that we remember to have seen in the dreams of our innocent years.
3110,ARGUMENT,"The little face bent down: he beheld, trembling with fear and joy, alas!"
3111,ARGUMENT,"he beheld most clearly--he recalled and recognised now that short, bright"
3112,ARGUMENT,"golden hair done up in tiny curl papers white as snow, like silvery pods,"
3113,ARGUMENT,which in the gleam of the sun shone like a crown on the image of a saint.
3114,ARGUMENT,
3115,ARGUMENT,"He started up, and the vision straightway vanished, frightened by the"
3116,ARGUMENT,"noise; he waited, but it did not return! He only heard again a"
3117,ARGUMENT,"thrice-repeated knocking and the words: ""Get up, sir; it is time for"
3118,ARGUMENT,"hunting, you have overslept."" He jumped from his couch, and with both"
3119,ARGUMENT,"hands pushed back the shutters, so that their hinges rattled, and flying"
3120,ARGUMENT,open they knocked against the wall on either side. He rushed out and
3121,ARGUMENT,"looked around, amazed and confused, but he saw nothing, nor did he"
3122,ARGUMENT,perceive traces of any one. Not far from the window was the garden fence;
3123,ARGUMENT,on it the hop leaves and the flowery garlands were trembling; had some
3124,ARGUMENT,light hands touched them or had the wind stirred them? Thaddeus gazed long
3125,ARGUMENT,"on them, but did not dare enter the enclosure; he only leaned on the"
3126,ARGUMENT,"fence, raised his eyes, and, with his finger pressed on his lips, bade"
3127,ARGUMENT,"himself be silent, in order not to break the stillness by a hasty word."
3128,ARGUMENT,"Then he rapped his forehead, as though he were tapping for some ancient"
3129,ARGUMENT,"memories that had been lulled to sleep within him; finally, gnawing his"
3130,ARGUMENT,"fingers, he drew blood, and shouted at the top of his voice: ""It serves me"
3131,ARGUMENT,"right, it does."""
3132,ARGUMENT,
3133,ARGUMENT,"In the yard, where a few moments before there had been so many cries, now"
3134,ARGUMENT,everything was desolate and silent as in a graveyard; all had gone afield.
3135,ARGUMENT,"Thaddeus pricked up his ears, and put his hands to them like trumpets; he"
3136,ARGUMENT,listened till the wind that blew from the forest brought to him the sound
3137,ARGUMENT,of horns and the shouts of the hunting throng.
3138,ARGUMENT,
3139,ARGUMENT,"Thaddeus's horse was waiting saddled in the stable. So, musket in hand, he"
3140,ARGUMENT,"vaulted upon it, and like a madman galloped towards the inns that stood"
3141,ARGUMENT,"near the forest chapel, where the beaters were to have gathered at early"
3142,ARGUMENT,dawn.
3143,ARGUMENT,
3144,ARGUMENT,"The two taverns bent forward from either side of the road, threatening"
3145,ARGUMENT,each other with their windows like enemies. The old one rightfully
