,Poem Title,line
1400,PREFACE.,Instances of Poetical Fire; which is as much shewn in describing a
1401,PREFACE.,"Winter-piece, as in describing a Battle, or a Conflagration. However, as"
1402,PREFACE.,"it appears from the Examples before cited, _Virgil_ was not deficient"
1403,PREFACE.,"even in That sort of Fire which is commonly called so, the fierce, the"
1404,PREFACE.,"rapid, the fighting: And where he either shews not That, or none at all,"
1405,PREFACE.,"'tis not because he _can't_, but because he _w'on't_; because 'tis not"
1406,PREFACE.,"proper. To explain my self, I refer the Reader to my Remark upon V. 712"
1407,PREFACE.,"of the First Book. Excepting some uncorrect Verses, _Virgil_ never"
1408,PREFACE.,"flags: Or when he appears to do so, it is on purpose; according to that"
1409,PREFACE.,most true Opinion of my Lord _Roscommon_:
1410,PREFACE.,
1411,PREFACE.,_For I mistake; or far the greatest Part
1412,PREFACE.,"Of what some call Neglect, was study'd Art."
1413,PREFACE.,When_ Virgil _seems to trifle in a Line;
1414,PREFACE.,"'Tis like a Warning-piece, which gives the Sign,"
1415,PREFACE.,"To wake your Fancy, and prepare your Sight"
1416,PREFACE.,To reach the noble Height of some unusual Flight._
1417,PREFACE.,
1418,PREFACE.,"His very Negligences are accurate, and even his Blemishes are Beauties."
1419,PREFACE.,"Besides; a considerable Number of Verses together may have little, or no"
1420,PREFACE.,"Fire in them; and yet be very graceful, and deserve great Praise."
1421,PREFACE.,"_Virgil_ (which I think is not so observable in _Homer_) can be elegant,"
1422,PREFACE.,"and admirable, without being in a Hurry, or in a Passion. He is"
1423,PREFACE.,"sometimes higher indeed, and sometimes lower: but he always flies; and"
1424,PREFACE.,that too (as Mr. _Segrais_ judiciously observes) always at a Distance
1425,PREFACE.,"from the Ground: He rises, and sinks, as he pleases; but never flutters,"
1426,PREFACE.,or grovels. Can the same be as truly said of _Homer_? His Fire in the
1427,PREFACE.,"main is divine; but as I think he has too much of it in some Places, has"
1428,PREFACE.,"he not too little in others? Mr. _Dryden_ says, [15]_Milton runs into a"
1429,PREFACE.,"flat Thought, sometimes for a hundred Lines together_. Which, I think,"
1430,PREFACE.,is not true: He sometimes flags in many Lines together; and perhaps the
1431,PREFACE.,same may be as truly said of his Greek Master. In _Homer_ methinks I see
1432,PREFACE.,"a Rider of a noble, generous, and fiery Steed; who always puts him upon"
1433,PREFACE.,"the Stretch, and therefore sometimes tires him: _Virgil_ mounted upon"
1434,PREFACE.,"the same, or such another, gives him either the Reins, or the Curb, at"
1435,PREFACE.,"proper times; and so his Pace, if not always rapid, as it should not be,"
1436,PREFACE.,"is always stately, and majestick; and his Fire appears by being"
1437,PREFACE.,"suppressed, as well as by being indulged. For the Judgment of this"
1438,PREFACE.,"incomparable Poet, in alternately suppressing, and indulging his Divine"
1439,PREFACE.,"Fury, puts me in mind of his own _Apollo_ overruling and inspiring his"
1440,PREFACE.,"own _Sibyl_; which whole Passage, by the way (for I shall cite but Part"
1441,PREFACE.,of it) is it self one of the noblest Instances of Poetical Fire this Day
1442,PREFACE.,extant in the whole World. My Application a little perverts it: But That
1443,PREFACE.,is a small Circumstance in Allusions.
1444,PREFACE.,
1445,PREFACE.,_At Phœbi nondum patiens immanis in antro
1446,PREFACE.,"Bacchatur vates, magnum si pectore possit"
1447,PREFACE.,Excussisse Deum_; tanto magis ille fatigat
1448,PREFACE.,"Os rabidum, fera corda domans, fingitque premendo."
1449,PREFACE.,
1450,PREFACE.,But afterwards;
1451,PREFACE.,
1452,PREFACE.,_Talibus ex adyto dictis Cumæa Sibylla
1453,PREFACE.,"Horrendas canit ambages, antroque remugit,"
1454,PREFACE.,Obscuris vera involvens_; ea fræna furenti
1455,PREFACE.,"Concutit, & stimulos sub pectore vertit Apollo."
1456,PREFACE.,
1457,PREFACE.,"What was my Lord _Roscommon'_s Precept, was _Virgil_'s Practice,"
1458,PREFACE.,
1459,PREFACE.,"_To write with Fury, but correct with Phlegm:_"
1460,PREFACE.,
1461,PREFACE.,Things very consistent in their own Nature. And therefore I must insist
1462,PREFACE.,that _Virgil_ was no way deficient in Poetical Fire; and that _Homer_
1463,PREFACE.,"excelled him not in that Particular. By which last I always mean, that"
1464,PREFACE.,"either _Homer_ had not _more_ of it, or if he had _more in the Whole_,"
1465,PREFACE.,"he had _too much_ in _some_ Instances, and _too little_ in _others_. If"
1466,PREFACE.,"His were _more_ than _Virgil_'s, (tho' even That I question) it was not"
1467,PREFACE.,"_better_; no nor _so good_: considering how their Fire was disposed, or"
1468,PREFACE.,(if I may so speak) situated in their several Constitutions; and what
1469,PREFACE.,use they severally made of it in their Writings. And therefore upon this
1470,PREFACE.,"Article I must take the Liberty to say, Mr. _Pope_ is not just to"
1471,PREFACE.,"_Virgil_, as well as to some other Poets, in the Preface to his"
1472,PREFACE.,"admirable Translation of _Homer_. ""This Fire (says he) is discerned in"
1473,PREFACE.,"_Virgil_; but discerned as through a Glass, reflected, and rather"
1474,PREFACE.,"shining than warm, but every-where equal and constant: In _Lucan_, and"
1475,PREFACE.,"_Statius_, it bursts out in sudden, short, and interrupted Flashes: In"
1476,PREFACE.,"_Milton_, it glows like a Furnace, kept up to an uncommon Fierceness by"
1477,PREFACE.,"the Force of Art: In _Shakespear_, it strikes before we are aware, like"
1478,PREFACE.,"an accidental Fire from Heaven: But in _Homer_, and in Him only, it"
1479,PREFACE.,"burns every where clearly, and every where irresistibly."" Supposing his"
1480,PREFACE.,Account of _Lucan_ and _Statius_ to be true: I no more know how to
1481,PREFACE.,"distinguish it from his Account of _Shakespear_, than I agree with him"
1482,PREFACE.,in the Character he gives of that great Man. For Fires from Heaven do
1483,PREFACE.,"not _often_ strike; and when they do, are of no long Continuance: And so"
1484,PREFACE.,"_Shakespear_'s, like That of the other Two before mentioned, is supposed"
1485,PREFACE.,"to _burst out in short, sudden, and interrupted Flashes_: For Instance,"
1486,PREFACE.,like Lightning; which is the only Fire from Heaven that we ordinarily
1487,PREFACE.,"see, or hear of, and even That not very frequently. For if any other"
1488,PREFACE.,"Celestial flashes are here meant, they indeed may be more Divine; but"
1489,PREFACE.,"they are much more rare, and short, than Those of _Statius_ and _Lucan_."
1490,PREFACE.,"Whereas _Shakespear_, in my Judgment, has more of the Poetical Fire,"
1491,PREFACE.,than either of those Poets. _Milton_ indeed had more of it than He: and
1492,PREFACE.,"therefore I am no less suprized at the Character here given of his Fire,"
1493,PREFACE.,"that _it glows like a Furnace, kept up to an uncommon Fierceness by the"
1494,PREFACE.,"Force of Art_: Because, tho' his Art, Learning, and Use of Books,"
1495,PREFACE.,"especially of _Homer_, be very great; yet he is most distinguished by"
1496,PREFACE.,"natural Genius, Spirit, Invention, and Fire; in all which perhaps he is"
1497,PREFACE.,"not very much inferiour to _Homer_ himself. Whose Fire again does not, I"
1498,PREFACE.,"conceive, _burn every where clearly, and irresistibly_: Or if it did, it"
1499,PREFACE.,"would be no Commendation. For the small Praise here given to _Virgil_,"
1500,PREFACE.,"is, in my Opinion, no true Praise at all: His Fire is not every where"
1501,PREFACE.,"equal: and it would be a Fault in him, if it were; as I have above"
1502,PREFACE.,observed. But waving That; Surely such an Account of _Virgil_'s Fire was
1503,PREFACE.,"never given by any Critick before. _It is discerned_: As faint, and"
1504,PREFACE.,"lessening an Expression, as could have been thought of. And how is it"
1505,PREFACE.,even _discerned_? Only _through a Glass_: And lest we should imagine
1506,PREFACE.,"That Glass to be a _Burning-Glass_; it is _reflected_, and _rather"
1507,PREFACE.,"shining, than warm_. Now I desire to be informed, what truer Idea any"
1508,PREFACE.,"one can have of the coldest, and most spiritless Writer in the World;"
1509,PREFACE.,"supposing him only to be a good Judge, and a Man of tolerable Parts. If"
1510,PREFACE.,"I am my self a little warm upon this Subject, I hope it may be pardoned"
1511,PREFACE.,upon such an Occasion; when so great a Genius as _Virgil_'s is unjustly
1512,PREFACE.,"censured by so great a Genius as Mr. _Pope_'s. However it be; _Homer_,"
1513,PREFACE.,"according to this Account, remains the Sun of Poetry: For I know of no"
1514,PREFACE.,other Luminary (to which he may be compared) whose Fire _burns every
1515,PREFACE.,"where clearly, and every where irresistibly_. Whereas, if we must pursue"
1516,PREFACE.,"these Similes of Light, and Fire, (tho', like other Similes, they do not"
1517,PREFACE.,"answer in every Particular) I should rather say, as I hinted in the"
1518,PREFACE.,"Beginning of this Preface, that the Fire of Poetry arose in _Homer_,"
1519,PREFACE.,"like Light at the Creation; shining, and burning, it is true, but"
1520,PREFACE.,"enshrined in a Cloud: But was afterwards transplanted into _Virgil_, as"
1521,PREFACE.,into the Sun; according to the Account which _Milton_ gives of Both:[16]
1522,PREFACE.,
1523,PREFACE.,"_Let there be Light, said God; and forthwith Light"
1524,PREFACE.,"Ethereal, first of Things, Quintessence pure,"
1525,PREFACE.,Sprang from the Deep; and from her native East
1526,PREFACE.,"To journy thro' the airy Gloom began,"
1527,PREFACE.,Sphear'd in a radiant Cloud: For yet the Sun
1528,PREFACE.,Was not; She in a cloudy Tabernacle
1529,PREFACE.,Sojourn'd the while.----_
1530,PREFACE.,
1531,PREFACE.,Afterwards:
1532,PREFACE.,
1533,PREFACE.,"_Of Light by far the greater Part he took,"
1534,PREFACE.,"Transplanted from her cloudy Shrine, and plac'd"
1535,PREFACE.,"In the Sun's Orb, made porous to receive"
1536,PREFACE.,And drink the liquid Light; firm to retain
1537,PREFACE.,"Her gather'd Beams, great Palace now of Light._"
1538,PREFACE.,
1539,PREFACE.,"If it be said, that according to this Account, _Homer_ has the"
1540,PREFACE.,Advantage; because _all_ the Light is supposed to have been first in
1541,PREFACE.,"him, and only a _Part_ of it (tho' the greatest) transferred to"
1542,PREFACE.,_Virgil_: it must be remembered that we are only making a _Comparison_:
1543,PREFACE.,"For if it were an exact _Parallel_, we must conceive (which we are far"
1544,PREFACE.,from doing) that the _very individual_ Fire of the _Greek_ Poet was
1545,PREFACE.,transferred into the _Roman_; and that the one ceases to exist
1546,PREFACE.,separately from the other. But besides; admitting _Homer_ to have the
1547,PREFACE.,Advantage _so far_ as this Objection supposes; yet still _Virgil_ has it
1548,PREFACE.,"_upon the Whole_, even with respect to Fire, of which we are now"
1549,PREFACE.,discoursing. Tho' the Light in the cloudy Shrine were _more_ than That
1550,PREFACE.,"in the Sun; yet in the Sun it is placed in a _higher_, and more"
1551,PREFACE.,_regular_ Sphere; more _aptly disposed_ for _warming_ and
1552,PREFACE.,"_illuminating_, and more _commodiously situated_ for the Delight and"
1553,PREFACE.,"Benefit of Mankind. ""The _Roman_ Author (we are told) seldom rises into"
1554,PREFACE.,"very astonishing Sentiments, where he is not fired by the _Iliad_.[17]"""
1555,PREFACE.,"Tho' I absolutely deny the Matter of Fact yet supposing it were true,"
1556,PREFACE.,"still _fired he is_: The Poetical Spirit is in him, however he came by"
1557,PREFACE.,"it; and that too _better_, if not _more_, than in him from whom he is"
1558,PREFACE.,imagined to have received it. How far the Reader will be of my Opinion
1559,PREFACE.,upon this Head I know not: But to me the Truth of what I have urged
1560,PREFACE.,resembles the _Things_ of which I have been speaking: It _shines_ like
1561,PREFACE.,"the _Light_, and _burns_ like the _Fire_."
1562,PREFACE.,
1563,PREFACE.,"As to _Similes_, _Homer_ is supposed to have the full Propriety of"
1564,PREFACE.,_Them_; and even the greatest Part of _Virgil_'s must be His. That a
1565,PREFACE.,"great Number of _Virgil_'s are taken from him, I deny not; but most of"
1566,PREFACE.,them are exceedingly improved by being transplanted: Tho' I believe if
1567,PREFACE.,"he had taken fewer from _Homer_, and given us more of his own, his Poem"
1568,PREFACE.,would have been so much the better. Not that he really has copy'd from
1569,PREFACE.,"_Homer_ in this Instance, near so much as some Criticks pretend; and he"
1570,PREFACE.,has more Similes entirely his own; than the aforesaid Criticks will
1571,PREFACE.,allow him. In my Remarks I shall mention some Particulars.
1572,PREFACE.,
1573,PREFACE.,"Generally speaking, _Homer's Descriptions_ are admirable. But even in"
1574,PREFACE.,"this View, I think Those are unjust to _Virgil_, who do not allow that"
1575,PREFACE.,"he excels his Master. Consider the several Instances already cited, upon"
1576,PREFACE.,the Article of Poetical Fire; for most of them may be equally applied to
1577,PREFACE.,This. What Images! what Paintings! what Representations of Nature! what
1578,PREFACE.,"Nature it self, do we find and feel in them! Besides a Multitude of"
1579,PREFACE.,"others, which cannot now be so much as mentioned: I must here again"
1580,PREFACE.,refer to my Notes for Particulars.
1581,PREFACE.,
1582,PREFACE.,"For _Style_, _Diction_, and _Verification_, _Homer_, I acknowledge, is"
1583,PREFACE.,"allowed the Triumph, even by the Generality of _Virgil_'s Party:"
1584,PREFACE.,particularly by _Rapin_; as he is likewise by him in the Instances of
1585,PREFACE.,"_Fire_, and _Description_, above-mentioned. However, that I may not be"
1586,PREFACE.,"thought singular in my Opinion, a Character which I by no means desire;"
1587,PREFACE.,it may be considered that I agree with _Scaliger_ in his express
1588,PREFACE.,"Assertions, and with my Lord _Roscommon_ in his Hints and Insinuations,"
1589,PREFACE.,"not to mention other Authorities; when I frankly declare my Sentiments,"
1590,PREFACE.,that the _Roman_ Poet is superiour to the _Grecian_ even in this
1591,PREFACE.,"Respect. The _Greek_ Language, it is true, is superiour to the _Latin_,"
1592,PREFACE.,"in This, as well as in every thing else; being the most expressive, the"
1593,PREFACE.,"most harmonious, the most various, rich, and fruitful, and indeed, upon"
1594,PREFACE.,"all Accounts, the best Language in the World. But if notwithstanding"
1595,PREFACE.,"this great Advantage, _Virgil_'s Diction and Versification be preferable"
1596,PREFACE.,to _Homer_'s; his Glory for That very Reason will be so much the
1597,PREFACE.,"greater. _Homer's Epithets_, for the most part, are in _Themselves_"
1598,PREFACE.,exceedingly beautiful; but are not many of them _superfluous_? Whether
1599,PREFACE.,"many, nay all, of those Particles which are commonly (and indeed, I"
1600,PREFACE.,"think, falsly enough) called Expletives, be significant or no, I do not"
1601,PREFACE.,"now dispute: But admitting them to be so; are not too many little Words,"
1602,PREFACE.,"whether _Expletives_, nay whether _Particles_, or not, often crouded"
1603,PREFACE.,"together? Ἤ εἰ δή ποτέ τοι κατὰ, _&c._ and Ἦ ῥὰ νύ μοί ποτὲ καὶ σὺ,"
1604,PREFACE.,"_&c._ are not, I own, very agreeable Sounds to my Ears; and many more of"
1605,PREFACE.,"the same Kind are to be met with. Moreover, does not _Homer_ make an ill"
1606,PREFACE.,"use of one great Privilege of his Language, (among many others) I mean"
1607,PREFACE.,"That of dissolving Diphthongs, by so very frequently inserting a Word of"
1608,PREFACE.,"five, or six Syllables, to drag his Sense to the End of a Verse, which"
1609,PREFACE.,"concludes with the long Word aforesaid? Those Words, even at the End of"
1610,PREFACE.,"a Verse, are sometimes indeed very agreeable: But are they not often"
1611,PREFACE.,"otherwise? Especially at the Close of a Paragraph, or Speech; when for"
1612,PREFACE.,"the most part too they are Epithets: and yet more especially, when those"
1613,PREFACE.,"Epithets are of little Significancy? I shall give but one Instance,"
1614,PREFACE.,tho' it were very easy to produce many; and That shall be the last Line
1615,PREFACE.,"of the _Iliad_: Upon which, compared with the last of the _Æneis_, I"
1616,PREFACE.,cannot but think that
1617,PREFACE.,
1618,PREFACE.,"_Vitaque cum gemitu fugit indignata sub umbras_,"
1619,PREFACE.,
1620,PREFACE.,"is a nobler Conclusion of an Heroic Poem, than"
1621,PREFACE.,
1622,PREFACE.,Ὣς οἲ γ' ἀμφίεπον τάφον Ἕκτορος ἱπποδάμοιο.
1623,PREFACE.,
1624,PREFACE.,"A thousand things of the same, or of the like Nature, might be"
1625,PREFACE.,mentioned: And I am aware that such Observations will by some Criticks
1626,PREFACE.,be called _modern Criticisms_. But be That as it will; I am for Truth
1627,PREFACE.,"and Reason, whether it be called Ancient, or Modern."
1628,PREFACE.,
1629,PREFACE.,"To display the Excellence of _Virgil_'s Style, Diction, and"
1630,PREFACE.,"Versification, cannot be the Business of this Preface: Here again I must"
1631,PREFACE.,"refer to my Notes. I only observe, that nothing can be more sublime, and"
1632,PREFACE.,"majestick, than some Parts; nothing more sweet, and soft, than others;"
1633,PREFACE.,"nothing more harmonious, flowing, numerous, and sounding than both his"
1634,PREFACE.,"Soft, and his Sublime. As to which latter, when he describes the Fury,"
1635,PREFACE.,"Noise, and Confusion of War, I recollect That of my Lord _Roscommon_;"
1636,PREFACE.,
1637,PREFACE.,"_Th'_ Æneian _Muse, when she appears in State,"
1638,PREFACE.,Makes all_ Jove's _Thunder on her Verses wait._
1639,PREFACE.,
1640,PREFACE.,And That of _Virgil_ himself:
1641,PREFACE.,
1642,PREFACE.,_----Quo non præstantior alter
1643,PREFACE.,"Ære ciere viros, Martemque accendere cantu._"
1644,PREFACE.,
1645,PREFACE.,"For those Lines may as well be applied to the Trumpet of _Virgil_, as of"
1646,PREFACE.,"_Misenus_. Not but that in this way of Writing, I mean the Martial, and"
1647,PREFACE.,"the Furious, _Homer_, setting aside his Redundancy, is at least equal to"
1648,PREFACE.,_Virgil_; perhaps superiour. But then he is not comparable to him in the
1649,PREFACE.,"other Part, the smooth, the soft, and the sweetly flowing. This in"
1650,PREFACE.,"_Virgil_ always puts me in mind of some Verses of his own, which I have"
1651,PREFACE.,"elsewhere cited: Verses, which, in the Sixth Eclogue, the Speakers"
1652,PREFACE.,"apply to each other; and which, above all Writers, are most applicable"
1653,PREFACE.,"to Him, who gives Speech to them both."
1654,PREFACE.,
1655,PREFACE.,"_Tale tuum carmen nobis, divine Poeta,"
1656,PREFACE.,"Quale sopor fessis in gramine, quale per æstum"
1657,PREFACE.,Dulcis aquæ saliente sitim restinguere rivo.
1658,PREFACE.,"Nam neque me tantum venientis sibilus Austri,"
1659,PREFACE.,"Nec percussa juvant fluctu tam littora, nec quæ"
1660,PREFACE.,Saxosas inter decurrunt flumina valles._
1661,PREFACE.,
1662,PREFACE.,But the exquisite Art of _Virgil_'s Versification is seen in his varying
1663,PREFACE.,"the Pauses, and Periods, and Cadence of his Numbers; in being rough or"
1664,PREFACE.,"smooth, soft or vehement, long or short, _&c._ according to the Nature"
1665,PREFACE.,"of the Ideas he would convey to the Mind: in which, I think, he exceeds"
1666,PREFACE.,"all Writers, whether Ancient or Modern; and is in particular the best"
1667,PREFACE.,"Versifier, as well as, upon the whole, the best Poet in the World."
1668,PREFACE.,
1669,PREFACE.,"Upon the Subject of _Speeches_, Mr. _Pope_ tells us, ""That in _Virgil_"
1670,PREFACE.,"they often consist of general Reflections, or Thoughts, which might be"
1671,PREFACE.,equally just in any Person's Mouth upon the same Occasion. As many of
1672,PREFACE.,his Persons have no apparent Characters; so many of his Speeches escape
1673,PREFACE.,"being applied, and judged by the Rule of Propriety. We oftner think of"
1674,PREFACE.,"the Author himself, when we read _Virgil_, than when we are engaged in"
1675,PREFACE.,"_Homer_. All which are the Effects of _a colder Invention_, that"
1676,PREFACE.,"interests us less in the Action described: _Homer_ makes us Hearers, and"
1677,PREFACE.,"_Virgil_ leaves us Readers."" I have the Misfortune to be of a quite"
1678,PREFACE.,"different Sentiment. If _Virgil_ outshines _Homer_ in any thing, it is"
1679,PREFACE.,"especially in his _Speeches_. Which are all, so far as it is necessary,"
1680,PREFACE.,"adapted to the Manners of the Speakers, and diversified by their several"
1681,PREFACE.,Characters. Nor do I know of any one Beauty by which _Virgil_ is more
1682,PREFACE.,"peculiarly distinguished, than That of his Speeches: Considering the"
1683,PREFACE.,"Sweetness and Softness of some, the Cunning and Artifice of others; the"
1684,PREFACE.,Majesty and Gravity of a third sort; the Fire and Fury of a fourth: In
1685,PREFACE.,"which two last Kinds especially we have the united Eloquence of Oratory,"
1686,PREFACE.,and Poetry; and read _Tully_ involved in _Virgil_. That the Characters
1687,PREFACE.,of the Heroes are more particularly marked and distinguished in the
1688,PREFACE.,"_Greek_, than in the _Latin_, I readily acknowledge. In That the"
1689,PREFACE.,"_Iliad_ excels the _Æneis_; and, I think, in nothing else. And the"
1690,PREFACE.,"Controversy between these two great Poets Should, in my Opinion, be thus"
1691,PREFACE.,"determined: ""That _Virgil_ is very much obliged to _Homer_; and"
1692,PREFACE.,"_Homer_'s Poems, upon the whole, very much exceeded by _Virgil_'s."""
1693,PREFACE.,
1694,PREFACE.,"But I am sensible, that by arguing for _Virgil_ I have all this while"
1695,PREFACE.,"been arguing against my self. For the more excellent the Author, the"
1696,PREFACE.,more presumptuous the Translator. I have however thus much to plead in
1697,PREFACE.,"my Excuse, That this Work was very far _advanced_, before it was"
1698,PREFACE.,_undertaken_; having been for many Years the Diversion of my leisure
1699,PREFACE.,"Hours at the University, and growing upon me by insensible Degrees; so"
1700,PREFACE.,"that a great _Part_ of the _Æneis_ was _actually translated_, before I"
1701,PREFACE.,had _any Design_ of _attempting the Whole_. But with regard to the
1702,PREFACE.,"_Publick Office in Poetry_, with which the University of _Oxford_ was"
1703,PREFACE.,"afterwards pleased to honour me, (an Honour which I Now enjoy, and which"
1704,PREFACE.,I shall Forever gratefully acknowledge) I thought it might not be
1705,PREFACE.,"improper for me to review, and finish this Work; which otherwise had"
1706,PREFACE.,"certainly been as much neglected by Me, as perhaps it will now be by"
1707,PREFACE.,Every body else.
1708,PREFACE.,
1709,PREFACE.,"It is to That renowned Seat of Learning and Virtue, (the Pride and Glory"
1710,PREFACE.,of our Island!)
1711,PREFACE.,
1712,PREFACE.,"_----cujus amor mihi crescit in horas,_"
1713,PREFACE.,
1714,PREFACE.,and my Love and Veneration for which I Shall never be able to express:
1715,PREFACE.,"It is to That famous University, I say, that I owe a very considerable"
1716,PREFACE.,Part of my Encouragement in this Undertaking; tho' at the same time I
1717,PREFACE.,"have great and signal Obligations to many _Others_, who were not only"
1718,PREFACE.,"Subscribers to it themselves, but Promoters of it by their Interest in"
1719,PREFACE.,"their Friends. With the most grateful Sense of the Favour, and Honour"
1720,PREFACE.,"done me, I return my _general_ Thanks to _All_ Those of the Nobility,"
1721,PREFACE.,"and Gentry, and all Others, who appear as my Subscribers: But These my"
1722,PREFACE.,_especial Benefactors_ are desired to accept of my more _particular_
1723,PREFACE.,Acknowledgments. Even These (many of whom are Persons of Quality) are so
1724,PREFACE.,"numerous, that to mention them would be to transcribe a great Part of my"
1725,PREFACE.,"List into my Preface: And Since I cannot properly name them _All_, I"
1726,PREFACE.,"think it the best Manners to name _None_. I wish for Their sakes, as"
1727,PREFACE.,"well as my Own, that, when they have read this Translation, they may"
1728,PREFACE.,not repent of the _generous Encouragement_ they have given it.
1729,PREFACE.,
1730,PREFACE.,"One Thing of which, I hope, I may say; and That is, that _it is a"
1731,PREFACE.,"Translation_. And if it be; I believe I may add, that it is almost the"
1732,PREFACE.,"only one in Verse, and of a considerable Length. And this I am very far"
1733,PREFACE.,"from speaking, upon the Account of any great Opinion which I have"
1734,PREFACE.,conceived of my own Performance. For besides that a Translation may be
1735,PREFACE.,"very _close_, and yet very _bad_. Others could have done the same thing"
1736,PREFACE.,"much better, if they would: But they thought it either impracticable, or"
1737,PREFACE.,improper. They have been so averse from the Folly of rendering Word for
1738,PREFACE.,"Word, that they have ran into the other Extreme; and their Translations"
1739,PREFACE.,"are commonly so very licentious, that they can scarce be called so much"
1740,PREFACE.,"as Paraphrases. Whereas, were it practicable to translate _verbatim_ in"
1741,PREFACE.,"the strictest Sense; and yet preserve the Elegance, and Sublimity, and"
1742,PREFACE.,"Spirit of the Author, as much as if one allowed one's self a greater"
1743,PREFACE.,Latitude: That Method ought to be chosen before the other. And in
1744,PREFACE.,"proportion, the nearer one approaches to the Original, the better it is;"
1745,PREFACE.,"provided the Version be in other Respects no way prejudiced, but rather"
1746,PREFACE.,"improved by it: A Thing, in my Apprehension, by no Means inconceivable."
