,Poem Title,line
1747,PREFACE.,"A Translator should _draw the Picture_ of his Author: And in Painting,"
1748,PREFACE.,"we know, _Likeness_ is the _first_ Beauty; so that if it has not _That_,"
1749,PREFACE.,all the rest are insignificant. Draw _Virgil_ as _like_ as you can; To
1750,PREFACE.,"think of _improving_ him is _arrogant_; and to flatter him, is"
1751,PREFACE.,"_impossible_. I have not added, or omitted very many Words: Many indeed"
1752,PREFACE.,"are varied; the Sense of the Substantive in the Latin, being often"
1753,PREFACE.,transferred to the Adjective in the English; and so on the Reverse: with
1754,PREFACE.,"a great Number of such like Instances, which it is needless to mention."
1755,PREFACE.,"Yet many Lines are translated Word for Word: But, upon the Whole, to"
1756,PREFACE.,"give a tolerable, and yet a perfectly litteral Version, I take to be in"
1757,PREFACE.,the Nature of Things absolutely impossible.
1758,PREFACE.,
1759,PREFACE.,"I am sensible too, as I said before, that it may be a true Translation,"
1760,PREFACE.,"a close Translation; and yet, after all, a very bad Translation. Whether"
1761,PREFACE.,"This be so, or not, is with all imaginable Deference submitted to the"
1762,PREFACE.,"Judgment of the World. To render the bare Sense, and Words of a Poet, is"
1763,PREFACE.,"only to paint his Features, and Lineaments; but to render his _Poetry_,"
1764,PREFACE.,"that is, the _peculiar Turn_ of his Thoughts, and Diction, is to paint"
1765,PREFACE.,his _Air_ and _Manner_. And as the Air of a Face arises from a Man's
1766,PREFACE.,"_Soul_, as well as from his Body; it is just the same here: Or rather,"
1767,PREFACE.,This peculiar Turn of the Poet's Sentiments and Expressions _is it self_
1768,PREFACE.,the Soul of his Poetry: If we are asked what That is; the Answer must
1769,PREFACE.,"be, if we may properly compare a _Mode_ to a _Substance_, that the Soul"
1770,PREFACE.,"of Poetry, like the Soul of Man, is perceivable only by its Effects;"
1771,PREFACE.,"like That, immaterial, and invisible; and like That too, immortal."
1772,PREFACE.,
1773,PREFACE.,"But then all this being taken care of, certainly the nearer to the"
1774,PREFACE.,"Original, the better: Nay indeed it is impossible to hit the Air right;"
1775,PREFACE.,"unless you hit the Features, from which the Air, so far as it relates to"
1776,PREFACE.,"the Body, rises, and results. Should my Translation be approved of for"
1777,PREFACE.,"the Spirit of Poetry; I should not be sorry, nay I should be glad, if at"
1778,PREFACE.,the same time it served for a Construing-Book to a School-Boy. But still
1779,PREFACE.,"whenever it happens (as it very often does, and must) that a close"
1780,PREFACE.,"Version, and a graceful Expression are inconsistent; the latter is"
1781,PREFACE.,always to be preferred. A _less litteral Translation_ is very frequently
1782,PREFACE.,"beautiful; but nothing can justify _an ill Verse_. In This Case, one"
1783,PREFACE.,departs from the Original by adhering to it; and such an Author as
1784,PREFACE.,"_Virgil_ might justly say of his bad Translator, what _Martial_ says of"
1785,PREFACE.,his bad Neighbour;
1786,PREFACE.,
1787,PREFACE.,"_Nemo tam prope, tam proculque nobis._"
1788,PREFACE.,
1789,PREFACE.,"For the Version would retain more not only of the _Beauty_, but of the"
1790,PREFACE.,"_real Sense_ of the Original; and so _upon the whole_, be more _like_"
1791,PREFACE.,it: If it were a less faithful Interpretation of Words and Expressions.
1792,PREFACE.,
1793,PREFACE.,Here therefore we can no longer pursue the Comparison between Painting
1794,PREFACE.,"and Translating: When true Beauty is to be imitated, the Features cannot"
1795,PREFACE.,"be too exactly traced in the One, to make a handsom Likeness; but Words"
1796,PREFACE.,may be too exactly rendered in the Other. Upon this Head I cannot avoid
1797,PREFACE.,"transcribing a Passage from the ingenious, and (in all Instances, but"
1798,PREFACE.,one) judicious Dr. _Felton_'s Dissertation upon _Reading the Classicks
1799,PREFACE.,"addressed to the Lord Marquis of_ Granby. ""When therefore ([18]says He)"
1800,PREFACE.,you meet with any Expressions which will not be rendered without this
1801,PREFACE.,"Disadvantage, the Thing to be regarded is the Beauty and Elegance of the"
1802,PREFACE.,"Original; and your Lordship, without minding any thing but the Sense of"
1803,PREFACE.,"the Author, is to consider how that Passage would be best expressed in"
1804,PREFACE.,"_English_, if you were not tied up to the Words of the Original: And you"
1805,PREFACE.,"may depend upon it, that if you can find a Way of expressing the same"
1806,PREFACE.,"Sense as beautifully in _English_; you have hit the true Translation,"
1807,PREFACE.,"tho' you cannot construe the Words backwards, and forwards into one"
1808,PREFACE.,"another: For then you certainly have translated, as the Author, were he"
1809,PREFACE.,"an _Englishman_, would have wrote."" And since I have cited thus much"
1810,PREFACE.,"from That Treatise; I will borrow a little more from it upon the Nature,"
1811,PREFACE.,and Difficulty of Translations in general: Because it entirely expresses
1812,PREFACE.,"my Sentiments, in far better Words than I am able to make use of."
1813,PREFACE.,"""[19]'Tis no exceeding Labour for every great Genius to exert, and"
1814,PREFACE.,"manage, and master his own Spirit: But 'tis almost an insuperable Task"
1815,PREFACE.,"to compass, to equal, to command the Spirit of another Man. Yet this is"
1816,PREFACE.,"what every Translator taketh upon himself to do; and must do, if he"
1817,PREFACE.,"deserves the Name. He must put himself into the Place of his Authors,"
1818,PREFACE.,"not only be Master of their Manner as to their Style, their Periods,"
1819,PREFACE.,"Turn, and Cadence of their Writings; but he must bring himself to their"
1820,PREFACE.,"Habit, and Way of Thinking, and have, if possible, the same Train of"
1821,PREFACE.,"Notions in his Head, which gave Birth to Those they have selected, and"
1822,PREFACE.,"placed in their Works."" For the Rest, I refer my Reader to the"
1823,PREFACE.,Dissertation it self; of which I would say that it is a most curious and
1824,PREFACE.,"delicate Piece of Wit, and Criticism, and polite Learning; did I not"
1825,PREFACE.,fear that (for a Reason which I will not mention) it would look like
1826,PREFACE.,Vanity in Me to do common Justice to it's Author. At the same time I
1827,PREFACE.,must acknowledge that the Doctor represents a Translation of _Virgil_
1828,PREFACE.,after Mr. _Dryden_'s as a desperate Undertaking: Which would be no small
1829,PREFACE.,Mortification to me; were not mine of a different Nature from His: Of
1830,PREFACE.,which more in it's proper Place.
1831,PREFACE.,
1832,PREFACE.,"Endeavouring to resemble _Virgil_ as much as possible, I have imitated"
1833,PREFACE.,him in his _Breaks_. For tho' I am satisfied he never intended to leave
1834,PREFACE.,"those Verses unfinished, and therefore he is in that Particular absurdly"
1835,PREFACE.,mimicked by some Moderns in their Original Writings; yet _unfinished
1836,PREFACE.,"they are_: And this Imitation is not (with Mr. _Dryden_'s Leave) ""like"
1837,PREFACE.,"the Affectation of _Alexander_'s Courtiers, who held their Necks awry,"
1838,PREFACE.,"because He could not help it."" For besides that a _wry Neck_ is one"
1839,PREFACE.,"thing, and a _Scar_ is another; _Apelles_ in a _Picture_ ought to have"
1840,PREFACE.,"imitated his Master's Imperfection, if he intended to draw an exact"
1841,PREFACE.,"Likeness, tho' his _Courtiers_ were ridiculous Flatterers for doing the"
1842,PREFACE.,Same in their _Gestures_.
1843,PREFACE.,
1844,PREFACE.,A Work of This Nature is to be regarded in Two different Views; both as
1845,PREFACE.,"a _Poem_, and as a _Translated Poem_. In the one, all Persons of good"
1846,PREFACE.,"Sense, and a true Taste of Poetry, are Judges of it; tho' they are"
1847,PREFACE.,"skilled in no Language, but their Own. In the other, Those only are so;"
1848,PREFACE.,"who besides the Qualification just mentioned, are familiarly acquainted"
1849,PREFACE.,"with the Original. And it may well admit of a Question, to which of"
1850,PREFACE.,these Species of Readers a good Translation is the more agreeable
1851,PREFACE.,"Entertainment. The Unlearned are affected like Those, who see the"
1852,PREFACE.,Picture of One whose Character they admire; but whose Person they never
1853,PREFACE.,"saw: The Learned, like Those who see the Picture of one whom they love,"
1854,PREFACE.,and admire; and with whom they are intimately acquainted. The Reason of
1855,PREFACE.,the first Pleasure is clear; but That of the last requires a little more
1856,PREFACE.,"Consideration. It may all, be resolved into the Love of Imitation,"
1857,PREFACE.,"Comparison, and Variety; which arises from the Imperfection of human"
1858,PREFACE.,Happiness; for a Reason which I have elsewhere[20] assigned. Delightful
1859,PREFACE.,therefore it is to compare the Version with the Original: Through the
1860,PREFACE.,"whole Course of which Comparison, we discover many retired Beauties in"
1861,PREFACE.,"the Author himself, which we never before observed. Delightful it must"
1862,PREFACE.,"be to have the same Ideas started in our Minds, different ways; and the"
1863,PREFACE.,"more agreeable those Ideas are in themselves, the more agreeable is this"
1864,PREFACE.,"Variety. Therefore, the better we understand a Poet, the more we love"
1865,PREFACE.,and admire him; the more Pleasure we conceive in reading him well
1866,PREFACE.,translated: As we most delight to see the Pictures of Those whom we best
1867,PREFACE.,love; and to see the Persons themselves in Variety of Dresses. Upon
1868,PREFACE.,"which Account, I will be bold to affirm; that he who says he values no"
1869,PREFACE.,"Translation of this, or that Poem, because he understands the Original,"
1870,PREFACE.,"has indeed no true Relish, that is, in effect, no _true Understanding_"
1871,PREFACE.,of _Either_.
1872,PREFACE.,
1873,PREFACE.,"It is indeed no less certain on the Reverse, that a Man is as much"
1874,PREFACE.,"provoked to see an ill Picture of his Friend, or Mistress, as he is"
1875,PREFACE.,pleased to see a good one; and it is just the same in Translations. But
1876,PREFACE.,it is evident that the _bare Understanding_ of a Poet (as that Word is
1877,PREFACE.,commonly used) is not the _only_ Argument of one's _truly_ understanding
1878,PREFACE.,"him: that is, understanding him as a _Poet_. Because what I have just"
1879,PREFACE.,"now said, concerning the Agreeableness of a good Translation, holds as"
1880,PREFACE.,"true, when it is from our own Language to another, as when it is from"
1881,PREFACE.,"another to our own. It may be presumed that _Milton_'s _Paradise Lost_,"
1882,PREFACE.,"being in _English_, is well _understood_ (vulgarly speaking) by"
1883,PREFACE.,"_Englishmen_. But notwithstanding That, were it possible (as I think it"
1884,PREFACE.,"is not) to have all That amazing Poem as well translated into _Latin_,"
1885,PREFACE.,"or _Greek_, as some Parts of it certainly may be; with what Pleasure"
1886,PREFACE.,should we read it! And he who would not read such a Translation with
1887,PREFACE.,"Pleasure, will, I believe, be allowed by all who have a right Taste of"
1888,PREFACE.,Poetry not _truly_ to understand the Original. Besides what I have said
1889,PREFACE.,"concerning the Delight arising from Imitation, Comparison, and Variety,"
1890,PREFACE.,"which respects the Relation between the Version, and the Original; the"
1891,PREFACE.,"Translator's Work, even to Those who understand the Original, is in a"
1892,PREFACE.,"great measure a _New Poem_: The Thought, and Contrivance are his"
1893,PREFACE.,"Author's; but his Language, and the Turn of his Versification, and"
1894,PREFACE.,"Expressions, are his own. What I have offered upon this Subject relates"
1895,PREFACE.,to Translations in general: Of my own in particular I have nothing to
1896,PREFACE.,"say, but what I have said before; which is to submit it to the Judgment"
1897,PREFACE.,of Others.
1898,PREFACE.,
1899,PREFACE.,In Pursuance of my Design of endeavouring to be as like _Virgil_ as
1900,PREFACE.,"possible; I have chosen Blank Verse, rather than Rhime. For besides that"
1901,PREFACE.,"the Fetters of Rhime often cramp the Expression, and spoil the Verse,"
1902,PREFACE.,"and so you can both translate more closely, and also more fully express"
1903,PREFACE.,"the Spirit of your Author, without it, than with it; I say besides This,"
1904,PREFACE.,"supposing other Circumstances were equal, Blank Verse is _in it self"
1905,PREFACE.,"better_. It is not only more Majestick, and Sublime, but more Musical,"
1906,PREFACE.,"and Harmonious: It has more _Rhime_ in it, according to the ancient, and"
1907,PREFACE.,"true Sense of the Word, than Rhime it self, as it is now used. For in"
1908,PREFACE.,"it's original Signification, it consists not in the Tinkling of Vowels,"
1909,PREFACE.,"and Consonants; but in the metrical Disposition of Words, and Syllables,"
1910,PREFACE.,"and the proper Cadence of Numbers; which is more agreeable to the Ear,"
1911,PREFACE.,"without the Jingling of like Endings, than with it. The Reader may say,"
1912,PREFACE.,To whose Ear is it so? To Yours perhaps; but not to Mine. And I grant
1913,PREFACE.,"all This to be matter of Fact, rather than of Reason; and to be"
1914,PREFACE.,"determined by Votes, rather than Arguments. And accordingly a great"
1915,PREFACE.,"Majority of the best Genius's, and Judges in Poetry now living, with"
1916,PREFACE.,"many of whom I have frequently conversed upon this Subject, have"
1917,PREFACE.,determined in favour of this way of Writing. And among Those who are
1918,PREFACE.,"dead, the same was the Opinion not only of my Lord _Roscommon_ (to omit"
1919,PREFACE.,"others,) but of [21]Mr. _Dryden_ Himself; who was the best Rhimer, as"
1920,PREFACE.,"well as the best Poet, of the Age in which he lived. And indeed let but"
1921,PREFACE.,a Man consult his own Ears.
1922,PREFACE.,
1923,PREFACE.,_----Him the Almighty Pow'r
1924,PREFACE.,"Hurl'd headlong, flaming from th' ethereal Sky,"
1925,PREFACE.,"With hideous Ruin, and Combustion, down"
1926,PREFACE.,To bottomless Perdition; there to dwell
1927,PREFACE.,"In Adamantine Chains, and penal Fire;"
1928,PREFACE.,Who durst defy th' Omnipotent to Arms.
1929,PREFACE.,"Nine times the Space that measures Day, and Night"
1930,PREFACE.,"To mortal Men, he with his horrid Crew"
1931,PREFACE.,"Lay vanquish'd, rowling in the fiery Gulph,"
1932,PREFACE.,"Confounded, tho' immmortal----_"
1933,PREFACE.,
1934,PREFACE.,"Who that hears This, can think it wants Rhime to recommend it? Or rather"
1935,PREFACE.,does not think it sounds far better without it? I purposely produced a
1936,PREFACE.,"Citation, beginning and ending in the Middle of a Verse; because the"
1937,PREFACE.,"Privilege of resting on this, or that Foot, sometimes one, and sometimes"
1938,PREFACE.,"another, and so diversifying the Pauses, and Cadences, is the greatest"
1939,PREFACE.,"Beauty of Blank Verse, and perfectly agreeable to the Practice of our"
1940,PREFACE.,"Masters, the _Greeks_, and _Romans_. This can be done but rarely in"
1941,PREFACE.,"Rhime: For if it were frequent, the Rhime would be, in a manner, lost by"
1942,PREFACE.,it: The End of almost every Verse must be something of a Pause; and it
1943,PREFACE.,is but seldom that a Sentence begins in the Middle. The same may be said
1944,PREFACE.,of placing the Verb after the Accusative Case; and the Adjective after
1945,PREFACE.,"the Substantive; both which, especially the last, are more frequent in"
1946,PREFACE.,"Blank Verse, than in Rhime. This Turn of Expression likewise is"
1947,PREFACE.,agreeable to the Practice of the Ancients; and even in our own Language
1948,PREFACE.,"adds much to the Grandeur, and Majesty of the Poem, if it be wrought"
1949,PREFACE.,"with Care, and Judgment. As does also the judicious interspersing (for"
1950,PREFACE.,"_judicious_, and _sparing_ it must be) of _antique_ Words, and of such"
1951,PREFACE.,"as, being derived from _Latin_, retain the Air of That Language: Both"
1952,PREFACE.,"which have a better Effect in Blank Verse, than in Rhime; by Reason of a"
1953,PREFACE.,"certain Majestick Stiffness, which becomes the one, more than the other."
1954,PREFACE.,"_Milton_ indeed has, I think, rather too much of This: And perhaps the"
1955,PREFACE.,most ingenious Mr. _Philips_ has too much imitated him in it; as he has
1956,PREFACE.,certainly well nigh equalled him in his most singular Beauties. I speak
1957,PREFACE.,"of this Stiffness only in some particular Passages, for which it is"
1958,PREFACE.,"proper: For Blank Verse, when it pleases, can be as smooth, as soft, and"
1959,PREFACE.,"as flowing, as Rhime. Now these Advantages alone (were there no other)"
1960,PREFACE.,"which Blank Verse has above Rhime, would more than compensate for the"
1961,PREFACE.,Loss of that Pleasure which comes from the Chiming of Syllables; the
1962,PREFACE.,"former, by reason of those Advantages, being, all things considered,"
1963,PREFACE.,"even more musical, and harmonious, as well as more noble, and sublime,"
1964,PREFACE.,than the latter.
1965,PREFACE.,
1966,PREFACE.,"Upon Varying the Pauses it is to be observed, that Two Verses together"
1967,PREFACE.,should rarely pause at the same Foot; for a Reason too plain to be
1968,PREFACE.,mentioned. I said _rarely_; because there is no Law so strict in Things
1969,PREFACE.,"of This Nature, but that it is sometimes a Vertue to break it. And tho'"
1970,PREFACE.,"it be one great Privilege in this sort of Verse, to make a full Period"
1971,PREFACE.,"at the Beginning, or in the Middle of a Line; yet you may do it too"
1972,PREFACE.,"often. _Milton_, I think, does so; who sometimes gives you thirty, or"
1973,PREFACE.,"forty Verses together, not one of which concludes with a full Period."
1974,PREFACE.,But to return to our Comparison.
1975,PREFACE.,
1976,PREFACE.,"Tho' all This be rather Matter of Sense, than of Reason; yet I appealed"
1977,PREFACE.,"to the best Genius's, and Judges in Poetry; because it is a great"
1978,PREFACE.,"Mistake to think that all Ears are equally Judges. It may as well, nay"
1979,PREFACE.,"better, be affirmed that all Persons have equally Ears for Musick. This"
1980,PREFACE.,"Sentiment is not _purely_ Organical, and depends not _solely_ upon the"
1981,PREFACE.,Mechanism of Sense. The Judgment has _a Share_ in it: Or if it has not;
1982,PREFACE.,there is (which amounts to much the same) so close an Union between the
1983,PREFACE.,"Soul and Body of Man, as also between the Spirit and the Diction, which"
1984,PREFACE.,may be called the Soul and Body of Poetry; that the Poetical Turn of any
1985,PREFACE.,Person's Mind affects the very Organs of Sense. Readers of vulgar and
1986,PREFACE.,mean Tastes may relish Rhime best; and so may Some even of the best
1987,PREFACE.,Taste; because they have been habituated to it. But the more they
1988,PREFACE.,accustom themselves to Blank Verse; the better they will like it:
1989,PREFACE.,
1990,PREFACE.,"_----Si propius stes,"
1991,PREFACE.,Te capiet magis----_
1992,PREFACE.,
1993,PREFACE.,"After all, I cannot agree with Those, who _entirely condemn_ the Use of"
1994,PREFACE.,Rhime even in an Heroic Poem; nor can I absolutely reject That in
1995,PREFACE.,"Speculation, which Mr. _Dryden_, and Mr. _Pope_ have ennobled by their"
1996,PREFACE.,"Practice. I acknowledge too that, in some particular Views, tho' not"
1997,PREFACE.,"upon the Whole, This Way of Writing has the Advantage over the other."
1998,PREFACE.,"You may pick out more Lines, which, singly considered, look mean, and"
1999,PREFACE.,"low, from a Poem in Blank Verse, than from one in Rhime: supposing them"
2000,PREFACE.,"to be in other respects equal. Take the Lines singly by themselves, or"
2001,PREFACE.,"in Couplets; and more in Blank Verse shall be less strong, and smooth,"
2002,PREFACE.,than in Rhime: But then take a considerable Number together; and Blank
2003,PREFACE.,"Verse shall have the Advantage in both Regards. Little, and ignoble"
2004,PREFACE.,"Words, as _Thus_, _Now_, _Then_, _Him_, &c. on the one Hand; and long"
2005,PREFACE.,"ones, as _Elements_, _Omnipotent_, _Majesty_, &c. on the other, would in"
2006,PREFACE.,"a Poem consisting of Rhime sound weak, and languishing, at the End of a"
2007,PREFACE.,"Verse: because the Rhime draws out the Sound of those Words, and makes"
2008,PREFACE.,"them observed, and taken notice of by the Ear: Whereas in Blank Verse"
2009,PREFACE.,"they are covered, and concealed by running immediately into the next"
2010,PREFACE.,"Line. And yet a considerable Number of Lines are not, in the Main,"
2011,PREFACE.,"Prosaick, or Flat; but more Noble, than if they were all in Rhime. For"
2012,PREFACE.,"Instance, the following Verses out of _Milton_'s _Paradise Lost_, Book"
2013,II.,II.
2014,II.,
2015,II.,"_Of Heav'n were falling, and these Elements----_"
2016,II.,
2017,II.,"_Instinct with Fire, and Nitre hurry'd him----_"
2018,II.,
2019,II.,"taken singly, look low, and mean; but pray read them in Conjunction with"
2020,II.,others; and then see what a different Face will be set upon them.
2021,II.,
2022,II.,_----Or less than if this Frame
2023,II.,"Of Heav'n were falling, and these Elements"
2024,II.,In Mutinie had from her Axle torn
2025,II.,The stedfast Earth. At last his sail-broad Vans
2026,II.,"He spreads for flight; and in the surging Smoke,_ &c."
2027,II.,
2028,II.,_----Had not by ill chance
2029,II.,The strong Rebuff of some tumultuous Cloud
2030,II.,"Instinct with Fire, and Nitre, hurry'd him"
2031,II.,As many miles aloft. That fury stay'd;
2032,II.,"Quench'd in a boggy Syrtis, neither Sea,"
2033,II.,"Nor good dry Land: Nigh founder'd on he fares,"
2034,II.,Treading the crude Consistence----_
2035,II.,
2036,II.,Thus again in the VIth Book.
2037,II.,
2038,II.,_Had to her Center shook. What wonder? when----_
2039,II.,
2040,II.,_Had not th' Eternal King Omnipotent----_
2041,II.,
2042,II.,_And limited their Might; tho' number'd such----_
2043,II.,
2044,II.,These Verses disjointed from their Fellows make but an indifferent
2045,II.,Figure: But read the following Passage and I believe you will
2046,II.,acknowledge there is not one bad Verse in it:
2047,II.,
2048,II.,_So under fiery Cope together rush'd
2049,II.,"Both Battles maine, with ruinous Assault,"
2050,II.,And inextinguishable Rage: All Heav'n
2051,II.,"Resounded; and had Earth been then, all Earth"
2052,II.,Had to her Center shook. What wonder? when
2053,II.,Millions of fierce encountring Angels fought
2054,II.,On either side; the least of whom could wield
2055,II.,"These Elements, and arm him with the force"
2056,II.,"Of all their Regions. How much more of pow'r,"
2057,II.,"Army 'gainst Army, numberless, to raise"
2058,II.,"Dreadful Combustion, warring, and disturb,"
2059,II.,"Tho' not destroy, their happy native Seat:"
2060,II.,Had not th' Eternal King Omnipotent
2061,II.,From his strong Hold of Heav'n high over-rul'd
2062,II.,And limited their Might; tho' number'd such
2063,II.,As each divided Legion might have seem'd
2064,II.,"A num'rous Host in strength, each armed hand"
2065,II.,A Legion----_
2066,II.,
2067,II.,"In Short, a Poem consisting of Rhime is like a Building in which the"
2068,II.,Stones are all (or far the greatest part of them) _hewn with equal
2069,II.,"Exactness_; but are all of a Shape, and not so well jointed: _Every one_"
2070,II.,"of them, _by it self_, is better squared, than _some_ in another"
2071,II.,"Building, in which they are of different Figures. But tho' in this"
2072,II.,"latter there shall be a few, which, taken separately, do not look so"
2073,II.,"well: yet some _running into others_, and all being _better adjusted_"
2074,II.,"together; it shall not only _upon the Whole_, but with regard to any"
2075,II.,"_considerable Part_, by it self, be a stronger, and a more beautiful"
2076,II.,"Fabrick, than the former."
2077,II.,
2078,II.,But we are told that Blank Verse is not enough distinguished from Prose.
2079,II.,"The Answer must be, It is according as it is. That of our _English_"
2080,II.,"Tragedies, I confess, is not; tho' very proper for the Purpose to which"
2081,II.,it is apply'd. This indeed is what the _French_ rightly call _Prose
2082,II.,"mesurée_, rather than Verse. But much worse is to be said of _any_ Poem,"
2083,II.,"which is only written in the Shape of Metre, but has no more of Verse in"
2084,II.,"it, than of Rhime; no Harmony, or Prosody, no true Metrical Cadence;"
2085,II.,"half the Lines concluding with double Syllables, as _Torment_,"
2086,II.,"_Greatness_, and the Participles ending in _ing_. This deserves not so"
2087,II.,much as the Name of _Prose on Horseback_; 'Tis Prose upon Crutches; and
2088,II.,"of all Prose the vilest. But if Blank Verse be laboured, as it ought to"
2089,II.,"be; it is sufficiently distinguished from Prose. We have no Feet, nor"
2090,II.,"Quantities, like the Ancients; and nothing in our poor Language will"
2091,II.,"ever supply That Defect: Rhime is at least as far from doing it, as the"
2092,II.,more Advantageous Variety of Cadences in Blank Verse: Which requires so
2093,II.,"much the more Care, and Art, to work it up into Numbers, and Support it"
2094,II.,from groveling into Prose.
2095,II.,
2096,II.,"Which naturally leads us to observe further, that many Imperfections,"
2097,II.,"both in Thought, and Expression, will be overlooked in Rhime, which will"
2098,II.,"not be endured in Blank Verse: So that the same may be said of This,"
2099,II.,which _Horace_ applies to Comedy;
2100,II.,
2101,II.,_Creditur----habere
2102,II.,Sudoris minimum; sed habet----tanto
2103,II.,"Plus oneris, quanto veniæ minus----_"
2104,II.,
2105,II.,"I do not say, Rhime is, all things considered, more easy than the other:"
2106,II.,That Point cannot be well determined; because it relates to the
