,Poem Title,line
962,CANTO XXVIII,"I saw, and yet it seems to pass before me,"
963,CANTO XXVIII,"A headless trunk, that even as the rest"
964,CANTO XXVIII,Of the sad flock pac'd onward.  By the hair
965,CANTO XXVIII,"It bore the sever'd member, lantern-wise"
966,CANTO XXVIII,"Pendent in hand, which look'd at us and said,"
967,CANTO XXVIII,
968,CANTO XXVIII,"""Woe's me!""  The spirit lighted thus himself,"
969,CANTO XXVIII,"And two there were in one, and one in two."
970,CANTO XXVIII,How that may be he knows who ordereth so.
971,CANTO XXVIII,
972,CANTO XXVIII,"When at the bridge's foot direct he stood,"
973,CANTO XXVIII,"His arm aloft he rear'd, thrusting the head"
974,CANTO XXVIII,"Full in our view, that nearer we might hear"
975,CANTO XXVIII,"The words, which thus it utter'd: ""Now behold"
976,CANTO XXVIII,"This grievous torment, thou, who breathing go'st"
977,CANTO XXVIII,To spy the dead; behold if any else
978,CANTO XXVIII,Be terrible as this.  And that on earth
979,CANTO XXVIII,"Thou mayst bear tidings of me, know that I"
980,CANTO XXVIII,"Am Bertrand, he of Born, who gave King John"
981,CANTO XXVIII,The counsel mischievous.  Father and son
982,CANTO XXVIII,I set at mutual war.  For Absalom
983,CANTO XXVIII,"And David more did not Ahitophel,"
984,CANTO XXVIII,Spurring them on maliciously to strife.
985,CANTO XXVIII,"For parting those so closely knit, my brain"
986,CANTO XXVIII,"Parted, alas!  I carry from its source,"
987,CANTO XXVIII,That in this trunk inhabits.  Thus the law
988,CANTO XXVIII,"Of retribution fiercely works in me."""
989,CANTO XXVIII,
990,CANTO XXVIII,
991,CANTO XXVIII,
992,CANTO XXVIII,
993,CANTO XXVIII,
994,CANTO XXVIII,"End of Project Gutenberg's The Vision of Hell, Part 8, by Dante Alighieri"
995,CANTO XXVIII,
996,CANTO XXVIII,
997,CANTO XXVIII,
