,Poem Title,line
0,,
1,,
2,,
3,,
4,,Produced by David Widger
5,,
6,,
7,,
8,,
9,,
10,THE VISION,THE VISION
11,THE VISION,
12,OF,OF
13,OF,
14,"HELL, PURGATORY, AND PARADISE","HELL, PURGATORY, AND PARADISE"
15,"HELL, PURGATORY, AND PARADISE",
16,"HELL, PURGATORY, AND PARADISE",
17,"HELL, PURGATORY, AND PARADISE",
18,"HELL, PURGATORY, AND PARADISE",
19,"HELL, PURGATORY, AND PARADISE",
20,BY,BY
21,BY,
22,DANTE ALIGHIERI,DANTE ALIGHIERI
23,DANTE ALIGHIERI,
24,DANTE ALIGHIERI,
25,DANTE ALIGHIERI,
26,TRANSLATED BY,TRANSLATED BY
27,TRANSLATED BY,
28,"THE REV. H. F. CARY, M.A.","THE REV. H. F. CARY, M.A."
29,"THE REV. H. F. CARY, M.A.",
30,"THE REV. H. F. CARY, M.A.",
31,"THE REV. H. F. CARY, M.A.",
32,HELL,HELL
33,HELL,
34,OR THE INFERNO,OR THE INFERNO
35,OR THE INFERNO,
36,OR THE INFERNO,
37,OR THE INFERNO,Part 8
38,OR THE INFERNO,
39,OR THE INFERNO,
40,OR THE INFERNO,Cantos 23 - 28
41,OR THE INFERNO,
42,OR THE INFERNO,
43,OR THE INFERNO,
44,OR THE INFERNO,
45,CANTO XXIII,CANTO XXIII
46,CANTO XXIII,
47,CANTO XXIII,"IN silence and in solitude we went,"
48,CANTO XXIII,"One first, the other following his steps,"
49,CANTO XXIII,As minor friars journeying on their road.
50,CANTO XXIII,
51,CANTO XXIII,The present fray had turn'd my thoughts to muse
52,CANTO XXIII,"Upon old Aesop's fable, where he told"
53,CANTO XXIII,What fate unto the mouse and frog befell.
54,CANTO XXIII,"For language hath not sounds more like in sense,"
55,CANTO XXIII,"Than are these chances, if the origin"
56,CANTO XXIII,And end of each be heedfully compar'd.
57,CANTO XXIII,"And as one thought bursts from another forth,"
58,CANTO XXIII,"So afterward from that another sprang,"
59,CANTO XXIII,Which added doubly to my former fear.
60,CANTO XXIII,"For thus I reason'd: ""These through us have been"
61,CANTO XXIII,"So foil'd, with loss and mock'ry so complete,"
62,CANTO XXIII,As needs must sting them sore.  If anger then
63,CANTO XXIII,"Be to their evil will conjoin'd, more fell"
64,CANTO XXIII,"They shall pursue us, than the savage hound"
65,CANTO XXIII,"Snatches the leveret, panting 'twixt his jaws."""
66,CANTO XXIII,
67,CANTO XXIII,Already I perceiv'd my hair stand all
68,CANTO XXIII,"On end with terror, and look'd eager back."
69,CANTO XXIII,
70,CANTO XXIII,"""Teacher,"" I thus began, ""if speedily"
71,CANTO XXIII,"Thyself and me thou hide not, much I dread"
72,CANTO XXIII,Those evil talons.  Even now behind
73,CANTO XXIII,They urge us: quick imagination works
74,CANTO XXIII,"So forcibly, that I already feel them."""
75,CANTO XXIII,
76,CANTO XXIII,"He answer'd: ""Were I form'd of leaded glass,"
77,CANTO XXIII,I should not sooner draw unto myself
78,CANTO XXIII,"Thy outward image, than I now imprint"
79,CANTO XXIII,That from within.  This moment came thy thoughts
80,CANTO XXIII,"Presented before mine, with similar act"
81,CANTO XXIII,"And count'nance similar, so that from both"
82,CANTO XXIII,I one design have fram'd.  If the right coast
83,CANTO XXIII,"Incline so much, that we may thence descend"
84,CANTO XXIII,"Into the other chasm, we shall escape"
85,CANTO XXIII,"Secure from this imagined pursuit."""
86,CANTO XXIII,
87,CANTO XXIII,"He had not spoke his purpose to the end,"
88,CANTO XXIII,When I from far beheld them with spread wings
89,CANTO XXIII,Approach to take us.  Suddenly my guide
90,CANTO XXIII,"Caught me, ev'n as a mother that from sleep"
91,CANTO XXIII,"Is by the noise arous'd, and near her sees"
92,CANTO XXIII,"The climbing fires, who snatches up her babe"
93,CANTO XXIII,"And flies ne'er pausing, careful more of him"
94,CANTO XXIII,"Than of herself, that but a single vest"
95,CANTO XXIII,Clings round her limbs.  Down from the jutting beach
96,CANTO XXIII,"Supine he cast him, to that pendent rock,"
97,CANTO XXIII,Which closes on one part the other chasm.
98,CANTO XXIII,
99,CANTO XXIII,Never ran water with such hurrying pace
100,CANTO XXIII,"Adown the tube to turn a landmill's wheel,"
101,CANTO XXIII,"When nearest it approaches to the spokes,"
102,CANTO XXIII,"As then along that edge my master ran,"
103,CANTO XXIII,"Carrying me in his bosom, as a child,"
104,CANTO XXIII,Not a companion.  Scarcely had his feet
105,CANTO XXIII,"Reach'd to the lowest of the bed beneath,"
106,CANTO XXIII,
107,CANTO XXIII,When over us the steep they reach'd; but fear
108,CANTO XXIII,"In him was none; for that high Providence,"
109,CANTO XXIII,"Which plac'd them ministers of the fifth foss,"
110,CANTO XXIII,Power of departing thence took from them all.
111,CANTO XXIII,
112,CANTO XXIII,"There in the depth we saw a painted tribe,"
113,CANTO XXIII,"Who pac'd with tardy steps around, and wept,"
114,CANTO XXIII,Faint in appearance and o'ercome with toil.
115,CANTO XXIII,"Caps had they on, with hoods, that fell low down"
116,CANTO XXIII,"Before their eyes, in fashion like to those"
117,CANTO XXIII,Worn by the monks in Cologne.  Their outside
118,CANTO XXIII,"Was overlaid with gold, dazzling to view,"
119,CANTO XXIII,"But leaden all within, and of such weight,"
120,CANTO XXIII,That Frederick's compar'd to these were straw.
121,CANTO XXIII,"Oh, everlasting wearisome attire!"
122,CANTO XXIII,
123,CANTO XXIII,We yet once more with them together turn'd
124,CANTO XXIII,"To leftward, on their dismal moan intent."
125,CANTO XXIII,"But by the weight oppress'd, so slowly came"
126,CANTO XXIII,"The fainting people, that our company"
127,CANTO XXIII,Was chang'd at every movement of the step.
128,CANTO XXIII,
129,CANTO XXIII,"Whence I my guide address'd: ""See that thou find"
130,CANTO XXIII,"Some spirit, whose name may by his deeds be known,"
131,CANTO XXIII,"And to that end look round thee as thou go'st."""
132,CANTO XXIII,
133,CANTO XXIII,"Then one, who understood the Tuscan voice,"
134,CANTO XXIII,"Cried after us aloud: ""Hold in your feet,"
135,CANTO XXIII,Ye who so swiftly speed through the dusk air.
136,CANTO XXIII,"Perchance from me thou shalt obtain thy wish."""
137,CANTO XXIII,
138,CANTO XXIII,"Whereat my leader, turning, me bespake:"
139,CANTO XXIII,"""Pause, and then onward at their pace proceed."""
140,CANTO XXIII,
141,CANTO XXIII,"I staid, and saw two Spirits in whose look"
142,CANTO XXIII,Impatient eagerness of mind was mark'd
143,CANTO XXIII,To overtake me; but the load they bare
144,CANTO XXIII,And narrow path retarded their approach.
145,CANTO XXIII,
146,CANTO XXIII,"Soon as arriv'd, they with an eye askance"
147,CANTO XXIII,"Perus'd me, but spake not: then turning each"
148,CANTO XXIII,"To other thus conferring said: ""This one"
149,CANTO XXIII,"Seems, by the action of his throat, alive."
150,CANTO XXIII,"And, be they dead, what privilege allows"
151,CANTO XXIII,"They walk unmantled by the cumbrous stole?"""
152,CANTO XXIII,
153,CANTO XXIII,"Then thus to me: ""Tuscan, who visitest"
154,CANTO XXIII,"The college of the mourning hypocrites,"
155,CANTO XXIII,"Disdain not to instruct us who thou art."""
156,CANTO XXIII,
157,CANTO XXIII,"""By Arno's pleasant stream,"" I thus replied,"
158,CANTO XXIII,"""In the great city I was bred and grew,"
159,CANTO XXIII,And wear the body I have ever worn.
160,CANTO XXIII,"but who are ye, from whom such mighty grief,"
161,CANTO XXIII,"As now I witness, courseth down your cheeks?"
162,CANTO XXIII,"What torment breaks forth in this bitter woe?"""
163,CANTO XXIII,"""Our bonnets gleaming bright with orange hue,"""
164,CANTO XXIII,"One of them answer'd, ""are so leaden gross,"
165,CANTO XXIII,That with their weight they make the balances
166,CANTO XXIII,"To crack beneath them.  Joyous friars we were,"
167,CANTO XXIII,"Bologna's natives, Catalano I,"
168,CANTO XXIII,"He Loderingo nam'd, and by thy land"
169,CANTO XXIII,"Together taken, as men used to take"
170,CANTO XXIII,"A single and indifferent arbiter,"
171,CANTO XXIII,"To reconcile their strifes.  How there we sped,"
172,CANTO XXIII,"Gardingo's vicinage can best declare."""
173,CANTO XXIII,
174,CANTO XXIII,"""O friars!""  I began, ""your miseries--"""
175,CANTO XXIII,"But there brake off, for one had caught my eye,"
176,CANTO XXIII,Fix'd to a cross with three stakes on the ground:
177,CANTO XXIII,"He, when he saw me, writh'd himself, throughout"
178,CANTO XXIII,"Distorted, ruffling with deep sighs his beard."
179,CANTO XXIII,"And Catalano, who thereof was 'ware,"
180,CANTO XXIII,
181,CANTO XXIII,"Thus spake: ""That pierced spirit, whom intent"
182,CANTO XXIII,"Thou view'st, was he who gave the Pharisees"
183,CANTO XXIII,"Counsel, that it were fitting for one man"
184,CANTO XXIII,To suffer for the people.  He doth lie
185,CANTO XXIII,"Transverse; nor any passes, but him first"
186,CANTO XXIII,Behoves make feeling trial how each weighs.
187,CANTO XXIII,In straits like this along the foss are plac'd
188,CANTO XXIII,"The father of his consort, and the rest"
189,CANTO XXIII,"Partakers in that council, seed of ill"
190,CANTO XXIII,"And sorrow to the Jews.""  I noted then,"
191,CANTO XXIII,"How Virgil gaz'd with wonder upon him,"
192,CANTO XXIII,Thus abjectly extended on the cross
193,CANTO XXIII,In banishment eternal.  To the friar
194,CANTO XXIII,"He next his words address'd: ""We pray ye tell,"
195,CANTO XXIII,"If so be lawful, whether on our right"
196,CANTO XXIII,"Lies any opening in the rock, whereby"
197,CANTO XXIII,"We both may issue hence, without constraint"
198,CANTO XXIII,"On the dark angels, that compell'd they come"
199,CANTO XXIII,"To lead us from this depth.""  He thus replied:"
200,CANTO XXIII,"""Nearer than thou dost hope, there is a rock"
201,CANTO XXIII,"From the next circle moving, which o'ersteps"
202,CANTO XXIII,"Each vale of horror, save that here his cope"
203,CANTO XXIII,Is shatter'd.  By the ruin ye may mount:
204,CANTO XXIII,"For on the side it slants, and most the height"
205,CANTO XXIII,"Rises below.""  With head bent down awhile"
206,CANTO XXIII,"My leader stood, then spake: ""He warn'd us ill,"
207,CANTO XXIII,"Who yonder hangs the sinners on his hook."""
208,CANTO XXIII,
209,CANTO XXIII,To whom the friar: At Bologna erst
210,CANTO XXIII,"""I many vices of the devil heard,"
211,CANTO XXIII,"Among the rest was said, 'He is a liar,"
212,CANTO XXIII,"And the father of lies!'""  When he had spoke,"
213,CANTO XXIII,"My leader with large strides proceeded on,"
214,CANTO XXIII,Somewhat disturb'd with anger in his look.
215,CANTO XXIII,
216,CANTO XXIII,"I therefore left the spirits heavy laden,"
217,CANTO XXIII,"And following, his beloved footsteps mark'd."
218,CANTO XXIII,
219,CANTO XXIII,
220,CANTO XXIII,
221,CANTO XXIII,
222,CANTO XXIV,CANTO XXIV
223,CANTO XXIV,
224,CANTO XXIV,"IN the year's early nonage, when the sun"
225,CANTO XXIV,"Tempers his tresses in Aquarius' urn,"
226,CANTO XXIV,"And now towards equal day the nights recede,"
227,CANTO XXIV,When as the rime upon the earth puts on
228,CANTO XXIV,"Her dazzling sister's image, but not long"
229,CANTO XXIV,"Her milder sway endures, then riseth up"
230,CANTO XXIV,"The village hind, whom fails his wintry store,"
231,CANTO XXIV,And looking out beholds the plain around
232,CANTO XXIV,"All whiten'd, whence impatiently he smites"
233,CANTO XXIV,"His thighs, and to his hut returning in,"
234,CANTO XXIV,"There paces to and fro, wailing his lot,"
235,CANTO XXIV,As a discomfited and helpless man;
236,CANTO XXIV,"Then comes he forth again, and feels new hope"
237,CANTO XXIV,"Spring in his bosom, finding e'en thus soon"
238,CANTO XXIV,"The world hath chang'd its count'nance, grasps his crook,"
239,CANTO XXIV,And forth to pasture drives his little flock:
240,CANTO XXIV,So me my guide dishearten'd when I saw
241,CANTO XXIV,"His troubled forehead, and so speedily"
242,CANTO XXIV,That ill was cur'd; for at the fallen bridge
243,CANTO XXIV,"Arriving, towards me with a look as sweet,"
244,CANTO XXIV,"He turn'd him back, as that I first beheld"
245,CANTO XXIV,At the steep mountain's foot.  Regarding well
246,CANTO XXIV,"The ruin, and some counsel first maintain'd"
247,CANTO XXIV,"With his own thought, he open'd wide his arm"
248,CANTO XXIV,"And took me up.  As one, who, while he works,"
249,CANTO XXIV,"Computes his labour's issue, that he seems"
250,CANTO XXIV,"Still to foresee the' effect, so lifting me"
251,CANTO XXIV,"Up to the summit of one peak, he fix'd"
252,CANTO XXIV,"His eye upon another.  ""Grapple that,"""
253,CANTO XXIV,"Said he, ""but first make proof, if it be such"
254,CANTO XXIV,"As will sustain thee.""  For one capp'd with lead"
255,CANTO XXIV,"This were no journey.  Scarcely he, though light,"
256,CANTO XXIV,"And I, though onward push'd from crag to crag,"
257,CANTO XXIV,Could mount.  And if the precinct of this coast
258,CANTO XXIV,"Were not less ample than the last, for him"
259,CANTO XXIV,"I know not, but my strength had surely fail'd."
260,CANTO XXIV,But Malebolge all toward the mouth
261,CANTO XXIV,"Inclining of the nethermost abyss,"
262,CANTO XXIV,"The site of every valley hence requires,"
263,CANTO XXIV,"That one side upward slope, the other fall."
264,CANTO XXIV,
265,CANTO XXIV,At length the point of our descent we reach'd
266,CANTO XXIV,"From the last flag: soon as to that arriv'd,"
267,CANTO XXIV,"So was the breath exhausted from my lungs,"
268,CANTO XXIV,"I could no further, but did seat me there."
269,CANTO XXIV,
270,CANTO XXIV,"""Now needs thy best of man;"" so spake my guide:"
271,CANTO XXIV,"""For not on downy plumes, nor under shade"
272,CANTO XXIV,"Of canopy reposing, fame is won,"
273,CANTO XXIV,Without which whosoe'er consumes his days
274,CANTO XXIV,"Leaveth such vestige of himself on earth,"
275,CANTO XXIV,As smoke in air or foam upon the wave.
276,CANTO XXIV,Thou therefore rise: vanish thy weariness
277,CANTO XXIV,"By the mind's effort, in each struggle form'd"
278,CANTO XXIV,"To vanquish, if she suffer not the weight"
279,CANTO XXIV,Of her corporeal frame to crush her down.
280,CANTO XXIV,A longer ladder yet remains to scale.
281,CANTO XXIV,From these to have escap'd sufficeth not.
282,CANTO XXIV,"If well thou note me, profit by my words."""
283,CANTO XXIV,
284,CANTO XXIV,"I straightway rose, and show'd myself less spent"
285,CANTO XXIV,"Than I in truth did feel me.  ""On,"" I cried,"
286,CANTO XXIV,"""For I am stout and fearless.""  Up the rock"
287,CANTO XXIV,"Our way we held, more rugged than before,"
288,CANTO XXIV,Narrower and steeper far to climb.  From talk
289,CANTO XXIV,"I ceas'd not, as we journey'd, so to seem"
290,CANTO XXIV,Least faint; whereat a voice from the other foss
291,CANTO XXIV,"Did issue forth, for utt'rance suited ill."
292,CANTO XXIV,"Though on the arch that crosses there I stood,"
293,CANTO XXIV,"What were the words I knew not, but who spake"
294,CANTO XXIV,"Seem'd mov'd in anger.  Down I stoop'd to look,"
295,CANTO XXIV,But my quick eye might reach not to the depth
296,CANTO XXIV,For shrouding darkness; wherefore thus I spake:
297,CANTO XXIV,"""To the next circle, Teacher, bend thy steps,"
298,CANTO XXIV,And from the wall dismount we; for as hence
299,CANTO XXIV,"I hear and understand not, so I see"
300,CANTO XXIV,"Beneath, and naught discern.""--""I answer not,"""
301,CANTO XXIV,"Said he, ""but by the deed.  To fair request"
302,CANTO XXIV,"Silent performance maketh best return."""
303,CANTO XXIV,
304,CANTO XXIV,"We from the bridge's head descended, where"
305,CANTO XXIV,"To the eighth mound it joins, and then the chasm"
306,CANTO XXIV,"Opening to view, I saw a crowd within"
307,CANTO XXIV,"Of serpents terrible, so strange of shape"
308,CANTO XXIV,"And hideous, that remembrance in my veins"
309,CANTO XXIV,Yet shrinks the vital current.  Of her sands
310,CANTO XXIV,"Let Lybia vaunt no more: if Jaculus,"
311,CANTO XXIV,"Pareas and Chelyder be her brood,"
312,CANTO XXIV,"Cenchris and Amphisboena, plagues so dire"
313,CANTO XXIV,"Or in such numbers swarming ne'er she shew'd,"
314,CANTO XXIV,"Not with all Ethiopia, and whate'er"
315,CANTO XXIV,Above the Erythraean sea is spawn'd.
316,CANTO XXIV,
317,CANTO XXIV,Amid this dread exuberance of woe
318,CANTO XXIV,"Ran naked spirits wing'd with horrid fear,"
319,CANTO XXIV,"Nor hope had they of crevice where to hide,"
320,CANTO XXIV,Or heliotrope to charm them out of view.
321,CANTO XXIV,"With serpents were their hands behind them bound,"
322,CANTO XXIV,Which through their reins infix'd the tail and head
323,CANTO XXIV,Twisted in folds before.  And lo! on one
324,CANTO XXIV,"Near to our side, darted an adder up,"
325,CANTO XXIV,"And, where the neck is on the shoulders tied,"
326,CANTO XXIV,Transpierc'd him.  Far more quickly than e'er pen
327,CANTO XXIV,"Wrote O or I, he kindled, burn'd, and chang'd"
328,CANTO XXIV,"To ashes, all pour'd out upon the earth."
329,CANTO XXIV,"When there dissolv'd he lay, the dust again"
330,CANTO XXIV,"Uproll'd spontaneous, and the self-same form"
331,CANTO XXIV,"Instant resumed.  So mighty sages tell,"
332,CANTO XXIV,"The' Arabian Phoenix, when five hundred years"
333,CANTO XXIV,"Have well nigh circled, dies, and springs forthwith"
334,CANTO XXIV,Renascent.  Blade nor herb throughout his life
335,CANTO XXIV,"He tastes, but tears of frankincense alone"
336,CANTO XXIV,And odorous amomum: swaths of nard
337,CANTO XXIV,"And myrrh his funeral shroud.  As one that falls,"
338,CANTO XXIV,"He knows not how, by force demoniac dragg'd"
339,CANTO XXIV,"To earth, or through obstruction fettering up"
340,CANTO XXIV,"In chains invisible the powers of man,"
341,CANTO XXIV,"Who, risen from his trance, gazeth around,"
342,CANTO XXIV,Bewilder'd with the monstrous agony
343,CANTO XXIV,"He hath endur'd, and wildly staring sighs;"
344,CANTO XXIV,So stood aghast the sinner when he rose.
345,CANTO XXIV,
346,CANTO XXIV,"Oh! how severe God's judgment, that deals out"
347,CANTO XXIV,Such blows in stormy vengeance!  Who he was
348,CANTO XXIV,"My teacher next inquir'd, and thus in few"
349,CANTO XXIV,"He answer'd: ""Vanni Fucci am I call'd,"
350,CANTO XXIV,Not long since rained down from Tuscany
351,CANTO XXIV,To this dire gullet.  Me the beastial life
352,CANTO XXIV,"And not the human pleas'd, mule that I was,"
353,CANTO XXIV,"Who in Pistoia found my worthy den."""
354,CANTO XXIV,
355,CANTO XXIV,"I then to Virgil: ""Bid him stir not hence,"
356,CANTO XXIV,And ask what crime did thrust him hither: once
357,CANTO XXIV,"A man I knew him choleric and bloody."""
358,CANTO XXIV,
359,CANTO XXIV,"The sinner heard and feign'd not, but towards me"
360,CANTO XXIV,"His mind directing and his face, wherein"
361,CANTO XXIV,"Was dismal shame depictur'd, thus he spake:"
362,CANTO XXIV,"""It grieves me more to have been caught by thee"
363,CANTO XXIV,"In this sad plight, which thou beholdest, than"
364,CANTO XXIV,When I was taken from the other life.
365,CANTO XXIV,I have no power permitted to deny
366,CANTO XXIV,What thou inquirest.  I am doom'd thus low
367,CANTO XXIV,"To dwell, for that the sacristy by me"
368,CANTO XXIV,"Was rifled of its goodly ornaments,"
369,CANTO XXIV,And with the guilt another falsely charged.
370,CANTO XXIV,"But that thou mayst not joy to see me thus,"
371,CANTO XXIV,So as thou e'er shalt 'scape this darksome realm
372,CANTO XXIV,Open thine ears and hear what I forebode.
373,CANTO XXIV,"Reft of the Neri first Pistoia pines,"
374,CANTO XXIV,Then Florence changeth citizens and laws.
375,CANTO XXIV,"From Valdimagra, drawn by wrathful Mars,"
376,CANTO XXIV,"A vapour rises, wrapt in turbid mists,"
377,CANTO XXIV,And sharp and eager driveth on the storm
378,CANTO XXIV,"With arrowy hurtling o'er Piceno's field,"
379,CANTO XXIV,"Whence suddenly the cloud shall burst, and strike"
380,CANTO XXIV,Each helpless Bianco prostrate to the ground.
381,CANTO XXIV,"This have I told, that grief may rend thy heart."""
382,CANTO XXIV,
383,CANTO XXIV,
384,CANTO XXIV,
385,CANTO XXIV,
386,CANTO XXV,CANTO XXV
387,CANTO XXV,
388,CANTO XXV,"WHEN he had spoke, the sinner rais'd his hands"
389,CANTO XXV,"Pointed in mockery, and cried: ""Take them, God!"
390,CANTO XXV,"I level them at thee!""  From that day forth"
391,CANTO XXV,The serpents were my friends; for round his neck
392,CANTO XXV,"One of then rolling twisted, as it said,"
393,CANTO XXV,"""Be silent, tongue!""  Another to his arms"
394,CANTO XXV,"Upgliding, tied them, riveting itself"
395,CANTO XXV,"So close, it took from them the power to move."
396,CANTO XXV,
397,CANTO XXV,Pistoia!  Ah Pistoia! why dost doubt
398,CANTO XXV,"To turn thee into ashes, cumb'ring earth"
399,CANTO XXV,"No longer, since in evil act so far"
400,CANTO XXV,"Thou hast outdone thy seed?  I did not mark,"
401,CANTO XXV,"Through all the gloomy circles of the' abyss,"
402,CANTO XXV,"Spirit, that swell'd so proudly 'gainst his God,"
403,CANTO XXV,"Not him, who headlong fell from Thebes.  He fled,"
404,CANTO XXV,Nor utter'd more; and after him there came
405,CANTO XXV,"A centaur full of fury, shouting, ""Where"
406,CANTO XXV,"Where is the caitiff?""  On Maremma's marsh"
407,CANTO XXV,"Swarm not the serpent tribe, as on his haunch"
408,CANTO XXV,"They swarm'd, to where the human face begins."
409,CANTO XXV,"Behind his head upon the shoulders lay,"
410,CANTO XXV,"With open wings, a dragon breathing fire"
411,CANTO XXV,On whomsoe'er he met.  To me my guide:
412,CANTO XXV,"""Cacus is this, who underneath the rock"
413,CANTO XXV,Of Aventine spread oft a lake of blood.
414,CANTO XXV,"He, from his brethren parted, here must tread"
415,CANTO XXV,"A different journey, for his fraudful theft"
416,CANTO XXV,"Of the great herd, that near him stall'd; whence found"
417,CANTO XXV,"His felon deeds their end, beneath the mace"
418,CANTO XXV,"Of stout Alcides, that perchance laid on"
419,CANTO XXV,"A hundred blows, and not the tenth was felt."""
420,CANTO XXV,
421,CANTO XXV,"While yet he spake, the centaur sped away:"
422,CANTO XXV,"And under us three spirits came, of whom"
423,CANTO XXV,"Nor I nor he was ware, till they exclaim'd;"
424,CANTO XXV,"""Say who are ye?""  We then brake off discourse,"
425,CANTO XXV,Intent on these alone.  I knew them not;
426,CANTO XXV,"But, as it chanceth oft, befell, that one"
427,CANTO XXV,"Had need to name another.  ""Where,"" said he,"
428,CANTO XXV,"""Doth Cianfa lurk?""  I, for a sign my guide"
429,CANTO XXV,"Should stand attentive, plac'd against my lips"
430,CANTO XXV,"The finger lifted.  If, O reader! now"
431,CANTO XXV,"Thou be not apt to credit what I tell,"
432,CANTO XXV,No marvel; for myself do scarce allow
433,CANTO XXV,The witness of mine eyes.  But as I looked
434,CANTO XXV,"Toward them, lo! a serpent with six feet"
435,CANTO XXV,"Springs forth on one, and fastens full upon him:"
436,CANTO XXV,"His midmost grasp'd the belly, a forefoot"
437,CANTO XXV,Seiz'd on each arm (while deep in either cheek
438,CANTO XXV,He flesh'd his fangs); the hinder on the thighs
439,CANTO XXV,"Were spread, 'twixt which the tail inserted curl'd"
440,CANTO XXV,Upon the reins behind.  Ivy ne'er clasp'd
441,CANTO XXV,"A dodder'd oak, as round the other's limbs"
442,CANTO XXV,The hideous monster intertwin'd his own.
443,CANTO XXV,"Then, as they both had been of burning wax,"
444,CANTO XXV,"Each melted into other, mingling hues,"
445,CANTO XXV,That which was either now was seen no more.
446,CANTO XXV,"Thus up the shrinking paper, ere it burns,"
447,CANTO XXV,"A brown tint glides, not turning yet to black,"
448,CANTO XXV,And the clean white expires.  The other two
449,CANTO XXV,"Look'd on exclaiming: ""Ah, how dost thou change,"
450,CANTO XXV,"Agnello!  See!  Thou art nor double now,"
451,CANTO XXV,
452,CANTO XXV,"""Nor only one.""  The two heads now became"
453,CANTO XXV,"One, and two figures blended in one form"
454,CANTO XXV,"Appear'd, where both were lost.  Of the four lengths"
455,CANTO XXV,Two arms were made: the belly and the chest
456,CANTO XXV,"The thighs and legs into such members chang'd,"
457,CANTO XXV,As never eye hath seen.  Of former shape
458,CANTO XXV,All trace was vanish'd.  Two yet neither seem'd
459,CANTO XXV,"That image miscreate, and so pass'd on"
460,CANTO XXV,With tardy steps.  As underneath the scourge
461,CANTO XXV,"Of the fierce dog-star, that lays bare the fields,"
462,CANTO XXV,"Shifting from brake to brake, the lizard seems"
463,CANTO XXV,"A flash of lightning, if he thwart the road,"
464,CANTO XXV,So toward th' entrails of the other two
465,CANTO XXV,"Approaching seem'd, an adder all on fire,"
466,CANTO XXV,"As the dark pepper-grain, livid and swart."
467,CANTO XXV,"In that part, whence our life is nourish'd first,"
468,CANTO XXV,One he transpierc'd; then down before him fell
469,CANTO XXV,Stretch'd out.  The pierced spirit look'd on him
470,CANTO XXV,"But spake not; yea stood motionless and yawn'd,"
471,CANTO XXV,As if by sleep or fev'rous fit assail'd.
472,CANTO XXV,"He ey'd the serpent, and the serpent him."
473,CANTO XXV,"One from the wound, the other from the mouth"
474,CANTO XXV,"Breath'd a thick smoke, whose vap'ry columns join'd."
475,CANTO XXV,
476,CANTO XXV,"Lucan in mute attention now may hear,"
477,CANTO XXV,"Nor thy disastrous fate, Sabellus! tell,"
478,CANTO XXV,"Nor shine, Nasidius!  Ovid now be mute."
479,CANTO XXV,What if in warbling fiction he record
480,CANTO XXV,"Cadmus and Arethusa, to a snake"
481,CANTO XXV,"Him chang'd, and her into a fountain clear,"
482,CANTO XXV,I envy not; for never face to face
483,CANTO XXV,"Two natures thus transmuted did he sing,"
484,CANTO XXV,Wherein both shapes were ready to assume
485,CANTO XXV,The other's substance.  They in mutual guise
486,CANTO XXV,"So answer'd, that the serpent split his train"
487,CANTO XXV,"Divided to a fork, and the pierc'd spirit"
488,CANTO XXV,"Drew close his steps together, legs and thighs"
489,CANTO XXV,"Compacted, that no sign of juncture soon"
490,CANTO XXV,Was visible: the tail disparted took
491,CANTO XXV,"The figure which the spirit lost, its skin"
492,CANTO XXV,"Soft'ning, his indurated to a rind."
493,CANTO XXV,"The shoulders next I mark'd, that ent'ring join'd"
494,CANTO XXV,"The monster's arm-pits, whose two shorter feet"
495,CANTO XXV,"So lengthen'd, as the other's dwindling shrunk."
496,CANTO XXV,The feet behind then twisting up became
