,Poem Title,line
3842,CANTO XXV,"One of then rolling twisted, as it said,"
3843,CANTO XXV,"“Be silent, tongue!” Another to his arms"
3844,CANTO XXV,"Upgliding, tied them, riveting itself"
3845,CANTO XXV,"So close, it took from them the power to move."
3846,CANTO XXV,
3847,CANTO XXV,Pistoia! Ah Pistoia! why dost doubt
3848,CANTO XXV,"To turn thee into ashes, cumb’ring earth"
3849,CANTO XXV,"No longer, since in evil act so far"
3850,CANTO XXV,"Thou hast outdone thy seed? I did not mark,"
3851,CANTO XXV,"Through all the gloomy circles of the abyss,"
3852,CANTO XXV,"Spirit, that swell’d so proudly ’gainst his God,"
3853,CANTO XXV,"Not him, who headlong fell from Thebes. He fled,"
3854,CANTO XXV,Nor utter’d more; and after him there came
3855,CANTO XXV,"A centaur full of fury, shouting, “Where"
3856,CANTO XXV,Where is the caitiff?” On Maremma’s marsh
3857,CANTO XXV,"Swarm not the serpent tribe, as on his haunch"
3858,CANTO XXV,"They swarm’d, to where the human face begins."
3859,CANTO XXV,"Behind his head upon the shoulders lay,"
3860,CANTO XXV,"With open wings, a dragon breathing fire"
3861,CANTO XXV,On whomsoe’er he met. To me my guide:
3862,CANTO XXV,"“Cacus is this, who underneath the rock"
3863,CANTO XXV,Of Aventine spread oft a lake of blood.
3864,CANTO XXV,"He, from his brethren parted, here must tread"
3865,CANTO XXV,"A different journey, for his fraudful theft"
3866,CANTO XXV,"Of the great herd, that near him stall’d; whence found"
3867,CANTO XXV,"His felon deeds their end, beneath the mace"
3868,CANTO XXV,"Of stout Alcides, that perchance laid on"
3869,CANTO XXV,"A hundred blows, and not the tenth was felt.”"
3870,CANTO XXV,
3871,CANTO XXV,"While yet he spake, the centaur sped away:"
3872,CANTO XXV,"And under us three spirits came, of whom"
3873,CANTO XXV,"Nor I nor he was ware, till they exclaim’d;"
3874,CANTO XXV,"“Say who are ye?” We then brake off discourse,"
3875,CANTO XXV,Intent on these alone. I knew them not;
3876,CANTO XXV,"But, as it chanceth oft, befell, that one"
3877,CANTO XXV,"Had need to name another. “Where,” said he,"
3878,CANTO XXV,"“Doth Cianfa lurk?” I, for a sign my guide"
3879,CANTO XXV,"Should stand attentive, plac’d against my lips"
3880,CANTO XXV,"The finger lifted. If, O reader! now"
3881,CANTO XXV,"Thou be not apt to credit what I tell,"
3882,CANTO XXV,No marvel; for myself do scarce allow
3883,CANTO XXV,The witness of mine eyes. But as I looked
3884,CANTO XXV,"Toward them, lo! a serpent with six feet"
3885,CANTO XXV,"Springs forth on one, and fastens full upon him:"
3886,CANTO XXV,"His midmost grasp’d the belly, a forefoot"
3887,CANTO XXV,Seiz’d on each arm (while deep in either cheek
3888,CANTO XXV,He flesh’d his fangs); the hinder on the thighs
3889,CANTO XXV,"Were spread, ’twixt which the tail inserted curl’d"
3890,CANTO XXV,Upon the reins behind. Ivy ne’er clasp’d
3891,CANTO XXV,"A dodder’d oak, as round the other’s limbs"
3892,CANTO XXV,The hideous monster intertwin’d his own.
3893,CANTO XXV,"Then, as they both had been of burning wax,"
3894,CANTO XXV,"Each melted into other, mingling hues,"
3895,CANTO XXV,That which was either now was seen no more.
3896,CANTO XXV,"Thus up the shrinking paper, ere it burns,"
3897,CANTO XXV,"A brown tint glides, not turning yet to black,"
3898,CANTO XXV,And the clean white expires. The other two
3899,CANTO XXV,"Look’d on exclaiming: “Ah, how dost thou change,"
3900,CANTO XXV,"Agnello! See! Thou art nor double now,"
3901,CANTO XXV,
3902,CANTO XXV,
3903,CANTO XXV,“Nor only one.” The two heads now became
3904,CANTO XXV,"One, and two figures blended in one form"
3905,CANTO XXV,"Appear’d, where both were lost. Of the four lengths"
3906,CANTO XXV,Two arms were made: the belly and the chest
3907,CANTO XXV,"The thighs and legs into such members chang’d,"
3908,CANTO XXV,As never eye hath seen. Of former shape
3909,CANTO XXV,All trace was vanish’d. Two yet neither seem’d
3910,CANTO XXV,"That image miscreate, and so pass’d on"
3911,CANTO XXV,With tardy steps. As underneath the scourge
3912,CANTO XXV,"Of the fierce dog-star, that lays bare the fields,"
3913,CANTO XXV,"Shifting from brake to brake, the lizard seems"
3914,CANTO XXV,"A flash of lightning, if he thwart the road,"
3915,CANTO XXV,So toward th’ entrails of the other two
3916,CANTO XXV,"Approaching seem’d, an adder all on fire,"
3917,CANTO XXV,"As the dark pepper-grain, livid and swart."
3918,CANTO XXV,"In that part, whence our life is nourish’d first,"
3919,CANTO XXV,One he transpierc’d; then down before him fell
3920,CANTO XXV,Stretch’d out. The pierced spirit look’d on him
3921,CANTO XXV,"But spake not; yea stood motionless and yawn’d,"
3922,CANTO XXV,As if by sleep or fev’rous fit assail’d.
3923,CANTO XXV,"He ey’d the serpent, and the serpent him."
3924,CANTO XXV,"One from the wound, the other from the mouth"
3925,CANTO XXV,"Breath’d a thick smoke, whose vap’ry columns join’d."
3926,CANTO XXV,
3927,CANTO XXV,"Lucan in mute attention now may hear,"
3928,CANTO XXV,"Nor thy disastrous fate, Sabellus! tell,"
3929,CANTO XXV,"Nor shine, Nasidius! Ovid now be mute."
3930,CANTO XXV,What if in warbling fiction he record
3931,CANTO XXV,"Cadmus and Arethusa, to a snake"
3932,CANTO XXV,"Him chang’d, and her into a fountain clear,"
3933,CANTO XXV,I envy not; for never face to face
3934,CANTO XXV,"Two natures thus transmuted did he sing,"
3935,CANTO XXV,Wherein both shapes were ready to assume
3936,CANTO XXV,The other’s substance. They in mutual guise
3937,CANTO XXV,"So answer’d, that the serpent split his train"
3938,CANTO XXV,"Divided to a fork, and the pierc’d spirit"
3939,CANTO XXV,"Drew close his steps together, legs and thighs"
3940,CANTO XXV,"Compacted, that no sign of juncture soon"
3941,CANTO XXV,Was visible: the tail disparted took
3942,CANTO XXV,"The figure which the spirit lost, its skin"
3943,CANTO XXV,"Soft’ning, his indurated to a rind."
3944,CANTO XXV,"The shoulders next I mark’d, that ent’ring join’d"
3945,CANTO XXV,"The monster’s arm-pits, whose two shorter feet"
3946,CANTO XXV,"So lengthen’d, as the other’s dwindling shrunk."
3947,CANTO XXV,The feet behind then twisting up became
3948,CANTO XXV,"That part that man conceals, which in the wretch"
3949,CANTO XXV,Was cleft in twain. While both the shadowy smoke
3950,CANTO XXV,"With a new colour veils, and generates"
3951,CANTO XXV,"Th’ excrescent pile on one, peeling it off"
3952,CANTO XXV,"From th’ other body, lo! upon his feet"
3953,CANTO XXV,"One upright rose, and prone the other fell."
3954,CANTO XXV,Not yet their glaring and malignant lamps
3955,CANTO XXV,"Were shifted, though each feature chang’d beneath."
3956,CANTO XXV,"Of him who stood erect, the mounting face"
3957,CANTO XXV,"Retreated towards the temples, and what there"
3958,CANTO XXV,"Superfluous matter came, shot out in ears"
3959,CANTO XXV,"From the smooth cheeks, the rest, not backward dragg’d,"
3960,CANTO XXV,Of its excess did shape the nose; and swell’d
3961,CANTO XXV,Into due size protuberant the lips.
3962,CANTO XXV,"He, on the earth who lay, meanwhile extends"
3963,CANTO XXV,"His sharpen’d visage, and draws down the ears"
3964,CANTO XXV,"Into the head, as doth the slug his horns."
3965,CANTO XXV,His tongue continuous before and apt
3966,CANTO XXV,"For utt’rance, severs; and the other’s fork"
3967,CANTO XXV,Closing unites. That done the smoke was laid.
3968,CANTO XXV,"The soul, transform’d into the brute, glides off,"
3969,CANTO XXV,"Hissing along the vale, and after him"
3970,CANTO XXV,The other talking sputters; but soon turn’d
3971,CANTO XXV,"His new-grown shoulders on him, and in few"
3972,CANTO XXV,Thus to another spake: “Along this path
3973,CANTO XXV,"Crawling, as I have done, speed Buoso now!”"
3974,CANTO XXV,
3975,CANTO XXV,So saw I fluctuate in successive change
3976,CANTO XXV,Th’ unsteady ballast of the seventh hold:
3977,CANTO XXV,"And here if aught my tongue have swerv’d, events"
3978,CANTO XXV,So strange may be its warrant. O’er mine eyes
3979,CANTO XXV,"Confusion hung, and on my thoughts amaze."
3980,CANTO XXV,
3981,CANTO XXV,"Yet ’scap’d they not so covertly, but well"
3982,CANTO XXV,I mark’d Sciancato: he alone it was
3983,CANTO XXV,"Of the three first that came, who chang’d not: thou,"
3984,CANTO XXV,"The other’s fate, Gaville, still dost rue."
3985,CANTO XXV,
3986,CANTO XXV,
3987,CANTO XXV,
3988,CANTO XXV,
3989,CANTO XXVI,CANTO XXVI
3990,CANTO XXVI,
3991,CANTO XXVI,
3992,CANTO XXVI,Florence exult! for thou so mightily
3993,CANTO XXVI,"Hast thriven, that o’er land and sea thy wings"
3994,CANTO XXVI,"Thou beatest, and thy name spreads over hell!"
3995,CANTO XXVI,Among the plund’rers such the three I found
3996,CANTO XXVI,"Thy citizens, whence shame to me thy son,"
3997,CANTO XXVI,And no proud honour to thyself redounds.
3998,CANTO XXVI,
3999,CANTO XXVI,"But if our minds, when dreaming near the dawn,"
4000,CANTO XXVI,"Are of the truth presageful, thou ere long"
4001,CANTO XXVI,"Shalt feel what Prato, (not to say the rest)"
4002,CANTO XXVI,Would fain might come upon thee; and that chance
4003,CANTO XXVI,"Were in good time, if it befell thee now."
4004,CANTO XXVI,"Would so it were, since it must needs befall!"
4005,CANTO XXVI,"For as time wears me, I shall grieve the more."
4006,CANTO XXVI,
4007,CANTO XXVI,We from the depth departed; and my guide
4008,CANTO XXVI,"Remounting scal’d the flinty steps, which late"
4009,CANTO XXVI,"We downward trac’d, and drew me up the steep."
4010,CANTO XXVI,Pursuing thus our solitary way
4011,CANTO XXVI,"Among the crags and splinters of the rock,"
4012,CANTO XXVI,Sped not our feet without the help of hands.
4013,CANTO XXVI,
4014,CANTO XXVI,"Then sorrow seiz’d me, which e’en now revives,"
4015,CANTO XXVI,"As my thought turns again to what I saw,"
4016,CANTO XXVI,"And, more than I am wont, I rein and curb"
4017,CANTO XXVI,"The powers of nature in me, lest they run"
4018,CANTO XXVI,Where Virtue guides not; that if aught of good
4019,CANTO XXVI,"My gentle star, or something better gave me,"
4020,CANTO XXVI,I envy not myself the precious boon.
4021,CANTO XXVI,
4022,CANTO XXVI,"As in that season, when the sun least veils"
4023,CANTO XXVI,"His face that lightens all, what time the fly"
4024,CANTO XXVI,"Gives way to the shrill gnat, the peasant then"
4025,CANTO XXVI,"Upon some cliff reclin’d, beneath him sees"
4026,CANTO XXVI,"Fire-flies innumerous spangling o’er the vale,"
4027,CANTO XXVI,"Vineyard or tilth, where his day-labour lies:"
4028,CANTO XXVI,With flames so numberless throughout its space
4029,CANTO XXVI,"Shone the eighth chasm, apparent, when the depth"
4030,CANTO XXVI,"Was to my view expos’d. As he, whose wrongs"
4031,CANTO XXVI,"The bears aveng’d, at its departure saw"
4032,CANTO XXVI,"Elijah’s chariot, when the steeds erect"
4033,CANTO XXVI,"Rais’d their steep flight for heav’n; his eyes meanwhile,"
4034,CANTO XXVI,"Straining pursu’d them, till the flame alone"
4035,CANTO XXVI,Upsoaring like a misty speck he kenn’d;
4036,CANTO XXVI,"E’en thus along the gulf moves every flame,"
4037,CANTO XXVI,"A sinner so enfolded close in each,"
4038,CANTO XXVI,That none exhibits token of the theft.
4039,CANTO XXVI,
4040,CANTO XXVI,"Upon the bridge I forward bent to look,"
4041,CANTO XXVI,"And grasp’d a flinty mass, or else had fall’n,"
4042,CANTO XXVI,"Though push’d not from the height. The guide, who mark’d"
4043,CANTO XXVI,"How I did gaze attentive, thus began:"
4044,CANTO XXVI,
4045,CANTO XXVI,
4046,CANTO XXVI,"“Within these ardours are the spirits, each"
4047,CANTO XXVI,"Swath’d in confining fire.”—“Master, thy word,”"
4048,CANTO XXVI,"I answer’d, “hath assur’d me; yet I deem’d"
4049,CANTO XXVI,"Already of the truth, already wish’d"
4050,CANTO XXVI,"To ask thee, who is in yon fire, that comes"
4051,CANTO XXVI,"So parted at the summit, as it seem’d"
4052,CANTO XXVI,"Ascending from that funeral pile, where lay"
4053,CANTO XXVI,The Theban brothers?” He replied: “Within
4054,CANTO XXVI,Ulysses there and Diomede endure
4055,CANTO XXVI,"Their penal tortures, thus to vengeance now"
4056,CANTO XXVI,"Together hasting, as erewhile to wrath."
4057,CANTO XXVI,These in the flame with ceaseless groans deplore
4058,CANTO XXVI,"The ambush of the horse, that open’d wide"
4059,CANTO XXVI,"A portal for that goodly seed to pass,"
4060,CANTO XXVI,Which sow’d imperial Rome; nor less the guile
4061,CANTO XXVI,"Lament they, whence of her Achilles ’reft"
4062,CANTO XXVI,Deidamia yet in death complains.
4063,CANTO XXVI,"And there is rued the stratagem, that Troy"
4064,CANTO XXVI,Of her Palladium spoil’d.”—“If they have power
4065,CANTO XXVI,"Of utt’rance from within these sparks,” said I,"
4066,CANTO XXVI,“O master! think my prayer a thousand fold
4067,CANTO XXVI,"In repetition urg’d, that thou vouchsafe"
4068,CANTO XXVI,"To pause, till here the horned flame arrive."
4069,CANTO XXVI,"See, how toward it with desire I bend.”"
4070,CANTO XXVI,
4071,CANTO XXVI,"He thus: “Thy prayer is worthy of much praise,"
4072,CANTO XXVI,And I accept it therefore: but do thou
4073,CANTO XXVI,"Thy tongue refrain: to question them be mine,"
4074,CANTO XXVI,"For I divine thy wish: and they perchance,"
4075,CANTO XXVI,"For they were Greeks, might shun discourse with thee.”"
4076,CANTO XXVI,
4077,CANTO XXVI,"When there the flame had come, where time and place"
4078,CANTO XXVI,"Seem’d fitting to my guide, he thus began:"
4079,CANTO XXVI,"“O ye, who dwell two spirits in one fire!"
4080,CANTO XXVI,"If living I of you did merit aught,"
4081,CANTO XXVI,"Whate’er the measure were of that desert,"
4082,CANTO XXVI,"When in the world my lofty strain I pour’d,"
4083,CANTO XXVI,"Move ye not on, till one of you unfold"
4084,CANTO XXVI,In what clime death o’ertook him self-destroy’d.”
4085,CANTO XXVI,
4086,CANTO XXVI,Of the old flame forthwith the greater horn
4087,CANTO XXVI,"Began to roll, murmuring, as a fire"
4088,CANTO XXVI,"That labours with the wind, then to and fro"
4089,CANTO XXVI,"Wagging the top, as a tongue uttering sounds,"
4090,CANTO XXVI,"Threw out its voice, and spake: “When I escap’d"
4091,CANTO XXVI,"From Circe, who beyond a circling year"
4092,CANTO XXVI,"Had held me near Caieta, by her charms,"
4093,CANTO XXVI,"Ere thus Aeneas yet had nam’d the shore,"
4094,CANTO XXVI,"Nor fondness for my son, nor reverence"
4095,CANTO XXVI,"Of my old father, nor return of love,"
4096,CANTO XXVI,"That should have crown’d Penelope with joy,"
4097,CANTO XXVI,Could overcome in me the zeal I had
4098,CANTO XXVI,"T’ explore the world, and search the ways of life,"
4099,CANTO XXVI,Man’s evil and his virtue. Forth I sail’d
4100,CANTO XXVI,"Into the deep illimitable main,"
4101,CANTO XXVI,"With but one bark, and the small faithful band"
4102,CANTO XXVI,"That yet cleav’d to me. As Iberia far,"
4103,CANTO XXVI,"Far as Morocco either shore I saw,"
4104,CANTO XXVI,And the Sardinian and each isle beside
4105,CANTO XXVI,Which round that ocean bathes. Tardy with age
4106,CANTO XXVI,"Were I and my companions, when we came"
4107,CANTO XXVI,"To the strait pass, where Hercules ordain’d"
4108,CANTO XXVI,The bound’ries not to be o’erstepp’d by man.
4109,CANTO XXVI,"The walls of Seville to my right I left,"
4110,CANTO XXVI,On the other hand already Ceuta past.
4111,CANTO XXVI,"“O brothers!” I began, “who to the west"
4112,CANTO XXVI,"Through perils without number now have reach’d,"
4113,CANTO XXVI,"To this the short remaining watch, that yet"
4114,CANTO XXVI,"Our senses have to wake, refuse not proof"
4115,CANTO XXVI,"Of the unpeopled world, following the track"
4116,CANTO XXVI,Of Phoebus. Call to mind from whence we sprang:
4117,CANTO XXVI,Ye were not form’d to live the life of brutes
4118,CANTO XXVI,But virtue to pursue and knowledge high.”
4119,CANTO XXVI,With these few words I sharpen’d for the voyage
4120,CANTO XXVI,"The mind of my associates, that I then"
4121,CANTO XXVI,Could scarcely have withheld them. To the dawn
4122,CANTO XXVI,"Our poop we turn’d, and for the witless flight"
4123,CANTO XXVI,"Made our oars wings, still gaining on the left."
4124,CANTO XXVI,"Each star of the other pole night now beheld,"
4125,CANTO XXVI,"And ours so low, that from the ocean-floor"
4126,CANTO XXVI,"It rose not. Five times re-illum’d, as oft"
4127,CANTO XXVI,Vanish’d the light from underneath the moon
4128,CANTO XXVI,"Since the deep way we enter’d, when from far"
4129,CANTO XXVI,"Appear’d a mountain dim, loftiest methought"
4130,CANTO XXVI,"Of all I e’er beheld. Joy seiz’d us straight,"
4131,CANTO XXVI,But soon to mourning changed. From the new land
4132,CANTO XXVI,"A whirlwind sprung, and at her foremost side"
4133,CANTO XXVI,Did strike the vessel. Thrice it whirl’d her round
4134,CANTO XXVI,"With all the waves, the fourth time lifted up"
4135,CANTO XXVI,"The poop, and sank the prow: so fate decreed:"
4136,CANTO XXVI,And over us the booming billow clos’d.”
4137,CANTO XXVI,
4138,CANTO XXVI,
4139,CANTO XXVI,
4140,CANTO XXVI,
4141,CANTO XVII,CANTO XVII
4142,CANTO XVII,
4143,CANTO XVII,
4144,CANTO XVII,"Now upward rose the flame, and still’d its light"
4145,CANTO XVII,"To speak no more, and now pass’d on with leave"
4146,CANTO XVII,"From the mild poet gain’d, when following came"
4147,CANTO XVII,"Another, from whose top a sound confus’d,"
4148,CANTO XVII,"Forth issuing, drew our eyes that way to look."
4149,CANTO XVII,
4150,CANTO XVII,"As the Sicilian bull, that rightfully"
4151,CANTO XVII,"His cries first echoed, who had shap’d its mould,"
4152,CANTO XVII,"Did so rebellow, with the voice of him"
4153,CANTO XVII,"Tormented, that the brazen monster seem’d"
4154,CANTO XVII,Pierc’d through with pain; thus while no way they found
4155,CANTO XVII,"Nor avenue immediate through the flame,"
4156,CANTO XVII,Into its language turn’d the dismal words:
4157,CANTO XVII,"But soon as they had won their passage forth,"
4158,CANTO XVII,"Up from the point, which vibrating obey’d"
4159,CANTO XVII,"Their motion at the tongue, these sounds we heard:"
4160,CANTO XVII,“O thou! to whom I now direct my voice!
4161,CANTO XVII,"That lately didst exclaim in Lombard phrase,"
4162,CANTO XVII,
4163,CANTO XVII,"‘Depart thou, I solicit thee no more,’"
4164,CANTO XVII,Though somewhat tardy I perchance arrive
4165,CANTO XVII,"Let it not irk thee here to pause awhile,"
4166,CANTO XVII,And with me parley: lo! it irks not me
4167,CANTO XVII,And yet I burn. If but e’en now thou fall
4168,CANTO XVII,"into this blind world, from that pleasant land"
4169,CANTO XVII,"Of Latium, whence I draw my sum of guilt,"
4170,CANTO XVII,"Tell me if those, who in Romagna dwell,"
4171,CANTO XVII,Have peace or war. For of the mountains there
4172,CANTO XVII,"Was I, betwixt Urbino and the height,"
4173,CANTO XVII,Whence Tyber first unlocks his mighty flood.”
4174,CANTO XVII,
4175,CANTO XVII,"Leaning I listen’d yet with heedful ear,"
4176,CANTO XVII,"When, as he touch’d my side, the leader thus:"
4177,CANTO XVII,“Speak thou: he is a Latian.” My reply
4178,CANTO XVII,"Was ready, and I spake without delay:"
4179,CANTO XVII,
4180,CANTO XVII,“O spirit! who art hidden here below!
4181,CANTO XVII,Never was thy Romagna without war
4182,CANTO XVII,"In her proud tyrants’ bosoms, nor is now:"
4183,CANTO XVII,"But open war there left I none. The state,"
4184,CANTO XVII,"Ravenna hath maintain’d this many a year,"
4185,CANTO XVII,"Is steadfast. There Polenta’s eagle broods,"
4186,CANTO XVII,And in his broad circumference of plume
4187,CANTO XVII,O’ershadows Cervia. The green talons grasp
4188,CANTO XVII,"The land, that stood erewhile the proof so long,"
4189,CANTO XVII,And pil’d in bloody heap the host of France.
4190,CANTO XVII,
4191,CANTO XVII,"“The old mastiff of Verruchio and the young,"
4192,CANTO XVII,"That tore Montagna in their wrath, still make,"
4193,CANTO XVII,"Where they are wont, an augre of their fangs."
4194,CANTO XVII,
4195,CANTO XVII,“Lamone’s city and Santerno’s range
4196,CANTO XVII,Under the lion of the snowy lair.
4197,CANTO XVII,"Inconstant partisan! that changeth sides,"
4198,CANTO XVII,Or ever summer yields to winter’s frost.
4199,CANTO XVII,"And she, whose flank is wash’d of Savio’s wave,"
4200,CANTO XVII,"As ’twixt the level and the steep she lies,"
4201,CANTO XVII,Lives so ’twixt tyrant power and liberty.
4202,CANTO XVII,
4203,CANTO XVII,"“Now tell us, I entreat thee, who art thou?"
4204,CANTO XVII,"Be not more hard than others. In the world,"
4205,CANTO XVII,So may thy name still rear its forehead high.”
4206,CANTO XVII,
4207,CANTO XVII,"Then roar’d awhile the fire, its sharpen’d point"
4208,CANTO XVII,"On either side wav’d, and thus breath’d at last:"
4209,CANTO XVII,"“If I did think, my answer were to one,"
4210,CANTO XVII,"Who ever could return unto the world,"
4211,CANTO XVII,"This flame should rest unshaken. But since ne’er,"
4212,CANTO XVII,"If true be told me, any from this depth"
4213,CANTO XVII,"Has found his upward way, I answer thee,"
4214,CANTO XVII,Nor fear lest infamy record the words.
4215,CANTO XVII,
4216,CANTO XVII,"“A man of arms at first, I cloth’d me then"
4217,CANTO XVII,"In good Saint Francis’ girdle, hoping so"
4218,CANTO XVII,T’ have made amends. And certainly my hope
4219,CANTO XVII,"Had fail’d not, but that he, whom curses light on,"
4220,CANTO XVII,The high priest again seduc’d me into sin.
4221,CANTO XVII,And how and wherefore listen while I tell.
4222,CANTO XVII,Long as this spirit mov’d the bones and pulp
4223,CANTO XVII,"My mother gave me, less my deeds bespake"
4224,CANTO XVII,The nature of the lion than the fox.
4225,CANTO XVII,"All ways of winding subtlety I knew,"
4226,CANTO XVII,"And with such art conducted, that the sound"
4227,CANTO XVII,Reach’d the world’s limit. Soon as to that part
4228,CANTO XVII,"Of life I found me come, when each behoves"
4229,CANTO XVII,To lower sails and gather in the lines;
4230,CANTO XVII,"That which before had pleased me then I rued,"
4231,CANTO XVII,And to repentance and confession turn’d;
4232,CANTO XVII,Wretch that I was! and well it had bested me!
4233,CANTO XVII,"The chief of the new Pharisees meantime,"
4234,CANTO XVII,"Waging his warfare near the Lateran,"
4235,CANTO XVII,Not with the Saracens or Jews (his foes
4236,CANTO XVII,"All Christians were, nor against Acre one"
4237,CANTO XVII,"Had fought, nor traffic’d in the Soldan’s land),"
4238,CANTO XVII,He his great charge nor sacred ministry
4239,CANTO XVII,"In himself, rev’renc’d, nor in me that cord,"
4240,CANTO XVII,Which us’d to mark with leanness whom it girded.
4241,CANTO XVII,"As in Socrate, Constantine besought"
4242,CANTO XVII,"To cure his leprosy Sylvester’s aid,"
4243,CANTO XVII,So me to cure the fever of his pride
4244,CANTO XVII,This man besought: my counsel to that end
4245,CANTO XVII,He ask’d: and I was silent: for his words
4246,CANTO XVII,Seem’d drunken: but forthwith he thus resum’d:
4247,CANTO XVII,“From thy heart banish fear: of all offence
4248,CANTO XVII,"I hitherto absolve thee. In return,"
4249,CANTO XVII,"Teach me my purpose so to execute,"
4250,CANTO XVII,That Penestrino cumber earth no more.
4251,CANTO XVII,"Heav’n, as thou knowest, I have power to shut"
4252,CANTO XVII,"And open: and the keys are therefore twain,"
4253,CANTO XVII,The which my predecessor meanly priz’d.”
4254,CANTO XVII,
4255,CANTO XVII,"Then, yielding to the forceful arguments,"
4256,CANTO XVII,"Of silence as more perilous I deem’d,"
4257,CANTO XVII,And answer’d: “Father! since thou washest me
4258,CANTO XVII,"Clear of that guilt wherein I now must fall,"
4259,CANTO XVII,"Large promise with performance scant, be sure,"
4260,CANTO XVII,Shall make thee triumph in thy lofty seat.”
4261,CANTO XVII,
4262,CANTO XVII,"“When I was number’d with the dead, then came"
4263,CANTO XVII,Saint Francis for me; but a cherub dark
4264,CANTO XVII,"He met, who cried: “‘Wrong me not; he is mine,"
4265,CANTO XVII,"And must below to join the wretched crew,"
4266,CANTO XVII,For the deceitful counsel which he gave.
4267,CANTO XVII,"E’er since I watch’d him, hov’ring at his hair,"
4268,CANTO XVII,No power can the impenitent absolve;
4269,CANTO XVII,"Nor to repent and will at once consist,"
4270,CANTO XVII,By contradiction absolute forbid.”
4271,CANTO XVII,"Oh mis’ry! how I shook myself, when he"
4272,CANTO XVII,"Seiz’d me, and cried, “Thou haply thought’st me not"
4273,CANTO XVII,A disputant in logic so exact.”
4274,CANTO XVII,"To Minos down he bore me, and the judge"
4275,CANTO XVII,"Twin’d eight times round his callous back the tail,"
4276,CANTO XVII,"Which biting with excess of rage, he spake:"
4277,CANTO XVII,"‘This is a guilty soul, that in the fire"
4278,CANTO XVII,Must vanish.’ Hence perdition-doom’d I rove
4279,CANTO XVII,A prey to rankling sorrow in this garb.”
4280,CANTO XVII,
4281,CANTO XVII,"When he had thus fulfill’d his words, the flame"
4282,CANTO XVII,"In dolour parted, beating to and fro,"
4283,CANTO XVII,"And writhing its sharp horn. We onward went,"
4284,CANTO XVII,"I and my leader, up along the rock,"
4285,CANTO XVII,"Far as another arch, that overhangs"
4286,CANTO XVII,"The foss, wherein the penalty is paid"
4287,CANTO XVII,"Of those, who load them with committed sin."
4288,CANTO XVII,
4289,CANTO XVII,
4290,CANTO XVII,
4291,CANTO XVII,
4292,CANTO XXVIII,CANTO XXVIII
4293,CANTO XXVIII,
4294,CANTO XXVIII,
4295,CANTO XXVIII,"Who, e’en in words unfetter’d, might at full"
4296,CANTO XXVIII,"Tell of the wounds and blood that now I saw,"
4297,CANTO XXVIII,Though he repeated oft the tale? No tongue
4298,CANTO XXVIII,"So vast a theme could equal, speech and thought"
4299,CANTO XXVIII,Both impotent alike. If in one band
