,Poem Title,line
0,,
1,,
2,,
3,,
4,,"Produced by David Starner, Sankar Viswanathan, and the"
5,,Online Distributed Proofreading Team at https://www.pgdp.net
6,,
7,,
8,,
9,,
10,,
11,,
12,,
13,,
14,,
15,"BY STILL WATERS, LYRICAL","BY STILL WATERS, LYRICAL"
16,POEMS OLD AND NEW BY A.E.,POEMS OLD AND NEW BY A.E.
17,POEMS OLD AND NEW BY A.E.,
18,POEMS OLD AND NEW BY A.E.,
19,POEMS OLD AND NEW BY A.E.,
20,POEMS OLD AND NEW BY A.E.,
21,POEMS OLD AND NEW BY A.E.,
22,POEMS OLD AND NEW BY A.E.,
23,POEMS OLD AND NEW BY A.E.,
24,POEMS OLD AND NEW BY A.E.,
25,POEMS OLD AND NEW BY A.E.,
26,POEMS OLD AND NEW BY A.E.,
27,POEMS OLD AND NEW BY A.E.,
28,THE DUN EMER PRESS,THE DUN EMER PRESS
29,DUNDRUM,DUNDRUM
30,MCMVI,MCMVI
31,MCMVI,
32,MCMVI,
33,MCMVI,
34,MCMVI,
35,TABLE OF CONTENTS,TABLE OF CONTENTS
36,TABLE OF CONTENTS,
37,TABLE OF CONTENTS,
38,TABLE OF CONTENTS,Prelude
39,TABLE OF CONTENTS,A Summer Night
40,TABLE OF CONTENTS,Creation
41,TABLE OF CONTENTS,Dusk
42,TABLE OF CONTENTS,Night
43,TABLE OF CONTENTS,Dawn
44,TABLE OF CONTENTS,Day
45,TABLE OF CONTENTS,Dana
46,TABLE OF CONTENTS,Remembrance
47,TABLE OF CONTENTS,The Hour of the King
48,TABLE OF CONTENTS,The Winds of Angus
49,TABLE OF CONTENTS,Reflections
50,TABLE OF CONTENTS,The Dawn of Darkness
51,TABLE OF CONTENTS,Natural Magic
52,TABLE OF CONTENTS,In the Womb
53,TABLE OF CONTENTS,Forgiveness
54,TABLE OF CONTENTS,A Woman's Voice
55,TABLE OF CONTENTS,Parting
56,TABLE OF CONTENTS,A Prayer
57,TABLE OF CONTENTS,The Heroes
58,TABLE OF CONTENTS,Recall
59,TABLE OF CONTENTS,Blindness
60,TABLE OF CONTENTS,Brotherhood
61,TABLE OF CONTENTS,A New Being
62,TABLE OF CONTENTS,The Man to the Angel
63,TABLE OF CONTENTS,Endurance
64,TABLE OF CONTENTS,The Vesture of the Soul
65,TABLE OF CONTENTS,The Twilight of Earth
66,TABLE OF CONTENTS,The Dream
67,TABLE OF CONTENTS,The Parting of Ways
68,TABLE OF CONTENTS,Song
69,TABLE OF CONTENTS,The Virgin Mother
70,TABLE OF CONTENTS,
71,TABLE OF CONTENTS,
72,TABLE OF CONTENTS,The Manager of the Dun Emer Press has to thank Mr. John Lane for
73,TABLE OF CONTENTS,permission to reprint ten poems from Homeward Songs by the Way and
74,TABLE OF CONTENTS,"nine poems from The Earth Breath, also Messrs. Macmillan & Co. for"
75,TABLE OF CONTENTS,permission to reprint seven poems from The Divine Vision.
76,TABLE OF CONTENTS,
77,TABLE OF CONTENTS,
78,TABLE OF CONTENTS,
79,TABLE OF CONTENTS,
80,TABLE OF CONTENTS,"Oh, be not led away,"
81,TABLE OF CONTENTS,Lured by the colour of the sun-rich day.
82,TABLE OF CONTENTS,The gay romance of song
83,TABLE OF CONTENTS,Unto the spirit life doth not belong:
84,TABLE OF CONTENTS,Though far-between the hours
85,TABLE OF CONTENTS,In which the Master of Angelic powers
86,TABLE OF CONTENTS,Lightens the dusk within
87,TABLE OF CONTENTS,"The holy of holies, be it thine to win"
88,TABLE OF CONTENTS,"Rare vistas of white light,"
89,TABLE OF CONTENTS,Half parted lips through which the Infinite
90,TABLE OF CONTENTS,"Murmurs her ancient story,"
91,TABLE OF CONTENTS,Harkening to whom the wandering planets hoary
92,TABLE OF CONTENTS,"Waken primeval fires,"
93,TABLE OF CONTENTS,With deeper rapture in celestial choirs
94,TABLE OF CONTENTS,"Breathe, and with fleeter motion"
95,TABLE OF CONTENTS,Wheel in their orbits through the surgeless ocean.
96,TABLE OF CONTENTS,"So hearken thou like these,"
97,TABLE OF CONTENTS,"Intent on her, mounting by slow degrees,"
98,TABLE OF CONTENTS,Until thy song's elation
99,TABLE OF CONTENTS,Echoes her multitudinous meditation.
100,TABLE OF CONTENTS,
101,TABLE OF CONTENTS,
102,TABLE OF CONTENTS,
103,TABLE OF CONTENTS,
104,A SUMMER NIGHT,A SUMMER NIGHT
105,A SUMMER NIGHT,
106,A SUMMER NIGHT,
107,A SUMMER NIGHT,Her mist of primroses within her breast
108,A SUMMER NIGHT,"Twilight hath folded up, and o'er the west,"
109,A SUMMER NIGHT,"Seeking remoter valleys long hath gone,"
110,A SUMMER NIGHT,Not yet hath come her sister of the dawn.
111,A SUMMER NIGHT,Silence and coolness now the earth enfold:
112,A SUMMER NIGHT,"Jewels of glittering green, long mists of gold,"
113,A SUMMER NIGHT,"Hazes of nebulous silver veil the height,"
114,A SUMMER NIGHT,And shake in tremors through the shadowy night.
115,A SUMMER NIGHT,"Heard through the stillness, as in whispered words,"
116,A SUMMER NIGHT,The wandering God-guided wings of birds
117,A SUMMER NIGHT,Ruffle the dark. The little lives that lie
118,A SUMMER NIGHT,Deep hid in grass join in a long-drawn sigh
119,A SUMMER NIGHT,More softly still; and unheard through the blue
120,A SUMMER NIGHT,"The falling of innumerable dew,"
121,A SUMMER NIGHT,Lifts with grey fingers all the leaves that lay
122,A SUMMER NIGHT,Burned in the heat of the consuming day.
123,A SUMMER NIGHT,"The lawns and lakes lie in this night of love,"
124,A SUMMER NIGHT,Admitted to the majesty above.
125,A SUMMER NIGHT,Earth with the starry company hath part;
126,A SUMMER NIGHT,"The waters hold all heaven within their heart,"
127,A SUMMER NIGHT,And glimmer o'er with wave-lips everywhere
128,A SUMMER NIGHT,Lifted to meet the angel lips of air.
129,A SUMMER NIGHT,The many homes of men shine near and far;
130,A SUMMER NIGHT,"Peace-laden as the tender evening star,"
131,A SUMMER NIGHT,The late home-coming folk anticipate
132,A SUMMER NIGHT,"Their rest beyond the passing of the gate,"
133,A SUMMER NIGHT,And tread with sleep-filled hearts on drowsy feet.
134,A SUMMER NIGHT,"Oh, far away and wonderful and sweet"
135,A SUMMER NIGHT,"All this, all this. But far too many things"
136,A SUMMER NIGHT,"Obscuring, as a cloud of seraph wings"
137,A SUMMER NIGHT,"Blinding the seeker for the Lord behind,"
138,A SUMMER NIGHT,"I fall away in weariness of mind,"
139,A SUMMER NIGHT,"And think how far apart are I and you,"
140,A SUMMER NIGHT,"Beloved, from those spirit children who"
141,A SUMMER NIGHT,"Felt but one single Being long ago,"
142,A SUMMER NIGHT,Whispering in gentleness and leaning low
143,A SUMMER NIGHT,"Out of its majesty, as child to child."
144,A SUMMER NIGHT,I think upon it all with heart grown wild.
145,A SUMMER NIGHT,"Hearing no voice, howe'er my spirit broods."
146,A SUMMER NIGHT,"No whisper from the dense infinitudes,"
147,A SUMMER NIGHT,This world of myriad things whose distance awes.
148,A SUMMER NIGHT,Ah me; how innocent our childhood was!
149,A SUMMER NIGHT,
150,A SUMMER NIGHT,
151,A SUMMER NIGHT,
152,A SUMMER NIGHT,
153,CREATION,CREATION
154,CREATION,
155,CREATION,
156,CREATION,"As one by one the veils took flight,"
157,CREATION,"The day withdrew, the stars came up:"
158,CREATION,"The spirit issued dark and bright,"
159,CREATION,Filling thy beauty like a cup.
160,CREATION,
161,CREATION,"Sacred thy laughter on the air,"
162,CREATION,"Holy thy lightest word that fell,"
163,CREATION,Proud the innumerable hair
164,CREATION,That waved at the enchanter's spell.
165,CREATION,
166,CREATION,"Oh Master of the Beautiful,"
167,CREATION,"Creating us from hour to hour,"
168,CREATION,Give me this vision to the full
169,CREATION,To see in lightest things thy power!
170,CREATION,
171,CREATION,"This vision give, no heaven afar,"
172,CREATION,"No throne, and yet I will rejoice,"
173,CREATION,"Knowing beneath my feet a star,"
174,CREATION,Thy word in every wandering voice.
175,CREATION,
176,CREATION,
177,CREATION,
178,CREATION,
179,DUSK,DUSK
180,DUSK,
181,DUSK,
182,DUSK,Dusk wraps the village in its dim caress;
183,DUSK,"Each chimney's vapour, like a thin grey rod,"
184,DUSK,"Mounting aloft through miles of quietness,"
185,DUSK,Pillars the skies of God.
186,DUSK,
187,DUSK,"Far up they break or seem to break their line,"
188,DUSK,Mingling their nebulous crests that bow and nod
189,DUSK,Under the light of those fierce stars that shine
190,DUSK,Out of the calm of God.
191,DUSK,
192,DUSK,Only in clouds and dreams I felt those souls
193,DUSK,"In the abyss, each fire hid in its clod,"
194,DUSK,From which in clouds and dreams the spirit rolls
195,DUSK,Into the vast of God.
196,DUSK,
197,DUSK,
198,DUSK,
199,DUSK,
200,NIGHT,NIGHT
201,NIGHT,
202,NIGHT,
203,NIGHT,Heart-hidden from the outer things I rose;
204,NIGHT,The spirit woke anew in nightly birth
205,NIGHT,Unto the vastness where forever glows
206,NIGHT,The star-soul of the earth.
207,NIGHT,
208,NIGHT,"There all alone in primal ecstasy,"
209,NIGHT,"Within her depths where revels never tire,"
210,NIGHT,The Olden Beauty shines: each thought of me
211,NIGHT,Is veined through with its fire.
212,NIGHT,
213,NIGHT,And all my thoughts are throngs of living souls;
214,NIGHT,"They breathe in me, heart unto heart allied;"
215,NIGHT,"Their joy undimmed, though when the morning tolls"
216,NIGHT,The planets may divide.
217,NIGHT,
218,NIGHT,
219,NIGHT,
220,NIGHT,
221,DAWN,DAWN
222,DAWN,
223,DAWN,
224,DAWN,Still as the holy of holies breathes the vast
225,DAWN,Within its crystal depths the stars grow dim;
226,DAWN,Fire on the altar of the hills at last
227,DAWN,Burns on the shadowy rim.
228,DAWN,
229,DAWN,Moments that holds all moments; white upon
230,DAWN,The verge it trembles; then like mists of flowers
231,DAWN,Break from the fairy fountain of the dawn
232,DAWN,The hues of many hours.
233,DAWN,
234,DAWN,Thrown downward from that high companionship
235,DAWN,"Of dreaming inmost heart with inmost heart,"
236,DAWN,"Into the common daily ways I slip,"
237,DAWN,My fire from theirs apart.
238,DAWN,
239,DAWN,
240,DAWN,
241,DAWN,
242,DAY,DAY
243,DAY,
244,DAY,
245,DAY,In day from some titanic past it seems
246,DAY,As if a thread divine of memory runs;
247,DAY,"Born ere the Mighty One began his dreams,"
248,DAY,Or yet were stars and suns.
249,DAY,
250,DAY,But here an iron will has fixed the bars;
251,DAY,Forgetfulness falls on earth's myriad races:
252,DAY,No image of the proud and morning stars
253,DAY,Looks at us from their faces.
254,DAY,
255,DAY,"Yet yearning still to reach to those dim heights,"
256,DAY,"Each dream remembered is a burning-glass,"
257,DAY,Where through to darkness from the Light of Lights
258,DAY,Its rays in splendour pass.
259,DAY,
260,DAY,
261,DAY,
262,DAY,
263,DANA,DANA
264,DANA,
265,DANA,
266,DANA,"I am the tender voice calling 'Away,'"
267,DANA,"Whispering between the beatings of the heart,"
268,DANA,And inaccessible in dewy eyes
269,DANA,"I dwell, and all unkissed on lovely lips,"
270,DANA,"Lingering between white breasts inviolate,"
271,DANA,"And fleeting ever from the passionate touch,"
272,DANA,"I shine afar, till men may not divine"
273,DANA,Whether it is the stars or the beloved
274,DANA,They follow with wrapt spirit. And I weave
275,DANA,"My spells at evening, folding with dim caress,"
276,DANA,"Aerial arms and twilight dropping hair,"
277,DANA,"The lonely wanderer by wood or shore,"
278,DANA,"Till, filled with some deep tenderness, he yields,"
279,DANA,Feeling in dreams for the dear mother heart
280,DANA,"He knew, ere he forsook the starry way,"
281,DANA,"And clings there, pillowed far above the smoke"
282,DANA,And the dim murmur from the duns of men.
283,DANA,"I can enchant the trees and rocks, and fill"
284,DANA,"The dumb brown lips of earth with mystery,"
285,DANA,Make them reveal or hide the god. I breathe
286,DANA,"A deeper pity than all love, myself"
287,DANA,"Mother of all, but without hands to heal:"
288,DANA,"Too vast and vague, they know me not. But yet"
289,DANA,"I am the heartbreak over fallen things,"
290,DANA,"The sudden gentleness that stays the blow,"
291,DANA,And I am in the kiss that foemen give
292,DANA,"Pausing in battle, and in the tears that fall"
293,DANA,"Over the vanquished foe, and in the highest;"
294,DANA,"Among the Danaan gods, I am the last"
295,DANA,Council of mercy in their hearts where they
296,DANA,Mete justice from a thousand starry thrones.
297,DANA,
298,DANA,
299,DANA,
300,DANA,
301,REMEMBRANCE,REMEMBRANCE
302,REMEMBRANCE,
303,REMEMBRANCE,
304,REMEMBRANCE,"There were many burning hours on the heart-sweet tide,"
305,REMEMBRANCE,"And we passed away from ourselves, forgetting all"
306,REMEMBRANCE,"The immortal moods that faded, the god who died,"
307,REMEMBRANCE,Hastening away to the King on a distant call.
308,REMEMBRANCE,
309,REMEMBRANCE,"There were ruby dews were shed when the heart was riven,"
310,REMEMBRANCE,And passionate pleading and prayers to the dead we had wronged;
311,REMEMBRANCE,"And we passed away unremembering and unforgiven,"
312,REMEMBRANCE,Hastening away to the King for the peace we longed.
313,REMEMBRANCE,
314,REMEMBRANCE,"Love unremembered and heart-ache we left behind,"
315,REMEMBRANCE,"We forsook them, unheeding, hastening away in our flight;"
316,REMEMBRANCE,We knew the hearts we had wronged of old we would find
317,REMEMBRANCE,When we came to the fold of the King for rest in the night.
318,REMEMBRANCE,
319,REMEMBRANCE,
320,REMEMBRANCE,
321,REMEMBRANCE,
322,THE HOUR OF THE KING,THE HOUR OF THE KING
323,THE HOUR OF THE KING,
324,THE HOUR OF THE KING,
325,THE HOUR OF THE KING,Who would think this quiet breather
326,THE HOUR OF THE KING,From the world had taken flight?
327,THE HOUR OF THE KING,Yet within the form we see there
328,THE HOUR OF THE KING,Wakes the golden King to-night.
329,THE HOUR OF THE KING,
330,THE HOUR OF THE KING,Out upon the face of faces
331,THE HOUR OF THE KING,He looked forth before his sleep:
332,THE HOUR OF THE KING,Now he knows the starry races
333,THE HOUR OF THE KING,Haunters of the ancient deep;
334,THE HOUR OF THE KING,
335,THE HOUR OF THE KING,On the Bird of Diamond Glory
336,THE HOUR OF THE KING,Floats in mystic floods of song:
337,THE HOUR OF THE KING,As he lists Time's triple story
338,THE HOUR OF THE KING,Seems but as a day is long.
339,THE HOUR OF THE KING,
340,THE HOUR OF THE KING,From the mightier Adam falling
341,THE HOUR OF THE KING,"To his image dwarfed in clay,"
342,THE HOUR OF THE KING,He will at our voices calling
343,THE HOUR OF THE KING,Come to this side of the day.
344,THE HOUR OF THE KING,
345,THE HOUR OF THE KING,"When he wakes, the dreamy-hearted,"
346,THE HOUR OF THE KING,"He will know not whence he came,"
347,THE HOUR OF THE KING,And the light from which he parted
348,THE HOUR OF THE KING,"Be the seraph's sword of flame,"
349,THE HOUR OF THE KING,
350,THE HOUR OF THE KING,And behind it hosts supernal
351,THE HOUR OF THE KING,"Guarding the lost paradise,"
352,THE HOUR OF THE KING,And the tree of life eternal
353,THE HOUR OF THE KING,From the weeping human eyes.
354,THE HOUR OF THE KING,
355,THE HOUR OF THE KING,
356,THE HOUR OF THE KING,
357,THE HOUR OF THE KING,
358,THE WINDS OF ANGUS,THE WINDS OF ANGUS
359,THE WINDS OF ANGUS,
360,THE WINDS OF ANGUS,
361,THE WINDS OF ANGUS,The grey road whereupon we trod became as holy ground:
362,THE WINDS OF ANGUS,The eve was all one voice that breathed its message with no sound:
363,THE WINDS OF ANGUS,"And burning multitudes pour through my heart, too bright, too blind,"
364,THE WINDS OF ANGUS,Too swift and hurried in their flight to leave their tale behind.
365,THE WINDS OF ANGUS,"Twin gates unto that living world, dark honey-coloured eyes"
366,THE WINDS OF ANGUS,The lifting of whose lashes flushed the face with paradise--
367,THE WINDS OF ANGUS,"Beloved, there I saw within their ardent rays unfold"
368,THE WINDS OF ANGUS,The likeness of enraptured birds that flew from deeps of gold
369,THE WINDS OF ANGUS,To deeps of gold within my breast to rest or there to be
370,THE WINDS OF ANGUS,"Transfigured in the light, or find a death to life in me."
371,THE WINDS OF ANGUS,"So love, a burning multitude, a seraph wind which blows"
372,THE WINDS OF ANGUS,From out the deep of being to the deep of being goes:
373,THE WINDS OF ANGUS,And sun and moon and starry fires and earth and air and sea
374,THE WINDS OF ANGUS,"Are creatures from the deep let loose who pause in ecstasy,"
375,THE WINDS OF ANGUS,Or wing their wild and heavenly way until again they find
376,THE WINDS OF ANGUS,"The ancient deep and fade therein, enraptured, bright and blind."
377,THE WINDS OF ANGUS,
378,THE WINDS OF ANGUS,
379,THE WINDS OF ANGUS,
380,THE WINDS OF ANGUS,
381,REFLECTIONS,REFLECTIONS
382,REFLECTIONS,
383,REFLECTIONS,
384,REFLECTIONS,How shallow is this mere that gleams!
385,REFLECTIONS,Its depth of blue is from the skies;
386,REFLECTIONS,And from a distant sun the dreams
387,REFLECTIONS,And lovely light within your eyes.
388,REFLECTIONS,
389,REFLECTIONS,We deem our love so infinite
390,REFLECTIONS,"Because the Lord is everywhere,"
391,REFLECTIONS,And love awakening is made bright
392,REFLECTIONS,And bathed in that diviner air.
393,REFLECTIONS,
394,REFLECTIONS,We go on our enchanted way
395,REFLECTIONS,"And deem our hours immortal hours,"
396,REFLECTIONS,Who are but shadow kings that play
397,REFLECTIONS,With mirrored majesties and powers.
398,REFLECTIONS,
399,REFLECTIONS,
400,REFLECTIONS,
401,REFLECTIONS,
402,THE DAWN OF DARKNESS,THE DAWN OF DARKNESS
403,THE DAWN OF DARKNESS,
404,THE DAWN OF DARKNESS,
405,THE DAWN OF DARKNESS,Come earth's little children pit-pat from their burrows on the hill;
406,THE DAWN OF DARKNESS,Hangs within the gloom its weary head the shining daffodil.
407,THE DAWN OF DARKNESS,In the valley underneath us through the fragrance flit along
408,THE DAWN OF DARKNESS,Over fields and over hedgerows little quivering drops of song.
409,THE DAWN OF DARKNESS,All adown the pale blue mantle of the mountains far away
410,THE DAWN OF DARKNESS,Stream the tresses of the twilight flying in the wake of day.
411,THE DAWN OF DARKNESS,Night comes; soon alone shall fancy follow sadly in her flight
412,THE DAWN OF DARKNESS,"Where the fiery dust of evening, shaken from the feet of light,"
413,THE DAWN OF DARKNESS,"Thrusts its monstrous barriers between the pure, the good, the true,"
414,THE DAWN OF DARKNESS,"That our weeping eyes may strain for, but shall never after view."
415,THE DAWN OF DARKNESS,Only yester eve I watched with heart at rest the nebulæ
416,THE DAWN OF DARKNESS,Looming far within the shadowy shining of the Milky Way;
417,THE DAWN OF DARKNESS,Finding in the stillness joy and hope for all the sons of men;
418,THE DAWN OF DARKNESS,Now what silent anguish fills a night more beautiful than then.
419,THE DAWN OF DARKNESS,"For earth's age of pain has come, and all her sister planets weep,"
420,THE DAWN OF DARKNESS,Thinking of her fires of morning passing into dreamless sleep.
421,THE DAWN OF DARKNESS,In this cycle of great sorrow for the moments that we last
422,THE DAWN OF DARKNESS,We too shall be linked by weeping to the greatness of her past:
423,THE DAWN OF DARKNESS,"But the coming race shall know not, and the fount of tears shall dry,"
424,THE DAWN OF DARKNESS,And the arid heart of man be arid as the desert sky.
425,THE DAWN OF DARKNESS,So within my mind the darkness dawned and round me everywhere
426,THE DAWN OF DARKNESS,"Hope departed with the twilight, leaving only dumb despair."
427,THE DAWN OF DARKNESS,
428,THE DAWN OF DARKNESS,
429,THE DAWN OF DARKNESS,
430,THE DAWN OF DARKNESS,
431,NATURAL MAGIC,NATURAL MAGIC
432,NATURAL MAGIC,
433,NATURAL MAGIC,
434,NATURAL MAGIC,We are tired who follow after
435,NATURAL MAGIC,Phantasy and truth that flies:
436,NATURAL MAGIC,You with only look and laughter
437,NATURAL MAGIC,Stain our hearts with richest dyes.
438,NATURAL MAGIC,
439,NATURAL MAGIC,When you break upon our study
440,NATURAL MAGIC,Vanish all our frosty cares;
441,NATURAL MAGIC,"As the diamond deep grows ruddy,"
442,NATURAL MAGIC,Filled with morning unawares.
443,NATURAL MAGIC,
444,NATURAL MAGIC,With the stuff that dreams are made of
445,NATURAL MAGIC,But an empty house we build:
446,NATURAL MAGIC,"Glooms we are ourselves afraid of,"
447,NATURAL MAGIC,By the ancient starlight chilled.
448,NATURAL MAGIC,
449,NATURAL MAGIC,All unwise in thought or duty--
450,NATURAL MAGIC,Still our wisdom envies you:
451,NATURAL MAGIC,We who lack the living beauty
452,NATURAL MAGIC,Half our secret knowledge rue.
453,NATURAL MAGIC,
454,NATURAL MAGIC,Thought nor fear in you nor dreaming
455,NATURAL MAGIC,Veil the light with mist about;
456,NATURAL MAGIC,"Joy, as through a crystal gleaming,"
457,NATURAL MAGIC,Flashes from the gay heart out.
458,NATURAL MAGIC,
459,NATURAL MAGIC,"Pain and penitence forsaking,"
460,NATURAL MAGIC,"Hearts like cloisters dim and grey,"
461,NATURAL MAGIC,"By your laughter lured, awaking"
462,NATURAL MAGIC,Join with you the dance of day.
463,NATURAL MAGIC,
464,NATURAL MAGIC,
465,NATURAL MAGIC,
466,NATURAL MAGIC,
467,IN THE WOMB,IN THE WOMB
468,IN THE WOMB,
469,IN THE WOMB,
470,IN THE WOMB,Still rests the heavy share on the dark soil:
471,IN THE WOMB,Upon the black mould thick the dew-damp lies:
472,IN THE WOMB,The horse waits patient: from his lowly toil
473,IN THE WOMB,The ploughboy to the morning lifts his eyes.
474,IN THE WOMB,
475,IN THE WOMB,The unbudding hedgerows dark against day's fires
476,IN THE WOMB,Glitter with gold-lit crystals: on the rim
477,IN THE WOMB,Over the unregarding city's spires
478,IN THE WOMB,The lonely beauty shines alone for him.
479,IN THE WOMB,
480,IN THE WOMB,And day by day the dawn or dark enfolds
481,IN THE WOMB,And feeds with beauty eyes that cannot see
482,IN THE WOMB,How in her womb the mighty mother moulds
483,IN THE WOMB,The infant spirit for eternity.
484,IN THE WOMB,
485,IN THE WOMB,
486,IN THE WOMB,
487,IN THE WOMB,
488,FORGIVENESS,FORGIVENESS
489,FORGIVENESS,
490,FORGIVENESS,
491,FORGIVENESS,At dusk the window panes grew grey;
492,FORGIVENESS,The wet world vanished in the gloom;
493,FORGIVENESS,The dim and silver end of day
494,FORGIVENESS,Scarce glimmered through the little room.
495,FORGIVENESS,
496,FORGIVENESS,And all my sins were told; I said
497,FORGIVENESS,Such things to her who knew not sin--
498,FORGIVENESS,"The sharp ache throbbing in my head,"
499,FORGIVENESS,The fever running high within.
500,FORGIVENESS,
501,FORGIVENESS,I touched with pain her purity;
502,FORGIVENESS,Sin's darker sense I could not bring:
503,FORGIVENESS,My soul was black as night to me:
504,FORGIVENESS,To her I was a wounded thing.
505,FORGIVENESS,
506,FORGIVENESS,I needed love no words could say;
507,FORGIVENESS,"She drew me softly nigh her chair,"
508,FORGIVENESS,"My head upon her knees to lay,"
509,FORGIVENESS,With cool hands that caressed my hair.
510,FORGIVENESS,
511,FORGIVENESS,"She sat with hands as if to bless,"
512,FORGIVENESS,"And looked with grave, ethereal eyes;"
513,FORGIVENESS,"Ensouled by ancient quietness,"
514,FORGIVENESS,A gentle priestess of the Wise.
515,FORGIVENESS,
516,FORGIVENESS,
517,FORGIVENESS,
518,FORGIVENESS,
519,A WOMAN'S VOICE,A WOMAN'S VOICE
520,A WOMAN'S VOICE,
521,A WOMAN'S VOICE,
522,A WOMAN'S VOICE,"His head within my bosom lay,"
523,A WOMAN'S VOICE,But yet his spirit slipped not through:
524,A WOMAN'S VOICE,I only felt the burning clay
525,A WOMAN'S VOICE,That withered for the cooling dew.
526,A WOMAN'S VOICE,
527,A WOMAN'S VOICE,It was but pity when I spoke
528,A WOMAN'S VOICE,"And called him to my heart for rest,"
529,A WOMAN'S VOICE,And half a mother's love that woke
530,A WOMAN'S VOICE,Feeling his head upon my breast:
531,A WOMAN'S VOICE,
532,A WOMAN'S VOICE,And half the lion's tenderness
533,A WOMAN'S VOICE,"To shield her cubs from hurt or death,"
534,A WOMAN'S VOICE,"Which, when the serried hunters press,"
535,A WOMAN'S VOICE,Makes terrible her wounded breath.
536,A WOMAN'S VOICE,
537,A WOMAN'S VOICE,But when the lips I breathed upon
538,A WOMAN'S VOICE,Asked for such love as equals claim
539,A WOMAN'S VOICE,I looked where all the stars were gone
540,A WOMAN'S VOICE,Burned in the day's immortal flame.
541,A WOMAN'S VOICE,
542,A WOMAN'S VOICE,'Come thou like yon great dawn to me
543,A WOMAN'S VOICE,"From darkness vanquished, battles done:"
544,A WOMAN'S VOICE,Flame unto flame shall flow and be
545,A WOMAN'S VOICE,Within thy heart and mine as one.'
546,A WOMAN'S VOICE,
547,A WOMAN'S VOICE,
548,A WOMAN'S VOICE,
549,A WOMAN'S VOICE,
550,PARTING,PARTING
551,PARTING,
552,PARTING,
553,PARTING,As from our dream we died away
554,PARTING,Far off I felt the outer things;
555,PARTING,"Your wind-blown tresses round me play,"
556,PARTING,Your bosom's gentle murmurings.
557,PARTING,
558,PARTING,And far away our faces met
559,PARTING,As on the verge of the vast spheres;
560,PARTING,"And in the night our cheeks were wet,"
561,PARTING,I could not say with dew or tears.
562,PARTING,
563,PARTING,As one within the Mother's heart
564,PARTING,In that hushed dream upon the height
565,PARTING,"We lived, and then we rose to part,"
566,PARTING,Because her ways are infinite.
567,PARTING,
568,PARTING,
569,PARTING,
570,PARTING,
571,A PRAYER,A PRAYER
572,A PRAYER,
573,A PRAYER,
574,A PRAYER,"O, holy Spirit of the Hazel, hearken now,"
575,A PRAYER,"Though shining suns and silver moons burn on the bough,"
576,A PRAYER,"And though the fruit of stars by many myriads gleam,"
577,A PRAYER,"Yet in the undergrowth below, still in thy dream,"
578,A PRAYER,Lighting the labyrinthine maze and monstrous gloom
579,A PRAYER,Are many gem-winged flowers with gay and delicate bloom;
580,A PRAYER,"And in the shade, hearken, O Dreamer of the Tree,"
581,A PRAYER,One wild rose blossom of thy spirit breathed on me
582,A PRAYER,"With lovely and still light, a little sister flower"
583,A PRAYER,"To those that whitely on the tall moon branches tower,"
584,A PRAYER,"Lord of the Hazel now, oh hearken while I pray,"
585,A PRAYER,This wild rose blossom of thy spirit fades away.
586,A PRAYER,
587,A PRAYER,
588,A PRAYER,
589,A PRAYER,
590,THE HEROES,THE HEROES
591,THE HEROES,
592,THE HEROES,
593,THE HEROES,By many a dream of God and man my thoughts in shining flocks were led:
594,THE HEROES,But as I went through Patrick Street the hopes and prophecies were dead.
595,THE HEROES,The hopes and prophecies were dead: they could not blossom where the feet
596,THE HEROES,"Walked amid rottenness, or where the brawling shouters stamped the street."
597,THE HEROES,Where was the beauty that the Lord gave man when first he towered in pride?
598,THE HEROES,But one came by me at whose word the bitter condemnation died.
599,THE HEROES,His brows were crowned with thorns of light: his eyes were bright as one
600,THE HEROES,who sees
