,Poem Title,line
4556,THE BLIND MAN,"catching one's sleeve, and laughing at one's face.--And everywhere"
4557,THE BLIND MAN,"those flopping, wriggling petticoats were appearing and disappearing."
4558,THE BLIND MAN,"One saw slack hair whisking by the corner of one's eye. Mysteriously,"
4559,THE BLIND MAN,"urgently, they were coming and going and coming again, and never, never"
4560,THE BLIND MAN,being silent.
4561,THE BLIND MAN,
4562,THE BLIND MAN,More and more he went running to the public-house. But it was no
4563,THE BLIND MAN,"longer to be among men, it was to get drunk. One might imagine him"
4564,THE BLIND MAN,sitting there thinking those slow thoughts without words. One might
4565,THE BLIND MAN,"predict that the day would come when he would realise very suddenly,"
4566,THE BLIND MAN,"very clearly all that he had been thinking about, and, when this"
4567,THE BLIND MAN,"urgent, terrible thought had been translated into its own terms of"
4568,THE BLIND MAN,"action, he would be quietly hanged by the neck until he was as dead as"
4569,THE BLIND MAN,he had been before he was alive.
4570,THE BLIND MAN,
4571,THE BLIND MAN,
4572,THE BLIND MAN,
4573,THE BLIND MAN,
4574,SWEET-APPLE,SWEET-APPLE
4575,SWEET-APPLE,
4576,SWEET-APPLE,"At the end of the bough, at the top of the tree"
4577,SWEET-APPLE,"(As fragrant, as high, and as lovely as thou)"
4578,SWEET-APPLE,"One sweet apple reddens which all men may see,"
4579,SWEET-APPLE,At the end of the bough.
4580,SWEET-APPLE,
4581,SWEET-APPLE,"Swinging full to the view, tho' the gatherers now"
4582,SWEET-APPLE,"Pass, and evade, and o'erlook busily:"
4583,SWEET-APPLE,"Overlook! nay, but pluck it! they cannot tell how."
4584,SWEET-APPLE,
4585,SWEET-APPLE,"For it swings out of reach as a cloud, and as free"
4586,SWEET-APPLE,"As a star, or thy beauty, which seems too, I vow,"
4587,SWEET-APPLE,Remote as the sweet rosy apple--ah me!
4588,SWEET-APPLE,At the end of the bough.
4589,SWEET-APPLE,
4590,SWEET-APPLE,
4591,SWEET-APPLE,
4592,SWEET-APPLE,
4593,THREE HAPPY PLACES,THREE HAPPY PLACES
4594,THREE HAPPY PLACES,
4595,I,I
4596,I,
4597,I,One awakened suddenly in those days. Sleep was not followed by the
4598,I,haze which trails behind more mature slumbers. One's eyes opened wide
4599,I,"and bright, and brains and legs became instantly active. If by a"
4600,I,"chance the boy lying next to you was still asleep, it was the thing to"
4601,I,"hit him with a pillow. Even among boys, however, there are certain"
4602,I,"morose creatures who are ill-tempered in the morning, and these, on"
4603,I,"being struck with a pillow, become malignantly active, and desire to"
4604,I,fight with fists instead of pillows.
4605,I,
4606,I,Bull was such a boy. He was densely packed with pugnacity. He lived
4607,I,"for ever on the extreme slope of a fight, down which he slid at a word,"
4608,I,"a nod, a wink, into strenuous and bloodthirsty warfare. He was never"
4609,I,"seen without a black eye, a bruised lip, or something wrong with his"
4610,I,ear. He had the most miscellaneous collection of hurts that one could
4611,I,"imagine, and he was always prepared to exhibit his latest injury in"
4612,I,exchange for a piece of toffee. If this method of barter was not
4613,I,"relished, he would hit the proprietor of the toffee and confiscate the"
4614,I,goods to his own use.
4615,I,
4616,I,His knowledge of who had sweets was uncanny. He had an extra sense in
4617,I,"that direction, which was a trouble to all smaller boys. No matter how"
4618,I,"cunningly one concealed a sticky treasure, just when one was secretly"
4619,I,enjoying it he came leaping out of space with the most offensive
4620,I,"friendliness crinkling all over his face, and his desire to participate"
4621,I,in the confection was advanced without any preliminary courtesies--
4622,I,
4623,I,"""What have you got? Show! Give us a bit. Can't you give a fellow a"
4624,I,"bit?"""
4625,I,
4626,I,"When the bit was tendered he snatched it, swallowed it, and growled--"
4627,I,
4628,I,"""Do you call that a bit? Give us a real bit."""
4629,I,
4630,I,There are plenty of boys who will defend their toffee with their lives.
4631,I,"Such boys he liked to meet, for their refusal to surrender a part gave"
4632,I,him an opportunity to fight and a reason for confiscating the whole of
4633,I,the ravished sweetmeat. One often had to devour one's sweets at a full
4634,I,gallop. It was no uncommon thing to see a small boy scudding furiously
4635,I,"around a field with Bull pounding behind, intent as a bloodhound, and"
4636,I,as horribly vocal. A close examination would discover that the small
4637,I,boy's jaws were moving with even greater rapidity than his legs. If he
4638,I,managed to get his stuff devoured before he was caught it was all
4639,I,"right, but he got hammered anyhow when he was caught. However, Bull's"
4640,I,"approach was usually managed with great skill and strategy, and before"
4641,I,the small boy was aware Bull was squatting beside him using
4642,I,blandishments both moral and minatory.
4643,I,
4644,I,He was a very gifted boy. He had no bent for learning lessons but he
4645,I,had a great gift for collecting and turning to his own use the property
4646,I,of other people. Sometimes three or four boys swore a Solemn League
4647,I,and Covenant against him. His perplexity then was extreme. He saw
4648,I,toffee being devoured and none of it coming his way. Possibly his
4649,I,"method of thinking was in pictures, and he could visualise with painful"
4650,I,"clarity the alien gullets down which toffee was traveling, and,"
4651,I,"simultaneously, he could see the woeful emptiness of his own red lane."
4652,I,He must have felt that all was not right with a Providence which could
4653,I,allow such happenings. A world wherein there was toffee for others and
4654,I,none for him was certainly a world out of joint. His idea of Utopia
4655,I,would be a place where there were lots of things for him to eat and a
4656,I,circle of hungry boys who watched his deliberate jaws with envy and
4657,I,"humility. Furthermore, the idea that smaller boys could have, not the"
4658,I,"courage, but the heart to congregate against him, must have come to him"
4659,I,with a shock. He was appalled by a sense of the sinfulness of human
4660,I,"nature, and dismayed by the odds against which virtue has to fight."
4661,I,
4662,I,"The others, strong in numbers, followed him on such occasions chewing"
4663,I,"their tuck with grave deliberation, descanting minutely and loudly on"
4664,I,"the taste of each bit, the splendid length of time it took to dissolve,"
4665,I,and the blessedly large quantity which yet remained to be eaten. He
4666,I,"threatened them, but his threats were received with yawns. He wheedled"
4667,I,(a thing he could do consummately well) but they were not to be
4668,I,blandished. He mapped out on his own person the particular and painful
4669,I,places where later on he would hit them unless he was bound over to the
4670,I,peace by toffee. And they sucked their sweetstuff and made diagrams on
4671,I,each other of the places where they could hit Bull if they had a mind
4672,I,"to, and told each other and him that he was not worth hitting and,"
4673,I,would probably die if he were hit. But they were careful not dissolve
4674,I,partnership until the sweets were eaten and beyond even the wildest
4675,I,"hopes of salvage. Then, in the later-on that had been predicted, Bull"
4676,I,"captured them in detail, and, as he had promised, he ""lammed the"
4677,I,"stuffing"" out of them."
4678,I,
4679,I,"He had all the grave wisdom of the stupid, and the extraordinary energy"
4680,I,"and persistence which perpetuates them. He never could learn a lesson,"
4681,I,"but he could, and did, pinch the boy next to him into adept prompting,"
4682,I,"and would intimidate any one into doing his sums. Indeed, the man of"
4683,I,whom he was the promise had no need for ordinary learning. The lighter
4684,I,"accomplishments of life had no appeal, nor would the deeper lessons"
4685,I,"have any meaning for him. He is simply a big, physical appetite,"
4686,I,"untrammelled by anything like introspection or conscience, and working"
4687,I,in perfect innocence for the fulfilment of its simple wants. For at
4688,I,base his species are surely the most simple of human creatures. In
4689,I,spite of their complex physical structure they are one-celled organisms
4690,I,driven through life with only a passionate hunger as their motive
4691,I,"power, and with no complexities of thought or emotion to hamper their"
4692,I,loud progressions. None but those of their own kind can suffer from
4693,I,"their ravages, and, even so, they fly the contact of each other with"
4694,I,horror.
4695,I,
4696,I,Doubtless by this time Bull is a prosperous and wealthy citizen
4697,I,"somewhere, the proprietor of a curved waistcoat and a gold watch."
4698,I,Possessions other than these he would regard with the amiable tolerance
4699,I,of a philosopher regarding a child with toys. So strongly acquisitive
4700,I,a nature must win the particular little battles which it is fitted to
4701,I,wage. When a conscienceless mind is buttressed by a pugnacious
4702,I,"temperament then houses and land, and cattle and maidservants, and"
4703,I,"such-like, the small change of existence, are easily gotten."
4704,I,
4705,I,
4706,II,II
4707,II,
4708,II,The sunlight of youth has a special quality which will never again be
4709,II,known until we rediscover it in Paradise. What a time it was! How the
4710,II,"sun shone, and how often it shone! I remember playing about in a"
4711,II,parched and ragged field with a leaf from a copy-book stuck under my
4712,II,cap to aid its quarter-inch peak in keeping off the glare of that
4713,II,tremendous sunshine.
4714,II,
4715,II,"Tip-and-Tig, Horneys and Robbers, Relievo we played, and another game,"
4716,II,"the name of which did not then seem at all strange, but which now wears"
4717,II,"an amazing appearance--it was, Twenty-four Yards on the Billy-Goat's"
4718,II,"Tail. I wonder now what was that Billy-Goat, and was he able to wag the"
4719,II,triumphant tail of which twenty-four yards was probably no more than an
4720,II,"inconsiderable moiety. There were other games: Ball-in-the-Decker,"
4721,II,"Cap-on-the-Back, and Towns or Rounders. These were all summer games."
4722,II,
4723,II,With the lightest effort of imagination I can see myself and other
4724,II,tireless atoms scooting across reaches of sunlight. I can hear the
4725,II,"continuous howl which accompanied our play, and can see that ragged,"
4726,II,"parched field spreading, save for the cluster of boys, wide and silent"
4727,II,"to the further, greener fields, where the cows were lying down in great"
4728,II,"coloured lumps, and one antic deer, a pet, would make such astonishing"
4729,II,"journeys, jumping the entire circuit of the field on four thin and"
4730,II,absolutely rigid legs; for when it made these peculiar excursions it
4731,II,"never seemed to use its legs--these were held quite rigidly, and the"
4732,II,"deer bounded by some powerful, spring-like action, its brown coat"
4733,II,"flashing in the sunlight, and its movement a rhythmic glory which the"
4734,II,boys watched with ecstasy and laughter.
4735,II,
4736,II,"An old ass was native to that field also. He had been a bright,"
4737,II,"kind-hearted donkey at one time: a donkey whose nose might be tickled,"
4738,II,and who would allow one to climb upon his back. But the presence of
4739,II,"boys grew disturbing as he grew old, and the practical jokes of which"
4740,II,his youth took no heed induced a kind of insanity in his latter age.
4741,II,"He took to kicking the cows as they browsed peacefully, and, later, he"
4742,II,"developed a horrid appetite for fowl, and would stalk and kill and eat"
4743,II,hens whenever possible. Later still he directed this unhealthy
4744,II,"appetite towards small boys, and after he had eaten part of one lad's"
4745,II,shoulder and the calf from another boy's leg he disappeared--whether he
4746,II,"was sold to some innocent person, or had been slaughtered mysteriously,"
4747,II,we did not know. We professed to believe that he had died of the
4748,II,"horrible taste of the boys he had bitten, and, afterwards, whenever we"
4749,II,"played cannibals, we refused, greatly to their chagrin, to kill and eat"
4750,II,"these two boys, on the ground that their flesh was poisonous; but the"
4751,II,others we slaughtered and fed on with undiminished gusto.
4752,II,
4753,II,"There were only two trees in the field--great, gnarled monsters casting"
4754,II,a deep shade. In that shade the grass grew long and green and juicy.
4755,II,After a game the boys would fling themselves down in the shadow of the
4756,II,"trees to chew the sweet grass, and play ""knifey,"" and talk.--Such"
4757,II,"talk!--endless and careless, and loud as the converse of young bulls."
4758,II,What did we talk about? Delightful and inconsequent shoutings--
4759,II,
4760,II,"""That is a hawk up there, he's going to soar. How does he keep so"
4761,II,steady without moving his wings? Watch now! down he drops like a
4762,II,stone. . . . If you give your rabbit too many cabbage leaves he'll die
4763,II,of the gripes. . . . Did you ever play jack-stones? a fellow showed me
4764,II,"how, look! . . . When we were at the sea yesterday Jimmy Nelson"
4765,II,wouldn't go out from the shore. He was afraid of his life--he wouldn't
4766,II,"even duck down. I swam nearly out of sight, didn't I, Sam? So did"
4767,II,Sam. . . . You could climb right up to the top of that tree if you
4768,II,"tried. No you couldn't.--Yes I could, it's forked all the way"
4769,II,up. . . . The new master wears specs--Old Four-Eyes! and he grins at a
4770,II,fellow. I don't think he's much. . . . How do midges get born? . . .
4771,II,My brother has one with four blades and a thing for poking stones out
4772,II,of a horse's hoof. . . . A horse-hair won't break the cane at all:
4773,II,"it's all bosh: rosin is the only thing. . . ."""
4774,II,
4775,II,There was a little stream which twisted a six-foot path through the
4776,II,"field, the sunshine dashing off its waters in brilliant flashes. The"
4777,II,"top of the water swarmed with flying insects and strange, small"
4778,II,spider-things skimmed over its surface with amazing swiftness. We
4779,II,believed there were otters in that stream--they came out at nightfall
4780,II,"and, unless you had the good fortune to be rescued by a Newfoundland"
4781,II,"dog, they would hold you down under water until you were drowned. We"
4782,II,also held there were leeches in the stream--they would grip you by the
4783,II,"hundred thousand and suck you to death in five minutes, and they clung"
4784,II,so tightly that one could not prise their mouths open with a poker. We
4785,II,"hoped there were whales in it, but not one of us desired a shark"
4786,II,because it is the Sailor's Enemy.
4787,II,
4788,II,An iron railing ran by part of the field. Every hole and joint of it
4789,II,"was crammed with earwigs, and these could be poked out of the crevices"
4790,II,with a straw. When an amazing number of them had been poked out there
4791,II,was always another one left. The very last earwig that could be
4792,II,discovered was the King. He was able and willing to bite ten times as
4793,II,"badly as any of the others, and he was awfully vicious when his nest"
4794,II,"was broken into. Furthermore, he had the ability to put a curse on you"
4795,II,"before he died, and he always did this because he was so vicious. If a"
4796,II,King Earwig had time to curse you before he was killed terrible things
4797,II,might happen. His favourite curse was to translate himself into the
4798,II,"next piece of bread you would eat, and then you would see one-half of"
4799,II,him waggling in a hole in the bread: the other half you had already
4800,II,eaten.--For this reason the King Earwig was always allowed to go free
4801,II,"until he was not looking, then he was killed with great suddenness."
4802,II,
4803,II,I remember how the slow evening shadows drew over the quiet fields. The
4804,II,"sunlight slowly faded to a mist of gold, into which the great trees"
4805,II,"thrust timorous, shy fingers, and these gradually widened, until, at"
4806,II,"last, the whole horizon bowed into the twilight."
4807,II,
4808,II,"Across the field there could be heard the voice of the river, a"
4809,II,"furtive, desolate hoarseness in the dusk. The cows in the far fields"
4810,II,"had long ago wandered home to be milked, scarcely a bird moved in the"
4811,II,"high silences, the gnats had hidden themselves away in the deep, rugged"
4812,II,"bark of the trees, and, through the dimness, the heavy beetles were"
4813,II,"hurling like stones, and dropping and rising again in a laborious"
4814,II,flight.
4815,II,
4816,II,
4817,III,III
4818,III,
4819,III,He could remember that he had wept to be allowed go to school. Even
4820,III,more vivid was his recollection of the persuasive and persistent tears
4821,III,which he had shed to be allowed to stay at home.
4822,III,
4823,III,Most of the joys of school were exhausted after he had submitted to one
4824,III,hour of dreary discipline.--To be compelled to sit still when every
4825,III,inch of one's being clamoured to move about; to have to stand up and
4826,III,stare at a blackboard upon which meaningless white scrawls were
4827,III,"perpetually being drawn, and as perpetually being wiped out to a"
4828,III,"master's meaningless, monotonous verbal accompaniment; to have to join"
4829,III,"in a chant which began with ""a, b, c,"" and droned steadily through a"
4830,III,"complexity of sounds to a ridiculously inadequate ""z""--such things"
4831,III,"became desperately boring. One was not even let go to sleep, and if"
4832,III,"one wept from sheer ennui, then one was clouted. School, he shortly"
4833,III,"decided, was not worth anybody's while, but he also discovered that a"
4834,III,torment had commenced which was not by any artifice to be evaded.
4835,III,
4836,III,Along the road to school there ran a succession of meadows--the path
4837,III,was really a footway through fields--and how not to stray into these
4838,III,meadows was a problem demanding the entire of one's attention.
4839,III,Sometimes a rabbit bolted almost from under one's feet--it flapped away
4840,III,"through the grass, and bobbed up and down in a great hurry. Then his"
4841,III,heart filled with envy. He said to himself--
4842,III,
4843,III,"""That rabbit is not going to school: if it was it wouldn't run so"
4844,III,"quickly."""
4845,III,
4846,III,It was paltry comfort to hurl a wad of grass after it.
4847,III,
4848,III,"Through most of the journey there was an immense, lazy bee with a bass"
4849,III,"voice, and he droned defiance three feet away from one's cap which"
4850,III,almost jolted to be put over him. He seemed to understand that at such
4851,III,"an hour he was not in any danger, and so he would drop to the grass,"
4852,III,"roll on his back, and cock up his legs in ecstasy."
4853,III,
4854,III,"""Bees,"" said he to himself in amazement and despair, ""do not go to"
4855,III,"school."""
4856,III,
4857,III,"Each bush and tree seemed, for the moment, to be inhabited by a bird"
4858,III,whose song was unfamiliar and the markings on whom he could not
4859,III,remember to have seen before; and he had no time to stay and note them.
4860,III,"He dragged beyond these objects reluctantly, pondering on the"
4861,III,unreasonable savagery of parents who sent one to school when the sun
4862,III,was shining.
4863,III,
4864,III,But the greatest obstacle to getting to school was the river which
4865,III,danced briskly through the fields. The footpath went for a stretch
4866,III,"along this stream, and, during that piece of the journey, haste was not"
4867,III,possible. There are so many things in a river to look at. The
4868,III,movement of the water in itself exercises fascinations over a boy.
4869,III,"There are always bubbles, based strongly in froth, sailing gallantly"
4870,III,along.--One speculates how long a bubble will swim before it hits a
4871,III,"rock, or is washed into nothing by an eddy, or is becalmed in a"
4872,III,sheltered corner to ride at jaunty anchor with a navy of similar
4873,III,delicate tonnage.
4874,III,
4875,III,"Further, if one finds a twig on the path, or a leaf, there is nothing"
4876,III,more natural than to throw these into the river and see how fast or how
4877,III,erratically they sail. Pebbles also clamour to be cast into the
4878,III,stream. Perhaps a dragon-fly whirls above the surface of the water to
4879,III,hold one late from school. The grasses and rushes by the marge may
4880,III,stir as a grey rat slips out to take to the water and swim low down and
4881,III,very fast on some strange and important journey. The inspection of
4882,III,"such an event cannot be hurried. One must, if it is possible, discover"
4883,III,"where he swims to, and if his hole is found it has to be blocked up"
4884,III,"with stones, even though the persistent bell is clanging down over the"
4885,III,fields.
4886,III,
4887,III,Perhaps a big frog will push out from the grass and go in fat leaps
4888,III,down to the water--plop! and away he swims with his sarcastic nose up
4889,III,"and his legs going like fury. The strange, very-little-boy motions of"
4890,III,"a frog in water is a thing to ponder over. There are small frogs also,"
4891,III,"every bit as interesting, thin-legged, round-bellied anatomies who try"
4892,III,"to jump two ways at once when they are observed, and are caught so"
4893,III,easily that it is scarcely worth one's trouble to chase them at all.
4894,III,
4895,III,Just where the path turned there was an arch under which the river
4896,III,flowed.--It was covered in with an iron grating. Surely it was a place
4897,III,"of mystery. Through the bars the dark, swirling waters were dimly"
4898,III,visible--there were things in there. Black lumps rose out of the
4899,III,"water, and, for a little distance, the slimy, shimmering, cold-looking"
4900,III,"walls could be seen. Beyond there was a deeper gloom, and, beyond that"
4901,III,"again, a blank, mysterious darkness. Through the grating the voice of"
4902,III,"the stream came back with a strange note. On the outside, under the"
4903,III,"sun, it was a tinkle and a rush, a dance indeed, but within it was a"
4904,III,low snarl that deepened to a grim whisper. There was an edge of malice
4905,III,to the sound: something dark and very terrible brooded on the face of
4906,III,those hidden waters. It was the home of surmise.--What might there not
4907,III,be there? There might be gully-holes where the waters whirled in wide
4908,III,"circles, and then flew smoothly down, and down, and down. If one could"
4909,III,have got in there to see! To crawl along by the slippery edge in the
4910,III,darkness and solitude! It was very hard to get away from this place.
4911,III,
4912,III,A little farther on two goats were tethered. As one passed they would
4913,III,"cease to pluck the grass and begin to dance slowly, such dainty, antic"
4914,III,"steps, with their heads held down and their pale eyes looking upwards"
4915,III,with a joke in them. They did not really want to fight; they wanted to
4916,III,play but were too shy to admit it.
4917,III,
4918,III,And here the schoolhouse was in sight. The bell had stopped: it was
4919,III,now time to run.
4920,III,
4921,III,He gripped the mouth of his satchel with one hand to prevent the lesson
4922,III,"books from jumping out as he ran, he gripped his pocket with the other"
4923,III,hand to prevent his lunch from being jolted into the road.
4924,III,
4925,III,Another few yards and he was at the gate--some one was glaring out
4926,III,through a window. It was a big face rimmed with spectacles and
4927,III,whiskers--a master. He knew that when yonder severe eye had lifted
4928,III,"from him it had dropped to look at a watch, and he also knew exactly"
4929,III,what the owner of the severe eye would say to him as he sidled in.
4930,III,
4931,III,
4932,III,
4933,III,
4934,THE MOON,THE MOON
4935,THE MOON,
4936,THE MOON,If the Moon had a hand
4937,THE MOON,I wonder would she
4938,THE MOON,Stretch it down unto me?
4939,THE MOON,
4940,THE MOON,"If she did, I would go"
4941,THE MOON,"To her glacier land,"
4942,THE MOON,To her ice-covered strand.
4943,THE MOON,
4944,THE MOON,"I would run, I would fly,"
4945,THE MOON,"Were the cold ever so,"
4946,THE MOON,And be warm in the snow.
4947,THE MOON,
4948,THE MOON,"O Moon of all Light,"
4949,THE MOON,"Sailing far, sailing high"
4950,THE MOON,In the infinite sky.
4951,THE MOON,
4952,THE MOON,"Do not come down to me,"
4953,THE MOON,"Lest I shriek in affright,"
4954,THE MOON,Lest I die in the night
4955,THE MOON,Of your chill ecstasy.
4956,THE MOON,
4957,THE MOON,
4958,THE MOON,
4959,THE MOON,
4960,THERE IS A TAVERN IN THE TOWN,THERE IS A TAVERN IN THE TOWN
4961,THERE IS A TAVERN IN THE TOWN,
4962,I,I
4963,I,
4964,I,"The old gentleman entered, and was about to sit down, when a button"
4965,I,became detached from some portion of his raiment and rolled upon the
4966,I,floor. He picked the button up and observed that he would keep it for
4967,I,"his housekeeper to sew on, and, while speaking on the strangeness of"
4968,I,"housekeeping and buttons, he came slowly to the subject of matrimony--"
4969,I,
4970,I,"""Like so many other customs,"" said he, ""marriage is not native to the"
4971,I,"human race, nor is it altogether peculiar to it. So far as I am aware"
4972,I,"no person was ever born married, and in extreme youth bachelors and"
4973,I,"spinsters are so common as to call for no remark. Nature strives, not"
4974,I,for duality as in the case of the Siamese Twins but for individuality.
4975,I,"We are all born strongly separated, and I am often inclined to fancy"
