,Poem Title,line
3628,_CHAPTER THE SEVENTH._,To escape from her questions by no means a few.
3629,_CHAPTER THE SEVENTH._,"But I found each plan vain,"
3630,_CHAPTER THE SEVENTH._,"Till at length I spoke plain,--"
3631,_CHAPTER THE SEVENTH._,"'Then know, I am going a fair bride to obtain.'"
3632,_CHAPTER THE SEVENTH._,"'O the monster! the wretch!' she exclaimed with such fury,"
3633,_CHAPTER THE SEVENTH._,"That I'm sure any justice and impartial jury,"
3634,_CHAPTER THE SEVENTH._,"Had she killed me, would say 'twas manslaughter."
3635,_CHAPTER THE SEVENTH._,"As it was, from the fear she some rash act might do,"
3636,_CHAPTER THE SEVENTH._,"To my heels out of sight like an arrow I flew,"
3637,_CHAPTER THE SEVENTH._,Truly grieved I was thus forced to thwart her.
3638,_CHAPTER THE SEVENTH._,"Still returning, I lingered some moments about,"
3639,_CHAPTER THE SEVENTH._,"To catch hold of some maid, if perchance one came out,"
3640,_CHAPTER THE SEVENTH._,"Who would fetch me my clothes, for I wished to appear"
3641,_CHAPTER THE SEVENTH._,"To the greatest advantage, when coming up here;"
3642,_CHAPTER THE SEVENTH._,"But just as I had made up my mind to depart,"
3643,_CHAPTER THE SEVENTH._,"She stepp'd forth, and I scarcely had time back to start,"
3644,_CHAPTER THE SEVENTH._,Ere she drew near the spot where I stood;
3645,_CHAPTER THE SEVENTH._,"And, overwhelmed by despair, on the bank's mossy side"
3646,_CHAPTER THE SEVENTH._,"She flung herself down, and most piteously cried."
3647,_CHAPTER THE SEVENTH._,"'Oh, poor dear! 'twill,' I thought, 'do her good.'"
3648,_CHAPTER THE SEVENTH._,"She had buried her face in her hands from my view,"
3649,_CHAPTER THE SEVENTH._,"Yet I saw a tear trickle her long fingers through,--"
3650,_CHAPTER THE SEVENTH._,How I wished I her grief could assuage!
3651,_CHAPTER THE SEVENTH._,"But I feared all the means I the pow'r had to try,"
3652,_CHAPTER THE SEVENTH._,"Which her sorrows could soothe, or her bitter tears dry,"
3653,_CHAPTER THE SEVENTH._,Might p'rhaps also rekindle her rage:
3654,_CHAPTER THE SEVENTH._,"So I kept snug concealed there as still as a mouse,"
3655,_CHAPTER THE SEVENTH._,Till she sobbed out the very last tear;
3656,_CHAPTER THE SEVENTH._,"Then just waited to see her safe into the house,"
3657,_CHAPTER THE SEVENTH._,And made double-quick haste to get here.
3658,_CHAPTER THE SEVENTH._,"So, my friends, you perceive that no blame I can own,"
3659,_CHAPTER THE SEVENTH._,I felt sure the excuse for the fault would atone;
3660,_CHAPTER THE SEVENTH._,"With your leave I will go now and fetch Mr. Peter,"
3661,_CHAPTER THE SEVENTH._,"Cruel Fate has perplexed me, but still I'll defeat her."""
3662,_CHAPTER THE SEVENTH._,
3663,_CHAPTER THE SEVENTH._,"""Stop,"" said Flanagan John, ""little Patrick will go,--"
3664,_CHAPTER THE SEVENTH._,Every turn in the wood he from instinct must know;
3665,_CHAPTER THE SEVENTH._,"And besides, I've been waiting I don't know how long,"
3666,_CHAPTER THE SEVENTH._,"For the treat you just promised--a comical song."""
3667,_CHAPTER THE SEVENTH._,
3668,_CHAPTER THE SEVENTH._,"""Well,"" said Murphy, ""I fear I'm not equal at present,"
3669,_CHAPTER THE SEVENTH._,And a molar he eased with the quill of a pheasant;
3670,_CHAPTER THE SEVENTH._,"""Not quite wound up, I mean, for a comical strain,"
3671,_CHAPTER THE SEVENTH._,Though not long in key doleful I mean to remain.
3672,_CHAPTER THE SEVENTH._,"But if Pat, my young namesake, my son that's to be,"
3673,_CHAPTER THE SEVENTH._,"Will just trouble himself after Peter to see,"
3674,_CHAPTER THE SEVENTH._,"And Maguire will oblige with the part instrumental,"
3675,_CHAPTER THE SEVENTH._,"I will try what I can in a song sentimental."""
3676,_CHAPTER THE SEVENTH._,"""With the greatest of pleasure,"" said Patrick, ""I'm sure,"""
3677,_CHAPTER THE SEVENTH._,As he bolted without hat or cap through the door;
3678,_CHAPTER THE SEVENTH._,"Though he tarried outside till the singing was done,"
3679,_CHAPTER THE SEVENTH._,And then swift as the deer on his errand he run.
3680,_CHAPTER THE SEVENTH._,"But quick, look, he returns,--he is after some spree;"
3681,_CHAPTER THE SEVENTH._,"I can tell by his eyes, they are sparkling with glee:"
3682,_CHAPTER THE SEVENTH._,"See, he enters the house by a window behind,--"
3683,_CHAPTER THE SEVENTH._,"He will play them some trick, we shall presently find."
3684,_CHAPTER THE SEVENTH._,"Per-ling, pling--twang, twang, twang, went the fiddle strings soon,"
3685,_CHAPTER THE SEVENTH._,As Maguire screwed them up to the requisite tune;
3686,_CHAPTER THE SEVENTH._,"Though he scarce knows the song, he with grief must declare;"
3687,_CHAPTER THE SEVENTH._,So that Murphy politely first whistles the air;
3688,_CHAPTER THE SEVENTH._,"And then, after a prelude of Maguire's composing,"
3689,_CHAPTER THE SEVENTH._,To the following words his melodious voice flows in:
3690,_CHAPTER THE SEVENTH._,
3691,_CHAPTER THE SEVENTH._,"""As rambling forth one morning,"
3692,_CHAPTER THE SEVENTH._,"Whilst the birds were sweetly singing,"
3693,_CHAPTER THE SEVENTH._,"I chanced to meet fair Kitty,"
3694,_CHAPTER THE SEVENTH._,Who her milk-pails home was bringing;
3695,_CHAPTER THE SEVENTH._,"She pretended not to see me,"
3696,_CHAPTER THE SEVENTH._,"And was hastening away,"
3697,_CHAPTER THE SEVENTH._,"When I hurried quickly after her,"
3698,_CHAPTER THE SEVENTH._,"And said, ""Sweet maiden, stay--"
3699,_CHAPTER THE SEVENTH._,"For I love you fondly, dearly,"
3700,_CHAPTER THE SEVENTH._,"Most tenderly, sincerely!"
3701,_CHAPTER THE SEVENTH._,"And than a king more happy you can make me if you choose!"""
3702,_CHAPTER THE SEVENTH._,But the maid seemed scarce to hear me;
3703,_CHAPTER THE SEVENTH._,"Oh! she loves me not, I feared me;"
3704,_CHAPTER THE SEVENTH._,For she only shook her little head and said it was no use.
3705,_CHAPTER THE SEVENTH._,"""Oh thou fairest, brightest, flower,"
3706,_CHAPTER THE SEVENTH._,That e'er bloomed in beauty's bower!
3707,_CHAPTER THE SEVENTH._,Than the nightingale's sweet melody I much prefer your voice;
3708,_CHAPTER THE SEVENTH._,"Then, dear maid, be not thus cruel,"
3709,_CHAPTER THE SEVENTH._,"I can bear neglect from you, ill."
3710,_CHAPTER THE SEVENTH._,"As I've banished all your rivals to allow you the first choice."""
3711,_CHAPTER THE SEVENTH._,"""Oh, you men do so deceive, sir,"
3712,_CHAPTER THE SEVENTH._,"That your vows I'll not believe, sir,"
3713,_CHAPTER THE SEVENTH._,"For you tell each girl she's pretty, that you roaming chance to meet;"
3714,_CHAPTER THE SEVENTH._,"Then, besides, some other fellow"
3715,_CHAPTER THE SEVENTH._,"P'rhaps may love me quite as well oh,"
3716,_CHAPTER THE SEVENTH._,"Who has vowed to be my slave through life, and thrown him at my feet."""
3717,_CHAPTER THE SEVENTH._,"""I will challenge ev'ry other,"
3718,_CHAPTER THE SEVENTH._,"Who presumes to be your lover,"
3719,_CHAPTER THE SEVENTH._,"Though I kill a man each morning, not a minikin care I;"
3720,_CHAPTER THE SEVENTH._,"Sure, I'll perforate the river,"
3721,_CHAPTER THE SEVENTH._,"Though the thought it makes me shiver,"
3722,_CHAPTER THE SEVENTH._,"For without you as I cannot live, 'tis pleasant so to die."
3723,_CHAPTER THE SEVENTH._,"For my heart I know you'll break it,"
3724,_CHAPTER THE SEVENTH._,"Though my love you ne'er can shake it,"
3725,_CHAPTER THE SEVENTH._,'Tis more deeply rooted than yon oak that rears its head on high;
3726,_CHAPTER THE SEVENTH._,"Though the stem of hope is shivered,"
3727,_CHAPTER THE SEVENTH._,"And each branch of pleasure withered,"
3728,_CHAPTER THE SEVENTH._,"Yet it clings unto the earth still firm,--so, to my love, will I."""
3729,_CHAPTER THE SEVENTH._,"""Will you promise ne'er to tease me,"
3730,_CHAPTER THE SEVENTH._,"And do all you can to please me,"
3731,_CHAPTER THE SEVENTH._,"If I take you for the better, though I know 'twill be for worse?"
3732,_CHAPTER THE SEVENTH._,Are you sure you love me truly?
3733,_CHAPTER THE SEVENTH._,"Well, I cannot think that you lie,"
3734,_CHAPTER THE SEVENTH._,"But remember 'tis yourself I wed, and not your gilded purse."""
3735,_CHAPTER THE SEVENTH._,
3736,_CHAPTER THE SEVENTH._,"""Bravo! bravo! capital song,"
3737,_CHAPTER THE SEVENTH._,"Very good length, and nothing too long;"
3738,_CHAPTER THE SEVENTH._,"Lots of fine feeling and plenty of sense,"
3739,_CHAPTER THE SEVENTH._,"Comical rather, and of int'rest immense."""
3740,_CHAPTER THE SEVENTH._,
3741,_CHAPTER THE SEVENTH._,It was Flanagan John
3742,_CHAPTER THE SEVENTH._,"Sang this snatch of a song,"
3743,_CHAPTER THE SEVENTH._,Though the tune he was far from correct in;
3744,_CHAPTER THE SEVENTH._,"But he's one that don't care,"
3745,_CHAPTER THE SEVENTH._,And will do and can dare
3746,_CHAPTER THE SEVENTH._,"What he likes, without ever reflecting."
3747,_CHAPTER THE SEVENTH._,"""Let's encore it!--Encore!"""
3748,_CHAPTER THE SEVENTH._,"""No,"" said Murphy, ""no more,"
3749,_CHAPTER THE SEVENTH._,I must really the pleasure decline;
3750,_CHAPTER THE SEVENTH._,"'Tis now some lady's turn,"
3751,_CHAPTER THE SEVENTH._,"They such pretty songs learn,"
3752,_CHAPTER THE SEVENTH._,When their voices to singing incline.
3753,_CHAPTER THE SEVENTH._,"Ask the fairy-like May,"
3754,_CHAPTER THE SEVENTH._,Who with Samuel Delhay
3755,_CHAPTER THE SEVENTH._,In a corner like two birds are caged.
3756,_CHAPTER THE SEVENTH._,"Here, my sweet pretty Miss,"
3757,_CHAPTER THE SEVENTH._,"May I ask for a kiss,"
3758,_CHAPTER THE SEVENTH._,"When those sweet lips are quite disengaged?"""
3759,_CHAPTER THE SEVENTH._,"""Oh, for shame!"""
3760,_CHAPTER THE SEVENTH._,"Said the dame,"
3761,_CHAPTER THE SEVENTH._,"""Dearest Murphy, you really should never"
3762,_CHAPTER THE SEVENTH._,"Say such things,"
3763,_CHAPTER THE SEVENTH._,For it brings
3764,_CHAPTER THE SEVENTH._,A deep tint to the fairest cheek ever.
3765,_CHAPTER THE SEVENTH._,"But I'm sure Miss Maguire will oblige with a song,"
3766,_CHAPTER THE SEVENTH._,"I have heard her fine voice, though some time ago, long;"
3767,_CHAPTER THE SEVENTH._,"When a child she was, under my care."""
3768,_CHAPTER THE SEVENTH._,"""Well,"" said Jerry Maguire,"
3769,_CHAPTER THE SEVENTH._,"""She has at my desire"
3770,_CHAPTER THE SEVENTH._,Set her voice to an enchanting air;
3771,_CHAPTER THE SEVENTH._,"Which with pleasure she'll sing,"
3772,_CHAPTER THE SEVENTH._,"'Tis exactly the thing,"
3773,_CHAPTER THE SEVENTH._,"Will amuse our old friend sitting there."""
3774,_CHAPTER THE SEVENTH._,"""Oh, do sing, dearest May,"""
3775,_CHAPTER THE SEVENTH._,Whispered Samuel Delhay;
3776,_CHAPTER THE SEVENTH._,"""Pray oblige us,"" said every guest;"
3777,_CHAPTER THE SEVENTH._,"""Now then, May, don't be shy,"""
3778,_CHAPTER THE SEVENTH._,"Said her brother, ""when I"
3779,_CHAPTER THE SEVENTH._,"Can assist if you aid should request."""
3780,_CHAPTER THE SEVENTH._,"""And,"" said Murphy, ""I, too,"
3781,_CHAPTER THE SEVENTH._,"Will be sure to clap you,"
3782,_CHAPTER THE SEVENTH._,"If you will but oblige with your best."""
3783,_CHAPTER THE SEVENTH._,"""I will try my best style,"""
3784,_CHAPTER THE SEVENTH._,She replied with a smile;
3785,_CHAPTER THE SEVENTH._,"""If you'll promise you'll not be offended."
3786,_CHAPTER THE SEVENTH._,"Nor will go so far wrong,"
3787,_CHAPTER THE SEVENTH._,As to think that my song
3788,_CHAPTER THE SEVENTH._,"As a close to your tale is intended."""
3789,_CHAPTER THE SEVENTH._,"""Dear, what can the girl mean?"
3790,_CHAPTER THE SEVENTH._,"'Twill be presently seen,"""
3791,_CHAPTER THE SEVENTH._,Muttered he as the promise he gave.
3792,_CHAPTER THE SEVENTH._,"Then her voice mounted high,"
3793,_CHAPTER THE SEVENTH._,"As a lark in the sky,"
3794,_CHAPTER THE SEVENTH._,As she warbled each beautiful stave.
3795,_CHAPTER THE SEVENTH._,"Ev'ry ear it arrests, ev'ry whisper soon dropt,"
3796,_CHAPTER THE SEVENTH._,Even breathing that moment appeared to be stopt.
3797,_CHAPTER THE SEVENTH._,"While each bosom seem'd touched by the soft, thrilling strain,"
3798,_CHAPTER THE SEVENTH._,And few eyes quite unwashed to the end could remain.
3799,_CHAPTER THE SEVENTH._,The good dame as she hears
3800,_CHAPTER THE SEVENTH._,Gently melts into tears
3801,_CHAPTER THE SEVENTH._,As she thinks of disconsolate Joan.
3802,_CHAPTER THE SEVENTH._,"Who, heart-broken and sad,"
3803,_CHAPTER THE SEVENTH._,"Or from grief nearly mad,"
3804,_CHAPTER THE SEVENTH._,Is bewailing her hard fate alone.
3805,_CHAPTER THE SEVENTH._,"The words simply are these,"
3806,_CHAPTER THE SEVENTH._,Which fair May sang to tease
3807,_CHAPTER THE SEVENTH._,"Mr. Murphy, though it she'll not own."
3808,_CHAPTER THE SEVENTH._,
3809,_CHAPTER THE SEVENTH._,"""Oh, my beautiful flow'ret has faded,"
3810,_CHAPTER THE SEVENTH._,Is drooping its once joyous head;
3811,_CHAPTER THE SEVENTH._,For the bee with its sweetness has laded
3812,_CHAPTER THE SEVENTH._,His wings and away with it fled.
3813,_CHAPTER THE SEVENTH._,
3814,_CHAPTER THE SEVENTH._,"And the fierce, cruel wind, it hath broken"
3815,_CHAPTER THE SEVENTH._,The stem which the bright blossom fed;
3816,_CHAPTER THE SEVENTH._,While the leaves by their sad looks have spoken
3817,_CHAPTER THE SEVENTH._,Their grief for the kind parent dead.
3818,_CHAPTER THE SEVENTH._,
3819,_CHAPTER THE SEVENTH._,"So my heart's fondest hope has been slighted,"
3820,_CHAPTER THE SEVENTH._,Ev'ry joy has been stolen from me.
3821,_CHAPTER THE SEVENTH._,"I am drooping, am with'ring, am blighted;"
3822,_CHAPTER THE SEVENTH._,But the wreck of life shattered you see.
3823,_CHAPTER THE SEVENTH._,
3824,_CHAPTER THE SEVENTH._,Never more shall the sun by its brightness
3825,_CHAPTER THE SEVENTH._,Illumine my dark gloomy fate;
3826,_CHAPTER THE SEVENTH._,"Nor can peace to my spirit bring lightness,"
3827,_CHAPTER THE SEVENTH._,"For he comes to this bosom too late."""
3828,_CHAPTER THE SEVENTH._,
3829,_CHAPTER THE SEVENTH._,Now to scatter the gloom
3830,_CHAPTER THE SEVENTH._,"Which pervaded the room,"
3831,_CHAPTER THE SEVENTH._,Murphy piles all the chairs into heaps.
3832,_CHAPTER THE SEVENTH._,Flings his arm round the dame
3833,_CHAPTER THE SEVENTH._,"(Declares he's not to blame),"
3834,_CHAPTER THE SEVENTH._,And with her to the room's centre creeps.
3835,_CHAPTER THE SEVENTH._,While Maguire struck up soon
3836,_CHAPTER THE SEVENTH._,"Such a capital tune,"
3837,_CHAPTER THE SEVENTH._,That like magic each youth forward leaps
3838,_CHAPTER THE SEVENTH._,"To the side of some fair,"
3839,_CHAPTER THE SEVENTH._,"Who, with pleasure, steps where"
3840,_CHAPTER THE SEVENTH._,She in dancing can best show her feats.
3841,_CHAPTER THE SEVENTH._,"In and out,"
3842,_CHAPTER THE SEVENTH._,"Round about,"
3843,_CHAPTER THE SEVENTH._,It appears quite a riddle.
3844,_CHAPTER THE SEVENTH._,"Hands across,"
3845,_CHAPTER THE SEVENTH._,"Turn of course,"
3846,_CHAPTER THE SEVENTH._,And then rush down the middle.
3847,_CHAPTER THE SEVENTH._,"Back again,"
3848,_CHAPTER THE SEVENTH._,Pleasant pain!
3849,_CHAPTER THE SEVENTH._,Sure he'll wear out his fiddle.
3850,_CHAPTER THE SEVENTH._,"""Quicker play!"""
3851,_CHAPTER THE SEVENTH._,"""Scrape away!"""
3852,_CHAPTER THE SEVENTH._,Cries each pair as they pass by;
3853,_CHAPTER THE SEVENTH._,As whirling
3854,_CHAPTER THE SEVENTH._,And twirling
3855,_CHAPTER THE SEVENTH._,They still swifter and fast fly;
3856,_CHAPTER THE SEVENTH._,"And in spite,"
3857,_CHAPTER THE SEVENTH._,"Though fagged quite,"
3858,_CHAPTER THE SEVENTH._,Who can keep up the last try.
3859,_CHAPTER THE SEVENTH._,Till whizzy
3860,_CHAPTER THE SEVENTH._,And dizzy
3861,_CHAPTER THE SEVENTH._,They sink into a seat;
3862,_CHAPTER THE SEVENTH._,If they aint
3863,_CHAPTER THE SEVENTH._,Fit to faint
3864,_CHAPTER THE SEVENTH._,In a terrible heat.
3865,_CHAPTER THE SEVENTH._,"When to cool,"
3866,_CHAPTER THE SEVENTH._,"As by rule,"
3867,_CHAPTER THE SEVENTH._,To some draught they retreat.
3868,_CHAPTER THE SEVENTH._,Where the fair one imbibes such a delicate chill
3869,_CHAPTER THE SEVENTH._,That her frame is refreshed; but ere morning she will
3870,_CHAPTER THE SEVENTH._,Find the thoroughfare stopped in her organ of smell;
3871,_CHAPTER THE SEVENTH._,With a rising blockade in the thorax as well.
3872,_CHAPTER THE SEVENTH._,"While her forehead of snow into pieces seems splitting,"
3873,_CHAPTER THE SEVENTH._,As the pain ev'ry moment is worse and worse getting.
3874,_CHAPTER THE SEVENTH._,And her bright eyes are streaming regret for the folly
3875,_CHAPTER THE SEVENTH._,Which has garnished her lungs with a feeling like holly;
3876,_CHAPTER THE SEVENTH._,"And has changed her sweet voice, as a matter of course,"
3877,_CHAPTER THE SEVENTH._,From the nightingale's tone to sound dreadfully hoarse.
3878,_CHAPTER THE SEVENTH._,
3879,_CHAPTER THE SEVENTH._,"""Oh, how funny it seems to one not fond of dancing,"
3880,_CHAPTER THE SEVENTH._,To see women and men just like animals prancing!
3881,_CHAPTER THE SEVENTH._,"Roaming forwards and back like two bears in a cage,"
3882,_CHAPTER THE SEVENTH._,And then galloping round as if put in a rage.
3883,_CHAPTER THE SEVENTH._,"Working harder--I'll bet ten young pigs to a sow,"
3884,_CHAPTER THE SEVENTH._,"Than they've been all day long at the tail of the plough."""
3885,_CHAPTER THE SEVENTH._,"""Stop!"" I fancy I hear some fair maiden exclaim,"
3886,_CHAPTER THE SEVENTH._,In a tone full of ire strongly mixed with disdain.
3887,_CHAPTER THE SEVENTH._,"""'Tis some horrid old man has been writing this tale,"
3888,_CHAPTER THE SEVENTH._,"Who will make his remarks, though so stupid and stale."""
3889,_CHAPTER THE SEVENTH._,"Now, kind reader, of this I must beg to assure you,"
3890,_CHAPTER THE SEVENTH._,That 'twas Flanagan muttered those words placed before you.
3891,_CHAPTER THE SEVENTH._,
3892,_CHAPTER THE SEVENTH._,"Rat-a-tat! ""Who is that?"" Murphy cried; ""pray come in."""
3893,_CHAPTER THE SEVENTH._,And a priest walked inside who had listening been.
3894,_CHAPTER THE SEVENTH._,How the widow's heart beat as he stept up to greet her!
3895,_CHAPTER THE SEVENTH._,"He was very much like, still he was not old Peter."
3896,_CHAPTER THE SEVENTH._,"""Sure I'm in for it now,"" Murphy inwardly thought;"
3897,_CHAPTER THE SEVENTH._,"""I would fly, but must own I've been quite fairly caught."
3898,_CHAPTER THE SEVENTH._,"No I aint!--'tis but Pat, though in clever disguise;"
3899,_CHAPTER THE SEVENTH._,"He may cheat his old Mother's, but not these young eyes."
3900,_CHAPTER THE SEVENTH._,But I'll not spoil the fun; I'm reprieved by his aid.
3901,_CHAPTER THE SEVENTH._,"Ah! his voice, as I feared, has the secret betrayed;"
3902,_CHAPTER THE SEVENTH._,And the good little dame appears quite in a pet.
3903,_CHAPTER THE SEVENTH._,P'rhaps she'll wait longer still for a young bridegroom yet!
3904,_CHAPTER THE SEVENTH._,"For I rather repent having scouted poor Joan,"
3905,_CHAPTER THE SEVENTH._,"She is prettier far, though I don't like her home."
3906,_CHAPTER THE SEVENTH._,"Still a second-hand wife, and four babes ready made,"
3907,_CHAPTER THE SEVENTH._,Must be popped in the scale and against that be weighed.
3908,_CHAPTER THE SEVENTH._,"""Now, Murphy,"" cried Flanagan, ""your comical song!"
3909,_CHAPTER THE SEVENTH._,"Why, you look black as if all on earth had gone wrong!"
3910,_CHAPTER THE SEVENTH._,"Come, I'll bet what you like I can guess what you thought"
3911,_CHAPTER THE SEVENTH._,"(If you did take the trouble to meditate aught),"
3912,_CHAPTER THE SEVENTH._,"'Tis a bother, I own, and you well may look blue"
3913,_CHAPTER THE SEVENTH._,(Still you're quite green enough if your friends all speak true).
3914,_CHAPTER THE SEVENTH._,"Oh, I fear you are out both of temper and tune,"
3915,_CHAPTER THE SEVENTH._,"But I'll give you a song which shall banish care soon."""
3916,_CHAPTER THE SEVENTH._,"Then he whetted his whistle, and clearing his voice,"
3917,_CHAPTER THE SEVENTH._,In a very gruff tone sang this ditty so choice:--
3918,_CHAPTER THE SEVENTH._,
3919,_CHAPTER THE SEVENTH._,"""Oh, those that like, let them be sad,"
3920,_CHAPTER THE SEVENTH._,For my part I'll be merry.
3921,_CHAPTER THE SEVENTH._,"A life like theirs would drive me mad,"
3922,_CHAPTER THE SEVENTH._,"So I'll be jolly, very."
3923,_CHAPTER THE SEVENTH._,
3924,_CHAPTER THE SEVENTH._,"If Cupid should catch hold of me,"
3925,_CHAPTER THE SEVENTH._,"And from my love me sever,"
3926,_CHAPTER THE SEVENTH._,"And into woe would turn my glee,"
3927,_CHAPTER THE SEVENTH._,"Shall he succeed?--no, never!"
3928,_CHAPTER THE SEVENTH._,
3929,_CHAPTER THE SEVENTH._,"If valued friends prove false, unkind,"
3930,_CHAPTER THE SEVENTH._,When any scrape I get in;
3931,_CHAPTER THE SEVENTH._,"I'll drive their memory from my mind,"
3932,_CHAPTER THE SEVENTH._,And thus no sorrow let in.
3933,_CHAPTER THE SEVENTH._,
3934,_CHAPTER THE SEVENTH._,"If Miss Fortune should use me ill,"
3935,_CHAPTER THE SEVENTH._,"And steal my only penny,"
3936,_CHAPTER THE SEVENTH._,"Contentedly I'll jog on still,"
3937,_CHAPTER THE SEVENTH._,As happy without any.
3938,_CHAPTER THE SEVENTH._,
3939,_CHAPTER THE SEVENTH._,"Though Landladies may bore for rent,"
3940,_CHAPTER THE SEVENTH._,And duns may loudly bellow;
3941,_CHAPTER THE SEVENTH._,"I'll tell them, though my money's spent,"
3942,_CHAPTER THE SEVENTH._,I'm still a jolly fellow.
3943,_CHAPTER THE SEVENTH._,
3944,_CHAPTER THE SEVENTH._,For love in sparkling wine I'll drown
3945,_CHAPTER THE SEVENTH._,All care and melancholy;
3946,_CHAPTER THE SEVENTH._,They are but fools who sigh and frown;
3947,_CHAPTER THE SEVENTH._,"For my part I'll be jolly."""
3948,_CHAPTER THE SEVENTH._,
3949,_CHAPTER THE SEVENTH._,[Illustration: Then again the wild dance]
3950,_CHAPTER THE SEVENTH._,
3951,_CHAPTER THE SEVENTH._,Then again the wild dance
3952,_CHAPTER THE SEVENTH._,"Does each young toe entrance,"
3953,_CHAPTER THE SEVENTH._,And p'rhaps many an old one beside.
3954,_CHAPTER THE SEVENTH._,There's antique Miss O'Riley
3955,_CHAPTER THE SEVENTH._,Has coaxed Donoghue slily
3956,_CHAPTER THE SEVENTH._,"Just to waltz, which he ne'er before tried."
3957,_CHAPTER THE SEVENTH._,"For she chatted so pretty,"
3958,_CHAPTER THE SEVENTH._,"And talked, oh, so witty,"
3959,_CHAPTER THE SEVENTH._,That he guessed at her age rather wide.
3960,_CHAPTER THE SEVENTH._,But the maiden soon found
3961,_CHAPTER THE SEVENTH._,"She must drag him right round,"
3962,_CHAPTER THE SEVENTH._,For he could not his steps at all guide.
3963,_CHAPTER THE SEVENTH._,"While his arms stuck out still,"
3964,_CHAPTER THE SEVENTH._,Like the sails of a mill--
3965,_CHAPTER THE SEVENTH._,How young Flanagan laughed till he cried!
3966,_CHAPTER THE SEVENTH._,"And called out, ""Take care, Tom, what sweet words you are saying;"
3967,_CHAPTER THE SEVENTH._,"For the breach of a promise you'll not like the paying."""
3968,_CHAPTER THE SEVENTH._,"""What are breaches of promise?"" said Donoghue laughing,"
3969,_CHAPTER THE SEVENTH._,Who was not so well versed as his friend was in chaffing.
3970,_CHAPTER THE SEVENTH._,"""Oh,"" said Flanagan Ted, who was comical rather,"
3971,_CHAPTER THE SEVENTH._,"""They are breeches you'll get when worn out by your father."""
3972,_CHAPTER THE SEVENTH._,"""Oh, look, Mother!"" cried Pat; ""all the wood seems on fire;"
3973,_CHAPTER THE SEVENTH._,"It was first but a spark, but it now rises higher."
3974,_CHAPTER THE SEVENTH._,"We shall surely get burnt, for 'tis coming this way:"
3975,_CHAPTER THE SEVENTH._,"What a flare-up to finish a grand bridal day!"""
3976,_CHAPTER THE SEVENTH._,But the dame felt depressed
3977,_CHAPTER THE SEVENTH._,"In her feelings, and guessed"
3978,_CHAPTER THE SEVENTH._,He was only a-joking again.
3979,_CHAPTER THE SEVENTH._,"So that no heed she took,"
3980,_CHAPTER THE SEVENTH._,"No, not even a look,"
3981,_CHAPTER THE SEVENTH._,Although calling he still would remain.
3982,_CHAPTER THE SEVENTH._,"Like the boy that we read of in old sop's fable,"
3983,_CHAPTER THE SEVENTH._,He has jested till none to believe him are able.
3984,_CHAPTER THE SEVENTH._,"""Come, niece, give us some punch,"
3985,_CHAPTER THE SEVENTH._,"And of cake a slight hunch,"
3986,_CHAPTER THE SEVENTH._,"May it taste as it looks, so uncommonly nice,"
3987,_CHAPTER THE SEVENTH._,"That I've wished for some long,"
3988,_CHAPTER THE SEVENTH._,"But I feared 'twould be wrong,"
3989,_CHAPTER THE SEVENTH._,And might p'rhaps be thought greedy to ask for a slice.
3990,_CHAPTER THE SEVENTH._,"All the dancers, 'tis clear,"
3991,_CHAPTER THE SEVENTH._,"Very hungry appear,"
3992,_CHAPTER THE SEVENTH._,And would much be refreshed by that snow-looking ice;
3993,_CHAPTER THE SEVENTH._,While some hot whisky will
3994,_CHAPTER THE SEVENTH._,Perhaps warm up the chill
3995,_CHAPTER THE SEVENTH._,"They imbibed at the draught by not taking advice."""
3996,_CHAPTER THE SEVENTH._,"'Twas old Jonas thus spoke,"
3997,_CHAPTER THE SEVENTH._,"Half in earnest, half joke,"
3998,_CHAPTER THE SEVENTH._,The good dame from her rev'rie to rouse.
3999,_CHAPTER THE SEVENTH._,"But the lady felt sad,"
4000,_CHAPTER THE SEVENTH._,And thought just cause she had
4001,_CHAPTER THE SEVENTH._,For the grief which her spirit allows.
4002,_CHAPTER THE SEVENTH._,
4003,_CHAPTER THE SEVENTH._,"Still the punch she prepared,"
4004,_CHAPTER THE SEVENTH._,Though she sharply declared
4005,_CHAPTER THE SEVENTH._,She had rather not cut up the cake;
4006,_CHAPTER THE SEVENTH._,For the event it should grace
4007,_CHAPTER THE SEVENTH._,"Had not yet taken place,"
4008,_CHAPTER THE SEVENTH._,And much trouble it took her to make.
4009,_CHAPTER THE SEVENTH._,
4010,_CHAPTER THE SEVENTH._,"""Hark! what voices are those?"""
4011,_CHAPTER THE SEVENTH._,"Murphy cried, as he rose"
4012,_CHAPTER THE SEVENTH._,And went to look out at the door.
4013,_CHAPTER THE SEVENTH._,"But soon entered again,"
4014,_CHAPTER THE SEVENTH._,And admitted a train
4015,_CHAPTER THE SEVENTH._,"Of monks, about twenty or more."
4016,_CHAPTER THE SEVENTH._,"All in darkness arrayed,"
4017,_CHAPTER THE SEVENTH._,"With their heads in a shade,"
4018,_CHAPTER THE SEVENTH._,Although each one a flaming torch bore.
