,Poem Title,Stanza
530,PERHAPS,"The forest muttered, as it would say, "
531,PERHAPS,"Neither tomorrow, nor any day."" "
532,BELLUM AMORIS,BELLUM AMORIS 
533,BELLUM AMORIS,"Oh, the romance of it, "
534,BELLUM AMORIS,"Soul-thrilling trance of it, "
535,BELLUM AMORIS,Though lives are lost which no love can restore! 
536,BELLUM AMORIS,"Hearts ride a-prance at it, "
537,BELLUM AMORIS,Taking their chance at it-- 
538,BELLUM AMORIS,Wing-thriven hearts to the seat of Love's War. 
539,BELLUM AMORIS,Sorrow is theirs in store; 
540,BELLUM AMORIS,"This they know well before, "
541,BELLUM AMORIS,Yet do they ride from the West and the East 
542,BELLUM AMORIS,"Hoping for this at least, "
543,BELLUM AMORIS,"Out from the West and East, "
544,BELLUM AMORIS,Glory with death at the end of the war. 
545,BELLUM AMORIS,"Should they return again, "
546,BELLUM AMORIS,"Life sings the old refrain, "
547,BELLUM AMORIS,"Mystery, madness and mirth at the core: "
548,BELLUM AMORIS,"Patter of falling rain, "
549,BELLUM AMORIS,"Dawnings which wax and wane, "
550,BELLUM AMORIS,Life which is war at the end of Love's War. 
551,BELLUM AMORIS,"Thunders have ceased to roar, "
552,BELLUM AMORIS,Terrors they knew before 
553,BELLUM AMORIS,When they rode out from the East and the West. 
554,BELLUM AMORIS,"Though passions will not rest, "
555,BELLUM AMORIS,"Love, which is always best, "
556,BELLUM AMORIS,Honours brave lips at the end of the war. 
557,QUEEN MARY OF HEAVEN,QUEEN MARY OF HEAVEN 
558,QUEEN MARY OF HEAVEN,"She sits in God's garden, "
559,QUEEN MARY OF HEAVEN,"Queen Mary of Heaven, "
560,QUEEN MARY OF HEAVEN,Where birds sing their steven 
561,QUEEN MARY OF HEAVEN,Hid in the cool tree; 
562,QUEEN MARY OF HEAVEN,"And all the gold day-time, "
563,QUEEN MARY OF HEAVEN,"From morning till even, "
564,QUEEN MARY OF HEAVEN,Earth's little strange children 
565,QUEEN MARY OF HEAVEN,Play round her knee. 
566,QUEEN MARY OF HEAVEN,Earth's lost little children 
567,QUEEN MARY OF HEAVEN,"She binds to her bosom, "
568,QUEEN MARY OF HEAVEN,"Each wind-gathered blossom, "
569,QUEEN MARY OF HEAVEN,Till mothers are free 
570,QUEEN MARY OF HEAVEN,To steal to God's Garden 
571,QUEEN MARY OF HEAVEN,And name them and loose them-- 
572,QUEEN MARY OF HEAVEN,"In Eden's green garden, "
573,QUEEN MARY OF HEAVEN,'Neath Mary's tree. 
574,A BRAVE LIFE,A BRAVE LIFE 
575,A BRAVE LIFE,"The arid loneliness of life he knew, "
576,A BRAVE LIFE,"The doubtful darkness of the starless night, "
577,A BRAVE LIFE,And fear lest he should never see the sight 
578,A BRAVE LIFE,Of dawn and God the Father breaking through. 
579,A BRAVE LIFE,Brave offspring of a disenchanted age 
580,A BRAVE LIFE,He lived as though illusion were not dead; 
581,A BRAVE LIFE,His was the pain of faiths discredited 
582,A BRAVE LIFE,Which with new knowledge civil battles wage. 
583,A BRAVE LIFE,In all his deeds for righteous quests he stood 
584,A BRAVE LIFE,"And we, who watched his face and heard his voice, "
585,A BRAVE LIFE,"Dreamed of the Christ; we had not any choice, "
586,A BRAVE LIFE,In loving him we knew that God was good-- 
587,A BRAVE LIFE,"We knew. And thus, beneath the hooded sky, "
588,A BRAVE LIFE,Lightly we followed where his pain had made 
589,A BRAVE LIFE,"A path for us; if one should fall, he stayed "
590,A BRAVE LIFE,"To raise him, lest his frailer hope should die. "
591,A BRAVE LIFE,Ofttimes when summer's day had ceased to shine 
592,A BRAVE LIFE,"And on our London roofs the moon looked down, "
593,A BRAVE LIFE,We two would wander through the gas-lit town 
594,A BRAVE LIFE,Speaking in whispers of the things divine; 
595,A BRAVE LIFE,"Or in love's stillness, high above the strife, "
596,A BRAVE LIFE,"We found our spirits strangely catching fire, "
597,A BRAVE LIFE,"And told of that ""_ unspeakable desire "
598,A BRAVE LIFE,"After the knowledge of the buried life._"" "
599,A BRAVE LIFE,He knows its secret now; the morning mist 
600,A BRAVE LIFE,Drifts up the road where his last footprint lies; 
601,A BRAVE LIFE,"And I, as ever when a Christ-man dies, "
602,A BRAVE LIFE,"Stand awe-struck, asking, ""Was not this the "
603,A BRAVE LIFE,"Christ?"" "
604,A BRAVE LIFE,His soul craved God. I think we always knew 
605,A BRAVE LIFE,He would be with us but a little while. 
606,A BRAVE LIFE,Night vanished; dawn broke--when he saw God 
607,A BRAVE LIFE,smile 
608,A BRAVE LIFE,Back like a homing-bird to God he flew. 
609,THE MOON-MOTHER,THE MOON-MOTHER 
610,THE MOON-MOTHER,The world is a child who roams all day 
611,THE MOON-MOTHER,Through windswept meadows of gold and gray. 
612,THE MOON-MOTHER,"The gold flowers fade; he foils to sleep, "
613,THE MOON-MOTHER,And night is his cradle wide and deep. 
614,THE MOON-MOTHER,The moon-mother creeps from behind God's throne 
615,THE MOON-MOTHER,And steals up the skies to protect her own. 
616,THE MOON-MOTHER,She leans her breast 'gainst his cradle-rim 
617,THE MOON-MOTHER,While her small star-children gaze down on him. 
618,THE MOON-MOTHER,Stars are his brothers; clouds his dreams; 
619,THE MOON-MOTHER,His mother's arms are the pale moon-beams. 
620,THE MOON-MOTHER,"When meadows again grow gold and gray, "
621,THE MOON-MOTHER,He wakes from sleep and runs forth to play. 
622,THE MOON-MOTHER,But every night from behind God's throne 
623,THE MOON-MOTHER,The moon-mother steals to protect her own. 
624,TO A YOUNG GIRL WHO SAID SHE WAS NOT BEAUTIFUL,TO A YOUNG GIRL WHO SAID SHE WAS NOT BEAUTIFUL 
625,TO A YOUNG GIRL WHO SAID SHE WAS NOT BEAUTIFUL,"It's not her hair and it's not her feet, "
626,TO A YOUNG GIRL WHO SAID SHE WAS NOT BEAUTIFUL,Nor the way she walks with her head held high; 
627,TO A YOUNG GIRL WHO SAID SHE WAS NOT BEAUTIFUL,It's not because her eye-brows meet 
628,TO A YOUNG GIRL WHO SAID SHE WAS NOT BEAUTIFUL,Like a bird's wings over a glimpse of sky; 
629,TO A YOUNG GIRL WHO SAID SHE WAS NOT BEAUTIFUL,And it isn't her voice like April bloom 
630,TO A YOUNG GIRL WHO SAID SHE WAS NOT BEAUTIFUL,Rustling through an orchard's gloom-- 
631,TO A YOUNG GIRL WHO SAID SHE WAS NOT BEAUTIFUL,"It's none of these; not her wide gray eye, "
632,TO A YOUNG GIRL WHO SAID SHE WAS NOT BEAUTIFUL,Nor her crumpled mouth like a rose-bud red 
633,TO A YOUNG GIRL WHO SAID SHE WAS NOT BEAUTIFUL,Round which the snows of the jasmine spread. 
634,TO A YOUNG GIRL WHO SAID SHE WAS NOT BEAUTIFUL,Though her long white hands 
635,TO A YOUNG GIRL WHO SAID SHE WAS NOT BEAUTIFUL,"Are like lilies of Lent, "
636,TO A YOUNG GIRL WHO SAID SHE WAS NOT BEAUTIFUL,Palely young and purely bent 
637,TO A YOUNG GIRL WHO SAID SHE WAS NOT BEAUTIFUL,"O'er her breast, where God stands, "
638,TO A YOUNG GIRL WHO SAID SHE WAS NOT BEAUTIFUL,It's none of these. 
639,TO A YOUNG GIRL WHO SAID SHE WAS NOT BEAUTIFUL,Flowers and trees 
640,TO A YOUNG GIRL WHO SAID SHE WAS NOT BEAUTIFUL,With her to compare 
641,TO A YOUNG GIRL WHO SAID SHE WAS NOT BEAUTIFUL,Are too little rare. 
642,TO A YOUNG GIRL WHO SAID SHE WAS NOT BEAUTIFUL,"Though the grass yearns up to touch her feet, "
643,TO A YOUNG GIRL WHO SAID SHE WAS NOT BEAUTIFUL,"She is loved for this--she is sweet, sweet, sweet. "
644,HALLOWE'EN,HALLOWE'EN 
645,HALLOWE'EN,"_Hark to the patter of the rain, "
646,HALLOWE'EN,Voices of dead things come again: 
647,HALLOWE'EN,"Feet that rustle the lush wet grass, "
648,HALLOWE'EN,"Lips that mutter, ""Alas! Alas!"" "
649,HALLOWE'EN,And shadows that grope o'er my window-pane._ 
650,HALLOWE'EN,"Poor outcast souls, you saw my light "
651,HALLOWE'EN,"And thought that I, on such a night, "
652,HALLOWE'EN,Would pity take and bid you in 
653,HALLOWE'EN,"To warm your hands, so palely thin, "
654,HALLOWE'EN,Before my fire which blazeth bright. 
655,HALLOWE'EN,You come from hells of ice-cold clay 
656,HALLOWE'EN,"So pent that, striving every way, "
657,HALLOWE'EN,You may not stir the coffin-lid; 
658,HALLOWE'EN,"And well you know that, if you did, "
659,HALLOWE'EN,Darkness would come and not the day. 
660,HALLOWE'EN,Darkness! With you 'tis ever dark; 
661,HALLOWE'EN,No joy of skyward-mounting lark 
662,HALLOWE'EN,Or blue of swallow on the wing 
663,HALLOWE'EN,Can penetrate and comfort bring 
664,HALLOWE'EN,"You, where you lie all cramp'd and stark. "
665,HALLOWE'EN,"Deep sunk beneath the secret mould, "
666,HALLOWE'EN,You hear the worm his length unfold 
667,HALLOWE'EN,"And slime across your frail roof-plank, "
668,HALLOWE'EN,"And tap, and vanish, like the rank "
669,HALLOWE'EN,Foul memory of a sin untold. 
670,HALLOWE'EN,And this your penance in the tomb: 
671,HALLOWE'EN,To weave upon the mind's swift loom 
672,HALLOWE'EN,"White robes, to garb remorsefully "
673,HALLOWE'EN,A _Better Life_--which may not be 
674,HALLOWE'EN,"Or, when it comes, may seal your doom. "
675,HALLOWE'EN,"Thus, side by side, through all the year, "
676,HALLOWE'EN,"Yet just apart, you wake and hear, "
677,HALLOWE'EN,"As men on land the ocean's strum, "
678,HALLOWE'EN,Your Dead World's hushed delirium 
679,HALLOWE'EN,"Which, sounding distant, yet is near. "
680,HALLOWE'EN,"So near that, could he lean aside, "
681,HALLOWE'EN,The bridegroom well might touch his bride 
682,HALLOWE'EN,"And reach her flesh, which once was fair, "
683,HALLOWE'EN,"And, slow across the pale lips where "
684,HALLOWE'EN,"He kissed her, feel his fingers glide. "
685,HALLOWE'EN,"So distant, that he can but weep "
686,HALLOWE'EN,Whene'er she moans his name in sleep: 
687,HALLOWE'EN,"A cold-grown star, with light all spent, "
688,HALLOWE'EN,She gropes the abyssmal firmament. 
689,HALLOWE'EN,He hears her surging in the Deep. 
690,HALLOWE'EN,Ever throughout the year 'tis thus 
691,HALLOWE'EN,Till drones the dream-toned Angelus 
692,HALLOWE'EN,"Of Hallowe'en; then, underground, "
693,HALLOWE'EN,Unto dead ears its voice doth sound 
694,HALLOWE'EN,"Like Christ's voice, crying, ""_Lazarus_."" "
695,HALLOWE'EN,Palsied with haste the dead men rise 
696,HALLOWE'EN,"Groaning, because their unused eyes "
697,HALLOWE'EN,Can scarce endure Earth's blackest night; 
698,HALLOWE'EN,It wounds them as 'twere furious light 
699,HALLOWE'EN,And stars were flame-clouds in the skies. 
700,HALLOWE'EN,What tenderness and sad amaze 
701,HALLOWE'EN,Must grieve lost spirits when they gaze 
702,HALLOWE'EN,"Beneath a withered moon, and view "
703,HALLOWE'EN,The ancient happiness they knew-- 
704,HALLOWE'EN,"The live, sweet world and all its ways! "
705,HALLOWE'EN,"Ho, Deadmen! for a night you're free "
706,HALLOWE'EN,Till Dawn leads back Captivity. 
707,HALLOWE'EN,To make your respite seem more dear 
708,HALLOWE'EN,Mutter throughout your joy this fear: 
709,HALLOWE'EN,"""Who knows, within the coming year, "
710,HALLOWE'EN,"That God, our gaoler, may not die; "
711,HALLOWE'EN,"Then, who'll remember where we lief "
712,HALLOWE'EN,Who then will come to set us free f 
713,HALLOWE'EN,Through all the ages this may be 
714,HALLOWE'EN,"Our final night of liberty."" "
715,HALLOWE'EN,"Aye, hoard your moments miserly. "
716,HALLOWE'EN,"And yet .... and yet, it is His rain "
717,HALLOWE'EN,That drives against my window-pane. 
718,HALLOWE'EN,"Oh, surely all Earth's dead have rest "
719,HALLOWE'EN,"And stretch at peace in God's own breast, "
720,HALLOWE'EN,And never can return again! 
721,HALLOWE'EN,And yet . . . . 
722,UNSEEN,UNSEEN 
723,UNSEEN,"Oh mother, why are you weeping "
724,UNSEEN,When aLl the world's asleeping? 
725,UNSEEN,"Rest ye, rest ye, mother, "
726,UNSEEN,"I am near, dear, near. "
727,UNSEEN,Not beneath the moon-drenched grass 
728,UNSEEN,Do I turn to hear you pass-- 
729,UNSEEN,"You would see me walk beside you, if your eyes "
730,UNSEEN,saw dear. 
731,UNSEEN,"Oh mother, why are you crying? "
732,UNSEEN,There was no loss in dying. 
733,UNSEEN,"Rest ye, rest ye, mother, "
734,UNSEEN,"Have no fear, no fear. "
735,UNSEEN,"Still long hangs my golden hair, "
736,UNSEEN,But the body that I wear 
737,UNSEEN,"Treads more kindly and more lightly, could you "
738,UNSEEN,"hear, dear, hear. "
739,UNSEEN,She has stayed her eyes from weeping; 
740,UNSEEN,"She is sleeping, sweetly sleeping. "
741,UNSEEN,"Rest ye, weary mother, "
742,UNSEEN,"I am here, dear, here. "
743,UNSEEN,"Now the dawn-wind fans her cheek, "
744,UNSEEN,And she knows not that I speak-- 
745,UNSEEN,"But my arms are warm about her, could her eyes "
746,UNSEEN,see clear. 
747,WHY THEY LOVED HIM,WHY THEY LOVED HIM 
748,WHY THEY LOVED HIM,"So kindly was His love to us, "
749,WHY THEY LOVED HIM,"(We had not heard of love before), "
750,WHY THEY LOVED HIM,That all our life grew glorious 
751,WHY THEY LOVED HIM,When He had halted at our door. 
752,WHY THEY LOVED HIM,"So meekly did He love us men, "
753,WHY THEY LOVED HIM,"Though blind we were with shameful sin, "
754,WHY THEY LOVED HIM,"He touched our eyes with tears, and then "
755,WHY THEY LOVED HIM,Led God's tall angels flaming in. 
756,WHY THEY LOVED HIM,"He dwelt with us a little space, "
757,WHY THEY LOVED HIM,As mothers do in childhood's years; 
758,WHY THEY LOVED HIM,And still we can discern His face 
759,WHY THEY LOVED HIM,Wherever Joy or Love appears. 
760,WHY THEY LOVED HIM,"He made our virtues all His own, "
761,WHY THEY LOVED HIM,And lent them grace we could not give; 
762,WHY THEY LOVED HIM,"And now our world seems His alone, "
763,WHY THEY LOVED HIM,And while we live He seems to live. 
764,WHY THEY LOVED HIM,"He took our sorrows and our pain, "
765,WHY THEY LOVED HIM,And hid their torture in His breast; 
766,WHY THEY LOVED HIM,Till we received them back again 
767,WHY THEY LOVED HIM,To find on each His grief impressed. 
768,WHY THEY LOVED HIM,"He clasped our children in His arms, "
769,WHY THEY LOVED HIM,And showed us where their beauty shone; 
770,WHY THEY LOVED HIM,"He took from us our gray alarms, "
771,WHY THEY LOVED HIM,And put Death's icy armor on. 
772,WHY THEY LOVED HIM,So gentle were His ways with us 
773,WHY THEY LOVED HIM,That crippled souls had ceased to sigh; 
774,WHY THEY LOVED HIM,"On them He laid His hands, and thus "
775,WHY THEY LOVED HIM,They gloried at His passing by. 
776,WHY THEY LOVED HIM,"Without reproof or word of blame, "
777,WHY THEY LOVED HIM,"As mothers do in childhood's years, "
778,WHY THEY LOVED HIM,"He kissed our lips, in spite of shame, "
779,WHY THEY LOVED HIM,And stayed the passage of our tears. 
780,WHY THEY LOVED HIM,"So tender was His love to us, "
781,WHY THEY LOVED HIM,"(We had not learnt to love before), "
782,WHY THEY LOVED HIM,"That we grew like to Him, and thus "
783,WHY THEY LOVED HIM,Men sought His grace in us once more. 
784,WHY THEY LOVED HIM,"April fields and England's flowers, "
785,WHY THEY LOVED HIM,"English friends and April showers, "
786,WHY THEY LOVED HIM,April voices o'er the sea 
787,WHY THEY LOVED HIM,"Calling, calling unto me: "
788,WHY THEY LOVED HIM,"Oh, why tarry, why delay! "
789,WHY THEY LOVED HIM,Hither lies the meadow-way; 
790,WHY THEY LOVED HIM,"No such meadows shalt thou see, "
791,WHY THEY LOVED HIM,"Oh, come back to Arcady."" "
792,WHY THEY LOVED HIM,Happy English Arcady 
793,WHY THEY LOVED HIM,"Thou art calling, calling me "
794,WHY THEY LOVED HIM,Through thin flutes as frail as Pan 
795,WHY THEY LOVED HIM,"Fingered, when long since he ran "
796,WHY THEY LOVED HIM,"Careless as these foreign flowers, "
797,WHY THEY LOVED HIM,Trailing through these tropic bowers 
798,WHY THEY LOVED HIM,"All their largess of gold leaf, "
799,WHY THEY LOVED HIM,Piling splendors sheaf on sheaf. 
800,WHY THEY LOVED HIM,"Some there be who think Pan dead, "
801,WHY THEY LOVED HIM,Say his nymphs and flutings sped; 
802,WHY THEY LOVED HIM,"I know better, I have seen "
803,WHY THEY LOVED HIM,Where his racing feet have been. 
804,WHY THEY LOVED HIM,Still I hear the dead god's voice-- 
805,WHY THEY LOVED HIM,"England's; Had my soul the choice, "
806,WHY THEY LOVED HIM,It should wade through starry bloom 
807,WHY THEY LOVED HIM,Knee-deep to the brown-burnt broom. 
808,WHY THEY LOVED HIM,"April fields and April flowers, "
809,WHY THEY LOVED HIM,"April friends and April showers, "
810,WHY THEY LOVED HIM,"England shouting o'er the sea, "
811,WHY THEY LOVED HIM,"Calling, calling unto me. "
812,CHILDISH TRAVELLING,CHILDISH TRAVELLING 
813,CHILDISH TRAVELLING,"Ah, little child, as you lie in my breast, "
814,CHILDISH TRAVELLING,"Leaning your hair of gold close to my face, "
815,CHILDISH TRAVELLING,"Flushed in the gathering glow of the West, "
816,CHILDISH TRAVELLING,Where shall we travel--to what joyous place? 
817,CHILDISH TRAVELLING,"Shall we refashion our castles in Spain, "
818,CHILDISH TRAVELLING,"Or sail to the Indies with Sinbad again, "
819,CHILDISH TRAVELLING,Or noiselessly drift to where tired stars wane-- 
820,CHILDISH TRAVELLING,"Shall it be Africa, Sinbad or Spain? "
821,CHILDISH TRAVELLING,"Speak, little child, and together we'll go "
822,CHILDISH TRAVELLING,Back to the musical dreamlands we know. 
823,CHILDISH TRAVELLING,"Dear little child, you have wandered to rest. "
824,CHILDISH TRAVELLING,While you are sleeping I wonder and think 
825,CHILDISH TRAVELLING,"Where you will go, and what land will be best "
826,CHILDISH TRAVELLING,"Treading for such baby feet, and I shrink. "
827,CHILDISH TRAVELLING,"Should they be hillsides of laughing and song, "
828,CHILDISH TRAVELLING,"Or gardens of mercy and righting of wrong, "
829,CHILDISH TRAVELLING,"Of weeping, or triumph, or love growing strong, "
830,CHILDISH TRAVELLING,"Journeys of shouting, of sorrow or song? "
831,CHILDISH TRAVELLING,"I can but love you and kiss your gold hair, "
832,CHILDISH TRAVELLING,Happy in hoping that Christ may be there. 
833,THE IVORY LATCH,THE IVORY LATCH 
834,THE IVORY LATCH,Rattle the Ivory Latch of Love 
835,THE IVORY LATCH,And who will unbar the gate? 
836,THE IVORY LATCH,"Ask no questions, my dearest love, "
837,THE IVORY LATCH,But wait--wait--wait. 
838,THE IVORY LATCH,"Ah, will she be haughty Isabeau, "
839,THE IVORY LATCH,"Pale Isodore, or Kate? "
840,THE IVORY LATCH,"_Hush, dearest dear, some day you'll know, "
841,THE IVORY LATCH,Be not importunate._ 
842,THE IVORY LATCH,"Perchance I might love Isodore, "
843,THE IVORY LATCH,I think I could love Kate; 
844,THE IVORY LATCH,I have no fears for Isabeau 
845,THE IVORY LATCH,Should she unbar the gate. 
846,THE IVORY LATCH,"_Perchance she may be Isabeau, "
847,THE IVORY LATCH,Perhaps she will be Kate; 
848,THE IVORY LATCH,"But which, dear heart, you'll never know, "
849,THE IVORY LATCH,Till you have learned to wait._ 
850,THE ONCE SUNG SONG,THE ONCE SUNG SONG 
851,THE ONCE SUNG SONG,"Christ along the Road to Fame, "
852,THE ONCE SUNG SONG,"When all birds were singing, "
853,THE ONCE SUNG SONG,"Pluck't white lilies as He came, "
854,THE ONCE SUNG SONG,Set the blue-bells ringing; 
855,THE ONCE SUNG SONG,Poppies flared in strident flame 
856,THE ONCE SUNG SONG,When they heard His singing. 
857,THE ONCE SUNG SONG,Further up the Road to Fame 
858,THE ONCE SUNG SONG,Birds grew still in sorrow; 
859,THE ONCE SUNG SONG,Though His feet were very lame 
860,THE ONCE SUNG SONG,"Courage did He borrow, "
861,THE ONCE SUNG SONG,"Singing as He onward came, "
862,THE ONCE SUNG SONG,Dreaming of the morrow. 
863,THE ONCE SUNG SONG,Crimsoned by the Road of Fame 
864,THE ONCE SUNG SONG,Christ passed sick and dying. 
865,THE ONCE SUNG SONG,"Through the hedges, red with shame, "
866,THE ONCE SUNG SONG,"Crippled men there lying, "
867,THE ONCE SUNG SONG,"Seeing how He singing came, "
868,THE ONCE SUNG SONG,Marvelled at their sighing. 
869,THE ONCE SUNG SONG,"Distant down the Road to Fame, "
870,THE ONCE SUNG SONG,"When all else ceased singing, "
871,THE ONCE SUNG SONG,Messengers of music came-- 
872,THE ONCE SUNG SONG,Little echoes winging 
873,THE ONCE SUNG SONG,Withered hearts with wings of flame-- 
874,THE ONCE SUNG SONG,Fragments of Christ's singing. 
875,SPRING,SPRING 
876,SPRING,"_Sing, sing, "
877,SPRING,Spring and birth! 
878,SPRING,A maid shall be mother of all the earth._ 
879,SPRING,"Winter's bones lie bare and bleak, "
880,SPRING,Scattered white on the mountain peak. 
881,SPRING,Through stark woods the Madonna Spring 
882,SPRING,Glides with her unborn offering. 
883,SPRING,Where she treads dead flowers stir 
884,SPRING,"And raise their heads to gaze after her, "
885,SPRING,And trees make dense their boughs with green 
886,SPRING,That her motherhood may not be seen. 
887,SPRING,Summer lies hid 'neath her girlish breast; 
888,SPRING,Till her babe is bom she shall find no rest. 
889,SPRING,Yet is she glad in her wandering 
890,SPRING,And weaves meek songs 'gainst her mothering. 
891,SPRING,"_Birth, birth, "
892,SPRING,Lave and mirth! 
893,SPRING,Spring is Madonna of all the earth_. 
894,A LULLABY,A LULLABY 
895,A LULLABY,"Son of God, thou little child "
896,A LULLABY,"O'er whose sleep the Virgin smiled, "
897,A LULLABY,"Guard us, though this night be wild, "
898,A LULLABY,From Lilith--Lilith. 
899,A LULLABY,"Guard us, though our watch be slack, "
900,A LULLABY,"Guard us, though the night be black, "
901,A LULLABY,Though this night all stars should lack 
902,A LULLABY,From Lilith--Lilith. 
903,A LULLABY,"Stay her steps from drawing nigh, "
904,A LULLABY,"Kiss my baby lest he cry, "
905,A LULLABY,"And she hear him, and he die "
906,A LULLABY,From Lilith--Lilith. 
907,A LULLABY,"Son of God, thou little child "
908,A LULLABY,"O'er whose sleep the Virgin smiled, "
909,A LULLABY,May his soul be unbeguiled 
910,A LULLABY,By Lilith--Lilith. 
911,UNANSWERABLE QUESTIONS,UNANSWERABLE QUESTIONS 
912,UNANSWERABLE QUESTIONS,Is there light of moon or sun 
913,UNANSWERABLE QUESTIONS,In the land where thou hast gone? 
914,UNANSWERABLE QUESTIONS,Does the rush of wind and rain 
915,UNANSWERABLE QUESTIONS,Smite thy woodlands green again? 
916,UNANSWERABLE QUESTIONS,"Do dawn-birds rise up and sing, "
917,UNANSWERABLE QUESTIONS,"Sunrise. Sunrise,"" heralding? "
918,UNANSWERABLE QUESTIONS,"Dost thou fear, as once, the stark "
919,UNANSWERABLE QUESTIONS,Hours of panther-footed dark? 
920,UNANSWERABLE QUESTIONS,"Oh, little maiden, sweetly frail, "
921,UNANSWERABLE QUESTIONS,Naught can these empty words avail. 
922,UNANSWERABLE QUESTIONS,"For thee I clasp God's mantle fast, "
923,UNANSWERABLE QUESTIONS,Praying till night is overpast. 
924,THE HILL-TOWER,THE HILL-TOWER 
925,_A ROMANCE_,_A ROMANCE_ 
926,_A ROMANCE_,"_""Bianca of the yellow hair, "
927,_A ROMANCE_,"With witch-face white as ivory, "
928,_A ROMANCE_,Yield to our might that we may bear 
929,_A ROMANCE_,"Thy body back to Rimini.""_ "
930,_A ROMANCE_,And thus the foemen cried all day 
931,_A ROMANCE_,And strove to daunt with fierce display 
932,_A ROMANCE_,"Of armoured strength her maiden heart, "
933,_A ROMANCE_,So that with them she might depart 
934,_A ROMANCE_,From out that hill-tower where with three 
935,_A ROMANCE_,She'd held the pass right fearlessly-- 
936,_A ROMANCE_,So that with them she might depart 
937,_A ROMANCE_,To shameful death in Rimini. 
938,_A ROMANCE_,"Bianca, child of Abramo "
939,_A ROMANCE_,"The despot lord of Reggio, "
940,_A ROMANCE_,Had set our country-side on flame 
941,_A ROMANCE_,"With the binning torch of her beauty's fame, "
942,_A ROMANCE_,And a deadman's hate of her deadly name. 
943,_A ROMANCE_,For she had gazed with cold gray eyes 
944,_A ROMANCE_,On Rufo--he now starkly lies 
945,_A ROMANCE_,"Deep in a sculptured sepulchre, "
946,_A ROMANCE_,Smitten with death through love of her. 
947,_A ROMANCE_,"Rufo, the heir of Ugo Count "
948,_A ROMANCE_,Qf Rimini and vast amount 
949,_A ROMANCE_,"Of warrior-men and chivalry, "
950,_A ROMANCE_,Had come to claim her haughtily; 
951,_A ROMANCE_,But had scorched his soul in her golden hair. 
952,_A ROMANCE_,"As a wounded beast creeps to his lair, "
953,_A ROMANCE_,So he vilely died by slow degrees 
954,_A ROMANCE_,"Of heart-break and a sore disease, "
955,_A ROMANCE_,"Till his eyes grew glazed and ceased to stir, "
956,_A ROMANCE_,And his life gave out for his love of her. 
957,_A ROMANCE_,"Then Ugo swore a mighty oath, "
958,_A ROMANCE_,"By God's own Christ and by Christ's truth, "
959,_A ROMANCE_,"Though I go unarmed and go alone, "
960,_A ROMANCE_,For my son's death she shall atone. 
961,_A ROMANCE_,I'll take this witch of Reggio 
962,_A ROMANCE_,"And through the flames will make her go, "
963,_A ROMANCE_,"Till her sweet red lips grow cracked and sere, "
964,_A ROMANCE_,"Till her eyes are scarred and mad with fear, "
965,_A ROMANCE_,Till her false young tongue cannot speak love's 
966,_A ROMANCE_,"name, "
967,_A ROMANCE_,Till her tender feet drop off with flame-- 
968,_A ROMANCE_,Till she hath naught left that men desire 
969,_A ROMANCE_,"She shall pass and pass through consuming fire."" "
970,_A ROMANCE_,This was the oath which he did swear 
971,_A ROMANCE_,When he cursed her face in his hate of her. 
972,_A ROMANCE_,So Ugo rode on Reggio 
973,_A ROMANCE_,"And called on the name of Abramo, "
974,_A ROMANCE_,Claiming the body of her who wrought 
975,_A ROMANCE_,Love's enchantments and made distraught 
976,_A ROMANCE_,"The souls of the lovers who came to her, "
977,_A ROMANCE_,And told of the oath which he did swear. 
978,_A ROMANCE_,They bade him stand without the wall 
979,_A ROMANCE_,And bore his tidings to the hall. 
980,_A ROMANCE_,"From early mom he stood till eve, "
981,_A ROMANCE_,And still no message did receive. 
982,_A ROMANCE_,"When night was falling, dusk and dim, "
983,_A ROMANCE_,A city harlot drew nigh to him 
984,_A ROMANCE_,"And grayly glimmered along the wall, "
985,_A ROMANCE_,And stopped where the Count was standing tall. 
986,_A ROMANCE_,"What news,"" he cried, ""from Abramo, "
987,_A ROMANCE_,"Must I raze this city of Reggio?"" "
988,_A ROMANCE_,He reared his plume to its towering height. 
989,_A ROMANCE_,She leaned far out in the waning light. 
990,_A ROMANCE_,He clutched with one hand his saddle-bow 
991,_A ROMANCE_,"And saw her smile when she answered, ""No,"" "
992,_A ROMANCE_,And spat on his face and strained down on 
993,_A ROMANCE_,him. 
994,_A ROMANCE_,He rode away 'neath the crescent rim 
995,_A ROMANCE_,"Of a new-made moon through an olive-grove, "
