,Poem Title,Stanza
95,THE SHOEMAKERS.,"The foot is yours; where'er it falls, It treads your well-wrought leather, On earthen floor, in marble halls, On carpet, or on heather. Still there the sweetest charm is found Of matron grace or vestal's, As Hebe's foot bore nectar round Among the old celestials. "
96,THE SHOEMAKERS.,"Rap, rap!--your stout and bluff brogan, With footsteps slow and weary, May wander where the sky's blue span Shuts down upon the prairie. On Beauty's foot your slippers glance, By Saratoga's fountains, Or twinkle down the summer dance Beneath the Crystal Mountains! "
97,THE SHOEMAKERS.,"The red brick to the mason's hand, The brown earth to the tiller's, The shoe in yours shall wealth command, Like fairy Cinderella's! As they who shunned the household maid Beheld the crown upon her, So all shall see your toil repaid With hearth and home and honor. "
98,THE SHOEMAKERS.,"Then let the toast be freely quaffed, In water cool and brimming,-- ""All honor to the good old Craft, Its merry men and women!"" Call out again your long array, In the old time's pleasant manner Once more, on gay St. Crispin's day, Fling out his blazoned banner! 1845. "
99,THE FISHERMEN.,THE FISHERMEN. 
100,THE FISHERMEN.,"HURRAH! the seaward breezes Sweep down the bay amain; Heave up, my lads, the anchor! Run up the sail again Leave to the lubber landsmen The rail-car and the steed; The stars of heaven shall guide us, The breath of heaven shall speed. "
101,THE FISHERMEN.,"From the hill-top looks the steeple, And the lighthouse from the sand; And the scattered pines are waving Their farewell from the land. One glance, my lads, behind us, For the homes we leave one sigh, Ere we take the change and chances Of the ocean and the sky. "
102,THE FISHERMEN.,"Now, brothers, for the icebergs Of frozen Labrador, Floating spectral in the moonshine, Along the low, black shore! Where like snow the gannet's feathers On Brador's rocks are shed, And the noisy murr are flying, Like black scuds, overhead; "
103,THE FISHERMEN.,"Where in mist tie rock is hiding, And the sharp reef lurks below, And the white squall smites in summer, And the autumn tempests blow; Where, through gray and rolling vapor, From evening unto morn, A thousand boats are hailing, Horn answering unto horn. "
104,THE FISHERMEN.,"Hurrah! for the Red Island, With the white cross on its crown Hurrah! for Meccatina, And its mountains bare and brown! Where the Caribou's tall antlers O'er the dwarf-wood freely toss, And the footstep of the Mickmack Has no sound upon the moss. "
105,THE FISHERMEN.,"There we'll drop our lines, and gather Old Ocean's treasures in, Where'er the mottled mackerel Turns up a steel-dark fin. The sea's our field of harvest, Its scaly tribes our grain; We'll reap the teeming waters As at home they reap the plain. "
106,THE FISHERMEN.,"Our wet hands spread the carpet, And light the hearth of home; From our fish, as in the old time, The silver coin shall come. As the demon fled the chamber Where the fish of Tobit lay, So ours from all our dwellings Shall frighten Want away. "
107,THE FISHERMEN.,"Though the mist upon our jackets In the bitter air congeals, And our lines wind stiff and slowly From off the frozen reels; Though the fog be dark around us, And the storm blow high and loud, We will whistle down the wild wind, And laugh beneath the cloud! "
108,THE FISHERMEN.,"In the darkness as in daylight, On the water as on land, God's eye is looking on us, And beneath us is His hand! Death will find us soon or later, On the deck or in the cot; And we cannot meet him better Than in working out our lot. "
109,THE FISHERMEN.,"Hurrah! hurrah! the west-wind Comes freshening down the bay, The rising sails are filling; Give way, my lads, give way! Leave the coward landsman clinging To the dull earth, like a weed; The stars of heaven shall guide us, The breath of heaven shall speed! 1845. "
110,THE LUMBERMEN.,THE LUMBERMEN. 
111,THE LUMBERMEN.,"WILDLY round our woodland quarters Sad-voiced Autumn grieves; Thickly down these swelling waters Float his fallen leaves. Through the tall and naked timber, Column-like and old, Gleam the sunsets of November, From their skies of gold. "
112,THE LUMBERMEN.,"O'er us, to the southland heading, Screams the gray wild-goose; On the night-frost sounds the treading Of the brindled moose. Noiseless creeping, while we're sleeping, Frost his task-work plies; Soon, his icy bridges heaping, Shall our log-piles rise. "
113,THE LUMBERMEN.,"When, with sounds of smothered thunder, On some night of rain, Lake and river break asunder Winter's weakened chain, Down the wild March flood shall bear them To the saw-mill's wheel, Or where Steam, the slave, shall tear them With his teeth of steel. "
114,THE LUMBERMEN.,"Be it starlight, be it moonlight, In these vales below, When the earliest beams of sunlight Streak the mountain's snow, Crisps the boar-frost, keen and early, To our hurrying feet, And the forest echoes clearly All our blows repeat. "
115,THE LUMBERMEN.,"Where the crystal Ambijejis Stretches broad and clear, And Millnoket's pine-black ridges Hide the browsing deer Where, through lakes and wide morasses, Or through rocky walls, Swift and strong, Penobscot passes White with foamy falls; "
116,THE LUMBERMEN.,"Where, through clouds, are glimpses given Of Katahdin's sides,-- Rock and forest piled to heaven, Torn and ploughed by slides! Far below, the Indian trapping, In the sunshine warm; Far above, the snow-cloud wrapping Half the peak in storm! "
117,THE LUMBERMEN.,"Where are mossy carpets better Than the Persian weaves, And than Eastern perfumes sweeter Seem the fading leaves; And a music wild and solemn, From the pine-tree's height, Rolls its vast and sea-like volume On the wind of night; "
118,THE LUMBERMEN.,"Make we here our camp of winter; And, through sleet and snow, Pitchy knot and beechen splinter On our hearth shall glow. Here, with mirth to lighten duty, We shall lack alone Woman's smile and girlhood's beauty, Childhood's lisping tone. "
119,THE LUMBERMEN.,"But their hearth is brighter burning For our toil to-day; And the welcome of returning Shall our loss repay, When, like seamen from the waters, From the woods we come, Greeting sisters, wives, and daughters, Angels of our home! "
120,THE LUMBERMEN.,"Not for us the measured ringing From the village spire, Not for us the Sabbath singing Of the sweet-voiced choir, Ours the old, majestic temple, Where God's brightness shines Down the dome so grand and ample, Propped by lofty pines! "
121,THE LUMBERMEN.,"Through each branch-enwoven skylight, Speaks He in the breeze, As of old beneath the twilight Of lost Eden's trees! For His ear, the inward feeling Needs no outward tongue; He can see the spirit kneeling While the axe is swung. "
122,THE LUMBERMEN.,"Heeding truth alone, and turning From the false and dim, Lamp of toil or altar burning Are alike to Him. Strike, then, comrades! Trade is waiting On our rugged toil; Far ships waiting for the freighting Of our woodland spoil. "
123,THE LUMBERMEN.,"Ships, whose traffic links these highlands, Bleak and cold, of ours, With the citron-planted islands Of a clime of flowers; To our frosts the tribute bringing Of eternal heats; In our lap of winter flinging Tropic fruits and sweets. "
124,THE LUMBERMEN.,"Cheerly, on the axe of labor, Let the sunbeams dance, Better than the flash of sabre Or the gleam of lance! Strike! With every blow is given Freer sun and sky, And the long-hid earth to heaven Looks, with wondering eye! "
125,THE LUMBERMEN.,"Loud behind us grow the murmurs Of the age to come; Clang of smiths, and tread of farmers, Bearing harvest home! Here her virgin lap with treasures Shall the green earth fill; Waving wheat and golden maize-ears Crown each beechen hill. "
126,THE LUMBERMEN.,"Keep who will the city's alleys Take the smooth-shorn plain'; Give to us the cedarn valleys, Rocks and hills of Maine! In our North-land, wild and woody, Let us still have part Rugged nurse and mother sturdy, Hold us to thy heart! "
127,THE LUMBERMEN.,"Oh, our free hearts beat the warmer For thy breath of snow; And our tread is all the firmer For thy rocks below. Freedom, hand in hand with labor, Walketh strong and brave; On the forehead of his neighbor No man writeth Slave! "
128,THE LUMBERMEN.,"Lo, the day breaks! old Katahdin's Pine-trees show its fires, While from these dim forest gardens Rise their blackened spires. Up, my comrades! up and doing! Manhood's rugged play Still renewing, bravely hewing Through the world our way! 1845. "
129,THE SHIP-BUILDERS,THE SHIP-BUILDERS 
130,THE SHIP-BUILDERS,"THE sky is ruddy in the east, The earth is gray below, And, spectral in the river-mist, The ship's white timbers show. Then let the sounds of measured stroke And grating saw begin; The broad-axe to the gnarled oak, The mallet to the pin! "
131,THE SHIP-BUILDERS,"Hark! roars the bellows, blast on blast, The sooty smithy jars, And fire-sparks, rising far and fast, Are fading with the stars. All day for us the smith shall stand Beside that flashing forge; All day for us his heavy hand The groaning anvil scourge. "
132,THE SHIP-BUILDERS,"From far-off hills, the panting team For us is toiling near; For us the raftsmen down the stream Their island barges steer. Rings out for us the axe-man's stroke In forests old and still; For us the century-circled oak Falls crashing down his hill. "
133,THE SHIP-BUILDERS,"Up! up! in nobler toil than ours No craftsmen bear a part We make of Nature's giant powers The slaves of human Art. Lay rib to rib and beam to beam, And drive the treenails free; Nor faithless joint nor yawning seam Shall tempt the searching sea. "
134,THE SHIP-BUILDERS,"Where'er the keel of our good ship The sea's rough field shall plough; Where'er her tossing spars shall drip With salt-spray caught below; That ship must heed her master's beck, Her helm obey his hand, And seamen tread her reeling deck As if they trod the land. "
135,THE SHIP-BUILDERS,"Her oaken ribs the vulture-beak Of Northern ice may peel; The sunken rock and coral peak May grate along her keel; And know we well the painted shell We give to wind and wave, Must float, the sailor's citadel, Or sink, the sailor's grave. "
136,THE SHIP-BUILDERS,"Ho! strike away the bars and blocks, And set the good ship free! Why lingers on these dusty rocks The young bride of the sea? Look! how she moves adown the grooves, In graceful beauty now! How lowly on the breast she loves Sinks down her virgin prow. "
137,THE SHIP-BUILDERS,"God bless her! wheresoe'er the breeze Her snowy wing shall fan, Aside the frozen Hebrides, Or sultry Hindostan! Where'er, in mart or on the main, With peaceful flag unfurled, She helps to wind the silken chain Of commerce round the world! "
138,THE SHIP-BUILDERS,"Speed on the ship! But let her bear No merchandise of sin, No groaning cargo of despair Her roomy hold within; No Lethean drug for Eastern lands, Nor poison-draught for ours; But honest fruits of toiling hands And Nature's sun and showers. "
139,THE SHIP-BUILDERS,"Be hers the Prairie's golden grain, The Desert's golden sand, The clustered fruits of sunny Spain, The spice of Morning-land! Her pathway on the open main May blessings follow free, And glad hearts welcome back again Her white sails from the sea 1846. "
140,THE DROVERS.,THE DROVERS. 
141,THE DROVERS.,"THROUGH heat and cold, and shower and sun, Still onward cheerly driving There's life alone in duty done, And rest alone in striving. But see! the day is closing cool, The woods are dim before us; The white fog of the wayside pool Is creeping slowly o'er us. "
142,THE DROVERS.,"The night is falling, comrades mine, Our footsore beasts are weary, And through yon elms the tavern sign Looks out upon us cheery. The landlord beckons from his door, His beechen fire is glowing; These ample barns, with feed in store, Are filled to overflowing. "
143,THE DROVERS.,"From many a valley frowned across By brows of rugged mountains; From hillsides where, through spongy moss, Gush out the river fountains; From quiet farm-fields, green and low, And bright with blooming clover; From vales of corn the wandering crow No richer hovers over; "
144,THE DROVERS.,"Day after day our way has been O'er many a hill and hollow; By lake and stream, by wood and glen, Our stately drove we follow. Through dust-clouds rising thick and dun, As smoke of battle o'er us, Their white horns glisten in the sun, Like plumes and crests before us. "
145,THE DROVERS.,"We see them slowly climb the hill, As slow behind it sinking; Or, thronging close, from roadside rill, Or sunny lakelet, drinking. Now crowding in the narrow road, In thick and struggling masses, They glare upon the teamster's load, Or rattling coach that passes. "
146,THE DROVERS.,"Anon, with toss of horn and tail, And paw of hoof, and bellow, They leap some farmer's broken pale, O'er meadow-close or fallow. Forth comes the startled goodman; forth Wife, children, house-dog, sally, Till once more on their dusty path The baffled truants rally. "
147,THE DROVERS.,"We drive no starvelings, scraggy grown, Loose-legged, and ribbed and bony, Like those who grind their noses down On pastures bare and stony,-- Lank oxen, rough as Indian dogs, And cows too lean for shadows, Disputing feebly with the frogs The crop of saw-grass meadows! "
148,THE DROVERS.,"In our good drove, so sleek and fair, No bones of leanness rattle; No tottering hide-bound ghosts are there, Or Pharaoh's evil cattle. Each stately beeve bespeaks the hand That fed him unrepining; The fatness of a goodly land In each dun hide is shining. "
149,THE DROVERS.,"We've sought them where, in warmest nooks, The freshest feed is growing, By sweetest springs and clearest brooks Through honeysuckle flowing; Wherever hillsides, sloping south, Are bright with early grasses, Or, tracking green the lowland's drouth, The mountain streamlet passes. "
150,THE DROVERS.,"But now the day is closing cool, The woods are dim before us, The white fog of the wayside pool Is creeping slowly o'er us. The cricket to the frog's bassoon His shrillest time is keeping; The sickle of yon setting moon The meadow-mist is reaping. "
151,THE DROVERS.,"The night is falling, comrades mine, Our footsore beasts are weary, And through yon elms the tavern sign Looks out upon us cheery. To-morrow, eastward with our charge We'll go to meet the dawning, Ere yet the pines of Kearsarge Have seen the sun of morning. "
152,THE DROVERS.,"When snow-flakes o'er the frozen earth, Instead of birds, are flitting; When children throng the glowing hearth, And quiet wives are knitting; While in the fire-light strong and clear Young eyes of pleasure glisten, To tales of all we see and hear The ears of home shall listen. "
153,THE DROVERS.,"By many a Northern lake and bill, From many a mountain pasture, Shall Fancy play the Drover still, And speed the long night faster. Then let us on, through shower and sun, And heat and cold, be driving; There 's life alone in duty done, And rest alone in striving. 1847. "
154,THE HUSKERS.,THE HUSKERS. 
155,THE HUSKERS.,"IT was late in mild October, and the long autumnal rain Had left the summer harvest-fields all green with grass again; The first sharp frosts had fallen, leaving all the woodlands gay With the hues of summer's rainbow, or the meadow-flowers of May. "
156,THE HUSKERS.,"Through a thin, dry mist, that morning, the sun rose broad and red, At first a rayless disk of fire, he brightened as he sped; Yet, even his noontide glory fell chastened and subdued, On the cornfields and the orchards, and softly pictured wood. "
157,THE HUSKERS.,"And all that quiet afternoon, slow sloping to the night, He wove with golden shuttle the haze with yellow light; Slanting through the painted beeches, he glorified the hill; And, beneath it, pond and meadow lay brighter, greener still. "
158,THE HUSKERS.,"And shouting boys in woodland haunts caught glimpses of that sky, Flecked by the many-tinted leaves, and laughed, they knew not why; And school-girls, gay with aster-flowers, beside the meadow brooks, Mingled the glow of autumn with the sunshine of sweet looks. "
159,THE HUSKERS.,"From spire and barn looked westerly the patient weathercocks; But even the birches on the hill stood motionless as rocks. No sound was in the woodlands, save the squirrel's dropping shell, And the yellow leaves among the boughs, low rustling as they fell. "
160,THE HUSKERS.,"The summer grains were harvested; the stubble-fields lay dry, Where June winds rolled, in light and shade, the pale green waves of rye; But still, on gentle hill-slopes, in valleys fringed with wood, Ungathered, bleaching in the sun, the heavy corn crop stood. "
161,THE HUSKERS.,"Bent low, by autumn's wind and rain, through husks that, dry and sere, Unfolded from their ripened charge, shone out the yellow ear; Beneath, the turnip lay concealed, in many a verdant fold, And glistened in the slanting light the pumpkin's sphere of gold. "
162,THE HUSKERS.,"There wrought the busy harvesters; and many a creaking wain Bore slowly to the long barn-floor its load of husk and grain; Till broad and red, as when he rose, the sun sank down, at last, And like a merry guest's farewell, the day in brightness passed. "
163,THE HUSKERS.,"And to! as through the western pines, on meadow, stream, and pond, Flamed the red radiance of a sky, set all afire beyond, Slowly o'er the eastern sea-bluffs a milder glory shone, And the sunset and the moonrise were mingled into one! "
164,THE HUSKERS.,"As thus into the quiet night the twilight lapsed away, And deeper in the brightening moon the tranquil shadows lay; From many a brown old farm-house, and hamlet without name, Their milking and their home-tasks done, the  merry huskers came. "
165,THE HUSKERS.,"Swung o'er the heaped-up harvest, from pitchforks in the mow, Shone dimly down the lanterns on the pleasant scene below; The growing pile of husks behind, the golden ears before, And laughing eyes and busy hands and brown cheeks glimmering o'er. "
166,THE HUSKERS.,"Half hidden, in a quiet nook, serene of look and heart, Talking their old times over, the old men sat apart; While up and down the unhusked pile, or nestling in its shade, At hide-and-seek, with laugh and shout, the happy children played. "
167,THE HUSKERS.,"Urged by the good host's daughter, a maiden young and fair, Lifting to light her sweet blue eyes and pride of soft brown hair, The master of the village school, sleek of hair and smooth of tongue, To the quaint tune of some old psalm, a husking ballad sung. "
168,THE CORN-SONG.,THE CORN-SONG. Heap high the farmer's wintry hoard Heap high the golden corn No richer gift has Autumn poured From out her lavish horn! 
169,THE CORN-SONG.,"Let other lands, exulting, glean The apple from the pine, The orange from its glossy green, The cluster from the vine; "
170,THE CORN-SONG.,"We better love the hardy gift Our rugged vales bestow, To cheer us when the storm shall drift Our harvest-fields with snow. "
171,THE CORN-SONG.,"Through vales of grass and mends of flowers Our ploughs their furrows made, While on the hills the sun and showers Of changeful April played. "
172,THE CORN-SONG.,"We dropped the seed o'er hill and plain Beneath the sun of May, And frightened from our sprouting grain The robber crows away. "
173,THE CORN-SONG.,"All through the long, bright days of June Its leaves grew green and fair, And waved in hot midsummer's noon Its soft and yellow hair. "
174,THE CORN-SONG.,"And now, with autumn's moonlit eves, Its harvest-time has come, We pluck away the frosted leaves, And bear the treasure home. "
175,THE CORN-SONG.,"There, when the snows about us drift, And winter winds are cold, Fair hands the broken grain shall sift, And knead its meal of gold. "
176,THE CORN-SONG.,"Let vapid idlers loll in silk Around their costly board; Give us the bowl of samp and milk, By homespun beauty poured! "
177,THE CORN-SONG.,"Where'er the wide old kitchen hearth Sends up its smoky curls, Who will not thank the kindly earth, And bless our farmer girls! "
178,THE CORN-SONG.,"Then shame on all the proud and vain, Whose folly laughs to scorn The blessing of our hardy grain, Our wealth of golden corn. "
179,THE CORN-SONG.,"Let earth withhold her goodly root, Let mildew blight the rye, Give to the worm the orchard's fruit, The wheat-field to the fly. "
180,THE CORN-SONG.,"But let the good old crop adorn The hills our fathers trod; Still let us, for his golden corn, Send up our thanks to God! 1847. "
181,THE REFORMER.,THE REFORMER. 
182,THE REFORMER.,"ALL grim and soiled and brown with tan, I saw a Strong One, in his wrath, Smiting the godless shrines of man Along his path. "
183,THE REFORMER.,"The Church, beneath her trembling dome, Essayed in vain her ghostly charm Wealth shook within his gilded home With strange alarm. "
184,THE REFORMER.,Fraud from his secret chambers fled Before the sunlight bursting in Sloth drew her pillow o'er her head To drown the din. 
185,THE REFORMER.,"""Spare,"" Art implored, ""yon holy pile; That grand, old, time-worn turret spare;"" Meek Reverence, kneeling in the aisle, Cried out, ""Forbear!"" "
186,THE REFORMER.,"Gray-bearded Use, who, deaf and blind, Groped for his old accustomed stone, Leaned on his staff, and wept to find His seat o'erthrown. "
187,THE REFORMER.,"Young Romance raised his dreamy eyes, O'erhung with paly locks of gold,-- ""Why smite,"" he asked in sad surprise, ""The fair, the old?"" "
188,THE REFORMER.,"Yet louder rang the Strong One's stroke, Yet nearer flashed his axe's gleam; Shuddering and sick of heart I woke, As from a dream. "
189,THE REFORMER.,"I looked: aside the dust-cloud rolled, The Waster seemed the Builder too; Upspringing from the ruined Old I saw the New. "
190,THE REFORMER.,"'T was but the ruin of the bad,-- The wasting of the wrong and ill; Whate'er of good the old time had Was living still. "
191,THE REFORMER.,"Calm grew the brows of him I feared; The frown which awed me passed away, And left behind a smile which cheered Like breaking day. "
192,THE REFORMER.,"The grain grew green on battle-plains, O'er swarded war-mounds grazed the cow; The slave stood forging from his chains The spade and plough. "
193,THE REFORMER.,"Where frowned the fort, pavilions gay And cottage windows, flower-entwined, Looked out upon the peaceful bay And hills behind. "
194,THE REFORMER.,"Through vine-wreathed cups with wine once red, The lights on brimming crystal fell, Drawn, sparkling, from the rivulet head And mossy well. "
195,THE REFORMER.,"Through prison walls, like Heaven-sent hope, Fresh breezes blew, and sunbeams strayed, And with the idle gallows-rope The young child played. "
196,THE REFORMER.,"Where the doomed victim in his cell Had counted o'er the weary hours, Glad school-girls, answering to the bell, Came crowned with flowers. "
197,THE REFORMER.,"Grown wiser for the lesson given, I fear no longer, for I know That, where the share is deepest driven, The best fruits grow. "
198,THE REFORMER.,"The outworn rite, the old abuse, The pious fraud transparent grown, The good held captive in the use Of wrong alone,-- "
199,THE REFORMER.,"These wait their doom, from that great law Which makes the past time serve to-day; And fresher life the world shall draw From their decay. "
200,THE REFORMER.,"Oh, backward-looking son of time! The new is old, the old is new, The cycle of a change sublime Still sweeping through. "
201,THE REFORMER.,"So wisely taught the Indian seer; Destroying Seva, forming Brahm, Who wake by turns Earth's love and fear, Are one, the same. "
202,THE REFORMER.,"Idly as thou, in that old day Thou mournest, did thy sire repine; So, in his time, thy child grown gray Shall sigh for thine. "
203,THE REFORMER.,"But life shall on and upward go; Th' eternal step of Progress beats To that great anthem, calm and slow, Which God repeats. "
204,THE REFORMER.,"Take heart! the Waster builds again, A charmed life old Goodness bath; The tares may perish, but the grain Is not for death. "
205,THE REFORMER.,God works in all things; all obey His first propulsion from the night Wake thou and watch! the world is gray With morning light! 1848. 
206,THE PEACE CONVENTION AT BRUSSELS.,THE PEACE CONVENTION AT BRUSSELS. 
207,THE PEACE CONVENTION AT BRUSSELS.,"STILL in thy streets, O Paris! doth the stain Of blood defy the cleansing autumn rain; Still breaks the smoke Messina's ruins through, And Naples mourns that new Bartholomew, When squalid beggary, for a dole of bread, At a crowned murderer's beck of license, fed The yawning trenches with her noble dead; Still, doomed Vienna, through thy stately halls The shell goes crashing and the red shot falls, And, leagued to crush thee, on the Danube's side, The bearded Croat and Bosniak spearman ride; Still in that vale where Himalaya's snow Melts round the cornfields and the vines below, The Sikh's hot cannon, answering ball for ball, Flames in the breach of Moultan's shattered wall; On Chenab's side the vulture seeks the slain, And Sutlej paints with blood its banks again. "
