,Poem Title,Stanza
208,THE PEACE CONVENTION AT BRUSSELS.,"""What folly, then,"" the faithless critic cries, With sneering lip, and wise world-knowing eyes, ""While fort to fort, and post to post, repeat The ceaseless challenge of the war-drum's beat, And round the green earth, to the church-bell's chime, The morning drum-roll of the camp keeps time, To dream of peace amidst a world in arms, Of swords to ploughshares changed by Scriptural charms, Of nations, drunken with the wine of blood, Staggering to take the Pledge of Brotherhood, Like tipplers answering Father Matthew's call; The sullen Spaniard, and the mad-cap Gaul, The bull-dog Briton, yielding but with life, The Yankee swaggering with his bowie-knife, The Russ, from banquets with the vulture shared, The blood still dripping from his amber beard, Quitting their mad Berserker dance to hear The dull, meek droning of a drab-coat seer; Leaving the sport of Presidents and Kings, Where men for dice each titled gambler flings, To meet alternate on the Seine and Thames, For tea and gossip, like old country dames No! let the cravens plead the weakling's cant, Let Cobden cipher, and let Vincent rant, Let Sturge preach peace to democratic throngs, And Burritt, stammering through his hundred tongues, Repeat, in all, his ghostly lessons o'er, Timed to the pauses of the battery's roar; Check Ban or Kaiser with the barricade Of ""Olive-leaves"" and Resolutions made, Spike guns with pointed Scripture-texts, and hope To capsize navies with a windy trope; Still shall the glory and the pomp of War Along their train the shouting millions draw; Still dusty Labor to the passing Brave His cap shall doff, and Beauty's kerchief wave; Still shall the bard to Valor tune his song, Still Hero-worship kneel before the Strong; Rosy and sleek, the sable-gowned divine, O'er his third bottle of suggestive wine, To plumed and sworded auditors, shall prove Their trade accordant with the Law of Love; And Church for State, and State for Church, shall fight, And both agree, that ""Might alone is Right!"" Despite of sneers like these, O faithful few, Who dare to hold God's word and witness true, Whose clear-eyed faith transcends our evil time, And o'er the present wilderness of crime Sees the calm future, with its robes of green, Its fleece-flecked mountains, and soft streams between,-- Still keep the path which duty bids ye tread, Though worldly wisdom shake the cautious head; No truth from Heaven descends upon our sphere, Without the greeting of the skeptic's sneer; Denied and mocked at, till its blessings fall, Common as dew and sunshine, over all."" "
209,THE PEACE CONVENTION AT BRUSSELS.,"Then, o'er Earth's war-field, till the strife shall cease, Like Morven's harpers, sing your song of peace; As in old fable rang the Thracian's lyre, Midst howl of fiends and roar of penal fire, Till the fierce din to pleasing murmurs fell, And love subdued the maddened heart of hell. Lend, once again, that holy song a tongue, Which the glad angels of the Advent sung, Their cradle-anthem for the Saviour's birth, Glory to God, and peace unto the earth Through the mad discord send that calming word Which wind and wave on wild Genesareth heard, Lift in Christ's name his Cross against the Sword! Not vain the vision which the prophets saw, Skirting with green the fiery waste of war, Through the hot sand-gleam, looming soft and calm On the sky's rim, the fountain-shading palm. Still lives for Earth, which fiends so long have trod, The great hope resting on the truth of God,-- Evil shall cease and Violence pass away, And the tired world breathe free through a long Sabbath day. 11th mo., 1848. "
210,THE PRISONER FOR DEBT.,THE PRISONER FOR DEBT. 
211,THE PRISONER FOR DEBT.,"Before the law authorizing imprisonment for debt had been abolished in Massachusetts, a revolutionary pensioner was confined in Charlestown jail for a debt of fourteen dollars, and on the fourth of July was seen waving a handkerchief from the bars of his cell in honor of the day. "
212,THE PRISONER FOR DEBT.,"Look on him! through his dungeon grate, Feebly and cold, the morning light Comes stealing round him, dim and late, As if it loathed the sight. Reclining on his strawy bed, His hand upholds his drooping head; His bloodless cheek is seamed and hard, Unshorn his gray, neglected beard; And o'er his bony fingers flow His long, dishevelled locks of snow. No grateful fire before him glows, And yet the winter's breath is chill; And o'er his half-clad person goes The frequent ague thrill! Silent, save ever and anon, A sound, half murmur and half groan, Forces apart the painful grip Of the old sufferer's bearded lip; Oh, sad and crushing is the fate Of old age chained and desolate! "
213,THE PRISONER FOR DEBT.,"Just God! why lies that old man there? A murderer shares his prison bed, Whose eyeballs, through his horrid hair, Gleam on him, fierce and red; And the rude oath and heartless jeer Fall ever on his loathing ear, And, or in wakefulness or sleep, Nerve, flesh, and pulses thrill and creep Whene'er that ruffian's tossing limb, Crimson with murder, touches him! "
214,THE PRISONER FOR DEBT.,"What has the gray-haired prisoner done? Has murder stained his hands with gore? Not so; his crime's a fouler one; God made the old man poor! For this he shares a felon's cell, The fittest earthly type of hell For this, the boon for which he poured His young blood on the invader's sword, And counted light the fearful cost; His blood-gained liberty is lost! "
215,THE PRISONER FOR DEBT.,"And so, for such a place of rest, Old prisoner, dropped thy blood as rain On Concord's field, and Bunker's crest, And Saratoga's plain? Look forth, thou man of many scars, Through thy dim dungeon's iron bars; It must be joy, in sooth, to see Yon monument upreared to thee; Piled granite and a prison cell, The land repays thy service well! "
216,THE PRISONER FOR DEBT.,"Go, ring the bells and fire the guns, And fling the starry banner out; Shout ""Freedom!"" till your lisping ones Give back their cradle-shout; Let boastful eloquence declaim Of honor, liberty, and fame; Still let the poet's strain be heard, With glory for each second word, And everything with breath agree To praise ""our glorious liberty!"" "
217,THE PRISONER FOR DEBT.,"But when the patron cannon jars That prison's cold and gloomy wall, And through its grates the stripes and stars Rise on the wind, and fall, Think ye that prisoner's aged ear Rejoices in the general cheer? Think ye his dim and failing eye Is kindled at your pageantry? Sorrowing of soul, and chained of limb, What is your carnival to him? "
218,THE PRISONER FOR DEBT.,"Down with the law that binds him thus! Unworthy freemen, let it find No refuge from the withering curse Of God and human-kind Open the prison's living tomb, And usher from its brooding gloom The victims of your savage code To the free sun and air of God; No longer dare as crime to brand The chastening of the Almighty's hand. 1849. "
219,THE CHRISTIAN TOURISTS.,THE CHRISTIAN TOURISTS. 
220,THE CHRISTIAN TOURISTS.,"The reader of the biography of William Allen, the philanthropic associate of Clarkson and Romilly, cannot fail to admire his simple and beautiful record of a tour through Europe, in the years 1818 and 1819, in the company of his American friend, Stephen Grellett. "
221,THE CHRISTIAN TOURISTS.,"No aimless wanderers, by the fiend Unrest Goaded from shore to shore; No schoolmen, turning, in their classic quest, The leaves of empire o'er. Simple of faith, and bearing in their hearts The love of man and God, Isles of old song, the Moslem's ancient marts, And Scythia's steppes, they trod. "
222,THE CHRISTIAN TOURISTS.,"Where the long shadows of the fir and pine In the night sun are cast, And the deep heart of many a Norland mine Quakes at each riving blast; Where, in barbaric grandeur, Moskwa stands, A baptized Scythian queen, With Europe's arts and Asia's jewelled hands, The North and East between! "
223,THE CHRISTIAN TOURISTS.,"Where still, through vales of Grecian fable, stray The classic forms of yore, And beauty smiles, new risen from the spray, And Dian weeps once more; Where every tongue in Smyrna's mart resounds; And Stamboul from the sea Lifts her tall minarets over burial-grounds Black with the cypress-tree. "
224,THE CHRISTIAN TOURISTS.,"From Malta's temples to the gates of Rome, Following the track of Paul, And where the Alps gird round the Switzer's home Their vast, eternal wall; They paused not by the ruins of old time, They scanned no pictures rare, Nor lingered where the snow-locked mountains climb The cold abyss of air! "
225,THE CHRISTIAN TOURISTS.,"But unto prisons, where men lay in chains, To haunts where Hunger pined, To kings and courts forgetful of the pains And wants of human-kind, Scattering sweet words, and quiet deeds of good, Along their way, like flowers, Or pleading, as Christ's freemen only could, With princes and with powers; "
226,THE CHRISTIAN TOURISTS.,"Their single aim the purpose to fulfil Of Truth, from day to day, Simply obedient to its guiding will, They held their pilgrim way. Yet dream not, hence, the beautiful and old Were wasted on their sight, Who in the school of Christ had learned to hold All outward things aright. "
227,THE CHRISTIAN TOURISTS.,"Not less to them the breath of vineyards blown From off the Cyprian shore, Not less for them the Alps in sunset shone, That man they valued more. A life of beauty lends to all it sees The beauty of its thought; And fairest forms and sweetest harmonies Make glad its way, unsought. "
228,THE CHRISTIAN TOURISTS.,"In sweet accordancy of praise and love, The singing waters run; And sunset mountains wear in light above The smile of duty done; Sure stands the promise,--ever to the meek A heritage is given; Nor lose they Earth who, single-hearted, seek The righteousness of Heaven! 1849. "
229,THE MEN OF OLD.,THE MEN OF OLD. 
230,THE MEN OF OLD.,"""WELL speed thy mission, bold Iconoclast! Yet all unworthy of its trust thou art, If, with dry eye, and cold, unloving heart, Thou tread'st the solemn Pantheon of the Past, By the great Future's dazzling hope made blind To all the beauty, power, and truth behind. Not without reverent awe shouldst thou put by The cypress branches and the amaranth blooms, Where, with clasped hands of prayer, upon their tombs The effigies of old confessors lie, God's witnesses; the voices of His will, Heard in the slow march of the centuries still Such were the men at whose rebuking frown, Dark with God's wrath, the tyrant's knee went down; Such from the terrors of the guilty drew The vassal's freedom and the poor man's due."" "
231,THE MEN OF OLD.,"St. Anselm (may he rest forevermore In Heaven's sweet peace!) forbade, of old, the sale Of men as slaves, and from the sacred pale Hurled the Northumbrian buyers of the poor. To ransom souls from bonds and evil fate St. Ambrose melted down the sacred plate,-- Image of saint, the chalice, and the pix, Crosses of gold, and silver candlesticks. ""Man is worth more than temples!"" he replied To such as came his holy work to chide. And brave Cesarius, stripping altars bare, And coining from the Abbey's golden hoard The captive's freedom, answered to the prayer Or threat of those whose fierce zeal for the Lord Stifled their love of man,--""An earthen dish The last sad supper of the Master bore Most miserable sinners! do ye wish More than your Lord, and grudge His dying poor What your own pride and not His need requires? Souls, than these shining gauds, He values more Mercy, not sacrifice, His heart desires!"" O faithful worthies! resting far behind In your dark ages, since ye fell asleep, Much has been done for truth and human-kind; Shadows are scattered wherein ye groped blind; Man claims his birthright, freer pulses leap Through peoples driven in your day like sheep; Yet, like your own, our age's sphere of light, Though widening still, is walled around by night; With slow, reluctant eye, the Church has read, Skeptic at heart, the lessons of its Head; Counting, too oft, its living members less Than the wall's garnish and the pulpit's dress; World-moving zeal, with power to bless and feed Life's fainting pilgrims, to their utter need, Instead of bread, holds out the stone of creed; Sect builds and worships where its wealth and pride And vanity stand shrined and deified, Careless that in the shadow of its walls God's living temple into ruin falls. We need, methinks, the prophet-hero still, Saints true of life, and martyrs strong of will, To tread the land, even now, as Xavier trod The streets of Goa, barefoot, with his bell, Proclaiming freedom in the name of God, And startling tyrants with the fear of hell Soft words, smooth prophecies, are doubtless well; But to rebuke the age's popular crime, We need the souls of fire, the hearts of that old time! 1849. "
232,TO PIUS IX.,TO PIUS IX. 
233,TO PIUS IX.,"The writer of these lines is no enemy of Catholics. He has, on more than one occasion, exposed himself to the censures of his Protestant brethren, by his strenuous endeavors to procure indemnification for the owners of the convent destroyed near Boston. He defended the cause of the Irish patriots long before it had become popular in this country; and he was one of the first to urge the most liberal aid to the suffering and starving population of the Catholic island. The severity of his language finds its ample apology in the reluctant confession of one of the most eminent Romish priests, the eloquent and devoted Father Ventura. "
234,TO PIUS IX.,"THE cannon's brazen lips are cold; No red shell blazes down the air; And street and tower, and temple old, Are silent as despair. "
235,TO PIUS IX.,"The Lombard stands no more at bay, Rome's fresh young life has bled in vain; The ravens scattered by the day Come back with night again. "
236,TO PIUS IX.,"Now, while the fratricides of France Are treading on the neck of Rome, Hider at Gaeta, seize thy chance! Coward and cruel, come! "
237,TO PIUS IX.,"Creep now from Naples' bloody skirt; Thy mummer's part was acted well, While Rome, with steel and fire begirt, Before thy crusade fell! "
238,TO PIUS IX.,"Her death-groans answered to thy prayer; Thy chant, the drum and bugle-call; Thy lights, the burning villa's glare; Thy beads, the shell and ball! "
239,TO PIUS IX.,"Let Austria clear thy way, with hands Foul from Ancona's cruel sack, And Naples, with his dastard bands Of murderers, lead thee back! "
240,TO PIUS IX.,"Rome's lips are dumb; the orphan's wail, The mother's shriek, thou mayst not hear Above the faithless Frenchman's hail, The unsexed shaveling's cheer! "
241,TO PIUS IX.,"Go, bind on Rome her cast-off weight, The double curse of crook and crown, Though woman's scorn and manhood's hate From wall and roof flash down! "
242,TO PIUS IX.,"Nor heed those blood-stains on the wall, Not Tiber's flood can wash away, Where, in thy stately Quirinal, Thy mangled victims lay! "
243,TO PIUS IX.,Let the world murmur; let its cry Of horror and disgust be heard; Truth stands alone; thy coward lie Is backed by lance and sword! 
244,TO PIUS IX.,"The cannon of St. Angelo, And chanting priest and clanging bell, And beat of drum and bugle blow, Shall greet thy coming well! "
245,TO PIUS IX.,"Let lips of iron and tongues of slaves Fit welcome give thee; for her part, Rome, frowning o'er her new-made graves, Shall curse thee from her heart! "
246,TO PIUS IX.,No wreaths of sad Campagna's flowers Shall childhood in thy pathway fling; No garlands from their ravaged bowers Shall Terni's maidens bring; 
247,TO PIUS IX.,"But, hateful as that tyrant old, The mocking witness of his crime, In thee shall loathing eyes behold The Nero of our time! "
248,TO PIUS IX.,"Stand where Rome's blood was freest shed, Mock Heaven with impious thanks, and call Its curses on the patriot dead, Its blessings on the Gaul! "
249,TO PIUS IX.,"Or sit upon thy throne of lies, A poor, mean idol, blood-besmeared, Whom even its worshippers despise, Unhonored, unrevered! "
250,TO PIUS IX.,"Yet, Scandal of the World! from thee One needful truth mankind shall learn That kings and priests to Liberty And God are false in turn. "
251,TO PIUS IX.,"Earth wearies of them; and the long Meek sufferance of the Heavens doth fail; Woe for weak tyrants, when the strong Wake, struggle, and prevail! "
252,TO PIUS IX.,"Not vainly Roman hearts have bled To feed the Crosier and the Crown, If, roused thereby, the world shall tread The twin-born vampires down 1849. "
253,CALEF IN BOSTON.,CALEF IN BOSTON. 
254,CALEF IN BOSTON.,1692. 
255,CALEF IN BOSTON.,"IN the solemn days of old, Two men met in Boston town, One a tradesman frank and bold, One a preacher of renown. "
256,CALEF IN BOSTON.,"Cried the last, in bitter tone: ""Poisoner of the wells of truth Satan's hireling, thou hast sown With his tares the heart of youth!"" "
257,CALEF IN BOSTON.,"Spake the simple tradesman then, ""God be judge 'twixt thee and me; All thou knowed of truth hath been Once a lie to men like thee. "
258,CALEF IN BOSTON.,"""Falsehoods which we spurn to-day Were the truths of long ago; Let the dead boughs fall away, Fresher shall the living grow. "
259,CALEF IN BOSTON.,"""God is good and God is light, In this faith I rest secure; Evil can but serve the right, Over all shall love endure. "
260,CALEF IN BOSTON.,"""Of your spectral puppet play I have traced the cunning wires; Come what will, I needs must say, God is true, and ye are liars."" "
261,CALEF IN BOSTON.,"When the thought of man is free, Error fears its lightest tones; So the priest cried, ""Sadducee!"" And the people took up stones. "
262,CALEF IN BOSTON.,"In the ancient burying-ground, Side by side the twain now lie; One with humble grassy mound, One with marbles pale and high. "
263,CALEF IN BOSTON.,"But the Lord hath blest the seed Which that tradesman scattered then, And the preacher's spectral creed Chills no more the blood of men. "
264,CALEF IN BOSTON.,"Let us trust, to one is known Perfect love which casts out fear, While the other's joys atone For the wrong he suffered here. 1849. "
265,OUR STATE.,OUR STATE. 
266,OUR STATE.,"THE South-land boasts its teeming cane, The prairied West its heavy grain, And sunset's radiant gates unfold On rising marts and sands of gold. "
267,OUR STATE.,"Rough, bleak, and hard, our little State Is scant of soil, of limits strait; Her yellow sands are sands alone, Her only mines are ice and stone! "
268,OUR STATE.,"From Autumn frost to April rain, Too long her winter woods complain; From budding flower to falling leaf, Her summer time is all too brief. "
269,OUR STATE.,"Yet, on her rocks, and on her sands, And wintry hills, the school-house stands, And what her rugged soil denies, The harvest of the mind supplies. "
270,OUR STATE.,"The riches of the Commonwealth Are free, strong minds, and hearts of health; And more to her than gold or grain, The cunning hand and cultured brain. "
271,OUR STATE.,"For well she keeps her ancient stock, The stubborn strength of Pilgrim Rock; And still maintains, with milder laws, And clearer light, the Good Old Cause. "
272,OUR STATE.,"Nor heeds the skeptic's puny hands, While near her school the church-spire stands; Nor fears the blinded bigot's rule, While near her church-spire stands the school. 1549. "
273,THE PRISONERS OF NAPLES.,THE PRISONERS OF NAPLES. 
274,THE PRISONERS OF NAPLES.,"I HAVE been thinking of the victims bound In Naples, dying for the lack of air And sunshine, in their close, damp cells of pain, Where hope is not, and innocence in vain Appeals against the torture and the chain! Unfortunates! whose crime it was to share Our common love of freedom, and to dare, In its behalf, Rome's harlot triple-crowned, And her base pander, the most hateful thing Who upon Christian or on Pagan ground Makes vile the old heroic name of king. O God most merciful! Father just and kind Whom man hath bound let thy right hand unbind. Or, if thy purposes of good behind Their ills lie hidden, let the sufferers find Strong consolations; leave them not to doubt Thy providential care, nor yet without The hope which all thy attributes inspire, That not in vain the martyr's robe of fire Is worn, nor the sad prisoner's fretting chain; Since all who suffer for thy truth send forth, Electrical, with every throb of pain, Unquenchable sparks, thy own baptismal rain Of fire and spirit over all the earth, Making the dead in slavery live again. Let this great hope be with them, as they lie Shut from the light, the greenness, and the sky; From the cool waters and the pleasant breeze, The smell of flowers, and shade of summer trees; Bound with the felon lepers, whom disease And sins abhorred make loathsome; let them share Pellico's faith, Foresti's strength to bear Years of unutterable torment, stern and still, As the chained Titan victor through his will! Comfort them with thy future; let them see The day-dawn of Italian liberty; For that, with all good things, is hid with Thee, And, perfect in thy thought, awaits its time to be. "
275,THE PRISONERS OF NAPLES.,"I, who have spoken for freedom at the cost Of some weak friendships, or some paltry prize Of name or place, and more than I have lost Have gained in wider reach of sympathies, And free communion with the good and wise; May God forbid that I should ever boast Such easy self-denial, or repine That the strong pulse of health no more is mine; That, overworn at noonday, I must yield To other hands the gleaning of the field; A tired on-looker through the day's decline. For blest beyond deserving still, and knowing That kindly Providence its care is showing In the withdrawal as in the bestowing, Scarcely I dare for more or less to pray. Beautiful yet for me this autumn day Melts on its sunset hills; and, far away, For me the Ocean lifts its solemn psalm, To me the pine-woods whisper; and for me Yon river, winding through its vales of calm, By greenest banks, with asters purple-starred, And gentian bloom and golden-rod made gay, Flows down in silent gladness to the sea, Like a pure spirit to its great reward! "
276,THE PRISONERS OF NAPLES.,"Nor lack I friends, long-tried and near and dear, Whose love is round me like this atmosphere, Warm, soft, and golden. For such gifts to me What shall I render, O my God, to thee? Let me not dwell upon my lighter share Of pain and ill that human life must bear; Save me from selfish pining; let my heart, Drawn from itself in sympathy, forget The bitter longings of a vain regret, The anguish of its own peculiar smart. Remembering others, as I have to-day, In their great sorrows, let me live alway Not for myself alone, but have a part, Such as a frail and erring spirit may, In love which is of Thee, and which indeed Thou art! 1851. "
277,THE PEACE OF EUROPE.,THE PEACE OF EUROPE. 
278,THE PEACE OF EUROPE.,"""GREAT peace in Europe! Order reigns From Tiber's hills to Danube's plains!"" So say her kings and priests; so say The lying prophets of our day. "
279,THE PEACE OF EUROPE.,"Go lay to earth a listening ear; The tramp of measured marches hear; The rolling of the cannon's wheel, The shotted musket's murderous peal, The night alarm, the sentry's call, The quick-eared spy in hut and hall! From Polar sea and tropic fen The dying-groans of exiled men! The bolted cell, the galley's chains, The scaffold smoking with its stains! Order, the hush of brooding slaves Peace, in the dungeon-vaults and graves! "
280,THE PEACE OF EUROPE.,"O Fisher! of the world-wide net, With meshes in all waters set, Whose fabled keys of heaven and hell Bolt hard the patriot's prison-cell, And open wide the banquet-hall, Where kings and priests hold carnival! Weak vassal tricked in royal guise, Boy Kaiser with thy lip of lies; Base gambler for Napoleon's crown, Barnacle on his dead renown! Thou, Bourbon Neapolitan, Crowned scandal, loathed of God and man And thou, fell Spider of the North! Stretching thy giant feelers forth, Within whose web the freedom dies Of nations eaten up like flies! Speak, Prince and Kaiser, Priest and Czar I If this be Peace, pray what is War? "
281,THE PEACE OF EUROPE.,"White Angel of the Lord! unmeet That soil accursed for thy pure feet. Never in Slavery's desert flows The fountain of thy charmed repose; No tyrant's hand thy chaplet weaves Of lilies and of olive-leaves; Not with the wicked shalt thou dwell, Thus saith the Eternal Oracle; Thy home is with the pure and free! Stern herald of thy better day, Before thee, to prepare thy way, The Baptist Shade of Liberty, Gray, scarred and hairy-robed, must press With bleeding feet the wilderness! Oh that its voice might pierces the ear Of princes, trembling while they hear A cry as of the Hebrew seer Repent! God's kingdom draweth near! 1852. "
282,ASTRAEA.,ASTRAEA. 
283,"BEN JONSON, 1615.","""Jove means to settle Astraea in her seat again, And let down from his golden chain An age of better metal."" BEN JONSON, 1615. "
284,"BEN JONSON, 1615.","O POET rare and old! Thy words are prophecies; Forward the age of gold, The new Saturnian lies. "
285,"BEN JONSON, 1615.","The universal prayer And hope are not in vain; Rise, brothers! and prepare The way for Saturn's reign. "
286,"BEN JONSON, 1615.",Perish shall all which takes From labor's board and can; Perish shall all which makes A spaniel of the man! 
287,"BEN JONSON, 1615.","Free from its bonds the mind, The body from the rod; Broken all chains that bind The image of our God. "
288,"BEN JONSON, 1615.",Just men no longer pine Behind their prison-bars; Through the rent dungeon shine The free sun and the stars. 
289,"BEN JONSON, 1615.","Earth own, at last, untrod By sect, or caste, or clan, The fatherhood of God, The brotherhood of man! "
290,"BEN JONSON, 1615.","Fraud fail, craft perish, forth The money-changers driven, And God's will done on earth, As now in heaven; 1852. "
291,THE DISENTHRALLED.,THE DISENTHRALLED. 
