,Poem Title,line
2976,APPRECIATIONS,"instead of progression, of thought. . ."
2977,APPRECIATIONS,
2978,APPRECIATIONS,"""Fifth and last; thoughts and images too great for the subject.  This"
2979,APPRECIATIONS,"is an approximation to what might be called mental bombast, as"
2980,APPRECIATIONS,"distinguished from verbal: for, as in the latter there is a"
2981,APPRECIATIONS,"disproportion of the expressions to the thoughts, so in this there is a"
2982,APPRECIATIONS,disproportion of thought to the circumstance and occasion. . .
2983,APPRECIATIONS,
2984,APPRECIATIONS,"""To these defects, which . . . are only occasional, I may oppose . . ."
2985,APPRECIATIONS,the following (for the most part correspondent) excellencies:
2986,APPRECIATIONS,
2987,APPRECIATIONS,"""First; an austere purity of language both grammatically and logically;"
2988,APPRECIATIONS,in short a perfect appropriateness of the words to the meaning. . .
2989,APPRECIATIONS,
2990,APPRECIATIONS,"""The second characteristic excellence of Mr. Wordsworth's works is--a"
2991,APPRECIATIONS,"correspondent weight and sanity of the thoughts and sentiments, won not"
2992,APPRECIATIONS,"from books, but from the poet's own meditative observations.  They are"
2993,APPRECIATIONS,fresh and have the dew upon them. . .
2994,APPRECIATIONS,
2995,APPRECIATIONS,"""Third; . . . the sinewy strength and originality of single lines and"
2996,APPRECIATIONS,paragraphs; the frequent _curiosa felicitas_ of his diction. . .
2997,APPRECIATIONS,
2998,APPRECIATIONS,"""Fourth; the perfect truth of nature in his images and descriptions as"
2999,APPRECIATIONS,"taken immediately from nature, and proving a long and genial intimacy"
3000,APPRECIATIONS,with the very spirit which gives the physiognomic expressions to all
3001,APPRECIATIONS,the works of nature.  Like a green field reflected in a calm and
3002,APPRECIATIONS,"perfectly transparent lake, the image is distinguished from the reality"
3003,APPRECIATIONS,only by its greater softness and lustre.  Like the moisture or the
3004,APPRECIATIONS,"polish on a pebble, genius neither distorts nor false-colors its"
3005,APPRECIATIONS,"objects; but on the contrary, brings out many a vein and many a tint,"
3006,APPRECIATIONS,"which escape the eye of common observation, thus raising to the rank of"
3007,APPRECIATIONS,gems what had been often kicked away by the hurrying foot of the
3008,APPRECIATIONS,traveller on the dusty high-road of custom. . .
3009,APPRECIATIONS,
3010,APPRECIATIONS,"""Fifth; a meditative pathos, a union of deep and subtle thought with"
3011,APPRECIATIONS,sensibility; a sympathy with man as man; the sympathy indeed of a
3012,APPRECIATIONS,"contemplator, rather than a fellow-sufferer or co-mate, but of a"
3013,APPRECIATIONS,"contemplator, from whose view no difference of rank conceals the"
3014,APPRECIATIONS,"sameness of the nature; no injuries of wind or weather, of toil, or"
3015,APPRECIATIONS,"even of ignorance, wholly disguise the human face divine.  The"
3016,APPRECIATIONS,superscription and the image of the Creator still remains legible to
3017,APPRECIATIONS,"_him_ under the dark lines, with which guilt or calamity had cancelled"
3018,APPRECIATIONS,or cross-barred it.  Here the Man and the Poet lose and find themselves
3019,APPRECIATIONS,"in each other, the one as glorified, the latter as substantiated.  In"
3020,APPRECIATIONS,"this mild and philosophic pathos, Wordsworth appears to me without a"
3021,APPRECIATIONS,compeer.  Such as he is; so he writes.
3022,APPRECIATIONS,
3023,APPRECIATIONS,"""Last and pre-eminently, I challenge for this poet the gift of"
3024,APPRECIATIONS,imagination in the highest and strictest sense of the word.  In the
3025,APPRECIATIONS,"play of fancy, Wordsworth, to my feelings, is not always graceful, and"
3026,APPRECIATIONS,"sometimes recondite. . . But in imaginative power, he stands nearest of"
3027,APPRECIATIONS,all writers to Shakespeare and Milton; and yet in a kind perfectly
3028,APPRECIATIONS,"unborrowed and his own."""
3029,APPRECIATIONS,
3030,APPRECIATIONS,These are the grounds upon which Coleridge bases the poetic claims of
3031,APPRECIATIONS,Wordsworth.
3032,APPRECIATIONS,
3033,APPRECIATIONS,"Matthew Arnold, in the preface to his well-known collection of"
3034,APPRECIATIONS,"Wordsworth's poems, accords to the poet a rank no less exalted.  ""I"
3035,APPRECIATIONS,"firmly believe that the poetical performance of Wordsworth is, after"
3036,APPRECIATIONS,"that of Shakespeare and Milton, of which all the world now recognizes"
3037,APPRECIATIONS,"the worth, undoubtedly the most considerable in our language from the"
3038,APPRECIATIONS,"Elizabethan age to the present time.""  His essential greatness is to be"
3039,APPRECIATIONS,"found in his shorter pieces, despite the frequent intrusion of much"
3040,APPRECIATIONS,"that is very inferior.  Still it is ""by the great body of powerful and"
3041,APPRECIATIONS,significant work which remains to him after every reduction and
3042,APPRECIATIONS,"deduction has been made, that Wordsworth's superiority is proved."""
3043,APPRECIATIONS,
3044,APPRECIATIONS,"Coleridge had not dwelt sufficiently, perhaps, upon the joyousness"
3045,APPRECIATIONS,which results from Wordsworth's philosophy of human life and external
3046,APPRECIATIONS,nature.  This Matthew Arnold considers to be the prime source of his
3047,APPRECIATIONS,"greatness.  ""Wordsworth's poetry is great because of the extraordinary"
3048,APPRECIATIONS,power with which Wordsworth feels the joy offered to us in the simple
3049,APPRECIATIONS,primary affections and duties; and because of the extraordinary power
3050,APPRECIATIONS,"with which, in case after case, he shows us this joy, and renders it so"
3051,APPRECIATIONS,"as to make us share it.""  Goethe's poetry, as Wordsworth once said, is"
3052,APPRECIATIONS,"not inevitable enough, is too consciously moulded by the supreme will"
3053,APPRECIATIONS,"of the artist.  ""But Wordsworth's poetry,"" writes Arnold, ""when he is"
3054,APPRECIATIONS,"at his best, is inevitable, as inevitable as Nature herself.  It might"
3055,APPRECIATIONS,"seem that Nature not only gave him the matter for his poem, but wrote"
3056,APPRECIATIONS,"his poem for him.""  The set poetic style of _The Excursion_ is a"
3057,APPRECIATIONS,"failure, but there is something unique and unmatchable in the simple"
3058,APPRECIATIONS,"grace of his narrative poems and lyrics.  ""Nature herself seems, I say,"
3059,APPRECIATIONS,"to take the pen out of his hand, and to write for him with her own"
3060,APPRECIATIONS,"bare, sheer, penetrating power.  This arises from two causes: from the"
3061,APPRECIATIONS,"profound sincereness with which Wordsworth feels his subject, and also"
3062,APPRECIATIONS,from the profoundly sincere and natural character of his subject
3063,APPRECIATIONS,itself.  He can and will treat such a subject with nothing but the most
3064,APPRECIATIONS,"plain, first hand, almost austere naturalness.  His expression may"
3065,APPRECIATIONS,"often be called bald, as, for instance, in the poem of _Resolution and"
3066,APPRECIATIONS,"Independence_; but it is bald as the bare mountain tops are bald, with"
3067,APPRECIATIONS,a baldness which is full of grandeur. . .  Wherever we meet with the
3068,APPRECIATIONS,"successful balance, in Wordsworth, of profound truth of subject with"
3069,APPRECIATIONS,"profound truth of execution, he is unique."""
3070,APPRECIATIONS,
3071,APPRECIATIONS,Professor Dowden has also laid stress upon the harmonious balance of
3072,APPRECIATIONS,"Wordsworth's nature, his different faculties seeming to interpenetrate"
3073,APPRECIATIONS,"one another, and yield mutual support.  He has likewise called"
3074,APPRECIATIONS,attention to the austere naturalism of which Arnold speaks.
3075,APPRECIATIONS,"""Wordsworth was a great naturalist in literature, but he was also a"
3076,APPRECIATIONS,great Idealist; and between the naturalist and the idealist in
3077,APPRECIATIONS,"Wordsworth no opposition existed: each worked with the other, each"
3078,APPRECIATIONS,"served the other.  While Scott, by allying romance with reality, saved"
3079,APPRECIATIONS,romantic fiction from the extravagances and follies into which it had
3080,APPRECIATIONS,"fallen, Wordsworth's special work was to open a higher way for"
3081,APPRECIATIONS,"naturalism in art by its union with ideal truth."""
3082,APPRECIATIONS,
3083,APPRECIATIONS,"Criticism has long since ceased to ridicule his _Betty Foy_, and his"
3084,APPRECIATIONS,"_Harry Gill_, whose ""teeth, they chatter, chatter still.""  Such"
3085,APPRECIATIONS,"malicious sport proved only too easy for Wordsworth's contemporaries,"
3086,APPRECIATIONS,and still the essential value of his poetry was unimpaired.
3087,APPRECIATIONS,
3088,APPRECIATIONS,"The range of poetry is indeed inexhaustible, and even the greatest"
3089,APPRECIATIONS,poets must suffer some subtraction from universal pre-eminence.
3090,APPRECIATIONS,"Therefore we may frankly admit the deficiencies of Wordsworth,--that he"
3091,APPRECIATIONS,was lacking in dramatic force and in the power of characterization;
3092,APPRECIATIONS,"that he was singularly deficient in humor, and therefore in the saving"
3093,APPRECIATIONS,grace of self-criticism in the capacity to see himself occasionally in
3094,APPRECIATIONS,a ridiculous light; that he has little of the romantic glamor and none
3095,APPRECIATIONS,of the narrative energy of Scott; that Shelley's lyrical flights leave
3096,APPRECIATIONS,him plodding along the dusty highway; and that Byron's preternatural
3097,APPRECIATIONS,force makes his passion seen by contrast pale and ineffectual.  All
3098,APPRECIATIONS,"this and more may freely be granted, and yet for his influence upon"
3099,APPRECIATIONS,"English thought, and especially upon the poetic thought of his country,"
3100,APPRECIATIONS,he must be named after Shakespeare and Milton.  The intellectual value
3101,APPRECIATIONS,"of his work will endure; for leaving aside much valuable doctrine,"
3102,APPRECIATIONS,"which from didactic excess fails as poetry, he has brought into the"
3103,APPRECIATIONS,world a new philosophy of Nature and has emphasised in a manner
3104,APPRECIATIONS,distinctively his own the dignity of simple manhood.--_Pelham Edgar_.
3105,APPRECIATIONS,
3106,APPRECIATIONS,
3107,APPRECIATIONS,
3108,REFERENCES ON WORDSWORTH'S LIFE AND WORKS,REFERENCES ON WORDSWORTH'S LIFE AND WORKS
3109,REFERENCES ON WORDSWORTH'S LIFE AND WORKS,
3110,REFERENCES ON WORDSWORTH'S LIFE AND WORKS,"_Wordsworth_ by F. W. H. Myers, in _English Men of Letters_ series."
3111,REFERENCES ON WORDSWORTH'S LIFE AND WORKS,"Toronto: The Macmillan Company of Canada, Limited."
3112,REFERENCES ON WORDSWORTH'S LIFE AND WORKS,
3113,REFERENCES ON WORDSWORTH'S LIFE AND WORKS,"_Wordsworth_ by Walter Raleigh, London: Edward Arnold."
3114,REFERENCES ON WORDSWORTH'S LIFE AND WORKS,
3115,REFERENCES ON WORDSWORTH'S LIFE AND WORKS,"_Wordsworth_ by Rosaline Masson, in _The People's Books_ series."
3116,REFERENCES ON WORDSWORTH'S LIFE AND WORKS,"London: T. C. & E. C. Jack,"
3117,REFERENCES ON WORDSWORTH'S LIFE AND WORKS,
3118,REFERENCES ON WORDSWORTH'S LIFE AND WORKS,_Wordsworthiana_ edited by William Knight.  Toronto: The Macmillan
3119,REFERENCES ON WORDSWORTH'S LIFE AND WORKS,"Company of Canada, Limited."
3120,REFERENCES ON WORDSWORTH'S LIFE AND WORKS,
3121,REFERENCES ON WORDSWORTH'S LIFE AND WORKS,"_Essays Chiefly on Poetry_ by Aubrey de Vere, 2 volumes.  Toronto: The"
3122,REFERENCES ON WORDSWORTH'S LIFE AND WORKS,"Macmillan Company of Canada, Limited."
3123,REFERENCES ON WORDSWORTH'S LIFE AND WORKS,
3124,REFERENCES ON WORDSWORTH'S LIFE AND WORKS,_Literary Essays_ by Richard Holt Hutton.  Toronto: The Macmillan
3125,REFERENCES ON WORDSWORTH'S LIFE AND WORKS,"Company of Canada, Limited."
3126,REFERENCES ON WORDSWORTH'S LIFE AND WORKS,
3127,REFERENCES ON WORDSWORTH'S LIFE AND WORKS,"_Studies in Literature_ by Edward Dowden.  London: Kegan Paul, Trench,"
3128,REFERENCES ON WORDSWORTH'S LIFE AND WORKS,"Trubner & Co., Ltd."
3129,REFERENCES ON WORDSWORTH'S LIFE AND WORKS,
3130,REFERENCES ON WORDSWORTH'S LIFE AND WORKS,_Aspects of Poetry_ by J. S. C. Shairp.  Boston: Houghton Mifflin and
3131,REFERENCES ON WORDSWORTH'S LIFE AND WORKS,Company.
3132,REFERENCES ON WORDSWORTH'S LIFE AND WORKS,
3133,REFERENCES ON WORDSWORTH'S LIFE AND WORKS,_Lives of Great English Writers from Chaucer to Browning_ by Walter S.
3134,REFERENCES ON WORDSWORTH'S LIFE AND WORKS,"Hinchman and Francis B. Gummere.  Boston: Houghton, Mifflin and Company."
3135,REFERENCES ON WORDSWORTH'S LIFE AND WORKS,
3136,REFERENCES ON WORDSWORTH'S LIFE AND WORKS,_Great English Poets_ by Julian Hill.  Philadelphia: George W. Jacobs &
3137,REFERENCES ON WORDSWORTH'S LIFE AND WORKS,Co.
3138,REFERENCES ON WORDSWORTH'S LIFE AND WORKS,
3139,REFERENCES ON WORDSWORTH'S LIFE AND WORKS,_The Greater English Poets of the Nineteenth Century_ by William Morton
3140,REFERENCES ON WORDSWORTH'S LIFE AND WORKS,Payne.  New York: Henry Holt and Company.
3141,REFERENCES ON WORDSWORTH'S LIFE AND WORKS,
3142,REFERENCES ON WORDSWORTH'S LIFE AND WORKS,"_The Religious Spirit in the Poets_ by W. Boyd Carpenter, New York:"
3143,REFERENCES ON WORDSWORTH'S LIFE AND WORKS,"Thomas Y. Crowell & Co,"
3144,REFERENCES ON WORDSWORTH'S LIFE AND WORKS,
3145,REFERENCES ON WORDSWORTH'S LIFE AND WORKS,_Landscape in Poetry from Homer to Tennyson_ by Francis T. Palgrave.
3146,REFERENCES ON WORDSWORTH'S LIFE AND WORKS,"Toronto: The Macmillan Company of Canada, Limited."
3147,REFERENCES ON WORDSWORTH'S LIFE AND WORKS,
3148,REFERENCES ON WORDSWORTH'S LIFE AND WORKS,_A History of Nineteenth Century Literature_ by George Saintsbury.
3149,REFERENCES ON WORDSWORTH'S LIFE AND WORKS,"Toronto: The Macmillan Company of Canada, Limited."
3150,REFERENCES ON WORDSWORTH'S LIFE AND WORKS,
3151,REFERENCES ON WORDSWORTH'S LIFE AND WORKS,_Personal Traits of British Authors_ by E. T. Mason.  New York: Charles
3152,REFERENCES ON WORDSWORTH'S LIFE AND WORKS,Scribner's Sons.
3153,REFERENCES ON WORDSWORTH'S LIFE AND WORKS,
3154,REFERENCES ON WORDSWORTH'S LIFE AND WORKS,"_The English Poets_ edited by T. Humphrey Ward, Vol. iv.  Toronto: The"
3155,REFERENCES ON WORDSWORTH'S LIFE AND WORKS,"Macmillan Company of Canada, Limited."
3156,REFERENCES ON WORDSWORTH'S LIFE AND WORKS,
3157,REFERENCES ON WORDSWORTH'S LIFE AND WORKS,_Selections from Wordsworth_ edited by Matthew Arnold in _The Golden
3158,REFERENCES ON WORDSWORTH'S LIFE AND WORKS,"Treasury Series_.  Toronto: The Macmillan Company of Canada, Limited."
3159,REFERENCES ON WORDSWORTH'S LIFE AND WORKS,
3160,REFERENCES ON WORDSWORTH'S LIFE AND WORKS,"_Literary Studies_ by Walter Bagehot,  Vol. ii.  London: Longmans,"
3161,REFERENCES ON WORDSWORTH'S LIFE AND WORKS,Green and Co.
3162,REFERENCES ON WORDSWORTH'S LIFE AND WORKS,
3163,REFERENCES ON WORDSWORTH'S LIFE AND WORKS,_A Study of English and American Poets_ by J. Scott Clark.  New York:
3164,REFERENCES ON WORDSWORTH'S LIFE AND WORKS,Charles Scribner's Sons.
3165,REFERENCES ON WORDSWORTH'S LIFE AND WORKS,
3166,REFERENCES ON WORDSWORTH'S LIFE AND WORKS,_Prophets of the Century_ edited by Arthur Rickett.  London: Ward Lock
3167,REFERENCES ON WORDSWORTH'S LIFE AND WORKS,"and Co., Limited."
3168,REFERENCES ON WORDSWORTH'S LIFE AND WORKS,
3169,REFERENCES ON WORDSWORTH'S LIFE AND WORKS,_History of English Literature_ by A. S. Mackenzie.  Toronto: The
3170,REFERENCES ON WORDSWORTH'S LIFE AND WORKS,"Macmillan Company of Canada, Limited."
3171,REFERENCES ON WORDSWORTH'S LIFE AND WORKS,
3172,REFERENCES ON WORDSWORTH'S LIFE AND WORKS,_A Student's History of English Literature_ by William Edward Simonds.
3173,REFERENCES ON WORDSWORTH'S LIFE AND WORKS,"Boston: Houghton, Mifflin and Company."
3174,REFERENCES ON WORDSWORTH'S LIFE AND WORKS,
3175,REFERENCES ON WORDSWORTH'S LIFE AND WORKS,_Poems of William Wordsworth_ edited by Edward Dowden.  Boston: Ginn &
3176,REFERENCES ON WORDSWORTH'S LIFE AND WORKS,Company.
3177,REFERENCES ON WORDSWORTH'S LIFE AND WORKS,
3178,REFERENCES ON WORDSWORTH'S LIFE AND WORKS,_Home Life of Great Authors_ by Hattie Tyng Griswold.  Chicago: A. C.
3179,REFERENCES ON WORDSWORTH'S LIFE AND WORKS,McClurg & Co.
3180,REFERENCES ON WORDSWORTH'S LIFE AND WORKS,
3181,REFERENCES ON WORDSWORTH'S LIFE AND WORKS,
3182,NOTES,NOTES
3183,NOTES,
3184,MICHAEL,MICHAEL
3185,MICHAEL,
3186,MICHAEL,"The poem was composed in 1800, and published in the second volume of the"
3187,MICHAEL,"_Lyrical Ballads_ in the same year.  ""Written at the Town-end, Grasmere,"
3188,MICHAEL,"about the same time as _The Brothers_.  The Sheep-fold, on which so much"
3189,MICHAEL,"of the poem turns, remains, or rather the ruins of it.  The character and"
3190,MICHAEL,"circumstances of Luke were taken from a family to whom had belonged, many"
3191,MICHAEL,"years before, the house we lived in at Town-end, along with some fields"
3192,MICHAEL,and woodlands on the eastern shore of Grasmere.  The name of the Evening
3193,MICHAEL,"Star was not in fact given to this house, but to another on the same side"
3194,MICHAEL,"of the valley, more to the north."""
3195,MICHAEL,
3196,MICHAEL,"In a letter to Charles James Fox the poet says: ""In the two poems, _The"
3197,MICHAEL,"Brothers_ and _Michael_, I have attempted to draw a picture of the"
3198,MICHAEL,"domestic affections, as I know they exist among a class of men who are"
3199,MICHAEL,now almost confined to the north of England.  They are small independent
3200,MICHAEL,"_proprietors_ of land, here called 'statesmen' [i.e., estates-men], men"
3201,MICHAEL,"of respectable education, who daily labor on their little properties. . ."
3202,MICHAEL,Their little tract of land serves as a kind of rallying point for their
3203,MICHAEL,"domestic feelings, as a tablet upon which they are written, which makes"
3204,MICHAEL,"them objects of memory in a thousand instances, when they would otherwise"
3205,MICHAEL,be forgotten.  The two poems that I have mentioned were written to show
3206,MICHAEL,"that men who do not wear fine clothes can feel deeply."""
3207,MICHAEL,
3208,MICHAEL,Edward Fulton in a _A Selection of the Shorter Poems of Wordsworth_
3209,MICHAEL,"(Macmillan) says: ""The reason Wordsworth succeeds best in describing the"
3210,MICHAEL,"type of character portrayed in _Michael_ and _The Brothers_ is, of"
3211,MICHAEL,"course, chiefly because he knew that type best; but the fact that it was"
3212,MICHAEL,the type for which he himself might have stood as the representative was
3213,MICHAEL,not without its effect upon him.  His ideal man is but a variation of
3214,MICHAEL,himself.  As Dean Church puts it: 'The ideal man with Wordsworth is the
3215,MICHAEL,"hard-headed, frugal, unambitious dalesman of his own hills, with his"
3216,MICHAEL,"strong affections, his simple tastes, and his quiet and beautiful home;"
3217,MICHAEL,"and this dalesman, built up by communion with nature and by meditation"
3218,MICHAEL,"into the poet-philosopher, with his serious faith and his never-failing"
3219,MICHAEL,"spring of enjoyment, is himself.'  Types of character wholly alien to his"
3220,MICHAEL,own have little attraction for him.  He is content to look into the
3221,MICHAEL,depths of his own heart and to represent what he sees there.  His field
3222,MICHAEL,"of vision, therefore, is a very limited one: it takes in only a few"
3223,MICHAEL,"types.  It is _man_, in fact, rather than men, that interests him."""
3224,MICHAEL,
3225,MICHAEL,The poem _Michael_ is well adapted to show Wordsworth's powers of
3226,MICHAEL,"realism.  He describes the poem as ""a pastoral,"" which at once induces a"
3227,MICHAEL,"comparison, greatly to Wordsworth's advantage, with the pseudo-pastorals"
3228,MICHAEL,of the age of Pope.  There the shepherds and shepherdesses were scarcely
3229,MICHAEL,"the pale shadows of reality, while Wordsworth's poem never swerves from"
3230,MICHAEL,"the line of truth.  ""The poet,"" as Sir Henry Taylor says with reference"
3231,MICHAEL,"to _Michael_, ""writes in his confidence to impart interest to the"
3232,MICHAEL,"realities of life, deriving both the confidence and the power from the"
3233,MICHAEL,deep interest which he feels in them.  It is an attribute of unusual
3234,MICHAEL,susceptibility of imagination to need no extraordinary provocatives; and
3235,MICHAEL,when this is combined with intensity of observation and peculiarity of
3236,MICHAEL,"language, it is the high privilege of the poet so endowed to rest upon"
3237,MICHAEL,"the common realities of life and to dispense with its anomalies.""  The"
3238,MICHAEL,student should therefore be careful to observe (1) the truth of
3239,MICHAEL,"description, and the appropriateness of the description to the"
3240,MICHAEL,characters; (2) the strong and accurate delineation of the characters
3241,MICHAEL,themselves.  Not only is this to be noted in the passages where the poet
3242,MICHAEL,"has taken pains openly to portray their various characteristics, but"
3243,MICHAEL,"there are many passages, or single lines perhaps, which serve more subtly"
3244,MICHAEL,"to delineate them.  What proud reserve, what sorrow painfully restrained,"
3245,MICHAEL,"the following line, for example, contains: ""Two evenings after he had"
3246,MICHAEL,"heard the news."""
3247,MICHAEL,
3248,MICHAEL,
3249,MICHAEL,
3250,TO THE DAISY,TO THE DAISY
3251,TO THE DAISY,
3252,COMPOSED 1802: PUBLISHED 1807,COMPOSED 1802: PUBLISHED 1807
3253,COMPOSED 1802: PUBLISHED 1807,
3254,COMPOSED 1802: PUBLISHED 1807,"""This and the other poems addressed to the same flower were composed at"
3255,COMPOSED 1802: PUBLISHED 1807,"Town-end, Grasmere, during the earlier part of my residence there.""  The"
3256,COMPOSED 1802: PUBLISHED 1807,"three poems on the Daisy were the outpourings of one mood, and were"
3257,COMPOSED 1802: PUBLISHED 1807,prompted by the same spirit which moved him to write his poems of humble
3258,COMPOSED 1802: PUBLISHED 1807,life.  The sheltered garden flowers have less attraction for him than the
3259,COMPOSED 1802: PUBLISHED 1807,common blossoms by the wayside.  In their unobtrusive humility these
3260,COMPOSED 1802: PUBLISHED 1807,"""unassuming Common-places of Nature"" might be regarded, as the poet says,"
3261,COMPOSED 1802: PUBLISHED 1807,"""as administering both to moral and spiritual purposes.""  The ""Lesser"
3262,COMPOSED 1802: PUBLISHED 1807,"Celandine,"" buffeted by the storm, affords him, on another occasion, a"
3263,COMPOSED 1802: PUBLISHED 1807,symbol of meek endurance.
3264,COMPOSED 1802: PUBLISHED 1807,
3265,COMPOSED 1802: PUBLISHED 1807,Shelley and Keats have many beautiful references to flowers in their
3266,COMPOSED 1802: PUBLISHED 1807,"poetry.  Keats has merely a sensuous delight in their beauty, while"
3267,COMPOSED 1802: PUBLISHED 1807,"Shelley both revels in their hues and fragrance, and sees in them a"
3268,COMPOSED 1802: PUBLISHED 1807,symbol of transitory loveliness.  His _Sensitive Plant_ shows his
3269,COMPOSED 1802: PUBLISHED 1807,exquisite sympathy for flower life.
3270,COMPOSED 1802: PUBLISHED 1807,
3271,COMPOSED 1802: PUBLISHED 1807,
3272,COMPOSED 1802: PUBLISHED 1807,
3273,TO THE CUCKOO,TO THE CUCKOO
3274,TO THE CUCKOO,
3275,COMPOSED IN THE ORCHARD AT TOWN-END 1802: PUBLISHED 1807,COMPOSED IN THE ORCHARD AT TOWN-END 1802: PUBLISHED 1807
3276,COMPOSED IN THE ORCHARD AT TOWN-END 1802: PUBLISHED 1807,
3277,COMPOSED IN THE ORCHARD AT TOWN-END 1802: PUBLISHED 1807,"Wordsworth, in his Preface to the 1815 edition, has the following note on"
3278,COMPOSED IN THE ORCHARD AT TOWN-END 1802: PUBLISHED 1807,"ll. 3, 4 of the poem:--""This concise interrogation characterises the"
3279,COMPOSED IN THE ORCHARD AT TOWN-END 1802: PUBLISHED 1807,"seeming ubiquity of the cuckoo, and dispossesses the creature almost of"
3280,COMPOSED IN THE ORCHARD AT TOWN-END 1802: PUBLISHED 1807,corporeal existence; the Imagination being tempted to this exertion of
3281,COMPOSED IN THE ORCHARD AT TOWN-END 1802: PUBLISHED 1807,"her power, by a consciousness in the memory that the cuckoo is almost"
3282,COMPOSED IN THE ORCHARD AT TOWN-END 1802: PUBLISHED 1807,"perpetually heard throughout the season of spring, but seldom becomes an"
3283,COMPOSED IN THE ORCHARD AT TOWN-END 1802: PUBLISHED 1807,"object of sight.""  The cuckoo is the bird we associate with the name of"
3284,COMPOSED IN THE ORCHARD AT TOWN-END 1802: PUBLISHED 1807,"the vale of sunshine and of flowers, and yet its wandering voice brings"
3285,COMPOSED IN THE ORCHARD AT TOWN-END 1802: PUBLISHED 1807,back to him the thought of his vanished childhood.  We have already
3286,COMPOSED IN THE ORCHARD AT TOWN-END 1802: PUBLISHED 1807,noticed the almost sacred value which Wordsworth attaches to the
3287,COMPOSED IN THE ORCHARD AT TOWN-END 1802: PUBLISHED 1807,"impressions of his youth, and even to the memory of these impressions"
3288,COMPOSED IN THE ORCHARD AT TOWN-END 1802: PUBLISHED 1807,which remains with him to console his maturer life.  The bird is a link
3289,COMPOSED IN THE ORCHARD AT TOWN-END 1802: PUBLISHED 1807,which binds him to his childhood:
3290,COMPOSED IN THE ORCHARD AT TOWN-END 1802: PUBLISHED 1807,
3291,COMPOSED IN THE ORCHARD AT TOWN-END 1802: PUBLISHED 1807,"""And I can listen to thee yet;"
3292,COMPOSED IN THE ORCHARD AT TOWN-END 1802: PUBLISHED 1807,Can lie upon the plain
3293,COMPOSED IN THE ORCHARD AT TOWN-END 1802: PUBLISHED 1807,"And listen, till I do beget"
3294,COMPOSED IN THE ORCHARD AT TOWN-END 1802: PUBLISHED 1807,"That golden time again."""
3295,COMPOSED IN THE ORCHARD AT TOWN-END 1802: PUBLISHED 1807,
3296,COMPOSED IN THE ORCHARD AT TOWN-END 1802: PUBLISHED 1807,"In other poems, especially in the _Intimaticns of Immortality_, he speaks"
3297,COMPOSED IN THE ORCHARD AT TOWN-END 1802: PUBLISHED 1807,"of ""the glory and the freshness of a dream,"" which hallowed nature for"
3298,COMPOSED IN THE ORCHARD AT TOWN-END 1802: PUBLISHED 1807,"him as a child, and which grew fainter as the ""shades of the prison-house"
