,Poem Title,line
665,XXII.,Half frightened at this love that ran
666,XXII.,Hard gallop till her hot heart beat
667,XXII.,Like sounding of swift courser's feet.
668,XXII.,
669,XXII.,
670,XXIII.,XXIII.
671,XXIII.,
672,XXIII.,Two strong streams of a land must run
673,XXIII.,Together surely as the sun
674,XXIII.,Succeeds the moon. Who shall gainsay
675,XXIII.,"The fates that reign, that wisely reign?"
676,XXIII.,"Love is, love was, shall be again."
677,XXIII.,"Like death, inevitable it is;"
678,XXIII.,"Perchance, like death, the dawn of bliss."
679,XXIII.,"Let us, then, love the perfect day,"
680,XXIII.,"The twelve o'clock of life, and stop"
681,XXIII.,"The two hands pointing to the top,"
682,XXIII.,And hold them tightly while we may.
683,XXIII.,
684,XXIII.,
685,XXIV.,XXIV.
686,XXIV.,
687,XXIV.,How piteous strange is love! The walks
688,XXIV.,By wooded ways; the silent talks
689,XXIV.,Beneath the broad and fragrant bough.
690,XXIV.,"The dark deep wood, the dense black dell,"
691,XXIV.,Where scarce a single gold beam fell
692,XXIV.,From out the sun.
693,XXIV.,They rested now
694,XXIV.,On mossy trunk. They wandered then
695,XXIV.,Where never fell the feet of men.
696,XXIV.,
697,XXIV.,"Then longer walks, then deeper woods,"
698,XXIV.,"Then sweeter talks, sufficient sweet,"
699,XXIV.,"In denser, deeper solitudes,--"
700,XXIV.,Dear careless ways for careless feet;
701,XXIV.,"Sweet talks of paradise for two,"
702,XXIV.,"And only two, to watch or woo."
703,XXIV.,
704,XXIV.,She rarely spake. All seemed a dream
705,XXIV.,She would not waken from. She lay
706,XXIV.,"All night but waiting for the day,"
707,XXIV.,"When she might see his face, and deem"
708,XXIV.,"This man, with all his perils passed,"
709,XXIV.,Had found the Lotus-land at last.
710,XXIV.,
711,XXIV.,
712,XXV.,XXV.
713,XXV.,
714,XXV.,"The year waxed fervid, and the sun"
715,XXV.,Fell central down. The forest lay
716,XXV.,A-quiver in the heat. The sea
717,XXV.,Below the steep bank seemed to run
718,XXV.,A molten sea of gold.
719,XXV.,Away
720,XXV.,Against the gray and rock-built isles
721,XXV.,That broke the molten watery miles
722,XXV.,"Where lonesome sea-cows called all day,"
723,XXV.,The sudden sun smote angrily.
724,XXV.,
725,XXV.,"Therefore the need of deeper deeps,"
726,XXV.,"Of denser shade for man and maid,"
727,XXV.,"Of higher heights, of cooler steeps,"
728,XXV.,Where all day long the sea-wind stayed.
729,XXV.,
730,XXV.,They sought the rock-reared steep. The breeze
731,XXV.,Swept twenty thousand miles of seas;
732,XXV.,Had twenty thousand things to say
733,XXV.,"Of love, of lovers of Cathay,"
734,XXV.,To lovers 'mid these high-held trees.
735,XXV.,
736,XXV.,
737,XXVI.,XXVI.
738,XXVI.,
739,XXVI.,"To left, to right, below the height,"
740,XXVI.,"Below the wood by wave and stream,"
741,XXVI.,Plumed pampas grasses grew to gleam
742,XXVI.,"And bend their lordly plumes, and run"
743,XXVI.,"And shake, as if in very fright"
744,XXVI.,Before sharp lances of the sun.
745,XXVI.,
746,XXVI.,They saw the tide-bound battered ship
747,XXVI.,Creep close below against the bank;
748,XXVI.,They saw it cringe and shrink; it shrank
749,XXVI.,As shrinks some huge black beast with fear
750,XXVI.,When some uncommon dread is near.
751,XXVI.,"They heard the melting resin drip,"
752,XXVI.,As drip the last brave blood-drops when
753,XXVI.,Life's battle waxes hot with men.
754,XXVI.,
755,XXVI.,
756,XXVII.,XXVII.
757,XXVII.,
758,XXVII.,"Yet what to her were burning seas,"
759,XXVII.,Or what to him was forest flame?
760,XXVII.,"They loved; they loved the glorious trees,"
761,XXVII.,"The gleaming tides, or rise or fall;"
762,XXVII.,They loved the lisping winds that came
763,XXVII.,"From sea-lost spice-set isles unknown,"
764,XXVII.,With breath not warmer than their own:
765,XXVII.,"They loved, they loved,--and that was all."
766,XXVII.,
767,XXVII.,
768,XXVIII.,XXVIII.
769,XXVIII.,
770,XXVIII.,Full noon! Below the ancient moss
771,XXVIII.,"With mighty boughs high clanged across,"
772,XXVIII.,"The man with sweet words, over-sweet,"
773,XXVIII.,"Fell pleading, plaintive, at her feet."
774,XXVIII.,
775,XXVIII.,"He spake of love, of boundless love,--"
776,XXVIII.,"Of love that knew no other land,"
777,XXVIII.,"Or face, or place, or anything;"
778,XXVIII.,Of love that like the wearied dove
779,XXVIII.,"Could light nowhere, but kept the wing"
780,XXVIII.,"Till she alone put forth her hand,"
781,XXVIII.,And so received it in her ark
782,XXVIII.,From seas that shake against the dark!
783,XXVIII.,
784,XXVIII.,"He clasped her hands, climbed past her knees,"
785,XXVIII.,"Forgot her hands and kissed her hair,--"
786,XXVIII.,"The while her two hands clasped in prayer,"
787,XXVIII.,And fair face lifted to the trees.
788,XXVIII.,
789,XXVIII.,"Her proud breast heaved, her pure proud breast"
790,XXVIII.,Rose like the waves in their unrest
791,XXVIII.,When counter storms possess the seas.
792,XXVIII.,"Her mouth, her arched, uplifted mouth,"
793,XXVIII.,"Her ardent mouth that thirsted so,--"
794,XXVIII.,No glowing love-song of the South
795,XXVIII.,Can say; no man can say or know
796,XXVIII.,"The glory there, and so live on"
797,XXVIII.,Content without that glory gone!
798,XXVIII.,
799,XXVIII.,Her face still lifted up. And she
800,XXVIII.,Disdained the cup of passion he
801,XXVIII.,Hard pressed her panting lips to touch.
802,XXVIII.,"She dashed it by despised, and she"
803,XXVIII.,"Caught fast her breath. She trembled much,"
804,XXVIII.,"And sudden rose full height, and stood"
805,XXVIII.,An empress in high womanhood:
806,XXVIII.,"She stood a tower, tall as when"
807,XXVIII.,Proud Roman mothers suckled men
808,XXVIII.,Of old-time truth and taught them such.
809,XXVIII.,
810,XXVIII.,
811,XXIX.,XXIX.
812,XXIX.,
813,XXIX.,Her soul surged vast as space is. She
814,XXIX.,Was trembling as a courser when
815,XXIX.,"His thin flank quivers, and his feet"
816,XXIX.,"Touch velvet on the turf, and he"
817,XXIX.,"Is all afoam, alert, and fleet"
818,XXIX.,"As sunlight glancing on the sea,"
819,XXIX.,And full of triumph before men.
820,XXIX.,
821,XXIX.,"At last she bended some her face,"
822,XXIX.,"Half leaned, then put him back a pace,"
823,XXIX.,And met his eyes.
824,XXIX.,"Calm, silently"
825,XXIX.,"Her eyes looked deep into his eyes,--"
826,XXIX.,As maidens down some mossy well
827,XXIX.,Do peer in hope by chance to tell
828,XXIX.,By image there what future lies
829,XXIX.,"Before them, and what face shall be"
830,XXIX.,The pole-star of their destiny.
831,XXIX.,
832,XXIX.,Pure Nature's lover! Loving him
833,XXIX.,With love that made all pathways dim
834,XXIX.,"And difficult where he was not,--"
835,XXIX.,Then marvel not at form forgot.
836,XXIX.,And who shall chide? Doth priest know aught
837,XXIX.,"Of sign, or holy unction brought"
838,XXIX.,"From over seas, that ever can"
839,XXIX.,Make man love maid or maid love man
840,XXIX.,"One whit the more, one bit the less,"
841,XXIX.,For all his mummeries to bless?
842,XXIX.,"Yea, all his blessing or his ban?"
843,XXIX.,
844,XXIX.,The winds breathed warm as Araby:
845,XXIX.,"She leaned upon his breast, she lay"
846,XXIX.,A wide-winged swan with folded wing.
847,XXIX.,"He drowned his hot face in her hair,"
848,XXIX.,He heard her great heart rise and sing;
849,XXIX.,He felt her bosom swell.
850,XXIX.,The air
851,XXIX.,Swooned sweet with perfume of her form.
852,XXIX.,"Her breast was warm, her breath was warm,"
853,XXIX.,And warm her warm and perfumed mouth
854,XXIX.,As summer journeys through the South.
855,XXIX.,
856,XXIX.,
857,XXX.,XXX.
858,XXX.,
859,XXX.,"The argent sea surged steep below,"
860,XXX.,Surged languid in a tropic glow;
861,XXX.,And two great hearts kept surging so!
862,XXX.,
863,XXX.,The fervid kiss of heaven lay
864,XXX.,Precipitate on wood and sea.
865,XXX.,"Two great souls glowed with ecstasy,"
866,XXX.,The sea glowed scarce as warm as they.
867,XXX.,
868,XXX.,
869,XXXI.,XXXI.
870,XXXI.,
871,XXXI.,'Twas love's low amber afternoon.
872,XXXI.,"Two far-off pheasants thrummed a tune,"
873,XXXI.,A cricket clanged a restful air.
874,XXXI.,The dreamful billows beat a rune
875,XXXI.,Like heart regrets.
876,XXXI.,Around her head
877,XXXI.,There shone a halo. Men have said
878,XXXI.,'Twas from a dash of Titian
879,XXXI.,That flooded all her storm of hair
880,XXXI.,"In gold and glory. But they knew,"
881,XXXI.,"Yea, all men know there ever grew"
882,XXXI.,A halo round about her head
883,XXXI.,Like sunlight scarcely vanishèd.
884,XXXI.,
885,XXXI.,
886,XXXII.,XXXII.
887,XXXII.,
888,XXXII.,How still she was! She only knew
889,XXXII.,His love. She saw no life beyond.
890,XXXII.,She loved with love that only lives
891,XXXII.,"Outside itself and selfishness,--"
892,XXXII.,A love that glows in its excess;
893,XXXII.,"A love that melts pure gold, and gives"
894,XXXII.,Thenceforth to all who come to woo
895,XXXII.,"No coins but this face stamped thereon,--"
896,XXXII.,"Ay, this one image stamped upon"
897,XXXII.,"Its face, with some dim date long gone."
898,XXXII.,
899,XXXII.,
900,XXXIII.,XXXIII.
901,XXXIII.,
902,XXXIII.,They kept the headland high; the ship
903,XXXIII.,"Below began to chafe her chain,"
904,XXXIII.,To groan as some great beast in pain;
905,XXXIII.,While white fear leapt from lip to lip:
906,XXXIII.,"""The woods are fire! the woods are flame!"
907,XXXIII.,"Come down and save us, in God's name!"""
908,XXXIII.,
909,XXXIII.,"He heard! he did not speak or stir,--"
910,XXXIII.,"He thought of her, of only her."
911,XXXIII.,"While flames behind, before them lay"
912,XXXIII.,To hold the stoutest heart at bay!
913,XXXIII.,
914,XXXIII.,"Strange sounds were heard far up the flood,--"
915,XXXIII.,"Strange, savage sounds that chilled the blood!"
916,XXXIII.,Then sudden from the dense dark wood
917,XXXIII.,"Above, about them where they stood"
918,XXXIII.,A thousand beasts came peering out;
919,XXXIII.,"And now was thrust a long black snout,"
920,XXXIII.,And now a tusky mouth. It was
921,XXXIII.,A sight to make the stoutest pause.
922,XXXIII.,
923,XXXIII.,"""Cut loose the ship!"" the black mate cried;"
924,XXXIII.,"""Cut loose the ship!"" the crew replied."
925,XXXIII.,They drove into the sea. It lay
926,XXXIII.,As light as ever middle day.
927,XXXIII.,
928,XXXIII.,"The while their half-blind bitch, that sat"
929,XXXIII.,"All slobber-mouthed, and monkish cowled"
930,XXXIII.,"With great, broad, floppy, leathern ears,"
931,XXXIII.,"Amid the men, rose up and howled,"
932,XXXIII.,"And doleful howled her plaintive fears,"
933,XXXIII.,While all looked mute aghast thereat.
934,XXXIII.,"It was the grimmest eve, I think,"
935,XXXIII.,That ever hung on Hades' brink.
936,XXXIII.,
937,XXXIII.,"Great broad-winged bats possessed the air,"
938,XXXIII.,Bats whirling blindly everywhere;
939,XXXIII.,It was such troubled twilight eve
940,XXXIII.,As never mortal would believe.
941,XXXIII.,
942,XXXIII.,
943,XXXIV.,XXXIV.
944,XXXIV.,
945,XXXIV.,Some say the crazed hag lit the wood
946,XXXIV.,In circle where the lovers stood;
947,XXXIV.,Some say the gray priest feared the crew
948,XXXIV.,Might find at last the hoard of gold
949,XXXIV.,"Long hidden from the black ship's hold,--"
950,XXXIV.,I doubt me if men ever knew.
951,XXXIV.,"But such mad, howling, flame-lit shore"
952,XXXIV.,No mortal ever saw before.
953,XXXIV.,
954,XXXIV.,"Huge beasts above that shining sea,"
955,XXXIV.,"Wild, hideous beasts with shaggy hair,"
956,XXXIV.,"With red mouths lifting in the air,"
957,XXXIV.,"They piteous howled, and plaintively,--"
958,XXXIV.,"The wildest sounds, the weirdest sight"
959,XXXIV.,That ever shook the walls of night.
960,XXXIV.,
961,XXXIV.,"How lorn they howled, with lifted head,"
962,XXXIV.,To dim and distant isles that lay
963,XXXIV.,"Wedged tight along a line of red,"
964,XXXIV.,Caught in the closing gates of day
965,XXXIV.,"'Twixt sky and sea and far away,--"
966,XXXIV.,It was the saddest sound to hear
967,XXXIV.,That ever struck on human ear.
968,XXXIV.,
969,XXXIV.,They doleful called; and answered they
970,XXXIV.,"The plaintive sea-cows far away,--"
971,XXXIV.,"The great sea-cows that called from isles,"
972,XXXIV.,"Away across wide watery miles,"
973,XXXIV.,"With dripping mouths and lolling tongue,"
974,XXXIV.,"As if they called for captured young,--"
975,XXXIV.,
976,XXXIV.,The huge sea-cows that called the whiles
977,XXXIV.,Their great wide mouths were mouthing moss;
978,XXXIV.,And still they doleful called across
979,XXXIV.,From isles beyond the watery miles.
980,XXXIV.,No sound can half so doleful be
981,XXXIV.,As sea-cows calling from the sea.
982,XXXIV.,
983,XXXIV.,
984,XXXV.,XXXV.
985,XXXV.,
986,XXXV.,The drowned sun sank and died. He lay
987,XXXV.,In seas of blood. He sinking drew
988,XXXV.,"The gates of sunset sudden to,"
989,XXXV.,"Where shattered day in fragments lay,"
990,XXXV.,"And night came, moving in mad flame:"
991,XXXV.,"The night came, lighted as he came,"
992,XXXV.,As lighted by high summer sun
993,XXXV.,Descending through the burning blue.
994,XXXV.,"It was a gold and amber hue,"
995,XXXV.,And all hues blended into one.
996,XXXV.,"The night spilled splendor where she came,"
997,XXXV.,And filled the yellow world with flame.
998,XXXV.,
999,XXXV.,"The moon came on, came leaning low"
1000,XXXV.,Along the far sea-isles aglow;
1001,XXXV.,She fell along that amber flood
1002,XXXV.,A silver flame in seas of blood.
1003,XXXV.,"It was the strangest moon, ah me!"
1004,XXXV.,That ever settled on God's sea.
1005,XXXV.,
1006,XXXV.,
1007,XXXVI.,XXXVI.
1008,XXXVI.,
1009,XXXVI.,"Slim snakes slid down from fern and grass,"
1010,XXXVI.,"From wood, from fen, from anywhere;"
1011,XXXVI.,"You could not step, you would not pass,"
1012,XXXVI.,"And you would hesitate to stir,"
1013,XXXVI.,"Lest in some sudden, hurried tread"
1014,XXXVI.,Your foot struck some unbruisèd head:
1015,XXXVI.,
1016,XXXVI.,"They slid in streams into the stream,--"
1017,XXXVI.,It seemed like some infernal dream;
1018,XXXVI.,"They curved, and graceful curved across,"
1019,XXXVI.,"Like graceful, waving sea-green moss,--"
1020,XXXVI.,There is no art of man can make
1021,XXXVI.,A ripple like a rippling snake!
1022,XXXVI.,
1023,XXXVI.,
1024,XXXVII.,XXXVII.
1025,XXXVII.,
1026,XXXVII.,"Abandoned, lorn, the lovers stood,"
1027,XXXVII.,"Abandoned there, death in the air!"
1028,XXXVII.,"That beetling steep, that blazing wood,--"
1029,XXXVII.,Red flame! and red flame everywhere!
1030,XXXVII.,"Yet was he born to strive, to bear"
1031,XXXVII.,The front of battle. He would die
1032,XXXVII.,"In noble effort, and defy"
1033,XXXVII.,The grizzled visage of despair.
1034,XXXVII.,
1035,XXXVII.,He threw his two strong arms full length
1036,XXXVII.,As if to surely test their strength;
1037,XXXVII.,"Then tore his vestments, textile things"
1038,XXXVII.,That could but tempt the demon wings
1039,XXXVII.,"Of flame that girt them round about,"
1040,XXXVII.,Then threw his garments to the air
1041,XXXVII.,"As one that laughed at death, at doubt,"
1042,XXXVII.,And like a god stood grand and bare.
1043,XXXVII.,
1044,XXXVII.,She did not hesitate; she knew
1045,XXXVII.,The need of action; swift she threw
1046,XXXVII.,"Her burning vestments by, and bound"
1047,XXXVII.,Her wondrous wealth of hair that fell
1048,XXXVII.,An all-concealing cloud around
1049,XXXVII.,"Her glorious presence, as he came"
1050,XXXVII.,"To seize and bear her through the flame,--"
1051,XXXVII.,An Orpheus out of burning hell!
1052,XXXVII.,
1053,XXXVII.,"He leaned above her, wound his arm"
1054,XXXVII.,"About her splendor, while the noon"
1055,XXXVII.,"Of flood-tide, manhood, flushed his face,"
1056,XXXVII.,And high flames leapt the high headland!--
1057,XXXVII.,"They stood as twin-hewn statues stand,"
1058,XXXVII.,High lifted in some storied place.
1059,XXXVII.,
1060,XXXVII.,"He clasped her close, he spoke of death,--"
1061,XXXVII.,Of death and love in the same breath.
1062,XXXVII.,He clasped her close; her bosom lay
1063,XXXVII.,Like ship safe anchored in some bay.
1064,XXXVII.,
1065,XXXVII.,
1066,XXXVIII.,XXXVIII.
1067,XXXVIII.,
1068,XXXVIII.,The flames! They could not stand or stay;
1069,XXXVIII.,"Before the beetling steep, the sea!"
1070,XXXVIII.,"But at his feet a narrow way,"
1071,XXXVIII.,"A short steep path, pitched suddenly"
1072,XXXVIII.,"Safe open to the river's beach,"
1073,XXXVIII.,"Where lay a small white isle in reach,--"
1074,XXXVIII.,"A small, white, rippled isle of sand"
1075,XXXVIII.,Where yet the two might safely land.
1076,XXXVIII.,
1077,XXXVIII.,"And there, through smoke and flame, behold"
1078,XXXVIII.,"The priest stood safe, yet all appalled!"
1079,XXXVIII.,"He reached the cross; he cried, he called;"
1080,XXXVIII.,He waved his high-held cross of gold.
1081,XXXVIII.,"He called and called, he bade them fly"
1082,XXXVIII.,"Through flames to him, nor bide and die!"
1083,XXXVIII.,
1084,XXXVIII.,"Her lover saw; he saw, and knew"
1085,XXXVIII.,His giant strength would bear her through.
1086,XXXVIII.,And yet he would not start or stir.
1087,XXXVIII.,"He clasped her close as death can hold,"
1088,XXXVIII.,"Or dying miser clasp his gold,--"
1089,XXXVIII.,His hold became a part of her.
1090,XXXVIII.,
1091,XXXVIII.,He would not give her up! He would
1092,XXXVIII.,Not bear her waveward though he could!
1093,XXXVIII.,That height was heaven; the wave was hell.
1094,XXXVIII.,"He clasped her close,--what else had done"
1095,XXXVIII.,The manliest man beneath the sun?
1096,XXXVIII.,Was it not well? was it not well?
1097,XXXVIII.,
1098,XXXVIII.,"O man, be glad! be grandly glad,"
1099,XXXVIII.,And kinglike walk thy ways of death!
1100,XXXVIII.,For more than years of bliss you had
1101,XXXVIII.,That one brief time you breathed her breath.
1102,XXXVIII.,"Yea, more than years upon a throne"
1103,XXXVIII.,"That one brief time you held her fast,"
1104,XXXVIII.,"Soul surged to soul, vehement, vast,--"
1105,XXXVIII.,"True breast to breast, and all your own."
1106,XXXVIII.,
1107,XXXVIII.,"Live me one day, one narrow night,"
1108,XXXVIII.,One second of supreme delight
1109,XXXVIII.,"Like that, and I will blow like chaff"
1110,XXXVIII.,"The hollow years aside, and laugh"
1111,XXXVIII.,"A loud triumphant laugh, and I,"
1112,XXXVIII.,"King-like and crowned, will gladly die."
1113,XXXVIII.,
1114,XXXVIII.,"Oh, but to wrap my love with flame!"
1115,XXXVIII.,"With flame within, with flame without!"
1116,XXXVIII.,"Oh, but to die like this, nor doubt--"
1117,XXXVIII.,To die and know her still the same!
1118,XXXVIII.,To know that down the ghostly shore
1119,XXXVIII.,Snow-white she waits me evermore!
1120,XXXVIII.,
1121,XXXVIII.,
1122,XXXIX.,XXXIX.
1123,XXXIX.,
1124,XXXIX.,"He poised her, held her high in air,--"
1125,XXXIX.,"His great strong limbs, his great arm's length!--"
1126,XXXIX.,Then turned his knotted shoulders bare
1127,XXXIX.,"As birth-time in his splendid strength,"
1128,XXXIX.,"And strode, strode with a lordly stride"
1129,XXXIX.,To where the high and wood-hung edge
1130,XXXIX.,"Looked down, far down upon the molten tide."
1131,XXXIX.,"The flames leapt with him to the ledge,"
1132,XXXIX.,The flames leapt leering at his side.
1133,XXXIX.,
1134,XXXIX.,
1135,XL.,XL.
1136,XL.,
1137,XL.,He leaned above the ledge. Below
1138,XL.,"He saw the black ship idly cruise,--"
1139,XL.,"A midge below, a mile below."
1140,XL.,His limbs were knotted as the thews
1141,XL.,Of Hercules in his death-throe.
1142,XL.,
1143,XL.,The flame! the flame! the envious flame!
1144,XL.,"She wound her arms, she wound her hair"
1145,XL.,"About his tall form, grand and bare,"
1146,XL.,To stay the fierce flame where it came.
1147,XL.,
1148,XL.,"The black ship, like some moonlit wreck,"
1149,XL.,Below along the burning sea
1150,XL.,"Crept on and on all silently,"
1151,XL.,With silent pygmies on her deck.
1152,XL.,
1153,XL.,"That midge-like ship far, far below;"
1154,XL.,That mirage lifting from the hill!
1155,XL.,"His flame-lit form began to grow,--"
1156,XL.,To grow and grow more grandly still.
1157,XL.,"The ship so small, that form so tall,"
1158,XL.,It grew to tower over all.
1159,XL.,
1160,XL.,"A tall Colossus, bronze and gold,"
1161,XL.,As if that flame-lit form were he
1162,XL.,"Who once bestrode the Rhodian sea,"
1163,XL.,And ruled the watery world of old:
1164,XL.,As if the lost Colossus stood
1165,XL.,Above that burning sea of wood.
1166,XL.,
1167,XL.,"And she, that shapely form upheld,"
1168,XL.,"Held high, as if to touch the sky,"
1169,XL.,"What airy shape, how shapely high,--"
1170,XL.,A goddess of the seas of eld!
1171,XL.,
1172,XL.,"Her hand upheld, her high right hand,"
1173,XL.,As if she would forget the land;
1174,XL.,"As if to gather stars, and heap"
1175,XL.,The stars like torches there to light
1176,XL.,Her Hero's path across the deep
1177,XL.,To some far isle that fearful night.
1178,XL.,
1179,XL.,"It was as if Colossus came,"
1180,XL.,Came proudly reaching from the flame
1181,XL.,"Above the sea in sheen of gold,"
1182,XL.,His sea-bride leaping from his hold;
1183,XL.,"The lost Colossus, and his bride"
1184,XL.,In bronze perfection at his side:
1185,XL.,As if the lost Colossus came
1186,XL.,"Companioned from the past, his bride"
1187,XL.,With torch all faithful at his side:
1188,XL.,
1189,XL.,With star-tipped torch that reached and rolled
1190,XL.,Through cloud-built corridors of gold:
1191,XL.,"His bride, austere and stern and grand,--"
1192,XL.,"Bartholdi's goddess by the sea,"
1193,XL.,"Far lifting, lighting Liberty"
1194,XL.,From prison seas to Freedom's land.
1195,XL.,
1196,XL.,
1197,XLI.,XLI.
1198,XLI.,
1199,XLI.,"The flame! the envious flame, it leapt"
1200,XLI.,"Enraged to see such majesty,"
1201,XLI.,Such scorn of death; such kingly scorn.
1202,XLI.,Then like some lightning-riven tree
1203,XLI.,They sank down in that flame--and slept
1204,XLI.,And all was hushed above that steep
1205,XLI.,"So still, that they might sleep and sleep;"
1206,XLI.,As still as when a day is born.
1207,XLI.,
1208,XLI.,At last! from out the embers leapt
1209,XLI.,"Two shafts of light above the night,--"
1210,XLI.,Two wings of flame that lifting swept
1211,XLI.,"In steady, calm, and upward flight;"
1212,XLI.,Two wings of flame against the white
1213,XLI.,"Far-lifting, tranquil, snowy cone;"
1214,XLI.,"Two wings of love, two wings of light,"
1215,XLI.,"Far, far above that troubled night,"
1216,XLI.,"As mounting, mounting to God's throne."
1217,XLI.,
1218,XLI.,
1219,XLII.,XLII.
1220,XLII.,
1221,XLII.,And all night long that upward light
1222,XLII.,Lit up the sea-cow's bed below:
1223,XLII.,The far sea-cows still calling so
1224,XLII.,It seemed as they must call all night.
1225,XLII.,"All night! there was no night. Nay, nay,"
1226,XLII.,There was no night. The night that lay
1227,XLII.,"Between that awful eve and day,--"
1228,XLII.,That nameless night was burned away.
1229,XLII.,
1230,XLII.,
1231,XLII.,
1232,XLII.,
1233,THE RHYME OF THE GREAT RIVER.,THE RHYME OF THE GREAT RIVER.
1234,THE RHYME OF THE GREAT RIVER.,
1235,PART I.,PART I.
1236,PART I.,
1237,PART I.,
1238,PART I.,"Rhyme on, rhyme on in reedy flow,"
1239,PART I.,"O river, rhymer ever sweet!"
1240,PART I.,"The story of thy land is meet,"
1241,PART I.,The stars stand listening to know.
1242,PART I.,
1243,PART I.,"Rhyme on, O river of the earth!"
1244,PART I.,"Gray father of the dreadful seas,"
1245,PART I.,Rhyme on! the world upon its knees
1246,PART I.,Shall yet invoke thy wealth and worth.
1247,PART I.,
1248,PART I.,"Rhyme on, the reed is at thy mouth,"
1249,PART I.,"O kingly minstrel, mighty stream!"
1250,PART I.,"Thy Crescent City, like a dream,"
1251,PART I.,Hangs in the heaven of my South.
1252,PART I.,
1253,PART I.,"Rhyme on, rhyme on! these broken strings"
1254,PART I.,Sing sweetest in this warm south wind;
1255,PART I.,I sit thy willow banks and bind
1256,PART I.,A broken harp that fitful sings.
1257,PART I.,
1258,PART I.,
1259,I.,I.
1260,I.,
1261,I.,"And where is my city, sweet blossom-sown town?"
1262,I.,"And what is her glory, and what has she done?"
1263,I.,By the Mexican seas in the path of the sun
1264,I.,Sit you down: in the crescent of seas sit you down.
1265,I.,
1266,I.,"Ay, glory enough by my Mexican seas!"
1267,I.,"Ay, story enough in that battle-torn town,"
1268,I.,"Hidden down in the crescent of seas, hidden down"
1269,I.,'Mid mantle and sheen of magnolia-strown trees.
1270,I.,
1271,I.,But mine is the story of souls; of a soul
1272,I.,"That bartered God's limitless kingdom for gold,--"
1273,I.,Sold stars and all space for a thing he could hold
1274,I.,"In his palm for a day, ere he hid with the mole."
1275,I.,
1276,I.,O father of waters! O river so vast!
1277,I.,"So deep, so strong, and so wondrous wild,--"
1278,I.,"He embraces the land as he rushes past,"
1279,I.,Like a savage father embracing his child.
1280,I.,
1281,I.,"His sea-land is true and so valiantly true,"
1282,I.,"His leaf-land is fair and so marvellous fair,"
1283,I.,His palm-land is filled with a perfumed air
1284,I.,Of magnolia blooms to its dome of blue.
1285,I.,
1286,I.,"His rose-land has arbors of moss-swept oak,--"
1287,I.,"Gray, Druid old oaks; and the moss that sways"
1288,I.,And swings in the wind is the battle-smoke
1289,I.,"Of duellists, dead in her storied days."
1290,I.,
1291,I.,His love-land has churches and bells and chimes;
1292,I.,His love-land has altars and orange flowers;
1293,I.,"And that is the reason for all these rhymes,--"
1294,I.,"These bells, they are ringing through all the hours!"
1295,I.,
1296,I.,"His sun-land has churches, and priests at prayer,"
1297,I.,"White nuns, as white as the far north snow;"
1298,I.,"They go where danger may bid them go,--"
1299,I.,They dare when the angel of death is there.
1300,I.,
1301,I.,"His love-land has ladies so fair, so fair,"
1302,I.,"In the Creole quarter, with great black eyes,--"
1303,I.,So fair that the Mayor must keep them there
1304,I.,"Lest troubles, like troubles of Troy, arise."
1305,I.,
1306,I.,"His love-land has ladies, with eyes held down,--"
1307,I.,"Held down, because if they lifted them,"
1308,I.,"Why, you would be lost in that old French town,"
