,Poem Title,line
0,,
1,,
2,,
3,,
4,,Produced by Daniel Emerson Griffith and the Online
5,,Distributed Proofreading Team at https://www.pgdp.net (This
6,,file was produced from images generously made available
7,,by The Internet Archive)
8,,
9,,
10,,
11,,
12,,
13,,
14,,
15,,
16,,
17,SONGS OF THE MEXICAN SEAS,SONGS OF THE MEXICAN SEAS
18,SONGS OF THE MEXICAN SEAS,
19,BY JOAQUIN MILLER,BY JOAQUIN MILLER
20,"AUTHOR OF ""SONGS OF THE SIERRAS,"" ""SONGS OF ITALY,"" ETC.","AUTHOR OF ""SONGS OF THE SIERRAS,"" ""SONGS OF ITALY,"" ETC."
21,"AUTHOR OF ""SONGS OF THE SIERRAS,"" ""SONGS OF ITALY,"" ETC.",
22,"AUTHOR OF ""SONGS OF THE SIERRAS,"" ""SONGS OF ITALY,"" ETC.",
23,BOSTON,BOSTON
24,ROBERTS BROTHERS,ROBERTS BROTHERS
25,ROBERTS BROTHERS,1887
26,ROBERTS BROTHERS,
27,ROBERTS BROTHERS,
28,ROBERTS BROTHERS,"Copyright, 1887,"
29,ROBERTS BROTHERS,By Roberts Brothers.
30,ROBERTS BROTHERS,
31,UNIVERSITY PRESS:,UNIVERSITY PRESS:
32,UNIVERSITY PRESS:,"John Wilson and Son, Cambridge."
33,UNIVERSITY PRESS:,
34,UNIVERSITY PRESS:,
35,TO ABBIE.,TO ABBIE.
36,TO ABBIE.,
37,TO ABBIE.,
38,TO ABBIE.,"NOTE.--The lines in this little book, as in all my others, were"
39,TO ABBIE.,"written, or at least conceived, in the lands where the scenes are"
40,TO ABBIE.,"laid; so that whatever may be said of the imperfections of my work,"
41,TO ABBIE.,I at least have the correct atmosphere and color. I have now and
42,TO ABBIE.,"then sent forth from Mexico, and from remoter shores of the Gulf,"
43,TO ABBIE.,"fragments of these thoughts as they rounded into form, and some"
44,TO ABBIE.,"of them have been used at a Dartmouth College Commencement, and"
45,TO ABBIE.,elsewhere; but as a whole the book is new.
46,TO ABBIE.,
47,TO ABBIE.,"From the heart of the Sierra, where I once more hear the awful"
48,TO ABBIE.,"heart-throbs of Nature, I now intrust the first reception of these"
49,TO ABBIE.,"lessons entirely to my own country. And may I not ask in return,"
50,TO ABBIE.,"now at the last, when the shadows begin to grow long, something"
51,TO ABBIE.,"of that consideration which, thus far, has been accorded almost"
52,TO ABBIE.,entirely by strangers?
53,TO ABBIE.,
54,TO ABBIE.,Joaquin Miller.
55,TO ABBIE.,
56,TO ABBIE.,"Mount Shasta, California,"
57,A.D. 1887.,A.D. 1887.
58,A.D. 1887.,
59,A.D. 1887.,
60,A.D. 1887.,
61,A.D. 1887.,
62,SONGS OF THE MEXICAN SEAS.,SONGS OF THE MEXICAN SEAS.
63,SONGS OF THE MEXICAN SEAS.,
64,SONGS OF THE MEXICAN SEAS.,
65,SONGS OF THE MEXICAN SEAS.,
66,SONGS OF THE MEXICAN SEAS.,
67,THE SEA OF FIRE.,THE SEA OF FIRE.
68,THE SEA OF FIRE.,
69,THE SEA OF FIRE.,
70,THE SEA OF FIRE.,"In that far land, farther than Yucatan,"
71,THE SEA OF FIRE.,"Hondurian height, or Mahogany steep,"
72,THE SEA OF FIRE.,"Where the great sea, hollowed by the hand of man"
73,THE SEA OF FIRE.,Hears deep come calling across to deep;
74,THE SEA OF FIRE.,Where the great seas follow in the grooves of men
75,THE SEA OF FIRE.,Down under the bastions of Darien:
76,THE SEA OF FIRE.,
77,THE SEA OF FIRE.,In that land so far that you wonder whether
78,THE SEA OF FIRE.,If God would know it should you fall down dead;
79,THE SEA OF FIRE.,In that land so far through the wilds and weather
80,THE SEA OF FIRE.,"That the lost sun sinks like a warrior sped,--"
81,THE SEA OF FIRE.,"Where the sea and the sky seem closing together,"
82,THE SEA OF FIRE.,Seem closing together as a book that is read:
83,THE SEA OF FIRE.,
84,THE SEA OF FIRE.,"In that nude warm world, where the unnamed rivers"
85,THE SEA OF FIRE.,Roll restless in cradles of bright buried gold;
86,THE SEA OF FIRE.,Where white flashing mountains flow rivers of silver
87,THE SEA OF FIRE.,As a rock of the desert flowed fountains of old;
88,THE SEA OF FIRE.,"By a dark wooded river that calls to the dawn,"
89,THE SEA OF FIRE.,And calls all day with his dolorous swan:
90,THE SEA OF FIRE.,
91,THE SEA OF FIRE.,"In that land of the wonderful sun and weather,"
92,THE SEA OF FIRE.,"With green under foot and with gold over head,"
93,THE SEA OF FIRE.,"Where the spent sun flames, and you wonder whether"
94,THE SEA OF FIRE.,'Tis an isle of fire in his foamy bed:
95,THE SEA OF FIRE.,Where the oceans of earth shall be welded together
96,THE SEA OF FIRE.,"By the great French master in his forge flame red,--"
97,THE SEA OF FIRE.,
98,THE SEA OF FIRE.,"Lo! the half-finished world! Yon footfall retreating,--"
99,THE SEA OF FIRE.,It might be the Maker disturbed at his task.
100,THE SEA OF FIRE.,"But the footfall of God, or the far pheasant beating,"
101,THE SEA OF FIRE.,"It is one and the same, whatever the mask"
102,THE SEA OF FIRE.,It may wear unto man. The woods keep repeating
103,THE SEA OF FIRE.,"The old sacred sermons, whatever you ask."
104,THE SEA OF FIRE.,
105,THE SEA OF FIRE.,"The brown-muzzled cattle come stealthy to drink,"
106,THE SEA OF FIRE.,"The wild forest cattle, with high horns as trim"
107,THE SEA OF FIRE.,As the elk at their side: their sleek necks are slim
108,THE SEA OF FIRE.,"And alert like the deer. They come, then they shrink"
109,THE SEA OF FIRE.,"As afraid of their fellows, of shadow-beasts seen"
110,THE SEA OF FIRE.,In the deeps of the dark-wooded waters of green.
111,THE SEA OF FIRE.,
112,THE SEA OF FIRE.,"It is man in his garden, scarce wakened as yet"
113,THE SEA OF FIRE.,From the sleep that fell on him when woman was made.
114,THE SEA OF FIRE.,The new-finished garden is plastic and wet
115,THE SEA OF FIRE.,From the hand that has fashioned its unpeopled shade;
116,THE SEA OF FIRE.,And the wonder still looks from the fair woman's eyes
117,THE SEA OF FIRE.,As she shines through the wood like the light from the skies.
118,THE SEA OF FIRE.,
119,THE SEA OF FIRE.,And a ship now and then from some far Ophir's shore
120,THE SEA OF FIRE.,Draws in from the sea. It lies close to the bank;
121,THE SEA OF FIRE.,"Then a dull, muffled sound of the slow-shuffled plank"
122,THE SEA OF FIRE.,"As they load the black ship; but you hear nothing more,"
123,THE SEA OF FIRE.,"And the dark dewy vines, and the tall sombre wood"
124,THE SEA OF FIRE.,Like twilight droop over the deep sweeping flood.
125,THE SEA OF FIRE.,
126,THE SEA OF FIRE.,"The black masts are tangled with branches that cross,"
127,THE SEA OF FIRE.,"The rich, fragrant gums fall from branches to deck,"
128,THE SEA OF FIRE.,The thin ropes are swinging with streamers of moss
129,THE SEA OF FIRE.,That mantle all things like the shreds of a wreck;
130,THE SEA OF FIRE.,"The long mosses swing, there is never a breath:"
131,THE SEA OF FIRE.,The river rolls still as the river of death.
132,THE SEA OF FIRE.,
133,THE SEA OF FIRE.,
134,I.,I.
135,I.,
136,I.,"In the beginning,--ay, before"
137,I.,The six-days' labors were well o'er;
138,I.,"Yea, while the world lay incomplete,"
139,I.,Ere God had opened quite the door
140,I.,"Of this strange land for strong men's feet,--"
141,I.,There lay against that westmost sea
142,I.,One weird-wild land of mystery.
143,I.,
144,I.,"A far white wall, like fallen moon,"
145,I.,Girt out the world. The forest lay
146,I.,"So deep you scarcely saw the day,"
147,I.,Save in the high-held middle noon:
148,I.,"It lay a land of sleep and dreams,"
149,I.,And clouds drew through like shoreless streams
150,I.,That stretch to where no man may say.
151,I.,
152,I.,"Men reached it only from the sea,"
153,I.,"By black-built ships, that seemed to creep"
154,I.,"Along the shore suspiciously,"
155,I.,Like unnamed monsters of the deep.
156,I.,"It was the weirdest land, I ween,"
157,I.,That mortal eye has ever seen:
158,I.,
159,I.,"A dim, dark land of bird and beast,"
160,I.,"Black shaggy beasts with cloven claw,--"
161,I.,"A land that scarce knew prayer or priest,"
162,I.,"Or law of man, or Nature's law;"
163,I.,Where no fixed line drew sharp dispute
164,I.,'Twixt savage man and silent brute.
165,I.,
166,I.,
167,II.,II.
168,II.,
169,II.,It hath a history most fit
170,II.,For cunning hand to fashion on;
171,II.,No chronicler hath mentioned it;
172,II.,No buccaneer set foot upon.
173,II.,"'Tis of an outlawed Spanish Don,--"
174,II.,"A cruel man, with pirate's gold"
175,II.,That loaded down his deep ship's hold.
176,II.,
177,II.,A deep ship's hold of plundered gold!
178,II.,"The golden cruise, the golden cross,"
179,II.,"From many a church of Mexico,"
180,II.,"From Panama's mad overthrow,"
181,II.,"From many a ransomed city's loss,"
182,II.,"From many a follower stanch and bold,"
183,II.,And many a foeman stark and cold.
184,II.,
185,II.,"He found this wild, lost land. He drew"
186,II.,"His ship to shore. His ruthless crew,"
187,II.,"Like Romulus, laid lawless hand"
188,II.,"On meek brown maidens of the land,"
189,II.,And in their bloody forays bore
190,II.,Red firebrands along the shore.
191,II.,
192,II.,
193,III.,III.
194,III.,
195,III.,"The red men rose at night. They came,"
196,III.,"A firm, unflinching wall of flame;"
197,III.,"They swept, as sweeps some fateful sea"
198,III.,O'er land of sand and level shore
199,III.,"That howls in far, fierce agony."
200,III.,"The red men swept that deep, dark shore"
201,III.,As threshers sweep a threshing-floor.
202,III.,
203,III.,And yet beside the slain Don's door
204,III.,"They left his daughter, as they fled:"
205,III.,"They spared her life, because she bore"
206,III.,Their Chieftain's blood and name. The red
207,III.,And blood-stained hidden hoards of gold
208,III.,"They hollowed from the stout ship's hold,"
209,III.,And bore in many a slim canoe--
210,III.,To where? The good priest only knew.
211,III.,
212,III.,
213,IV.,IV.
214,IV.,
215,IV.,The course of life is like the sea:
216,IV.,Men come and go; tides rise and fall;
217,IV.,And that is all of history.
218,IV.,"The tide flows in, flows out to-day,--"
219,IV.,And that is all that man may say;
220,IV.,"Man is, man was,--and that is all."
221,IV.,
222,IV.,"Revenge at last came like a tide,--"
223,IV.,"'Twas sweeping, deep, and terrible;"
224,IV.,"The Christian found the land, and came"
225,IV.,To take possession in Christ's name.
226,IV.,For every white man that had died
227,IV.,"I think a thousand red men fell,--"
228,IV.,A Christian custom; and the land
229,IV.,Lay lifeless as some burned-out brand.
230,IV.,
231,IV.,
232,V.,V.
233,V.,
234,V.,Ere while the slain Don's daughter grew
235,V.,"A glorious thing, a flower of spring,"
236,V.,"A lithe slim reed, a sun-loved weed,"
237,V.,A something more than mortal knew;
238,V.,"A mystery of grace and face,--"
239,V.,A silent mystery that stood
240,V.,"An empress in that sea-set wood,"
241,V.,"Supreme, imperial in her place."
242,V.,
243,V.,"It might have been men's lust for gold,--"
244,V.,For all men knew that lawless crew
245,V.,"Left hoards of gold in that ship's hold,"
246,V.,"That drew ships hence, and silent drew"
247,V.,"Strange Jasons to that steep wood shore,"
248,V.,"As if to seek that hidden store,--"
249,V.,I never either cared or knew.
250,V.,
251,V.,I say it might have been this gold
252,V.,That ever drew and strangely drew
253,V.,"Strong men of land, strange men of sea,"
254,V.,To seek this shore of mystery
255,V.,With all its wondrous tales untold:
256,V.,"The gold or her, which of the two?"
257,V.,It matters not; I never knew.
258,V.,
259,V.,"But this I know, that as for me,"
260,V.,Between that face and the hard fate
261,V.,"That kept me ever from my own,"
262,V.,"As some wronged monarch from his throne,"
263,V.,God's heaped-up gold of land or sea
264,V.,Had never weighed one feather's weight.
265,V.,
266,V.,"Her home was on the wooded height,--"
267,V.,"A woody home, a priest at prayer,"
268,V.,"A perfume in the fervid air,"
269,V.,And angels watching her at night.
270,V.,I can but think upon the skies
271,V.,That bound that other Paradise.
272,V.,
273,V.,
274,VI.,VI.
275,VI.,
276,VI.,"Below a star-built arch, as grand"
277,VI.,As ever bended heaven spanned;
278,VI.,Tall trees like mighty columns grew--
279,VI.,"They loomed as if to pierce the blue,"
280,VI.,They reached as reaching heaven through.
281,VI.,
282,VI.,"The shadowed stream rolled far below,"
283,VI.,Where men moved noiseless to and fro
284,VI.,"As in some vast cathedral, when"
285,VI.,"The calm of prayer comes to men,"
286,VI.,"With benedictions, bending low."
287,VI.,
288,VI.,"Lo! wooded sea-banks, wild and steep!"
289,VI.,A trackless wood; a snowy cone
290,VI.,That lifted from this wood alone!
291,VI.,"This wild wide river, dark and deep!"
292,VI.,A ship against the shore asleep!
293,VI.,
294,VI.,
295,VII.,VII.
296,VII.,
297,VII.,"An Indian woman crept, a crone,"
298,VII.,"Hard by about the land alone,"
299,VII.,The relic of her perished race.
300,VII.,"She wore rich, rudely-fashioned bands"
301,VII.,Of gold above her bony hands:
302,VII.,She hissed hot curses on the place!
303,VII.,
304,VII.,
305,VIII.,VIII.
306,VIII.,
307,VIII.,Go seek the red man's last retreat!
308,VIII.,"A lonesome land, the haunted lands!"
309,VIII.,"Red mouths of beasts, red men's red hands:"
310,VIII.,"Red prophet-priest, in mute defeat!"
311,VIII.,
312,VIII.,His boundaries in blood are writ!
313,VIII.,"His land is ghostland! That is his,"
314,VIII.,Whatever man may claim of this;
315,VIII.,Beware how you shall enter it!
316,VIII.,He stands God's guardian of ghostlands;
317,VIII.,"Ay, this same wrapped half-prophet stands"
318,VIII.,"All nude and voiceless, nearer to"
319,VIII.,The awful God than I or you.
320,VIII.,
321,VIII.,
322,IX.,IX.
323,IX.,
324,IX.,"This bronzed child, by that river's brink,"
325,IX.,"Stood fair to see as you can think,"
326,IX.,"As tall as tall reeds at her feet,"
327,IX.,As fresh as flowers in her hair;
328,IX.,"As sweet as flowers over-sweet,"
329,IX.,As fair as vision more than fair!
330,IX.,
331,IX.,How beautiful she was! How wild!
332,IX.,"How pure as water-plant, this child,--"
333,IX.,This one wild child of Nature here
334,IX.,Grown tall in shadows.
335,IX.,And how near
336,IX.,"To God, where no man stood between"
337,IX.,"Her eyes and scenes no man hath seen,--"
338,IX.,"This maiden that so mutely stood,"
339,IX.,The one lone woman of that wood.
340,IX.,
341,IX.,"Stop still, my friend, and do not stir,"
342,IX.,Shut close your page and think of her.
343,IX.,The birds sang sweeter for her face;
344,IX.,Her lifted eyes were like a grace
345,IX.,"To seamen of that solitude,"
346,IX.,"However rough, however rude."
347,IX.,
348,IX.,"The rippled rivers of her hair,"
349,IX.,"That ran in wondrous waves, somehow"
350,IX.,"Flowed down divided by her brow,--"
351,IX.,"Half mantled her within its care,"
352,IX.,"And flooded all, or bronze or snow,"
353,IX.,In its uncommon fold and flow.
354,IX.,
355,IX.,A perfume and an incense lay
356,IX.,"Before her, as an incense sweet"
357,IX.,Before blithe mowers of sweet May
358,IX.,In early morn. Her certain feet
359,IX.,Embarked on no uncertain way.
360,IX.,
361,IX.,"Come, think how perfect before men,"
362,IX.,How sweet as sweet magnolia bloom
363,IX.,"Embalmed in dews of morning, when"
364,IX.,Rich sunlight leaps from midnight gloom
365,IX.,"Resolved to kiss, and swift to kiss"
366,IX.,Ere yet morn wakens man to bliss.
367,IX.,
368,IX.,
369,X.,X.
370,X.,
371,X.,The days swept on. Her perfect year
372,X.,Was with her now. The sweet perfume
373,X.,"Of womanhood in holy bloom,"
374,X.,"As when red harvest blooms appear,"
375,X.,Possessed her now. The priest did pray
376,X.,That saints alone should pass that way.
377,X.,
378,X.,"A red bird built beneath her roof,"
379,X.,"Brown squirrels crossed her cabin sill,"
380,X.,And welcome came or went at will.
381,X.,"A hermit spider wove his web,"
382,X.,And up against the roof would spin
383,X.,His net to catch mosquitoes in.
384,X.,
385,X.,"The silly elk, the spotted fawn,"
386,X.,"And all dumb beasts that came to drink,"
387,X.,That stealthy stole upon the brink
388,X.,In that dim while that lies between
389,X.,"The coming night and going dawn,"
390,X.,On seeing her familiar face
391,X.,Would fearless stop and stand in place.
392,X.,
393,X.,"She was so kind, the beasts of night"
394,X.,Gave her the road as if her right;
395,X.,The panther crouching overhead
396,X.,In sheen of moss would hear her tread
397,X.,"And bend his eyes, but never stir"
398,X.,Lest he by chance might frighten her.
399,X.,
400,X.,"Yet in her splendid strength, her eyes,"
401,X.,There lay the lightning of the skies;
402,X.,"The love-hate of the lioness,"
403,X.,"To kill the instant, or caress:"
404,X.,A pent-up soul that sometimes grew
405,X.,"Impatient; why, she hardly knew."
406,X.,
407,X.,"At last she sighed, uprose, and threw"
408,X.,Her strong arms out as if to hand
409,X.,"Her love, sun-born and all complete"
410,X.,"At birth, to some brave lover's feet"
411,X.,"On some far, fair, and unseen land,"
412,X.,As knowing now not what to do!
413,X.,
414,X.,
415,XI.,XI.
416,XI.,
417,XI.,"How beautiful she was! Why, she"
418,XI.,Was inspiration! She was born
419,XI.,"To walk God's summer hills at morn,"
420,XI.,Nor waste her by this wood-dark sea.
421,XI.,"What wonder, then, her soul's white wings"
422,XI.,"Beat at its bars, like living things!"
423,XI.,
424,XI.,Once more she sighed! She wandered through
425,XI.,"The sea-bound wood, then stopped and drew"
426,XI.,"Her hand above her face, and swept"
427,XI.,"The lonesome sea, and all day kept"
428,XI.,"Her face to sea, as if she knew"
429,XI.,"Some day, some near or distant day,"
430,XI.,Her destiny should come that way.
431,XI.,
432,XI.,
433,XII.,XII.
434,XII.,
435,XII.,How proud she was! How darkly fair!
436,XII.,"How full of faith, of love, of strength!"
437,XII.,"Her calm, proud eyes! Her great hair's length,--"
438,XII.,"Her long, strong, tumbled, careless hair,"
439,XII.,"Half curled and knotted anywhere,"
440,XII.,"From brow to breast, from cheek to chin,"
441,XII.,For love to trip and tangle in!
442,XII.,
443,XII.,
444,XIII.,XIII.
445,XIII.,
446,XIII.,At last a tall strange sail was seen:
447,XIII.,"It came so slow, so wearily,"
448,XIII.,"Came creeping cautious up the sea,"
449,XIII.,As if it crept from out between
450,XIII.,The half-closed sea and sky that lay
451,XIII.,"Tight wedged together, far away."
452,XIII.,
453,XIII.,"She watched it, wooed it. She did pray"
454,XIII.,"It might not pass her by, but bring"
455,XIII.,"Some love, some hate, some anything,"
456,XIII.,To break the awful loneliness
457,XIII.,That like a nightly nightmare lay
458,XIII.,Upon her proud and pent-up soul
459,XIII.,Until it barely brooked control.
460,XIII.,
461,XIII.,
462,XIV.,XIV.
463,XIV.,
464,XIV.,"The ship crept silent up the sea,"
465,XIV.,And came--
466,XIV.,You cannot understand
467,XIV.,"How fair she was, how sudden she"
468,XIV.,"Had sprung, full-grown, to womanhood:"
469,XIV.,"How gracious, yet how proud and grand;"
470,XIV.,"How glorified, yet fresh and free,"
471,XIV.,"How human, yet how more than good."
472,XIV.,
473,XIV.,
474,XV.,XV.
475,XV.,
476,XV.,"The ship stole slowly, slowly on;--"
477,XV.,Should you in Californian field
478,XV.,In ample flower-time behold
479,XV.,The soft south rose lift like a shield
480,XV.,"Against the sudden sun at dawn,"
481,XV.,"A double handful of heaped gold,"
482,XV.,"Why you, perhaps, might understand"
483,XV.,How splendid and how queenly she
484,XV.,Uprose beside that wood-set sea.
485,XV.,
486,XV.,The storm-worn ship scarce seemed to creep
487,XV.,From wave to wave. It scarce could keep--
488,XV.,"How still this fair girl stood, how fair!"
489,XV.,How proud her presence as she stood
490,XV.,Between that vast sea and west wood!
491,XV.,"How large and liberal her soul,"
492,XV.,"How confident, how purely chare,"
493,XV.,How trusting; how untried the whole
494,XV.,"Great heart, grand faith, that blossomed there!"
495,XV.,
496,XV.,
497,XVI.,XVI.
498,XVI.,
499,XVI.,"Ay, she was as Madonna to"
500,XVI.,"The tawny, lawless, faithful few"
501,XVI.,Who touched her hand and knew her soul:
502,XVI.,"She drew them, drew them as the pole"
503,XVI.,Points all things to itself.
504,XVI.,She drew
505,XVI.,"Men upward as a moon of spring,"
506,XVI.,"High wheeling, vast and bosom-full,"
507,XVI.,"Half clad in clouds and white as wool,"
508,XVI.,Draws all the strong seas following.
509,XVI.,
510,XVI.,"Yet still she moved as sad, as lone"
511,XVI.,"As that same moon that leans above,"
512,XVI.,And seems to search high heaven through
513,XVI.,"For some strong, all-sufficient love,"
514,XVI.,"For one brave love to be her own,"
515,XVI.,"To lean upon, to love, to woo,"
516,XVI.,"To lord her high white world, to yield"
517,XVI.,His clashing sword against her shield.
518,XVI.,
519,XVI.,"Oh, I once knew a sad, white dove"
520,XVI.,"That died for such sufficient love,"
521,XVI.,Such high-born soul with wings to soar:
522,XVI.,"That stood up equal in its place,"
523,XVI.,"That looked love level in the face,"
524,XVI.,Nor wearied love with leaning o'er
525,XVI.,To lift love level where she trod
526,XVI.,In sad delight the hills of God.
527,XVI.,
528,XVI.,
529,XVII.,XVII.
530,XVII.,
531,XVII.,"How slow before the sleeping breeze,"
532,XVII.,That stranger ship from under seas!
533,XVII.,"How like to Dido by her sea,"
534,XVII.,"When reaching arms imploringly,--"
535,XVII.,"Her large, round, rich, impassioned arms,"
536,XVII.,"Tossed forth from all her storied charms,--"
537,XVII.,This one lone maiden leaning stood
538,XVII.,"Above that sea, beside the wood!"
539,XVII.,
540,XVII.,The ship crept strangely up the seas;
541,XVII.,"Her shrouds seemed shreds, her masts seemed trees,--"
542,XVII.,Strange tattered trees of toughest bough
543,XVII.,That knew no cease of storm till now.
544,XVII.,The maiden pitied her; she prayed
545,XVII.,"Her crew might come, nor feel afraid;"
546,XVII.,"She prayed the winds might come,--they came,"
547,XVII.,As birds that answer to a name.
548,XVII.,
549,XVII.,The maiden held her blowing hair
550,XVII.,That bound her beauteous self about;
551,XVII.,The sea-winds housed within her hair:
552,XVII.,"She let it go, it blew in rout"
553,XVII.,About her bosom full and bare.
554,XVII.,"Her round, full arms were free as air,"
555,XVII.,"Her high hands clasped, as clasped in prayer."
556,XVII.,
557,XVII.,
558,XVIII.,XVIII.
559,XVIII.,
560,XVIII.,"The breeze grew bold, the battered ship"
561,XVIII.,Began to flap her weary wings;
562,XVIII.,"The tall, torn masts began to dip"
563,XVIII.,And walk the wave like living things.
564,XVIII.,"She rounded in, she struck the stream,"
565,XVIII.,She moved like some majestic dream.
566,XVIII.,
567,XVIII.,The captain kept her deck. He stood
568,XVIII.,A Hercules among his men;
569,XVIII.,"And now he watched the sea, and then"
570,XVIII.,He peered as if to pierce the wood.
571,XVIII.,"He now looked back, as if pursued,"
572,XVIII.,"Now swept the sea with glass, as though"
573,XVIII.,He fled or feared some hidden foe.
574,XVIII.,
575,XVIII.,"Swift sailing up the river's mouth,"
576,XVIII.,"Swift tacking north, swift tacking south,"
577,XVIII.,He touched the overhanging wood;
578,XVIII.,He tacked his ship; his tall black mast
579,XVIII.,Touched tree-top mosses as he passed;
580,XVIII.,He touched the steep shore where she stood.
581,XVIII.,
582,XVIII.,
583,XIX.,XIX.
584,XIX.,
585,XIX.,"Her hands still clasped as if in prayer,"
586,XIX.,Sweet prayer set to silentness;
587,XIX.,"Her sun-browned throat uplifted, bare"
588,XIX.,And beautiful.
589,XIX.,Her eager face
590,XIX.,"Illumed with love and tenderness,"
591,XIX.,"And all her presence gave such grace,"
592,XIX.,"Dark shadowed in her cloud of hair,"
593,XIX.,That she seemed more than mortal fair.
594,XIX.,
595,XIX.,
596,XX.,XX.
597,XX.,
598,XX.,He saw. He could not speak. No more
599,XX.,With lifted glass he sought the sea;
600,XX.,No more he watched the wild new shore.
601,XX.,"Now foes might come, now friends might flee;"
602,XX.,"He could not speak, he would not stir,--"
603,XX.,"He saw but her, he feared but her."
604,XX.,
605,XX.,"The black ship ground against the shore,"
606,XX.,She ground against the bank as one
607,XX.,"With long and weary journeys done,"
608,XX.,That would not rise to journey more.
609,XX.,
610,XX.,Yet still this Jason silent stood
611,XX.,"And gazed against that sun-lit wood,"
612,XX.,As one whose soul is anywhere.
613,XX.,
614,XX.,"All seemed so fair, so wondrous fair!"
615,XX.,"At last aroused, he stepped to land"
616,XX.,Like some Columbus. They laid hand
617,XX.,"On lands and fruits, and rested there."
618,XX.,
619,XX.,
620,XXI.,XXI.
621,XXI.,
622,XXI.,He found all fairer than fair morn
623,XXI.,"In sylvan land, where waters run"
624,XXI.,"With downward leap against the sun,"
625,XXI.,And full-grown sudden May is born.
626,XXI.,He found her taller than tall corn
627,XXI.,Tiptoe in tassel; found her sweet
628,XXI.,As vale where bees of Hybla meet.
629,XXI.,
630,XXI.,"An unblown rose, an unread book;"
631,XXI.,A wonder in her wondrous eyes;
632,XXI.,"A large, religious, steadfast look"
633,XXI.,"Of faith, of trust,--the look of one"
634,XXI.,New welcomed in her Paradise.
635,XXI.,
636,XXI.,"He read this book,--read on and on"
637,XXI.,From titlepage to colophon:
638,XXI.,"As in cool woods, some summer day,"
639,XXI.,"You find delight in some sweet lay,"
640,XXI.,And so entranced read on and on
641,XXI.,From titlepage to colophon.
642,XXI.,
643,XXI.,
644,XXII.,XXII.
645,XXII.,
646,XXII.,"And who was he that rested there,--"
647,XXII.,"This Hercules, so huge, so rare,"
648,XXII.,"This giant of a grander day,"
649,XXII.,"This Theseus of a nobler Greece,"
650,XXII.,This Jason of the golden fleece?
651,XXII.,And who was he? And who were they
652,XXII.,That came to seek the hidden gold
653,XXII.,Long hallowed from the pirate's hold?
654,XXII.,I do not know. You need not care.
655,XXII.,
656,XXII.,.     .     .     .     .     .
657,XXII.,
658,XXII.,"They loved, this maiden and this man,"
659,XXII.,"And that is all I surely know,--"
660,XXII.,The rest is as the winds that blow.
661,XXII.,"He bowed as brave men bow to fate,"
662,XXII.,Yet proud and resolute and bold;
663,XXII.,"She, coy at first, and mute and cold,"
664,XXII.,"Held back and seemed to hesitate,--"
