,Poem Title,line
1309,I.,Though you held even to God's garment hem.
1310,I.,
1311,I.,"His love-land has ladies so fair, so fair,"
1312,I.,That they bend their eyes to the holy book
1313,I.,"Lest you should forget yourself, your prayer,"
1314,I.,And never more cease to look and to look.
1315,I.,
1316,I.,"And these are the ladies that no men see,"
1317,I.,And this is the reason men see them not.
1318,I.,"Better their modest sweet mystery,--"
1319,I.,Better by far than the battle-shot.
1320,I.,
1321,I.,"And so, in this curious old town of tiles,"
1322,I.,"The proud French quarter of days long gone,"
1323,I.,In castles of Spain and tumble-down piles
1324,I.,These wonderful ladies live on and on.
1325,I.,
1326,I.,I sit in the church where they come and go;
1327,I.,"I dream of glory that has long since gone,"
1328,I.,"Of the low raised high, of the high brought low,"
1329,I.,As in battle-torn days of Napoleon.
1330,I.,
1331,I.,"These piteous places, so rich, so poor!"
1332,I.,One quaint old church at the edge of the town
1333,I.,"Has white tombs laid to the very church door,--"
1334,I.,White leaves in the story of life turned down.
1335,I.,
1336,I.,"White leaves in the story of life are these,"
1337,I.,"The low white slabs in the long strong grass,"
1338,I.,Where Glory has emptied her hour-glass
1339,I.,And dreams with the dreamers beneath the trees.
1340,I.,
1341,I.,"I dream with the dreamers beneath the sod,"
1342,I.,Where souls pass by to the great white throne;
1343,I.,I count each tomb as a mute milestone
1344,I.,"For weary, sweet souls on their way to God."
1345,I.,
1346,I.,"I sit all day by the vast, strong stream,"
1347,I.,'Mid low white slabs in the long strong grass
1348,I.,"Where Time has forgotten for aye to pass,"
1349,I.,"To dream, and ever to dream and to dream."
1350,I.,
1351,I.,"This quaint old church with its dead to the door,"
1352,I.,"By the cypress swamp at the edge of the town,"
1353,I.,So restful seems that you want to sit down
1354,I.,"And rest you, and rest you for evermore."
1355,I.,
1356,I.,"And one white tomb is a lowliest tomb,"
1357,I.,"That has crept up close to the crumbling door,--"
1358,I.,"Some penitent soul, as imploring room"
1359,I.,Close under the cross that is leaning o'er.
1360,I.,
1361,I.,"'Tis a low white slab, and 'tis nameless, too--"
1362,I.,"Her untold story, why, who should know?"
1363,I.,"Yet God, I reckon, can read right through"
1364,I.,That nameless stone to the bosom below.
1365,I.,
1366,I.,"And the roses know, and they pity her, too;"
1367,I.,"They bend their heads in the sun or rain,"
1368,I.,"And they read, and they read, and then read again,"
1369,I.,As children reading strange pictures through.
1370,I.,
1371,I.,"Why, surely her sleep it should be profound;"
1372,I.,For oh the apples of gold above!
1373,I.,And oh the blossoms of bridal love!
1374,I.,And oh the roses that gather around!
1375,I.,
1376,I.,"The sleep of a night, or a thousand morns?"
1377,I.,"Why what is the difference here, to-day?"
1378,I.,Sleeping and sleeping the years away
1379,I.,"With all earth's roses, and none of its thorns."
1380,I.,
1381,I.,Magnolias white and the roses red--
1382,I.,The palm-tree here and the cypress there:
1383,I.,"Sit down by the palm at the feet of the dead,"
1384,I.,And hear a penitent's midnight prayer.
1385,I.,
1386,I.,
1387,II.,II.
1388,II.,
1389,II.,"The old churchyard is still as death,"
1390,II.,A stranger passes to and fro
1391,II.,As if to church--he does not go--
1392,II.,The dead night does not draw a breath.
1393,II.,
1394,II.,A lone sweet lady prays within.
1395,II.,The stranger passes by the door--
1396,II.,Will he not pray? Is he so poor
1397,II.,He has no prayer for his sin?
1398,II.,
1399,II.,Is he so poor! His two strong hands
1400,II.,"Are full and heavy, as with gold;"
1401,II.,"They clasp, as clasp two iron bands"
1402,II.,About two bags with eager hold.
1403,II.,
1404,II.,"Will he not pause and enter in,"
1405,II.,"Put down his heavy load and rest,"
1406,II.,"Put off his garmenting of sin,"
1407,II.,As some black burden from his breast?
1408,II.,
1409,II.,"Ah, me! the brave alone can pray."
1410,II.,The church-door is as cannon's mouth
1411,II.,"To sinner North, or sinner South,"
1412,II.,More dreaded than dread battle day.
1413,II.,
1414,II.,"Now two men pace. They pace apart,"
1415,II.,And one with youth and truth is fair;
1416,II.,"The fervid sun is in his heart,"
1417,II.,The tawny South is in his hair.
1418,II.,
1419,II.,"Ay, two men pace, pace left and right--"
1420,II.,"The lone, sweet lady prays within--"
1421,II.,"Ay, two men pace: the silent night"
1422,II.,Kneels down in prayer for some sin.
1423,II.,
1424,II.,"Lo! two men pace; and one is gray,"
1425,II.,"A blue-eyed man from snow-clad land,"
1426,II.,"With something heavy in each hand,--"
1427,II.,"With heavy feet, as feet of clay."
1428,II.,
1429,II.,"Ay, two men pace; and one is light"
1430,II.,"Of step, but still his brow is dark"
1431,II.,His eyes are as a kindled spark
1432,II.,That burns beneath the brow of night!
1433,II.,
1434,II.,"And still they pace. The stars are red,"
1435,II.,The tombs are white as frosted snow;
1436,II.,The silence is as if the dead
1437,II.,"Did pace in couples, to and fro."
1438,II.,
1439,II.,
1440,III.,III.
1441,III.,
1442,III.,The azure curtain of God's house
1443,III.,"Draws back, and hangs star-pinned to space;"
1444,III.,"I hear the low, large moon arouse,"
1445,III.,I see her lift her languid face.
1446,III.,
1447,III.,"I see her shoulder up the east,"
1448,III.,"Low-necked, and large as womanhood,--"
1449,III.,"Low-necked, as for some ample feast"
1450,III.,"Of gods, within yon orange-wood."
1451,III.,
1452,III.,"She spreads white palms, she whispers peace,--"
1453,III.,Sweet peace on earth for evermore;
1454,III.,"Sweet peace for two beneath the trees,"
1455,III.,Sweet peace for one within the door.
1456,III.,
1457,III.,"The bent stream, like a scimitar"
1458,III.,"Flashed in the sun, sweeps on and on,"
1459,III.,Till sheathed like some great sword new-drawn
1460,III.,In seas beneath the Carib's star.
1461,III.,
1462,III.,"The high moon climbs the sapphire hill,"
1463,III.,The lone sweet lady prays within;
1464,III.,The crickets keep a clang and din--
1465,III.,"They are so loud, earth is so still!"
1466,III.,
1467,III.,And two men glare in silence there!
1468,III.,"The bitter, jealous hate of each"
1469,III.,Has grown too deep for deed or speech--
1470,III.,"The lone, sweet lady keeps her prayer."
1471,III.,
1472,III.,The vast moon high through heaven's field
1473,III.,In circling chariot is rolled;
1474,III.,"The golden stars are spun and reeled,"
1475,III.,And woven into cloth of gold.
1476,III.,
1477,III.,The white magnolia fills the night
1478,III.,"With perfume, as the proud moon fills"
1479,III.,The glad earth with her ample light
1480,III.,From out her awful sapphire hills.
1481,III.,
1482,III.,White orange blossoms fill the boughs
1483,III.,"Above, about the old church door,--"
1484,III.,"They wait the bride, the bridal vows,--"
1485,III.,They never hung so fair before.
1486,III.,
1487,III.,The two men glare as dark as sin!
1488,III.,"And yet all seems so fair, so white,"
1489,III.,"You would not reckon it was night,--"
1490,III.,The while the lady prays within.
1491,III.,
1492,III.,
1493,IV.,IV.
1494,IV.,
1495,IV.,"She prays so very long and late,--"
1496,IV.,"The two men, weary, waiting there,--"
1497,IV.,The great magnolia at the gate
1498,IV.,Bends drowsily above her prayer.
1499,IV.,
1500,IV.,"The cypress in his cloak of moss,"
1501,IV.,"That watches on in silent gloom,"
1502,IV.,Has leaned and shaped a shadow-cross
1503,IV.,"Above the nameless, lowly tomb."
1504,IV.,
1505,IV.,What can she pray for? What her sin?
1506,IV.,What folly of a maid so fair?
1507,IV.,What shadows bind the wondrous hair
1508,IV.,Of one who prays so long within?
1509,IV.,
1510,IV.,"The palm-trees guard in regiment,"
1511,IV.,Stand right and left without the gate;
1512,IV.,The myrtle-moss trees wait and wait;
1513,IV.,The tall magnolia leans intent.
1514,IV.,
1515,IV.,"The cypress trees, on gnarled old knees,"
1516,IV.,Far out the dank and marshy deep
1517,IV.,"Where slimy monsters groan and creep,"
1518,IV.,Kneel with her in their marshy seas.
1519,IV.,
1520,IV.,What can her sin be? Who shall know?
1521,IV.,"The night flies by,--a bird on wing;"
1522,IV.,The men no longer to and fro
1523,IV.,"Stride up and down, or anything."
1524,IV.,
1525,IV.,For one so weary and so old
1526,IV.,Has hardly strength to stride or stir;
1527,IV.,"He can but hold his bags of gold,--"
1528,IV.,But hug his gold and wait for her.
1529,IV.,
1530,IV.,"The two stand still,--stand face to face."
1531,IV.,The moon slides on; the midnight air
1532,IV.,Is perfumed as a house of prayer--
1533,IV.,The maiden keeps her holy place.
1534,IV.,
1535,IV.,"Two men! And one is gray, but one"
1536,IV.,Scarce lifts a full-grown face as yet:
1537,IV.,"With light foot on life's threshold set,--"
1538,IV.,Is he the other's sun-born son?
1539,IV.,
1540,IV.,"And one is of the land of snow,"
1541,IV.,And one is of the land of sun;
1542,IV.,"A black-eyed burning youth is one,"
1543,IV.,But one has pulses cold and slow:
1544,IV.,
1545,IV.,"Ay, cold and slow from clime of snow"
1546,IV.,"Where Nature's bosom, icy bound,"
1547,IV.,"Holds all her forces, hard, profound,--"
1548,IV.,Holds close where all the South lets go.
1549,IV.,
1550,IV.,"Blame not the sun, blame not the snows;"
1551,IV.,"God's great schoolhouse for all is clime,"
1552,IV.,"The great school-teacher, Father Time;"
1553,IV.,And each has borne as best he knows.
1554,IV.,
1555,IV.,"At last the elder speaks,--he cries,--"
1556,IV.,He speaks as if his heart would break;
1557,IV.,"He speaks out as a man that dies,--"
1558,IV.,As dying for some lost love's sake:
1559,IV.,
1560,IV.,"""Come, take this bag of gold, and go!"
1561,IV.,"Come, take one bag! See, I have two!"
1562,IV.,"Oh, why stand silent, staring so,"
1563,IV.,When I would share my gold with you?
1564,IV.,
1565,IV.,"""Come, take this gold! See how I pray!"
1566,IV.,"See how I bribe, and beg, and buy,--"
1567,IV.,"Ay, buy! buy love, as you, too, may"
1568,IV.,Some day before you come to die.
1569,IV.,
1570,IV.,"""God! take this gold, I beg, I pray!"
1571,IV.,I beg as one who thirsting cries
1572,IV.,"For but one drop of drink, and dies"
1573,IV.,"In some lone, loveless desert way."
1574,IV.,
1575,IV.,"""You hesitate? Still hesitate?"
1576,IV.,Stand silent still and mock my pain?
1577,IV.,"Still mock to see me wait and wait,"
1578,IV.,"And wait her love, as earth waits rain?"""
1579,IV.,
1580,IV.,
1581,V.,V.
1582,V.,
1583,V.,O broken ship! O starless shore!
1584,V.,"O black and everlasting night,"
1585,V.,Where love comes never any more
1586,V.,To light man's way with heaven's light.
1587,V.,
1588,V.,A godless man with bags of gold
1589,V.,I think a most unholy sight;
1590,V.,"Ah, who so desolate at night"
1591,V.,Amid death's sleepers still and cold?
1592,V.,
1593,V.,A godless man on holy ground
1594,V.,I think a most unholy sight.
1595,V.,I hear death trailing like a hound
1596,V.,"Hard after him, and swift to bite."
1597,V.,
1598,V.,
1599,VI.,VI.
1600,VI.,
1601,VI.,The vast moon settles to the west:
1602,VI.,"Two men beside a nameless tomb,"
1603,VI.,"And one would sit thereon to rest,--"
1604,VI.,"Ay, rest below, if there were room."
1605,VI.,
1606,VI.,"What is this rest of death, sweet friend?"
1607,VI.,"What is the rising up,--and where?"
1608,VI.,"I say, death is a lengthened prayer,"
1609,VI.,"A longer night, a larger end."
1610,VI.,
1611,VI.,Hear you the lesson I once learned:
1612,VI.,I died; I sailed a million miles
1613,VI.,"Through dreamful, flowery, restful isles,--"
1614,VI.,"She was not there, and I returned."
1615,VI.,
1616,VI.,I say the shores of death and sleep
1617,VI.,"Are one; that when we, wearied, come"
1618,VI.,"To Lethe's waters, and lie dumb,"
1619,VI.,"'Tis death, not sleep, holds us to keep."
1620,VI.,
1621,VI.,"Yea, we lie dead for need of rest"
1622,VI.,And so the soul drifts out and o'er
1623,VI.,The vast still waters to the shore
1624,VI.,"Beyond, in pleasant, tranquil quest:"
1625,VI.,
1626,VI.,"It sails straight on, forgetting pain,"
1627,VI.,"Past isles of peace, to perfect rest,--"
1628,VI.,"Now were it best abide, or best"
1629,VI.,Return and take up life again?
1630,VI.,
1631,VI.,"And that is all of death there is,"
1632,VI.,Believe me. If you find your love
1633,VI.,"In that far land, then like the dove"
1634,VI.,"Abide, and turn not back to this."
1635,VI.,
1636,VI.,But if you find your love not there;
1637,VI.,"Or if your feet feel sure, and you"
1638,VI.,"Have still allotted work to do,--"
1639,VI.,"Why, then return to toil and care."
1640,VI.,
1641,VI.,Death is no mystery. 'Tis plain
1642,VI.,"If death be mystery, then sleep"
1643,VI.,"Is mystery thrice strangely deep,--"
1644,VI.,For oh this coming back again!
1645,VI.,
1646,VI.,Austerest ferryman of souls!
1647,VI.,"I see the gleam of solid shores,"
1648,VI.,I hear thy steady stroke of oars
1649,VI.,Above the wildest wave that rolls.
1650,VI.,
1651,VI.,"O Charon, keep thy sombre ships!"
1652,VI.,"We come, with neither myrrh nor balm,"
1653,VI.,"Nor silver piece in open palm,"
1654,VI.,But lone white silence on our lips.
1655,VI.,
1656,VI.,
1657,VII.,VII.
1658,VII.,
1659,VII.,She prays so long! she prays so late!
1660,VII.,What sin in all this flower-land
1661,VII.,Against her supplicating hand
1662,VII.,Could have in heaven any weight?
1663,VII.,
1664,VII.,Prays she for her sweet self alone?
1665,VII.,"Prays she for some one far away,"
1666,VII.,"Or some one near and dear to-day,"
1667,VII.,"Or some poor, lorn, lost soul unknown?"
1668,VII.,
1669,VII.,It seems to me a selfish thing
1670,VII.,To pray forever for one's self;
1671,VII.,It seems to me like heaping pelf
1672,VII.,In heaven by hard reckoning.
1673,VII.,
1674,VII.,"Why, I would rather stoop, and bear"
1675,VII.,"My load of sin, and bear it well"
1676,VII.,"And bravely down to burning hell,"
1677,VII.,Than ever pray one selfish prayer!
1678,VII.,
1679,VII.,
1680,VIII.,VIII.
1681,VIII.,
1682,VIII.,The swift chameleon in the gloom--
1683,VIII.,This silence it is so profound!--
1684,VIII.,"Forsakes its bough, glides to the ground,"
1685,VIII.,"Then up, and lies across the tomb."
1686,VIII.,
1687,VIII.,"It erst was green as olive-leaf,"
1688,VIII.,It then grew gray as myrtle moss
1689,VIII.,The time it slid the moss across;
1690,VIII.,But now 'tis marble-white with grief.
1691,VIII.,
1692,VIII.,The little creature's hues are gone;
1693,VIII.,Here in the pale and ghostly light
1694,VIII.,"It lies so pale, so panting white,--"
1695,VIII.,White as the tomb it lies upon.
1696,VIII.,
1697,VIII.,"The two men by that nameless tomb,"
1698,VIII.,And both so still! You might have said
1699,VIII.,"These two men, they are also dead,"
1700,VIII.,And only waiting here for room.
1701,VIII.,
1702,VIII.,How still beneath the orange-bough!
1703,VIII.,"How tall was one, how bowed was one!"
1704,VIII.,"The one was as a journey done,"
1705,VIII.,The other as beginning now.
1706,VIII.,
1707,VIII.,"And one was young,--young with that youth"
1708,VIII.,Eternal that belongs to truth;
1709,VIII.,"And one was old,--old with the years"
1710,VIII.,That follow fast on doubts and fears.
1711,VIII.,
1712,VIII.,And yet the habit of command
1713,VIII.,"Was his, in every stubborn part;"
1714,VIII.,"No common knave was he at heart,"
1715,VIII.,Nor his the common coward's hand.
1716,VIII.,
1717,VIII.,"He looked the young man in the face,"
1718,VIII.,"So full of hate, so frank of hate;"
1719,VIII.,"The other, standing in his place,"
1720,VIII.,Stared back as straight and hard as fate.
1721,VIII.,
1722,VIII.,"And now he sudden turned away,"
1723,VIII.,"And now he paced the path, and now"
1724,VIII.,"Came back, beneath the orange-bough"
1725,VIII.,"Pale-browed, with lips as cold as clay."
1726,VIII.,
1727,VIII.,"As mute as shadows on a wall,"
1728,VIII.,"As silent still, as dark as they,"
1729,VIII.,"Before that stranger, bent and gray,"
1730,VIII.,"The youth stood scornful, proud, and tall."
1731,VIII.,
1732,VIII.,"He stood, a tall palmetto-tree"
1733,VIII.,With Spanish daggers guarding it;
1734,VIII.,"Nor deed, nor word, to him seemed fit"
1735,VIII.,While she prayed on so silently.
1736,VIII.,
1737,VIII.,He slew his rival with his eyes;
1738,VIII.,"His eyes were daggers piercing deep,--"
1739,VIII.,So deep that blood began to creep
1740,VIII.,From their deep wounds and drop wordwise:
1741,VIII.,
1742,VIII.,"His eyes so black, so bright that they"
1743,VIII.,"Might raise the dead, the living slay,"
1744,VIII.,"If but the dead, the living, bore"
1745,VIII.,Such hearts as heroes had of yore:
1746,VIII.,
1747,VIII.,"Two deadly arrows barbed in black,"
1748,VIII.,"And feathered, too, with raven's wing;"
1749,VIII.,"Two arrows that could silent sting,"
1750,VIII.,And with a death-wound answer back.
1751,VIII.,
1752,VIII.,How fierce he was! how deadly still
1753,VIII.,"In that mesmeric, hateful stare"
1754,VIII.,Turned on the pleading stranger there
1755,VIII.,"That drew to him, despite his will:"
1756,VIII.,
1757,VIII.,"So like a bird down-fluttering,"
1758,VIII.,"Down, down, beneath a snake's bright eyes,"
1759,VIII.,"He stood, a fascinated thing,"
1760,VIII.,"That hopeless, unresisting, dies."
1761,VIII.,
1762,VIII.,"He raised a hard hand as before,"
1763,VIII.,"Reached out the gold, and offered it"
1764,VIII.,"With hand that shook as ague-fit,--"
1765,VIII.,The while the youth but scorned the more.
1766,VIII.,
1767,VIII.,"""You will not touch it? In God's name"
1768,VIII.,"Who are you, and what are you, then?"
1769,VIII.,"Come, take this gold, and be of men,--"
1770,VIII.,A human form with human aim.
1771,VIII.,
1772,VIII.,"""Yea, take this gold,--she must be mine"
1773,VIII.,She shall be mine! I do not fear
1774,VIII.,"Your scowl, your scorn, your soul austere,"
1775,VIII.,"The living, dead, or your dark sign."
1776,VIII.,
1777,VIII.,"""I saw her as she entered there;"
1778,VIII.,"I saw her, and uncovered stood:"
1779,VIII.,The perfume of her womanhood
1780,VIII.,Was holy incense on the air.
1781,VIII.,
1782,VIII.,"""She left behind sweet sanctity,"
1783,VIII.,Religion lay the way she went;
1784,VIII.,"I cried I would repent, repent!"
1785,VIII.,"She passed on, all unheeding me."
1786,VIII.,
1787,VIII.,"""Her soul is young, her eyes are bright"
1788,VIII.,"And gladsome, as mine own are dim;"
1789,VIII.,"But, oh, I felt my senses swim"
1790,VIII.,The time she passed me by to-night!--
1791,VIII.,
1792,VIII.,"""The time she passed, nor raised her eyes"
1793,VIII.,"To hear me cry I would repent,"
1794,VIII.,"Nor turned her head to hear my cries,"
1795,VIII.,"But swifter went the way she went,--"
1796,VIII.,
1797,VIII.,"""Went swift as youth, for all these years!"
1798,VIII.,"And this the strangest thing appears,"
1799,VIII.,"That lady there seems just the same,--"
1800,VIII.,Sweet Gladys-- Ah! you know her name?
1801,VIII.,
1802,VIII.,"""You hear her name and start that I"
1803,VIII.,Should name her dear name trembling so?
1804,VIII.,"Why, boy, when I shall come to die"
1805,VIII.,That name shall be the last I know.
1806,VIII.,
1807,VIII.,"""That name shall be the last sweet name"
1808,VIII.,My lips shall utter in this life!
1809,VIII.,"That name is brighter than bright flame,--"
1810,VIII.,That lady is my wedded wife!
1811,VIII.,
1812,VIII.,"""Ah, start and catch your burning breath!"
1813,VIII.,"Ah, start and clutch your deadly knife!"
1814,VIII.,"If this be death, then be it death,--"
1815,VIII.,But that loved lady is my wife!
1816,VIII.,
1817,VIII.,"""Yea, you are stunned! your face is white,"
1818,VIII.,"That I should come confronting you,"
1819,VIII.,As comes a lorn ghost of the night
1820,VIII.,"From out the past, and to pursue."
1821,VIII.,
1822,VIII.,"""You thought me dead? You shake your head,"
1823,VIII.,You start back horrified to know
1824,VIII.,"That she is loved, that she is wed,"
1825,VIII.,That you have sinned in loving so.
1826,VIII.,
1827,VIII.,"""Yet what seems strange, that lady there,"
1828,VIII.,"Housed in the holy house of prayer,"
1829,VIII.,"Seems just the same for all her tears,--"
1830,VIII.,For all my absent twenty years.
1831,VIII.,
1832,VIII.,"""Yea, twenty years to-night, to-night,"
1833,VIII.,"Just twenty years this day, this hour,"
1834,VIII.,"Since first I plucked that perfect flower,"
1835,VIII.,And not one witness of the rite.
1836,VIII.,
1837,VIII.,"""Nay, do not doubt,--I tell you true!"
1838,VIII.,"Her prayers, her tears, her constancy"
1839,VIII.,"Are all for me, are all for me,--"
1840,VIII.,And not one single thought for you!
1841,VIII.,
1842,VIII.,"""I knew, I knew she would be here"
1843,VIII.,This night of nights to pray for me!
1844,VIII.,And how could I for twenty year
1845,VIII.,Know this same night so certainly?
1846,VIII.,
1847,VIII.,"""Ah me! some thoughts that we would drown"
1848,VIII.,Stick closer than a brother to
1849,VIII.,"The conscience, and pursue, pursue"
1850,VIII.,Like baying hound to hunt us down.
1851,VIII.,
1852,VIII.,"""And then, that date is history;"
1853,VIII.,"For on that night this shore was shelled,"
1854,VIII.,"And many a noble mansion felled,"
1855,VIII.,With many a noble family.
1856,VIII.,
1857,VIII.,"""I wore the blue; I watched the flight"
1858,VIII.,Of shells like stars tossed through the air
1859,VIII.,"To blow your hearth-stones--anywhere,"
1860,VIII.,"That wild, illuminated night."
1861,VIII.,
1862,VIII.,"""Nay, rage befits you not so well:"
1863,VIII.,"Why, you were but a babe at best,"
1864,VIII.,Your cradle some sharp bursted shell
1865,VIII.,"That tore, maybe, your mother's breast!"
1866,VIII.,
1867,VIII.,"""Hear me! We came in honored war."
1868,VIII.,The risen world was on your track!
1869,VIII.,"The whole North-land was at our back,"
1870,VIII.,From Hudson's bank to the North star!
1871,VIII.,
1872,VIII.,"""And from the North to palm-set sea"
1873,VIII.,The splendid fiery cyclone swept.
1874,VIII.,"Your fathers fell, your mothers wept,"
1875,VIII.,Their nude babes clinging to the knee.
1876,VIII.,
1877,VIII.,"""A wide and desolated track:"
1878,VIII.,"Behind, a path of ruin lay;"
1879,VIII.,"Before, some women by the way"
1880,VIII.,"Stood mutely gazing, clad in black."
1881,VIII.,
1882,VIII.,"""From silent women waiting there"
1883,VIII.,Some tears came down like still small rain;
1884,VIII.,Their own sons on the battle plain
1885,VIII.,Were now but viewless ghosts of air.
1886,VIII.,
1887,VIII.,"""Their own dear daring boys in gray,--"
1888,VIII.,They should not see them any more;
1889,VIII.,Our cruel drums kept telling o'er
1890,VIII.,The time their own sons went away.
1891,VIII.,
1892,VIII.,"""Through burning town, by bursting shell--"
1893,VIII.,"Yea, I remember well that night;"
1894,VIII.,"I led through orange-lanes of light,"
1895,VIII.,As through some hot outpost of hell!
1896,VIII.,
1897,VIII.,"""That night of rainbow-shot and shell"
1898,VIII.,Sent from your surging river's breast
1899,VIII.,"To waken me, no more to rest,--"
1900,VIII.,That night I should remember well!
1901,VIII.,
1902,VIII.,"""That night amid the maimed and dead,--"
1903,VIII.,A night in history set down
1904,VIII.,"By light of many a burning town,"
1905,VIII.,"And written all across in red,--"
1906,VIII.,
1907,VIII.,"""Her father dead, her brothers dead,"
1908,VIII.,"Her home in flames,--what else could she"
1909,VIII.,"But fly all helpless here to me,"
1910,VIII.,"A fluttered dove, that night of dread?"
1911,VIII.,
1912,VIII.,"""Short time, hot time had I to woo"
1913,VIII.,Amid the red shells' battle-chime;
1914,VIII.,"But women rarely reckon time,"
1915,VIII.,And perils speed their love when true.
1916,VIII.,
1917,VIII.,"""And then I wore a captain's sword;"
1918,VIII.,"And, too, had oftentime before"
1919,VIII.,"Doffed cap at her dead father's door,"
1920,VIII.,And passed a soldier's pleasant word.
1921,VIII.,
1922,VIII.,"""And then--ah, I was comely then!"
1923,VIII.,"I bore no load upon my back,"
1924,VIII.,"I heard no hounds upon my track,"
1925,VIII.,But stood the tallest of tall men.
1926,VIII.,
1927,VIII.,"""Her father's and her mother's shrine,"
1928,VIII.,"This church amid the orange wood,"
1929,VIII.,"So near and so secure it stood,"
1930,VIII.,It seemed to beckon as a sign.
1931,VIII.,
1932,VIII.,"""Its white cross seemed to beckon me:"
1933,VIII.,"My heart was strong, and it was mine"
1934,VIII.,"To throw myself upon my knee,"
1935,VIII.,To beg to lead her to this shrine.
1936,VIII.,
1937,VIII.,"""She did consent. Through lanes of light"
1938,VIII.,I led through that church-door that night--
1939,VIII.,Let fall your hand! Take back your face
1940,VIII.,"And stand,--stand patient in your place!"
1941,VIII.,
1942,VIII.,"""She loved me; and she loves me still."
1943,VIII.,"Yea, she clung close to me that hour"
1944,VIII.,"As honey-bee to honey-flower,--"
1945,VIII.,"And still is mine, through good or ill."
1946,VIII.,
1947,VIII.,"""The priest stood there. He spake the prayer;"
1948,VIII.,"He made the holy, mystic sign."
1949,VIII.,"And she was mine, was wholly mine,--"
1950,VIII.,Is mine this moment I will swear!
1951,VIII.,
1952,VIII.,"""Then days, then nights, of vast delight,--"
1953,VIII.,"Then came a doubtful, later day;"
1954,VIII.,"The faithful priest, now far away,"
1955,VIII.,Watched with the dying in the fight:
1956,VIII.,
1957,VIII.,"""The priest amid the dying, dead,"
1958,VIII.,"Kept duty on the battle-field,--"
1959,VIII.,That midnight marriage unrevealed
1960,VIII.,Kept strange thoughts running through my head.
1961,VIII.,
1962,VIII.,"""At last a stray ball struck the priest:"
1963,VIII.,This vestibule his chancel was.
1964,VIII.,"And now none lived to speak her cause,"
1965,VIII.,"Record, or champion her the least."
1966,VIII.,
1967,VIII.,"""Hear me! I had been bred to hate"
1968,VIII.,"All priests, their mummeries and all."
