,Poem Title,line
1969,VIII.,"Ah, it was fate,--ah, it was fate"
1970,VIII.,That all things tempted me to fall!
1971,VIII.,
1972,VIII.,"""And then the rattling songs we sang"
1973,VIII.,"Those nights when rudely revelling,--"
1974,VIII.,"The songs that only soldiers sing,--"
1975,VIII.,Until the very tent-poles rang!
1976,VIII.,
1977,VIII.,"""What is the rhyme that rhymers say"
1978,VIII.,Of maidens born to be betrayed
1979,VIII.,"By epaulettes and shining blade,"
1980,VIII.,While soldiers love and ride away?
1981,VIII.,
1982,VIII.,"""And then my comrades spake her name"
1983,VIII.,"Half taunting, with a touch of shame;"
1984,VIII.,Taught me to hold that lily-flower
1985,VIII.,As some light pastime of the hour.
1986,VIII.,
1987,VIII.,"""And then the ruin in the land,"
1988,VIII.,"The death, dismay, the lawlessness!"
1989,VIII.,"Men gathered gold on every hand,--"
1990,VIII.,Heaped gold: and why should I do less?
1991,VIII.,
1992,VIII.,"""The cry for gold was in the air,"
1993,VIII.,"For Creole gold, for precious things;"
1994,VIII.,The sword kept prodding here and there
1995,VIII.,Through bolts and sacred fastenings.
1996,VIII.,
1997,VIII.,"""'Get gold! get gold!' This was the cry."
1998,VIII.,And I loved gold. What else could I
1999,VIII.,"Or you, or any earnest one"
2000,VIII.,Born in this getting age have done?
2001,VIII.,
2002,VIII.,"""With this one lesson taught from youth,"
2003,VIII.,"And ever taught us, to get gold,--"
2004,VIII.,"To get and hold, and ever hold,--"
2005,VIII.,"What else could I have done, forsooth?"
2006,VIII.,
2007,VIII.,"""She, seeing how I sought for gold,--"
2008,VIII.,"This girl, my wife, one late night told"
2009,VIII.,"Of treasures hidden close at hand,"
2010,VIII.,In her dead father's mellow land:
2011,VIII.,
2012,VIII.,"""Of gold she helped her brothers hide"
2013,VIII.,"Beneath a broad banana tree,"
2014,VIII.,"The day the two in battle died,--"
2015,VIII.,The night she dying fled to me.
2016,VIII.,
2017,VIII.,"""It seemed too good; I laughed to scorn"
2018,VIII.,Her trustful tale. She answered not;
2019,VIII.,But meekly on the morrow morn
2020,VIII.,Two massive bags of bright gold brought.
2021,VIII.,
2022,VIII.,"""And when she brought this gold to me,"
2023,VIII.,"Red Creole gold, rich, rare, and old,--"
2024,VIII.,"When I at last had gold, sweet gold,"
2025,VIII.,I cried in very ecstasy!
2026,VIII.,
2027,VIII.,"""Red gold! rich gold! two bags of gold!"
2028,VIII.,The two stout bags of gold she brought
2029,VIII.,"And gave with scarce a second thought,--"
2030,VIII.,"Why, her two hands could hardly hold!"
2031,VIII.,
2032,VIII.,"""Now I had gold! two bags of gold!"
2033,VIII.,"Two wings of gold to fly, and fly"
2034,VIII.,The wide world's girth; red gold to hold
2035,VIII.,Against my heart for aye and aye!
2036,VIII.,
2037,VIII.,"""My country's lesson: 'Gold! get gold!'"
2038,VIII.,I learned it well in land of snow;
2039,VIII.,"And what can glow, so brightly glow,"
2040,VIII.,Long winter nights of Northern cold?
2041,VIII.,
2042,VIII.,"""Ay, now at last, at last I had"
2043,VIII.,"The one thing, all fair things above"
2044,VIII.,My land had taught me most to love!
2045,VIII.,A miser now! and I grew mad.
2046,VIII.,
2047,VIII.,"""With those two bags of gold my own,"
2048,VIII.,I then began to plan that night
2049,VIII.,"For flight, for far and sudden flight,--"
2050,VIII.,"For flight; and, too, for flight alone."
2051,VIII.,
2052,VIII.,"""I feared! I feared! My heart grew cold,--"
2053,VIII.,Some one might claim this gold of me!
2054,VIII.,"I feared her,--feared her purity,"
2055,VIII.,Feared all things but my bags of gold.
2056,VIII.,
2057,VIII.,"""I grew to hate her face, her creed,--"
2058,VIII.,That face the fairest ever yet
2059,VIII.,"That bowed o'er holy cross or bead,"
2060,VIII.,Or yet was in God's image set.
2061,VIII.,
2062,VIII.,"""I fled,--nay, not so knavish low"
2063,VIII.,"As you have fancied, did I fly;"
2064,VIII.,"I sought her at that shrine, and I"
2065,VIII.,Told her full frankly I should go.
2066,VIII.,
2067,VIII.,"""I stood a giant in my power,--"
2068,VIII.,And did she question or dispute?
2069,VIII.,"I stood a savage, selfish brute,--"
2070,VIII.,"She bowed her head, a lily-flower."
2071,VIII.,
2072,VIII.,"""And when I sudden turned to go,"
2073,VIII.,"And told her I should come no more,"
2074,VIII.,"She bowed her head so low, so low,"
2075,VIII.,Her vast black hair fell pouring o'er.
2076,VIII.,
2077,VIII.,"""And that was all; her splendid face"
2078,VIII.,"Was mantled from me, and her night"
2079,VIII.,Of hair half hid her from my sight
2080,VIII.,As she fell moaning in her place.
2081,VIII.,
2082,VIII.,"""And there, 'mid her dark night of hair,"
2083,VIII.,"She sobbed, low moaning through her tears,"
2084,VIII.,"That she would wait, wait all the years,--"
2085,VIII.,Would wait and pray in her despair.
2086,VIII.,
2087,VIII.,"""Nay, did not murmur, not deny,--"
2088,VIII.,She did not cross me one sweet word!
2089,VIII.,I turned and fled: I thought I heard
2090,VIII.,"A night-bird's piercing low death-cry!"""
2091,VIII.,
2092,VIII.,
2093,VIII.,
2094,VIII.,
2095,THE RHYME OF THE GREAT RIVER.,THE RHYME OF THE GREAT RIVER.
2096,THE RHYME OF THE GREAT RIVER.,
2097,PART II.,PART II.
2098,PART II.,
2099,PART II.,
2100,PART II.,How soft this moonlight of the South!
2101,PART II.,How sweet my South in soft moonlight!
2102,PART II.,I want to kiss her warm sweet mouth
2103,PART II.,As she lies sleeping here to-night.
2104,PART II.,
2105,PART II.,How still! I do not hear a mouse.
2106,PART II.,I see some bursting buds appear;
2107,PART II.,"I hear God in His garden,--hear"
2108,PART II.,Him trim some flowers for His house.
2109,PART II.,
2110,PART II.,I hear some singing stars; the mouth
2111,PART II.,"Of my vast river sings and sings,"
2112,PART II.,"And pipes on reeds of pleasant things,--"
2113,PART II.,Of splendid promise for my South:
2114,PART II.,
2115,PART II.,"My great South-woman, soon to rise"
2116,PART II.,And tiptoe up and loose her hair;
2117,PART II.,"Tiptoe, and take from all the skies"
2118,PART II.,God's stars and glorious moon to wear!
2119,PART II.,
2120,PART II.,
2121,I.,I.
2122,I.,
2123,I.,"The poet shall create or kill,"
2124,I.,"Bid heroes live, bid braggarts die."
2125,I.,"I look against a lurid sky,--"
2126,I.,My silent South lies proudly still.
2127,I.,
2128,I.,The lurid light of burning lands
2129,I.,Still climbs to God's house overhead;
2130,I.,Mute women wring white withered hands;
2131,I.,"Their eyes are red, their skies are red."
2132,I.,
2133,I.,Poor man! still boast your bitter wars!
2134,I.,"Still burn and burn, and burning die."
2135,I.,But God's white finger spins the stars
2136,I.,In calm dominion of the sky.
2137,I.,
2138,I.,And not one ray of light the less
2139,I.,Comes down to bid the grasses spring;
2140,I.,No drop of dew nor anything
2141,I.,Shall fail for all your bitterness.
2142,I.,
2143,I.,"The land that nursed a nation's youth,"
2144,I.,"Ye burned it, sacked it, sapped it dry."
2145,I.,"Ye gave it falsehoods for its truth,"
2146,I.,And fame was fashioned from a lie.
2147,I.,
2148,I.,"If man grows large, is God the less?"
2149,I.,"The moon shall rise and set the same,"
2150,I.,The great sun spill his splendid flame
2151,I.,And clothe the world in queenliness.
2152,I.,
2153,I.,And from that very soil ye trod
2154,I.,Some large-souled seeing youth shall come
2155,I.,"Some day, and he shall not be dumb"
2156,I.,Before the awful court of God.
2157,I.,
2158,I.,
2159,II.,II.
2160,II.,
2161,II.,"The weary moon had turned away,"
2162,II.,The far North-Star was turning pale
2163,II.,To hear the stranger's boastful tale
2164,II.,Of blood and flame that battle day.
2165,II.,
2166,II.,"And yet again the two men glared,"
2167,II.,Close face to face above that tomb;
2168,II.,Each seemed as jealous of the room
2169,II.,The other eager waiting shared.
2170,II.,
2171,II.,"Again the man began to say,--"
2172,II.,"As taking up some broken thread,"
2173,II.,"As talking to the patient dead,--"
2174,II.,The Creole was as still as they:
2175,II.,
2176,II.,"""That night we burned yon grass-grown town,--"
2177,II.,"The grasses, vines are reaching up;"
2178,II.,"The ruins they are reaching down,"
2179,II.,As sun-browned soldiers when they sup.
2180,II.,
2181,II.,"""I knew her,--knew her constancy."
2182,II.,"She said, this night of every year"
2183,II.,"She here would come, and kneeling here,"
2184,II.,Would pray the live-long night for me.
2185,II.,
2186,II.,"""This praying seems a splendid thing!"
2187,II.,It drives old Time the other way;
2188,II.,It makes him lose all reckoning
2189,II.,Of years that pagans have to pay.
2190,II.,
2191,II.,"""This praying seems a splendid thing!"
2192,II.,It makes me stronger as she prays--
2193,II.,"But oh the bitter, bitter days"
2194,II.,When I became a banished thing!
2195,II.,
2196,II.,"""I fled, took ship,--I fled as far"
2197,II.,As far ships drive tow'rd the North-Star;
2198,II.,"For I did hate the South, the sun"
2199,II.,That made me think what I had done.
2200,II.,
2201,II.,"""I could not see a fair palm-tree"
2202,II.,"In foreign land, in pleasant place,"
2203,II.,But it would whisper of her face
2204,II.,And shake its keen sharp blades at me.
2205,II.,
2206,II.,"""Each black-eyed woman would recall"
2207,II.,"A lone church-door, a face, a name,"
2208,II.,"A coward's flight, a soldier's shame:"
2209,II.,"I fled from woman's face, from all."
2210,II.,
2211,II.,"""I hugged my gold, my precious gold,"
2212,II.,"Within my strong, stout, buckskin vest."
2213,II.,I wore my bags against my breast
2214,II.,So close I felt my heart grow cold.
2215,II.,
2216,II.,"""I did not like to see it now;"
2217,II.,I did not spend one single piece.
2218,II.,"I travelled, travelled without cease"
2219,II.,As far as Russian ship could plow.
2220,II.,
2221,II.,"""And when my own scant hoard was gone,"
2222,II.,"And I had reached the far North-land,"
2223,II.,I took my two stout bags in hand
2224,II.,"As one pursued, and journeyed on."
2225,II.,
2226,II.,"""Ah, I was weary! I grew gray;"
2227,II.,I felt the fast years slip and reel
2228,II.,As slip black beads when maidens kneel
2229,II.,At altars when out-door is gay.
2230,II.,
2231,II.,"""At last I fell prone in the road,--"
2232,II.,Fell fainting with my cursèd load.
2233,II.,A skin-clad cossack helped me bear
2234,II.,"My bags, nor would one shilling share."
2235,II.,
2236,II.,"""He looked at me with proud disdain,--"
2237,II.,He looked at me as if he knew;
2238,II.,His black eyes burned me thro' and thro';
2239,II.,His scorn pierced like a deadly pain.
2240,II.,
2241,II.,"""He frightened me with honesty;"
2242,II.,"He made me feel so small, so base,"
2243,II.,"I fled, as if the fiend kept chase,--"
2244,II.,The fiend that claims my company!
2245,II.,
2246,II.,"""I bore my load alone; I crept"
2247,II.,Far up the steep and icy way;
2248,II.,"And there, before a cross there lay"
2249,II.,"A barefoot priest, who bowed and wept."
2250,II.,
2251,II.,"""I threw my gold right down and sped"
2252,II.,Straight on. And oh my heart was light!
2253,II.,A spring-time bird in spring-time flight
2254,II.,Flies not so happy as I fled.
2255,II.,
2256,II.,"""I felt somehow this monk would take"
2257,II.,"My gold, my load from off my back;"
2258,II.,"Would turn the fiend from off my track,"
2259,II.,Would take my gold for sweet Christ's sake!
2260,II.,
2261,II.,"""I fled; I did not look behind;"
2262,II.,"I fled, fled with the mountain wind."
2263,II.,At last; far down the mountain's base
2264,II.,I found a pleasant resting-place.
2265,II.,
2266,II.,"""I rested there so long, so well,"
2267,II.,More grateful than all tongues can tell.
2268,II.,It was such pleasant thing to hear
2269,II.,That valley's voices calm and clear:
2270,II.,
2271,II.,"""That valley veiled in mountain air,"
2272,II.,With white goats on the hills at morn;
2273,II.,"That valley green with seas of corn,"
2274,II.,With cottage islands here and there.
2275,II.,
2276,II.,"""I watched the mountain girls. The hay"
2277,II.,They mowed was not more sweet than they;
2278,II.,They laid brown hands in my white hair;
2279,II.,They marvelled at my face of care.
2280,II.,
2281,II.,"""I tried to laugh; I could but weep."
2282,II.,"I made these peasants one request,--"
2283,II.,"That I with them might toil or rest,"
2284,II.,"And with them sleep the long, last sleep."
2285,II.,
2286,II.,"""I begged that I might battle there,"
2287,II.,"For that fair valley-land, for those"
2288,II.,"Who gave me cheer when girt with foes,"
2289,II.,"And have a country, loved and fair."
2290,II.,
2291,II.,"""Where is that spot that poets name"
2292,II.,Our country? name the hallowed land?
2293,II.,Where is that spot where man must stand
2294,II.,Or fall when girt with sword and flame?
2295,II.,
2296,II.,"""Where is that one permitted spot?"
2297,II.,Where is the one place man must fight?
2298,II.,Where rests the one God-given right
2299,II.,"To fight, as ever patriots fought?"
2300,II.,
2301,II.,"""I say 'tis in that holy house"
2302,II.,Where God first set us down on earth:
2303,II.,"Where mother welcomed us at birth,"
2304,II.,"And bared her breasts, a happy spouse."
2305,II.,
2306,II.,"""But when some wrong, some deed of shame,"
2307,II.,Shall make that land no more our own--
2308,II.,Ah! hunger for that holy name
2309,II.,"My country, I have truly known!"
2310,II.,
2311,II.,"""The simple plough-boy from his field"
2312,II.,Looks forth. He sees God's purple wall
2313,II.,Encircling him. High over all
2314,II.,The vast sun wheels his shining shield.
2315,II.,
2316,II.,"""This King, who makes earth what it is,--"
2317,II.,King David bending to his toil!
2318,II.,"O lord and master of the soil,"
2319,II.,How envied in thy loyal bliss!
2320,II.,
2321,II.,"""Long live the land we loved in youth,--"
2322,II.,"That world with blue skies bent about,"
2323,II.,Where never entered ugly doubt!
2324,II.,"Long live the simple, homely truth!"
2325,II.,
2326,II.,"""Can true hearts love some far snow-land,"
2327,II.,Some bleak Alaska bought with gold?
2328,II.,God's laws are old as love is old;
2329,II.,And Home is something near at hand.
2330,II.,
2331,II.,"""Yea, change yon river's course; estrange"
2332,II.,The seven sweet stars; make hate divide
2333,II.,"The full moon from the flowing tide,--"
2334,II.,But this old truth ye cannot change.
2335,II.,
2336,II.,"""I begged a land as begging bread;"
2337,II.,I begged of these brave mountaineers
2338,II.,"To share their sorrows, share their tears;"
2339,II.,"To weep as they wept, with their dead."
2340,II.,
2341,II.,"""They did consent. The mountain town"
2342,II.,"Was mine to love, and valley lands."
2343,II.,That night the barefoot monk came down
2344,II.,And laid my two bags in my hands!
2345,II.,
2346,II.,"""On! On! And oh the load I bore!"
2347,II.,"Why, once I dreamed my soul was lead;"
2348,II.,Dreamed once it was a body dead!
2349,II.,"It made my cold, hard bosom sore."
2350,II.,
2351,II.,"""I dragged that body forth and back--"
2352,II.,"O conscience, what a baying hound!"
2353,II.,Nor frozen seas nor frosted ground
2354,II.,Can throw this bloodhound from his track.
2355,II.,
2356,II.,"""In farthest Russia I lay down"
2357,II.,"A dying man, at last to rest;"
2358,II.,I felt such load upon my breast
2359,II.,"As seamen feel, who sinking drown."
2360,II.,
2361,II.,"""That night, all chill and desperate,"
2362,II.,"I sprang up, for I could not rest;"
2363,II.,"I tore the two bags from my breast,"
2364,II.,And dashed them in the burning grate.
2365,II.,
2366,II.,"""I then crept back into my bed;"
2367,II.,"I tried, I begged, I prayed to sleep;"
2368,II.,"But those red, restless coins would keep"
2369,II.,"Slow dropping, dropping, and blood red."
2370,II.,
2371,II.,"""I heard them clink and clink and clink,--"
2372,II.,"They turned, they talked within that grate."
2373,II.,They talked of her; they made me think
2374,II.,Of one who still must pray and wait.
2375,II.,
2376,II.,"""And when the bags burned crisp and black,"
2377,II.,"Two coins did start, roll to the floor,--"
2378,II.,"Roll out, roll on, and then roll back,"
2379,II.,As if they needs must journey more.
2380,II.,
2381,II.,"""Ah, then I knew nor change nor space,"
2382,II.,Nor all the drowning years that rolled
2383,II.,"Could hide from me her haunting face,"
2384,II.,Nor still that red-tongued talking gold.
2385,II.,
2386,II.,"""Again I sprang forth from my bed!"
2387,II.,I shook as in an ague fit;
2388,II.,"I clutched that red gold, burning red,"
2389,II.,"I clutched, as if to strangle it."
2390,II.,
2391,II.,"""I clutched it up--you hear me, boy?--"
2392,II.,I clutched it up with joyful tears!
2393,II.,"I clutched it close, with such wild joy"
2394,II.,I had not felt for years and years!
2395,II.,
2396,II.,"""Such joy! for I should now retrace"
2397,II.,"My steps, should see my land, her face;"
2398,II.,"Bring back her gold this battle day,"
2399,II.,"And see her, see her, hear her pray!"
2400,II.,
2401,II.,"""I brought it back--you hear me, boy?--"
2402,II.,"I clutch it, hold it, hold it now:"
2403,II.,"Red gold, bright gold that giveth joy"
2404,II.,"To all, and anywhere or how;"
2405,II.,
2406,II.,"""That giveth joy to all but me,--"
2407,II.,"To all but me, yet soon to all."
2408,II.,"It burns my hands, it burns! but she"
2409,II.,Shall ope my hands and let it fall.
2410,II.,
2411,II.,"""For oh I have a willing hand"
2412,II.,To give these bags of gold; to see
2413,II.,Her smile as once she smiled on me
2414,II.,"Here in this pleasant, warm palm-land!"""
2415,II.,
2416,II.,"He ceased, he thrust each hard-clenched fist,"
2417,II.,"He threw his gold hard forth again,"
2418,II.,As one impelled by some mad pain
2419,II.,He would not or could not resist.
2420,II.,
2421,II.,"The creole, scorning, turned away,"
2422,II.,"As if he turned from that lost thief,--"
2423,II.,The one that died without belief
2424,II.,That awful crucifixion day.
2425,II.,
2426,II.,
2427,III.,III.
2428,III.,
2429,III.,"Believe in man, nor turn away."
2430,III.,Lo! man advances year by year;
2431,III.,"Time bears him upward, and his sphere"
2432,III.,Of life must broaden day by day.
2433,III.,
2434,III.,Believe in man with large belief;
2435,III.,The garnered grain each harvest-time
2436,III.,"Hath promise, roundness, and full prime"
2437,III.,For all the empty chaff and sheaf.
2438,III.,
2439,III.,Believe in man with proud belief:
2440,III.,"Truth keeps the bottom of her well,"
2441,III.,"And when the thief peeps down, the thief"
2442,III.,"Peeps back at him, perpetual."
2443,III.,
2444,III.,Faint not that this or that man fell;
2445,III.,For one that falls a thousand rise
2446,III.,To lift white Progress to the skies:
2447,III.,Truth keeps the bottom of her well.
2448,III.,
2449,III.,"Fear not for man, nor cease to delve"
2450,III.,"For cool sweet truth, with large belief."
2451,III.,"Lo! Christ himself chose only twelve,"
2452,III.,Yet one of these turned out a thief.
2453,III.,
2454,III.,
2455,IV.,IV.
2456,IV.,
2457,IV.,Down through the dark magnolia leaves
2458,IV.,Where climbs the rose of Cherokee
2459,IV.,"Against the orange-blossomed tree,"
2460,IV.,"A loom of moonlight weaves and weaves,--"
2461,IV.,
2462,IV.,"A loom of moonlight, weaving clothes"
2463,IV.,"From snow-white rose of Cherokee,"
2464,IV.,"And bridal blooms of orange-tree,"
2465,IV.,For fairy folk in fragrant rose.
2466,IV.,
2467,IV.,"Down through the mournful myrtle crape,"
2468,IV.,"Through moving moss, through ghostly gloom,"
2469,IV.,A long white moonbeam takes a shape
2470,IV.,"Above a nameless, lowly tomb;"
2471,IV.,
2472,IV.,A long white finger through the gloom
2473,IV.,"Of grasses gathered round about,--"
2474,IV.,As God's white finger pointing out
2475,IV.,A name upon that nameless tomb.
2476,IV.,
2477,IV.,
2478,V.,V.
2479,V.,
2480,V.,"Her white face bowed in her black hair,"
2481,V.,The maiden prays so still within
2482,V.,"That you might hear a falling pin,--"
2483,V.,"Ay, hear her white unuttered prayer."
2484,V.,
2485,V.,"The moon has grown disconsolate,"
2486,V.,Has turned her down her walk of stars:
2487,V.,"Why, she is shutting up her bars,"
2488,V.,As maidens shut a lover's gate.
2489,V.,
2490,V.,The moon has grown disconsolate;
2491,V.,She will no longer watch and wait.
2492,V.,But two men wait; and two men will
2493,V.,"Wait on till morning, mute and still:"
2494,V.,
2495,V.,"Still wait and walk among the trees,"
2496,V.,Quite careless if the moon may keep
2497,V.,Her walk along her starry steep
2498,V.,Above the Southern pearl-sown seas.
2499,V.,
2500,V.,"They know no moon, or set or rise"
2501,V.,"Of stars, or anything to light"
2502,V.,"The earth or skies, save her dark eyes,"
2503,V.,"This praying, waking, watching night."
2504,V.,
2505,V.,"They move among the tombs apart,"
2506,V.,Their eyes turn ever to that door;
2507,V.,They know the worn walks there by heart--
2508,V.,They turn and walk them o'er and o'er.
2509,V.,
2510,V.,"They are not wide, these little walks"
2511,V.,For dead folk by this crescent town.
2512,V.,"They lie right close when they lie down,"
2513,V.,As if they kept up quiet talks.
2514,V.,
2515,V.,
2516,VI.,VI.
2517,VI.,
2518,VI.,The two men keep their paths apart;
2519,VI.,But more and more begins to stoop
2520,VI.,"The man with gold, as droop and droop"
2521,VI.,Tall plants with something at their heart.
2522,VI.,
2523,VI.,Now once again with eager zest
2524,VI.,He offers gold with silent speech;
2525,VI.,"The other will not walk in reach,"
2526,VI.,"But walks around, as round a pest."
2527,VI.,
2528,VI.,"His dark eyes sweep the scene around,"
2529,VI.,"His young face drinks the fragrant air,"
2530,VI.,"His dark eyes journey everywhere,--"
2531,VI.,The other's cleave unto the ground.
2532,VI.,
2533,VI.,"It is a weary walk for him,"
2534,VI.,For oh he bears a weary load!
2535,VI.,He does not like that narrow road
2536,VI.,Between the dead--it is so dim:
2537,VI.,
2538,VI.,"It is so dark, that narrow place,"
2539,VI.,"Where graves lie thick, like yellow leaves:"
2540,VI.,"Give us the light of Christ and grace,"
2541,VI.,Give light to garner in the sheaves.
2542,VI.,
2543,VI.,"Give light of love; for gold is cold,"
2544,VI.,And gold is cruel as a crime;
2545,VI.,It gives no light at such sad time
2546,VI.,As when man's feet wax weak and old.
2547,VI.,
2548,VI.,"Ay, gold is heavy, hard, and cold!"
2549,VI.,And have I said this thing before?
2550,VI.,"Well, I will tell it o'er and o'er,"
2551,VI.,'Twere need be told ten thousand fold.
2552,VI.,
2553,VI.,"""Give us this day our daily bread,""--"
2554,VI.,"Get this of God, then all the rest"
2555,VI.,"Is housed in thine own honest breast,"
2556,VI.,If you but lift a lordly head.
2557,VI.,
2558,VI.,
2559,VII.,VII.
2560,VII.,
2561,VII.,"Oh, I have seen men, tall and fair,"
2562,VII.,"Stoop down their manhood with disgust,"
2563,VII.,"Stoop down God's image to the dust,"
2564,VII.,To get a load of gold to bear;
2565,VII.,
2566,VII.,Have seen men selling day by day
2567,VII.,The glance of manhood that God gave:
2568,VII.,To sell God's image as a slave
2569,VII.,Might sell some little pot of clay!
2570,VII.,
2571,VII.,Behold! here in this green graveyard
2572,VII.,A man with gold enough to fill
2573,VII.,"A coffin, as a miller's till;"
2574,VII.,"And yet his path is hard, so hard!"
2575,VII.,
2576,VII.,"His feet keep sinking in the sand,"
2577,VII.,And now so near an opened grave!
2578,VII.,He seems to hear the solemn wave
2579,VII.,Of dread oblivion at hand.
2580,VII.,
2581,VII.,"The sands, they grumble so, it seems"
2582,VII.,As if he walks some shelving brink.
2583,VII.,"He tries to stop, he tries to think,"
2584,VII.,He tries to make believe he dreams:
2585,VII.,
2586,VII.,"Why, he is free to leave the land,"
2587,VII.,The silver moon is white as dawn;
2588,VII.,"Why, he has gold in either hand,"
2589,VII.,Has silver ways to walk upon.
2590,VII.,
2591,VII.,"And who should chide, or bid him stay?"
2592,VII.,"Or taunt, or threat, or bid him fly?"
2593,VII.,"The world's for sale, I hear men say,"
2594,VII.,And yet this man has gold to buy.
2595,VII.,
2596,VII.,Buy what? Buy rest? He could not rest!
2597,VII.,"Buy gentle sleep? He could not sleep,"
2598,VII.,Though all these graves were wide and deep
2599,VII.,As their wide mouths with the request.
2600,VII.,
2601,VII.,"Buy Love, buy faith, buy snow-white truth?"
2602,VII.,"Buy moonlight, sunlight, present, past?"
2603,VII.,Buy but one brimful cup of youth
2604,VII.,That calm souls drink of to the last?
2605,VII.,
2606,VII.,O God! 'tis pitiful to see
2607,VII.,This miser so forlorn and old!
2608,VII.,O God! how poor a man may be
2609,VII.,With nothing in this world but gold!
2610,VII.,
2611,VII.,
2612,VIII.,VIII.
2613,VIII.,
2614,VIII.,The broad magnolia's blooms are white;
2615,VIII.,"Her blooms are large, as if the moon"
2616,VIII.,"Had lost her way some lazy night,"
2617,VIII.,And lodged here till the afternoon.
2618,VIII.,
2619,VIII.,"Oh, vast white blossoms breathing love!"
2620,VIII.,"White bosom of my lady dead,"
2621,VIII.,In your white heaven overhead
2622,VIII.,"I look, and learn to look above."
2623,VIII.,
2624,VIII.,
2625,IX.,IX.
2626,IX.,
2627,IX.,All night the tall magnolia kept
2628,IX.,Kind watch above the nameless tomb:
2629,IX.,Two shapes kept waiting in the gloom
2630,IX.,"And gray of morn, where roses wept."
2631,IX.,
2632,IX.,The dew-wet roses wept; their eyes
2633,IX.,"All dew, their breath as sweet as prayer."
2634,IX.,"And as they wept, the dead down there"
2635,IX.,Did feel their tears and hear their sighs.
2636,IX.,
2637,IX.,The grass uprose as if afraid
2638,IX.,Some stranger foot might press too near;
2639,IX.,"Its every blade was like a spear,"
2640,IX.,Its every spear a living blade.
2641,IX.,
2642,IX.,The grass above that nameless tomb
2643,IX.,"Stood all arrayed, as if afraid"
2644,IX.,Some weary pilgrim seeking room
2645,IX.,"And rest, might lay where she was laid."
2646,IX.,
2647,IX.,
2648,X.,X.
2649,X.,
