,Poem Title,line
3233,JUST FOLKS,It seemed before we'd settled down 'twas time to say good-bye.
3234,JUST FOLKS,"Those were the glad Thanksgivings, the old-time families knew"
3235,JUST FOLKS,When relatives could still be friends and every heart was true.
3236,JUST FOLKS,
3237,JUST FOLKS,
3238,JUST FOLKS,
3239,JUST FOLKS,
3240,JUST FOLKS,The Old-Fashioned Pair
3241,JUST FOLKS,
3242,JUST FOLKS,"'Tis a little old house with a squeak in the stairs,"
3243,JUST FOLKS,And a porch that seems made for just two easy chairs;
3244,JUST FOLKS,"In the yard is a group of geraniums red,"
3245,JUST FOLKS,And a glorious old-fashioned peony bed.
3246,JUST FOLKS,Petunias and pansies and larkspurs are there
3247,JUST FOLKS,Proclaiming their love for the old-fashioned pair.
3248,JUST FOLKS,
3249,JUST FOLKS,"Oh, it's hard now to picture the peace of the place!"
3250,JUST FOLKS,Never lovelier smile lit a fair woman's face
3251,JUST FOLKS,Than the smile of the little old lady who sits
3252,JUST FOLKS,On the porch through the bright days of summer and knits.
3253,JUST FOLKS,And a courtlier manner no prince ever had
3254,JUST FOLKS,"Than the little old man that she speaks of as ""dad."""
3255,JUST FOLKS,
3256,JUST FOLKS,In that little old house there is nothing of hate;
3257,JUST FOLKS,There are old-fashioned things by an old-fashioned grate;
3258,JUST FOLKS,On the walls there are pictures of fine looking men
3259,JUST FOLKS,"And beautiful ladies to look at, and then"
3260,JUST FOLKS,Time has placed on the mantel to comfort them there
3261,JUST FOLKS,"The pictures of grandchildren, radiantly fair."
3262,JUST FOLKS,
3263,JUST FOLKS,"Every part of the house seems to whisper of joy,"
3264,JUST FOLKS,Save the trinkets that speak of a lost little boy.
3265,JUST FOLKS,"Yet Time has long since soothed the hurt and the pain,"
3266,JUST FOLKS,And his glorious memories only remain:
3267,JUST FOLKS,"The laughter of children the old walls have known,"
3268,JUST FOLKS,"And the joy of it stays, though the babies have flown."
3269,JUST FOLKS,
3270,JUST FOLKS,I am fond of that house and that old-fashioned pair
3271,JUST FOLKS,And the glorious calm that is hovering there.
3272,JUST FOLKS,The riches of life are not silver and gold
3273,JUST FOLKS,"But fine sons and daughters when we are grown old,"
3274,JUST FOLKS,And I pray when the years shall have silvered our hair
3275,JUST FOLKS,We shall know the delights of that old-fashioned pair.
3276,JUST FOLKS,
3277,JUST FOLKS,
3278,JUST FOLKS,
3279,JUST FOLKS,
3280,JUST FOLKS,At Pelletier's
3281,JUST FOLKS,
3282,JUST FOLKS,We've been out to Pelletier's
3283,JUST FOLKS,"Brushing off the stain of years,"
3284,JUST FOLKS,Quitting all the moods of men
3285,JUST FOLKS,And been boys and girls again.
3286,JUST FOLKS,"We have romped through orchards blazing,"
3287,JUST FOLKS,"Petted ponies gently grazing,"
3288,JUST FOLKS,"Hidden in the hayloft's spaces,"
3289,JUST FOLKS,And the queerest sort of places
3290,JUST FOLKS,That are lost (and it's a pity!)
3291,JUST FOLKS,To the youngsters in the city.
3292,JUST FOLKS,And the hired men have let us
3293,JUST FOLKS,"Drive their teams, and stopped to get us"
3294,JUST FOLKS,"Apples from the trees, and lingered"
3295,JUST FOLKS,While a cow's cool nose we fingered;
3296,JUST FOLKS,And they told us all about her
3297,JUST FOLKS,And her grandpa who was stouter.
3298,JUST FOLKS,
3299,JUST FOLKS,We've been out to Pelletier's
3300,JUST FOLKS,"Watching horses raise their ears,"
3301,JUST FOLKS,And their joyous whinnies hearing
3302,JUST FOLKS,When the man with oats was nearing.
3303,JUST FOLKS,We've been climbing trees an' fences
3304,JUST FOLKS,Never minding consequences.
3305,JUST FOLKS,And we helped the man to curry
3306,JUST FOLKS,The fat ponies' sides so furry.
3307,JUST FOLKS,And we saw a squirrel taking
3308,JUST FOLKS,"Walnuts to the nest he's making,"
3309,JUST FOLKS,"Storing them for winter, when he"
3310,JUST FOLKS,Can't get out to hunt for any.
3311,JUST FOLKS,"And we watched the turkeys, growing"
3312,JUST FOLKS,Big and fat and never knowing
3313,JUST FOLKS,That the reason they were living
3314,JUST FOLKS,Is to die for our Thanksgiving.
3315,JUST FOLKS,
3316,JUST FOLKS,"We've been out to Pelletier's,"
3317,JUST FOLKS,Brushing off the stain of years.
3318,JUST FOLKS,We were kids set free from shamming
3319,JUST FOLKS,"And the city's awful cramming,"
3320,JUST FOLKS,And the clamor and the bustle
3321,JUST FOLKS,And the fearful rush and hustle--
3322,JUST FOLKS,Out of doors with room to race in
3323,JUST FOLKS,And broad acres soft to chase in.
3324,JUST FOLKS,We just stretched our souls and let them
3325,JUST FOLKS,"Drop the petty cares that fret them,"
3326,JUST FOLKS,"Left our narrow thoughts behind us,"
3327,JUST FOLKS,Loosed the selfish traits that bind us
3328,JUST FOLKS,And were wholesomer and plainer
3329,JUST FOLKS,"Simpler, kinder folks and saner,"
3330,JUST FOLKS,"And at night said: ""It's a pity"
3331,JUST FOLKS,"Mortals ever built a city."""
3332,JUST FOLKS,
3333,JUST FOLKS,
3334,JUST FOLKS,
3335,JUST FOLKS,
3336,JUST FOLKS,At Christmas
3337,JUST FOLKS,
3338,JUST FOLKS,A man is at his finest towards the finish of the year;
3339,JUST FOLKS,He is almost what he should be when the Christmas season's here;
3340,JUST FOLKS,"Then he's thinking more of others than be's thought the months before,"
3341,JUST FOLKS,And the laughter of his children is a joy worth toiling for.
3342,JUST FOLKS,He is less a selfish creature than at any other time;
3343,JUST FOLKS,When the Christmas spirit rules him he comes close to the sublime.
3344,JUST FOLKS,
3345,JUST FOLKS,When it's Christmas man is bigger and is better in his part;
3346,JUST FOLKS,He is keener for the service that is prompted by the heart.
3347,JUST FOLKS,All the petty thoughts and narrow seem to vanish for awhile
3348,JUST FOLKS,And the true reward he's seeking is the glory of a smile.
3349,JUST FOLKS,Then for others he is toiling and somehow it seems to me
3350,JUST FOLKS,That at Christmas he is almost what God wanted him to be.
3351,JUST FOLKS,
3352,JUST FOLKS,If I had to paint a picture of a man I think I'd wait
3353,JUST FOLKS,Till he'd fought his selfish battles and had put aside his hate.
3354,JUST FOLKS,"I'd not catch him at his labors when his thoughts are all of pelf,"
3355,JUST FOLKS,On the long days and the dreary when he's striving for himself.
3356,JUST FOLKS,"I'd not take him when he's sneering, when he's scornful or depressed,"
3357,JUST FOLKS,But I'd look for him at Christmas when he's shining at his best.
3358,JUST FOLKS,
3359,JUST FOLKS,Man is ever in a struggle and he's oft misunderstood;
3360,JUST FOLKS,"There are days the worst that's in him is the master of the good,"
3361,JUST FOLKS,But at Christmas kindness rules him and he puts himself aside
3362,JUST FOLKS,And his petty hates are vanquished and his heart is opened wide.
3363,JUST FOLKS,"Oh, I don't know how to say it, but somehow it seems to me"
3364,JUST FOLKS,That at Christmas man is almost what God sent him here to be.
3365,JUST FOLKS,
3366,JUST FOLKS,
3367,JUST FOLKS,
3368,JUST FOLKS,
3369,JUST FOLKS,The Little Army
3370,JUST FOLKS,
3371,JUST FOLKS,"Little women, little men,"
3372,JUST FOLKS,Childhood never comes again.
3373,JUST FOLKS,Live it gayly while you may;
3374,JUST FOLKS,Give your baby souls to play;
3375,JUST FOLKS,"March to sound of stick and pan,"
3376,JUST FOLKS,"In your paper hats, and tramp"
3377,JUST FOLKS,just as bravely as you can
3378,JUST FOLKS,To your pleasant little camp.
3379,JUST FOLKS,Wooden sword and wooden gun
3380,JUST FOLKS,Make a battle splendid fun.
3381,JUST FOLKS,Fine the victories you win
3382,JUST FOLKS,Dimpled cheek and dimpled chin.
3383,JUST FOLKS,
3384,JUST FOLKS,"Little women, little men,"
3385,JUST FOLKS,Hearts are light when years are ten;
3386,JUST FOLKS,Eyes are bright and cheeks are red
3387,JUST FOLKS,When life's cares lie all ahead.
3388,JUST FOLKS,Drums make merry music when
3389,JUST FOLKS,They are leading children out;
3390,JUST FOLKS,"Trumpet calls are cheerful then,"
3391,JUST FOLKS,Glorious is the battle shout.
3392,JUST FOLKS,"Little soldiers, single file,"
3393,JUST FOLKS,"Uniformed in grin and smile,"
3394,JUST FOLKS,Conquer every foe they meet
3395,JUST FOLKS,Up and down the gentle street.
3396,JUST FOLKS,
3397,JUST FOLKS,"Little women, little men,"
3398,JUST FOLKS,Would that youth could come again!
3399,JUST FOLKS,Would that I might fall in line
3400,JUST FOLKS,"As a little boy of nine,"
3401,JUST FOLKS,"But with broomstick for a gun,"
3402,JUST FOLKS,And with paper hat that I
3403,JUST FOLKS,"Bravely wore back there for fun,"
3404,JUST FOLKS,Never more may I defy
3405,JUST FOLKS,Foes that deep in ambush kneel--
3406,JUST FOLKS,Now my warfare's grim and real.
3407,JUST FOLKS,"I that once was brave and bold,"
3408,JUST FOLKS,"Now am battered, bruised and old."
3409,JUST FOLKS,
3410,JUST FOLKS,"Little women, little men,"
3411,JUST FOLKS,"Planning to attack my den,"
3412,JUST FOLKS,Little do you know the joy
3413,JUST FOLKS,That you give a worn-out boy
3414,JUST FOLKS,As he hears your gentle feet
3415,JUST FOLKS,Pitter-patting in the hall;
3416,JUST FOLKS,Gladly does he wait to meet
3417,JUST FOLKS,Conquest by a troop so small.
3418,JUST FOLKS,"Dimpled cheek and dimpled chin,"
3419,JUST FOLKS,You have but to smile to win.
3420,JUST FOLKS,Come and take him where he stays
3421,JUST FOLKS,Dreaming of his by-gone days.
3422,JUST FOLKS,
3423,JUST FOLKS,
3424,JUST FOLKS,
3425,JUST FOLKS,
3426,JUST FOLKS,Who Is Your Boss?
3427,JUST FOLKS,
3428,JUST FOLKS,"""I work for someone else,"" he said;"
3429,JUST FOLKS,"""I have no chance to get ahead."
3430,JUST FOLKS,At night I leave the job behind;
3431,JUST FOLKS,At morn I face the same old grind.
3432,JUST FOLKS,And everything I do by day
3433,JUST FOLKS,Just brings to me the same old pay.
3434,JUST FOLKS,While I am here I cannot see
3435,JUST FOLKS,"The semblance of a chance for me."""
3436,JUST FOLKS,
3437,JUST FOLKS,I asked another how he viewed
3438,JUST FOLKS,The occupation he pursued.
3439,JUST FOLKS,"""It's dull and dreary toil,"" said he,"
3440,JUST FOLKS,"""And brings but small reward to me."
3441,JUST FOLKS,My boss gets all the profits fine
3442,JUST FOLKS,That I believe are rightly mine.
3443,JUST FOLKS,My life's monotonously grim
3444,JUST FOLKS,"Because I'm forced to work for him."""
3445,JUST FOLKS,
3446,JUST FOLKS,I stopped a third young man to ask
3447,JUST FOLKS,His attitude towards his task.
3448,JUST FOLKS,A cheerful smile lit up his face;
3449,JUST FOLKS,"""I shan't be always in this place,"""
3450,JUST FOLKS,"He said, ""because some distant day"
3451,JUST FOLKS,"A better job will come my way."""
3452,JUST FOLKS,"""Your boss?"" I asked, and answered he:"
3453,JUST FOLKS,"""I'm going to make him notice me."
3454,JUST FOLKS,
3455,JUST FOLKS,"""He pays me wages and in turn"
3456,JUST FOLKS,"That money I am here to earn,"
3457,JUST FOLKS,But I don't work for him alone;
3458,JUST FOLKS,Allegiance to myself I own.
3459,JUST FOLKS,I do not do my best because
3460,JUST FOLKS,It gets me favors or applause--
3461,JUST FOLKS,"I work for him, but I can see"
3462,JUST FOLKS,That actually I work for me.
3463,JUST FOLKS,
3464,JUST FOLKS,"""It looks like business good to me"
3465,JUST FOLKS,The best clerk on the staff to be.
3466,JUST FOLKS,If customers approve my style
3467,JUST FOLKS,And like my manner and my smile
3468,JUST FOLKS,"I help the firm to get the pelf,"
3469,JUST FOLKS,But what is more I help myself.
3470,JUST FOLKS,From one big thought I'm never free:
3471,JUST FOLKS,"That every day I work for me."""
3472,JUST FOLKS,
3473,JUST FOLKS,"Oh, youth, thought I, you're bound to climb"
3474,JUST FOLKS,The ladder of success in time.
3475,JUST FOLKS,Too many self-impose the cross
3476,JUST FOLKS,"Of daily working for a boss,"
3477,JUST FOLKS,Forgetting that in failing him
3478,JUST FOLKS,It is their own stars that they dim.
3479,JUST FOLKS,And when real service they refuse
3480,JUST FOLKS,They are the ones who really lose.
3481,JUST FOLKS,
3482,JUST FOLKS,
3483,JUST FOLKS,
3484,JUST FOLKS,
3485,JUST FOLKS,The Truth About Envy
3486,JUST FOLKS,
3487,JUST FOLKS,"I like to see the flowers grow,"
3488,JUST FOLKS,To see the pansies in a row;
3489,JUST FOLKS,"I think a well-kept garden's fine,"
3490,JUST FOLKS,And wish that such a one were mine;
3491,JUST FOLKS,But one can't have a stock of flowers
3492,JUST FOLKS,Unless he digs and digs for hours.
3493,JUST FOLKS,
3494,JUST FOLKS,My ground is always bleak and bare;
3495,JUST FOLKS,The roses do not flourish there.
3496,JUST FOLKS,And where I once sowed poppy seeds
3497,JUST FOLKS,Is now a tangled mass of weeds.'
3498,JUST FOLKS,"I'm fond of flowers, but admit,"
3499,JUST FOLKS,For digging I don't care a bit.
3500,JUST FOLKS,
3501,JUST FOLKS,"I envy men whose yards are gay,"
3502,JUST FOLKS,But never work as hard as they;
3503,JUST FOLKS,I also envy men who own
3504,JUST FOLKS,More wealth than I have ever known.
3505,JUST FOLKS,I'm like a lot of men who yearn
3506,JUST FOLKS,For joys that they refuse to earn.
3507,JUST FOLKS,
3508,JUST FOLKS,You cannot have the joys of work
3509,JUST FOLKS,And take the comfort of a shirk.
3510,JUST FOLKS,I find the man I envy most
3511,JUST FOLKS,Is he who's longest at his post.
3512,JUST FOLKS,"I could have gold and roses, too,"
3513,JUST FOLKS,If I would work like those who do.
3514,JUST FOLKS,
3515,JUST FOLKS,
3516,JUST FOLKS,
3517,JUST FOLKS,
3518,JUST FOLKS,Living
3519,JUST FOLKS,
3520,JUST FOLKS,If through the years we're not to do
3521,JUST FOLKS,Much finer deeds than we have done;
3522,JUST FOLKS,If we must merely wander through
3523,JUST FOLKS,"Time's garden, idling in the sun;"
3524,JUST FOLKS,"If there is nothing big ahead,"
3525,JUST FOLKS,Why do we fear to join the dead?
3526,JUST FOLKS,
3527,JUST FOLKS,Unless to-morrow means that we
3528,JUST FOLKS,Shall do some needed service here;
3529,JUST FOLKS,That tasks are waiting you and me
3530,JUST FOLKS,"That will be lost, save we appear;"
3531,JUST FOLKS,Then why this dreadful thought of sorrow
3532,JUST FOLKS,That we may never see to-morrow?
3533,JUST FOLKS,
3534,JUST FOLKS,"If all our finest deeds are done,"
3535,JUST FOLKS,And all our splendor's in the past;
3536,JUST FOLKS,"If there's no battle to be won,"
3537,JUST FOLKS,What matter if to-day's our last?
3538,JUST FOLKS,Is life so sweet that we would live
3539,JUST FOLKS,Though nothing back to life we give?
3540,JUST FOLKS,
3541,JUST FOLKS,It is not greatness to have clung
3542,JUST FOLKS,To life through eighty fruitless years;
3543,JUST FOLKS,"The man who dies in action, young,"
3544,JUST FOLKS,"Deserves our praises and our cheers,"
3545,JUST FOLKS,Who ventures all for one great deed
3546,JUST FOLKS,And gives his life to serve life's need.
3547,JUST FOLKS,
3548,JUST FOLKS,
3549,JUST FOLKS,
3550,JUST FOLKS,
3551,JUST FOLKS,On Being Broke
3552,JUST FOLKS,
3553,JUST FOLKS,"Don't mind being broke at all,"
3554,JUST FOLKS,When I can say that what I had
3555,JUST FOLKS,Was spent for toys for kiddies small
3556,JUST FOLKS,And that the spending made 'em glad.
3557,JUST FOLKS,"I don't regret the money gone,"
3558,JUST FOLKS,If happiness it left behind.
3559,JUST FOLKS,An empty purse I'll look upon
3560,JUST FOLKS,"Contented, if its record's kind."
3561,JUST FOLKS,"There's no disgrace in being broke,"
3562,JUST FOLKS,Unless it's due to flying high;
3563,JUST FOLKS,"Though poverty is not a joke,"
3564,JUST FOLKS,"The only thing that counts is ""why?"""
3565,JUST FOLKS,
3566,JUST FOLKS,The dollars come to me and go;
3567,JUST FOLKS,To-day I've eight or ten to spend;
3568,JUST FOLKS,"To-morrow I'll be sailing low,"
3569,JUST FOLKS,And have to lean upon a friend.
3570,JUST FOLKS,But if that little bunch of mine
3571,JUST FOLKS,"Is richer by some toy or frill,"
3572,JUST FOLKS,I'll face the world and never whine
3573,JUST FOLKS,Because I lack a dollar bill.
3574,JUST FOLKS,"I'm satisfied, if I can see"
3575,JUST FOLKS,One smile that hadn't bloomed before.
3576,JUST FOLKS,The only thing that counts with me
3577,JUST FOLKS,Is what I've spent my money for.
3578,JUST FOLKS,
3579,JUST FOLKS,"I might regret my sorry plight,"
3580,JUST FOLKS,If selfishness brought it about;
3581,JUST FOLKS,"If for the fun I had last night,"
3582,JUST FOLKS,Some joy they'd have to go without.
3583,JUST FOLKS,"But if I've swapped my bit of gold,"
3584,JUST FOLKS,For laughter and a happier pack
3585,JUST FOLKS,Of youngsters in my little fold
3586,JUST FOLKS,I'll never wish those dollars back.
3587,JUST FOLKS,If I have traded coin for things
3588,JUST FOLKS,"They needed and have left them glad,"
3589,JUST FOLKS,Then being broke no sorrow brings--
3590,JUST FOLKS,I've done my best with what I had.
3591,JUST FOLKS,
3592,JUST FOLKS,
3593,JUST FOLKS,
3594,JUST FOLKS,
3595,JUST FOLKS,The Broken Drum
3596,JUST FOLKS,
3597,JUST FOLKS,There is sorrow in the household;
3598,JUST FOLKS,There's a grief too hard to bear;
3599,JUST FOLKS,There's a little cheek that's tear-stained
3600,JUST FOLKS,There's a sobbing baby there.
3601,JUST FOLKS,"And try how we will to comfort,"
3602,JUST FOLKS,Still the tiny teardrops come;
3603,JUST FOLKS,"For, to solve a vexing problem,"
3604,JUST FOLKS,Curly Locks has wrecked his drum.
3605,JUST FOLKS,
3606,JUST FOLKS,"It had puzzled him and worried,"
3607,JUST FOLKS,How the drum created sound;
3608,JUST FOLKS,For he couldn't understand it
3609,JUST FOLKS,It was not enough to pound
3610,JUST FOLKS,"With his tiny hands and drumsticks,"
3611,JUST FOLKS,"And at last the day has come,"
3612,JUST FOLKS,When another hope is shattered;
3613,JUST FOLKS,Now in ruins lies his drum.
3614,JUST FOLKS,
3615,JUST FOLKS,"With his metal bank he broke it,"
3616,JUST FOLKS,"Tore the tightened skin aside,"
3617,JUST FOLKS,"Gazed on vacant space bewildered,"
3618,JUST FOLKS,Then he broke right down and cried.
3619,JUST FOLKS,For the broken bubble shocked him
3620,JUST FOLKS,And the baby tears must come;
3621,JUST FOLKS,Now a joy has gone forever:
3622,JUST FOLKS,Curly Locks has wrecked his drum.
3623,JUST FOLKS,
3624,JUST FOLKS,"While his mother tries to soothe him,"
3625,JUST FOLKS,I am sitting here alone;
3626,JUST FOLKS,In the life that lies behind me;
3627,JUST FOLKS,Many shocks like that I've known.
3628,JUST FOLKS,"And the boy who's upstairs weeping,"
3629,JUST FOLKS,In the years that are to come
3630,JUST FOLKS,Will learn that many pleasures
3631,JUST FOLKS,Are as empty as his drum.
3632,JUST FOLKS,
3633,JUST FOLKS,
3634,JUST FOLKS,
3635,JUST FOLKS,
3636,JUST FOLKS,Mother's Excuses
3637,JUST FOLKS,
3638,JUST FOLKS,Mother for me made excuses
3639,JUST FOLKS,When I was a little tad;
3640,JUST FOLKS,Found some reason for my conduct
3641,JUST FOLKS,When it had been very bad.
3642,JUST FOLKS,Blamed it on a recent illness
3643,JUST FOLKS,Or my nervousness and told
3644,JUST FOLKS,Father to be easy with me
3645,JUST FOLKS,Every time he had to scold.
3646,JUST FOLKS,
3647,JUST FOLKS,"And I knew, as well as any"
3648,JUST FOLKS,"Roguish, healthy lad of ten,"
3649,JUST FOLKS,Mother really wasn't telling
3650,JUST FOLKS,Truthful things to father then.
3651,JUST FOLKS,"I knew I deserved the whipping,"
3652,JUST FOLKS,"Knew that I'd been very bad,"
3653,JUST FOLKS,Knew that mother knew it also
3654,JUST FOLKS,When she intervened with dad.
3655,JUST FOLKS,
3656,JUST FOLKS,I knew that my recent illness
3657,JUST FOLKS,Hadn't anything to do
3658,JUST FOLKS,"With the mischief I'd been up to,"
3659,JUST FOLKS,And I knew that mother knew.
3660,JUST FOLKS,But remembering my fever
3661,JUST FOLKS,"And my nervous temperament,"
3662,JUST FOLKS,Father put away the shingle
3663,JUST FOLKS,And postponed the sad event.
3664,JUST FOLKS,
3665,JUST FOLKS,"Now his mother, when I threaten"
3666,JUST FOLKS,"Punishment for this and that,"
3667,JUST FOLKS,Calls to mind the dreary night hours
3668,JUST FOLKS,When beside his bed we sat.
3669,JUST FOLKS,"Comes and tells me that he's nervous,"
3670,JUST FOLKS,"That's the reason he was bad,"
3671,JUST FOLKS,And the boy and doting mother
3672,JUST FOLKS,Put it over on the dad.
3673,JUST FOLKS,
3674,JUST FOLKS,"Some day when he's grown as I am,"
3675,JUST FOLKS,"With a boy on mischief bent,"
3676,JUST FOLKS,He will hear the timeworn story
3677,JUST FOLKS,Of the nervous temperament.
3678,JUST FOLKS,And remembering the shingle
3679,JUST FOLKS,"That aside I always threw,"
3680,JUST FOLKS,All I hope is that he'll let them
3681,JUST FOLKS,"Put it over on him, too."
3682,JUST FOLKS,
3683,JUST FOLKS,
3684,JUST FOLKS,
3685,JUST FOLKS,
3686,JUST FOLKS,As It Is
3687,JUST FOLKS,
3688,JUST FOLKS,"I might wish the world were better,"
3689,JUST FOLKS,I might sit around and sigh
3690,JUST FOLKS,For a water that is wetter
3691,JUST FOLKS,And a bluer sort of sky.
3692,JUST FOLKS,There are times I think the weather
3693,JUST FOLKS,"Could be much improved upon,"
3694,JUST FOLKS,But when taken altogether
3695,JUST FOLKS,It's a good old world we're on.
3696,JUST FOLKS,"I might tell how I would make it,"
3697,JUST FOLKS,But when I have had my say
3698,JUST FOLKS,It is still my job to take it
3699,JUST FOLKS,"As it is, from day to day."
3700,JUST FOLKS,
3701,JUST FOLKS,"I might wish that men were kinder,"
3702,JUST FOLKS,And less eager after gold;
3703,JUST FOLKS,I might wish that they were blinder
3704,JUST FOLKS,To the faults they now behold.
3705,JUST FOLKS,"And I'd try to make them gentle,"
3706,JUST FOLKS,And more tolerant in strife
3707,JUST FOLKS,And a bit more sentimental
3708,JUST FOLKS,O'er the finer things of life.
3709,JUST FOLKS,"But I am not here to make them,"
3710,JUST FOLKS,Or to work in human clay;
3711,JUST FOLKS,It is just my work to take them
3712,JUST FOLKS,As they are from day to day.
3713,JUST FOLKS,
3714,JUST FOLKS,"Here's a world that suffers sorrow,"
3715,JUST FOLKS,"Here are bitterness and pain,"
3716,JUST FOLKS,And the joy we plan to-morrow
3717,JUST FOLKS,May be ruined by the rain.
3718,JUST FOLKS,"Here are hate and greed and badness,"
3719,JUST FOLKS,"Here are love and friendship, too,"
3720,JUST FOLKS,But the most of it is gladness
3721,JUST FOLKS,When at last we've run it through.
3722,JUST FOLKS,Could we only understand it
3723,JUST FOLKS,As we shall some distant day
3724,JUST FOLKS,We should see that He who planned it
3725,JUST FOLKS,Knew our needs along the way.
3726,JUST FOLKS,
3727,JUST FOLKS,
3728,JUST FOLKS,
3729,JUST FOLKS,
3730,JUST FOLKS,A Boy's Tribute
3731,JUST FOLKS,
3732,JUST FOLKS,Prettiest girl I've ever seen
3733,JUST FOLKS,Is Ma.
3734,JUST FOLKS,Lovelier than any queen
3735,JUST FOLKS,Is Ma.
3736,JUST FOLKS,"Girls with curls go walking by,"
3737,JUST FOLKS,"Dainty, graceful, bold an' shy,"
3738,JUST FOLKS,But the one that takes my eye
3739,JUST FOLKS,Is Ma.
3740,JUST FOLKS,
3741,JUST FOLKS,Every girl made into one
3742,JUST FOLKS,Is Ma.
3743,JUST FOLKS,Sweetest girl to look upon
3744,JUST FOLKS,Is Ma.
3745,JUST FOLKS,"Seen 'em short and seen 'em tall,"
3746,JUST FOLKS,"Seen 'em big and seen 'em small,"
3747,JUST FOLKS,But the finest one of all
3748,JUST FOLKS,Is Ma.
3749,JUST FOLKS,
3750,JUST FOLKS,Best of all the girls on earth
3751,JUST FOLKS,Is Ma.
3752,JUST FOLKS,One that all the rest is worth
3753,JUST FOLKS,Is Ma.
3754,JUST FOLKS,"Some have beauty, some have grace,"
3755,JUST FOLKS,"Some look nice in silk and lace,"
3756,JUST FOLKS,But the one that takes first place
3757,JUST FOLKS,Is Ma.
3758,JUST FOLKS,
3759,JUST FOLKS,Sweetest singer in the land
3760,JUST FOLKS,is Ma.
3761,JUST FOLKS,She that has the softest hand
3762,JUST FOLKS,Is Ma.
3763,JUST FOLKS,"Tenderest, gentlest nurse is she,"
3764,JUST FOLKS,"Full of fun as she can be,"
3765,JUST FOLKS,An' the only girl for me
3766,JUST FOLKS,Is Ma.
3767,JUST FOLKS,
3768,JUST FOLKS,Bet if there's an angel here
3769,JUST FOLKS,It's Ma.'
3770,JUST FOLKS,"if God has a sweetheart dear,"
3771,JUST FOLKS,It's Ma.
3772,JUST FOLKS,"Take the girls that artists draw,"
3773,JUST FOLKS,"An' all the girls I ever saw,"
3774,JUST FOLKS,The only one without a flaw
3775,JUST FOLKS,Is Ma.
3776,JUST FOLKS,
3777,JUST FOLKS,
3778,JUST FOLKS,
3779,JUST FOLKS,
3780,JUST FOLKS,Up to the Ceiling
3781,JUST FOLKS,
3782,JUST FOLKS,Up to the ceiling
3783,JUST FOLKS,"And down to the floor,"
3784,JUST FOLKS,Hear him now squealing
3785,JUST FOLKS,And calling for more.
3786,JUST FOLKS,"Laughing and shouting,"
3787,JUST FOLKS,"""Away up!"" he cries."
3788,JUST FOLKS,Who could be doubting
3789,JUST FOLKS,The love in his eyes.
3790,JUST FOLKS,Heigho! my baby!
3791,JUST FOLKS,And heigho! my son!
3792,JUST FOLKS,Up to the ceiling
3793,JUST FOLKS,Is wonderful fun.
3794,JUST FOLKS,
3795,JUST FOLKS,Bigger than daddy
3796,JUST FOLKS,And bigger than mother;
3797,JUST FOLKS,"Only a laddie,"
3798,JUST FOLKS,But bigger than brother.
3799,JUST FOLKS,Laughing and crowing
3800,JUST FOLKS,"And squirming and wriggling,"
3801,JUST FOLKS,"Cheeks fairly glowing,"
3802,JUST FOLKS,Now cooing and giggling!
3803,JUST FOLKS,"Down to the cellar,"
3804,JUST FOLKS,Then quick as a dart
3805,JUST FOLKS,Up to the ceiling
3806,JUST FOLKS,Brings joy to the heart.
3807,JUST FOLKS,
3808,JUST FOLKS,"Gone is the hurry,"
3809,JUST FOLKS,"The anguish and sting,"
3810,JUST FOLKS,The heartache and worry
3811,JUST FOLKS,That business cares bring;
3812,JUST FOLKS,"Gone is the hustle,"
3813,JUST FOLKS,"The clamor for gold,"
3814,JUST FOLKS,The rush and the bustle
3815,JUST FOLKS,The day's affairs hold.
3816,JUST FOLKS,Peace comes to the battered
3817,JUST FOLKS,"Old heart of his dad,"
3818,JUST FOLKS,"When ""up to the ceiling"""
3819,JUST FOLKS,He plays with his lad.
3820,JUST FOLKS,
3821,JUST FOLKS,
3822,JUST FOLKS,
3823,JUST FOLKS,
3824,JUST FOLKS,Thanksgiving
3825,JUST FOLKS,
3826,JUST FOLKS,"Gettin' together to smile an' rejoice,"
3827,JUST FOLKS,An' eatin' an' laughin' with folks of your choice;
3828,JUST FOLKS,An' kissin' the girls an' declarin' that they
3829,JUST FOLKS,Are growin more beautiful day after day;
