,Poem Title,line
1131,III,"Never, so help me God, shall that thing be."
1132,III,"If she’s a woman fit to touch she’ll wive,"
1133,III,"If not she’s whore, and she shall deal with me."
1134,III,And may God’s blessed mercy help us see
1135,III,"And may He make my Jimmy count the cost,"
1136,III,"My little boy who’s lost, as I am lost.’"
1137,III,
1138,III,"People in love cannot be won by kindness,"
1139,III,And opposition makes them feel like martyrs.
1140,III,"When folk are crazy with a drunken blindness,"
1141,III,"It’s best to flog them with each other’s garters,"
1142,III,"And have the flogging done by Shropshire carters,"
1143,III,Born under Ercall where the while stones lie;
1144,III,Ercall that smells of honey in July.
1145,III,
1146,III,"Jimmy said nothing in reply, but thought"
1147,III,"That mother was an old, hard jealous thing."
1148,III,"’I’ll love my girl through good and ill report,"
1149,III,I shall be true whatever grief it bring.’
1150,III,And in his heart he heard the death-bell ring
1151,III,"For mother’s death, and thought what it would be"
1152,III,To bury her in churchyard and be free.
1153,III,
1154,III,"He saw the narrow grave under the wall,"
1155,III,"Home without mother nagging at his dear,"
1156,III,"And Anna there with him at evenfall,"
1157,III,Bidding him dry his eyes and be of cheer.
1158,III,"’The death that took poor mother brings me near,"
1159,III,"Nearer than we have ever been before,"
1160,III,"Near as the dead one came, but dearer, more.’"
1161,III,
1162,III,"’Good-night, my son,’ said mother.  ’Night,’ he said."
1163,III,"He dabbed her brow wi’s lips and blew the light,"
1164,III,"She lay quite silent crying on the bed,"
1165,III,"Stirring no limb, but crying through the night."
1166,III,"He slept, convinced that he was Anna’s knight."
1167,III,And when he went to work he left behind
1168,III,Money for mother crying herself blind.
1169,III,
1170,III,"After that night he came to Anna’s call,"
1171,III,"He was a fly in Anna’s subtle weavings,"
1172,III,Mother had no more share in him at all;
1173,III,All that the mother had was Anna’s leavings.
1174,III,"There were more lies, more lockets, more deceivings,"
1175,III,"Taunts from the proud old woman, lies from him,"
1176,III,"And Anna’s coo of ’Cruel.  Leave her, Jim.’"
1177,III,
1178,III,"Also the foreman spoke: ’You make me sick,"
1179,III,You come-day-go-day-God-send-plenty-beer.
1180,III,"You put less mizzle on your bit of Dick,"
1181,III,"Or get your time, I’ll have no slackers here,"
1182,III,"I’ve had my eye on you too long, my dear.’"
1183,III,"And Jimmy pondered while the man attacked,"
1184,III,’I’d see her all day long if I were sacked.’
1185,III,
1186,III,"And trembling mother thought, ’I’ll go to see’r."
1187,III,She’d give me back my boy if she were told
1188,III,"Just what he is to me, my pretty dear:"
1189,III,"She wouldn’t leave me starving in the cold,"
1190,III,Like what I am.’  But she was weak and old.
1191,III,"She thought, ’But if I ask her, I’m afraid"
1192,III,"He’d hate me ever after,’ so she stayed."
1193,III,
1194,III,
1195,III,
1196,III,
1197,IV,IV
1198,IV,
1199,IV,
1200,IV,"Bessie, the gipsy, got with child by Ern,"
1201,IV,"She joined her tribe again at Shepherd’s Meen,"
1202,IV,"In that old quarry overgrown with fern,"
1203,IV,Where goats are tethered on the patch of green.
1204,IV,"There she reflected on the fool she’d been,"
1205,IV,"And plaited kipes and waited for the bastard,"
1206,IV,And thought that love was glorious while it lasted.
1207,IV,
1208,IV,"And Ern the moody man went moody home,"
1209,IV,"To that most gentle girl from Ercall Hill,"
1210,IV,"And bade her take a heed now he had come,"
1211,IV,"Or else, by cripes, he’d put her through the mill."
1212,IV,"He didn’t want her love, he’d had his fill,"
1213,IV,"Thank you, of her, the bread and butter sack."
1214,IV,And Anna heard that Shepherd Ern was back.
1215,IV,
1216,IV,"’Back.  And I’ll have him back to me,’ she muttered,"
1217,IV,"’This lovesick boy of twenty, green as grass,"
1218,IV,"Has made me wonder if my brains are buttered,"
1219,IV,"He, and his lockets, and his love, the ass."
1220,IV,I don’t know why he comes.  Alas! alas!
1221,IV,God knows I want no love; but every sun
1222,IV,I bolt my doors on some poor loving one.
1223,IV,
1224,IV,"It breaks my heart to turn them out of doors,"
1225,IV,I hear them crying to me in the rain;
1226,IV,"One, with a white face, curses, one implores,"
1227,IV,"""Anna, for God’s sake, let me in again,"
1228,IV,"Anna, belov’d, I cannot bear the pain."""
1229,IV,Like hoovey sheep bleating outside a fold
1230,IV,"""Anna, belov’d, I’m in the wind and cold."""
1231,IV,
1232,IV,I want no men.  I’m weary to the soul
1233,IV,"Of men like moths about a candle flame,"
1234,IV,"Of men like flies about a sugar bowl,"
1235,IV,"Acting alike, and all wanting the same,"
1236,IV,"My dreamed-of swirl of passion never came,"
1237,IV,"No man has given me the love I dreamed,"
1238,IV,But in the best of each one something gleamed.
1239,IV,
1240,IV,"If my dear darling were alive, but he..."
1241,IV,He was the same; he didn’t understand.
1242,IV,"The eyes of that dead child are haunting me,"
1243,IV,I only turned the blanket with my hand.
1244,IV,"It didn’t hurt, he died as I had planned."
1245,IV,"A little skinny creature, weak and red;"
1246,IV,It looked so peaceful after it was dead.
1247,IV,
1248,IV,"I have been all alone, in spite of all."
1249,IV,Never a light to help me place my feet:
1250,IV,I have had many a pain and many a fall.
1251,IV,"Life’s a long headache in a noisy street,"
1252,IV,"Love at the budding looks so very sweet,"
1253,IV,"Men put such bright disguises on their lust,"
1254,IV,And then it all goes crumble into dust.
1255,IV,
1256,IV,"Jimmy the same, dear, lovely Jimmy, too,"
1257,IV,He goes the self-same way the others went:
1258,IV,I shall bring sorrow to those eyes of blue.
1259,IV,He asks the love I’m sure I never meant.
1260,IV,Am I to blame?  And all his money spent!
1261,IV,Men make this shutting doors such cruel pain.
1262,IV,"O, Ern, I want you in my life again.’"
1263,IV,
1264,IV,On Sunday afternoons the lovers walk
1265,IV,"Arm within arm, dressed in their Sunday best,"
1266,IV,"The man with the blue necktie sucks a stalk,"
1267,IV,The woman answers when she is addressed.
1268,IV,"On quiet country stiles they sit to rest,"
1269,IV,And after fifty years of wear and tear
1270,IV,They think how beautiful their courtships were.
1271,IV,
1272,IV,Jimmy and Anna met to walk together
1273,IV,The Sunday after Shepherd Ern returned;
1274,IV,And Anna’s hat was lovely with a feather
1275,IV,Bought and dyed blue with money Jimmy earned.
1276,IV,"They walked towards Callows Farm, and Anna yearned:"
1277,IV,"’Dear boy,’ she said, ’This road is dull to-day,"
1278,IV,Suppose we turn and walk the other way.’
1279,IV,
1280,IV,"They turned, she sighed.  ’What makes you sigh?’ he asked."
1281,IV,"’Thinking,’ she said, ’thinking and grieving, too."
1282,IV,Perhaps some wicked woman will come masked
1283,IV,"Into your life, my dear, to ruin you."
1284,IV,And trusting every woman as you do
1285,IV,It might mean death to love and be deceived;
1286,IV,"You’d take it hard, I thought, and so I grieved.’"
1287,IV,
1288,IV,"’Dear one, dear Anna.’  ’O my lovely boy,"
1289,IV,Life is all golden to the finger tips.
1290,IV,What will be must be: but to-day’s a joy.
1291,IV,Reach me that lovely branch of scarlet hips.’
1292,IV,He reached and gave; she put it to her lips.
1293,IV,"’And here,’ she said, ’we come to Plaister Turns.’"
1294,IV,And then she chose the road to Shepherd Ern’s.
1295,IV,
1296,IV,"As the deft angler, when the fishes rise,"
1297,IV,Flicks on the broadening circle over each
1298,IV,"The delicatest touch of dropping flies,"
1299,IV,"Then pulls more line and whips a longer reach,"
1300,IV,"Longing to feel the rod bend, the reel screech,"
1301,IV,"And the quick comrade net the monster out,"
1302,IV,So Anna played the fly over her trout.
1303,IV,
1304,IV,"Twice she passed, thrice, she with the boy beside her,"
1305,IV,"A lovely fly, hooked for a human heart,"
1306,IV,"She passed his little gate, while Jimmy eyed her,"
1307,IV,Feeling her beauty tear his soul apart:
1308,IV,"Then did the great trout rise, the great pike dart,"
1309,IV,"The gate went clack, a man came up the hill,"
1310,IV,The lucky strike had hooked him through the gill.
1311,IV,
1312,IV,"Her breath comes quick, her tired beauty glows,"
1313,IV,"She would not look behind, she looked ahead."
1314,IV,"It seemed to Jimmy she was like a rose,"
1315,IV,A golden white rose faintly flushed with red.
1316,IV,"Her eyes danced quicker at the approaching tread,"
1317,IV,Her finger nails dug sharp into her palm.
1318,IV,"She yearned to Jimmy’s shoulder, and kept calm."
1319,IV,
1320,IV,"’Evening,’ said Shepherd Ern.  She turned and eyed him,"
1321,IV,"Cold and surprised, but interested too,"
1322,IV,"To see how much he felt the hook inside him,"
1323,IV,"And how much be surmised, and Jimmy knew,"
1324,IV,And if her beauty still could make him do
1325,IV,The love tricks he had gambolled in the past.
1326,IV,A glow shot through her that her fish was grassed.
1327,IV,
1328,IV,"’Evening,’ she said.  ’Good evening.’  Jimmy felt"
1329,IV,Jealous and angry at the shepherd’s tone;
1330,IV,"He longed to hit the fellow’s nose a belt,"
1331,IV,He wanted his beloved his alone.
1332,IV,A fellow’s girl should be a fellow’s own.
1333,IV,"Ern gave the lad a glance and turned to Anna,"
1334,IV,Jim might have been in China by his manner.
1335,IV,
1336,IV,’Still walking out?’  ’As you are.’  ’I’ll be bound.’
1337,IV,"’Can you talk gipsy yet, or plait a kipe?’"
1338,IV,’I’ll teach you if I can when I come round.’
1339,IV,’And when will that be?’  ’When the time is ripe.’
1340,IV,And Jimmy longed to hit the man a swipe
1341,IV,"Under the chin to knock him out of time,"
1342,IV,But Anna stayed: she still had twigs to lime.
1343,IV,
1344,IV,"’Come, Anna, come, my dear,’ he muttered low."
1345,IV,"She frowned, and blinked and spoke again to Ern."
1346,IV,’I hear the gipsy has a row to hoe.’
1347,IV,"’The more you hear,’ he said, ’the less you’ll learn.’"
1348,IV,"’We’ve just come out,’ she said, ’to take a turn;"
1349,IV,Suppose you come along: the more the merrier.’
1350,IV,"’All right,’ he said, ’but how about the terrier?’"
1351,IV,
1352,IV,He cocked an eye at Jimmy.  ’Does he bite?’
1353,IV,"Jimmy blushed scarlet.  ’He’s a dear,’ said she."
1354,IV,"Ern walked a step, ’Will you be in to-night?’"
1355,IV,"She shook her head, ’I doubt if that may be."
1356,IV,"Jim, here’s a friend who wants to talk to me,"
1357,IV,So will you go and come another day?’
1358,IV,"’By crimes, I won’t!’ said Jimmy, ’I shall stay.’"
1359,IV,
1360,IV,"’I thought he bit,’ said Ern, and Anna smiled,"
1361,IV,And Jimmy saw the smile and watched her face
1362,IV,While all the jealous devils made him wild;
1363,IV,A third in love is always out of place;
1364,IV,And then her gentle body full of grace
1365,IV,"Leaned to him sweetly as she tossed her head,"
1366,IV,"’Perhaps we two’ll be getting on,’ she said."
1367,IV,
1368,IV,"They walked, but Jimmy turned to watch the third."
1369,IV,"’I’m here, not you,’ he said; the shepherd grinned:"
1370,IV,Anna was smiling sweet without a word;
1371,IV,She got the scarlet berry branch unpinned.
1372,IV,"’It’s cold,’ she said, ’this evening, in the wind.’"
1373,IV,"A quick glance showed that Jimmy didn’t mind her,"
1374,IV,"She beckoned with the berry branch behind her,"
1375,IV,
1376,IV,"Then dropped it gently on the broken stones,"
1377,IV,"Preoccupied, unheeding, walking straight,"
1378,IV,"Saying ’You jealous boy,’ in even tones,"
1379,IV,"Looking so beautiful, so delicate,"
1380,IV,Being so very sweet: but at her gate
1381,IV,She felt her shoe unlaced and looked to know
1382,IV,If Ern had taken up the sprig or no.
1383,IV,
1384,IV,"He had, she smiled.  ’Anna,’ said Jimmy sadly,"
1385,IV,"’That man’s not fit to be a friend of yourn,"
1386,IV,"He’s nobbut just an oaf; I love you madly,"
1387,IV,And hearing you speak kind to’m made me burn.
1388,IV,"Who is he then?’  She answered ’Shepherd Ern,"
1389,IV,"A pleasant man, an old, old friend of mine.’"
1390,IV,"’By cripes, then, Anna, drop him, he’s a swine.’"
1391,IV,
1392,IV,"’Jimmy,’ she said, ’you must have faith in me,"
1393,IV,Faith’s all the battle in a love like ours.
1394,IV,"You must believe, my darling, don’t you see"
1395,IV,That life to have its sweets must have its sours.
1396,IV,Love isn’t always two souls picking flowers.
1397,IV,You must have faith.  I give you all I can.
1398,IV,"What, can’t I say ""Good evening"" to a man?’"
1399,IV,
1400,IV,"’Yes,’ he replied, ’But not a man like him.’"
1401,IV,"’Why not a man like him?’ she said, ’What next?’"
1402,IV,"By this they’d reached her cottage in the dim,"
1403,IV,Among the daisies that the cold had kexed.
1404,IV,"’Because I say.  Now, Anna, don’t be vexed.’"
1405,IV,"’I’m more than vexed,’ she said, ’with words like these."
1406,IV,"""You say,"" indeed.  How dare you.  Leave me, please.’"
1407,IV,
1408,IV,"’Anna, my Anna.’  ’Leave me.’  She was cold,"
1409,IV,"Proud and imperious with a lifting lip,"
1410,IV,"Blazing within, but outwardly controlled;"
1411,IV,He had a colt’s first instant of the whip.
1412,IV,The long lash curled to cut a second strip.
1413,IV,"’You to presume to teach.  Of course, I know"
1414,IV,"You’re mother’s Sunday scholar, aren’t you?  Go.’"
1415,IV,
1416,IV,"She slammed the door behind her, clutching skirts."
1417,IV,’Anna.’  He heard her bedroom latches thud.
1418,IV,He learned at last how bitterly love hurts;
1419,IV,"He longed to cut her throat and see her blood,"
1420,IV,To stamp her blinking eyeballs into mud.
1421,IV,"’Anna, by God!’  Love’s many torments make"
1422,IV,"That tune soon change to ’Dear, for Jesus’ sake.’"
1423,IV,
1424,IV,"He beat the door for her.  She never stirred,"
1425,IV,But primming bitter lips before her glass;
1426,IV,"Admired her hat as though she hadn’t heard,"
1427,IV,"And tried her front hair parted, and in mass."
1428,IV,She heard her lover’s hasty footsteps pass.
1429,IV,"’He’s gone,’ she thought.  She crouched below the pane,"
1430,IV,And heard him cursing as he tramped the lane.
1431,IV,
1432,IV,Rage ran in Jimmy as he tramped the night;
1433,IV,"Rage, strongly mingled with a youth’s disgust"
1434,IV,"At finding a beloved woman light,"
1435,IV,And all her precious beauty dirty dust;
1436,IV,A tinsel-varnish gilded over lust.
1437,IV,"Nothing but that.  He sat him down to rage,"
1438,IV,Beside the stream whose waters never age.
1439,IV,
1440,IV,"Plashing, it slithered down the tiny fall"
1441,IV,To eddy wrinkles in the trembling pool
1442,IV,"With that light voice whose music cannot pall,"
1443,IV,"Always the note of solace, flute-like, cool."
1444,IV,"And when hot-headed man has been a fool,"
1445,IV,He could not do a wiser thing than go
1446,IV,To that dim pool where purple teazles grow.
1447,IV,
1448,IV,"He glowered there until suspicion came,"
1449,IV,"Suspicion, anger’s bastard, with mean tongue,"
1450,IV,"To mutter to him till his heart was flame,"
1451,IV,"And every fibre of his soul was wrung,"
1452,IV,That even then Ern and his Anna clung
1453,IV,Mouth against mouth in passionate embrace.
1454,IV,There was no peace for Jimmy in the place.
1455,IV,
1456,IV,Raging he hurried back to learn the truth.
1457,IV,"The little swinging wicket glimmered white,"
1458,IV,"The chimney jagged the skyline like a tooth,"
1459,IV,Bells came in swoons for it was Sunday night.
1460,IV,"The garden was all dark, but there was light"
1461,IV,Up in the little room where Anna slept:
1462,IV,"The hot blood beat his brain; he crept, he crept."
1463,IV,
1464,IV,"Clutching himself to hear, clutching to know,"
1465,IV,"Along the path, rustling with withered leaves,"
1466,IV,"Up to the apple, too decayed to blow,"
1467,IV,Which crooked a palsied finger at the eaves.
1468,IV,And up the lichened trunk his body heaves.
1469,IV,"Dust blinded him, twigs snapped, the branches shook,"
1470,IV,He leaned along a mossy bough to look.
1471,IV,
1472,IV,"Nothing at first, except a guttering candle"
1473,IV,"Shaking amazing shadows on the ceiling,"
1474,IV,"Then Anna’s voice upon a bar of ’Randal,"
1475,IV,"Where have you been:’ and voice and music reeling,"
1476,IV,"Trembling, as though she sang with flooding feeling."
1477,IV,"The singing stopped midway upon the stair,"
1478,IV,Then Anna showed in white with loosened hair.
1479,IV,
1480,IV,"Her back was towards him, and she stood awhile,"
1481,IV,"Like a wild creature tossing back her mane,"
1482,IV,"And then her head went back, he saw a smile"
1483,IV,On the half face half turned towards the pane;
1484,IV,"Her eyes closed, and her arms went out again."
1485,IV,"Jim gritted teeth, and called upon his Maker,"
1486,IV,She drooped into a man’s arms there to take her.
1487,IV,
1488,IV,"Agony first, sharp, sudden, like a knife,"
1489,IV,Then down the tree to batter at the door;
1490,IV,’Open there.  Let me in.  I’ll have your life.
1491,IV,"You Jezebel of hell, you painted whore,"
1492,IV,"Talk about faith, I’ll give you faith galore.’"
1493,IV,"The window creaked, a jug of water came"
1494,IV,Over his head and neck with certain aim.
1495,IV,
1496,IV,"’Clear out,’ said Ern; ’I’m here, not you, to-night,"
1497,IV,Clear out.  We whip young puppies when they yap.’
1498,IV,"’If you’re a man,’ said Jim, ’Come down and fight,"
1499,IV,I’ll put a stopper on your ugly chap.’
1500,IV,"’Go home,’ said Ern; ’Go home and get your pap."
1501,IV,"To kennel, pup, and bid your mother bake"
1502,IV,Some soothing syrup in your puppy cake.’
1503,IV,
1504,IV,"There was a dibble sticking in the bed,"
1505,IV,"Jim wrenched it out and swung it swiftly round,"
1506,IV,And sent it flying at the shepherd’s head:
1507,IV,"’I’ll give you puppy-cake.  Take that, you hound.’"
1508,IV,"The broken glass went clinking to the ground,"
1509,IV,"The dibble balanced, checked, and followed flat."
1510,IV,"’My God,’ said Ern, ’I’ll give you hell for that.’"
1511,IV,
1512,IV,"He flung the door ajar with ’Now, my pup--"
1513,IV,"Hold up the candle, Anna--now, we’ll see.’"
1514,IV,"’By crimes, come on,’ said Jimmy; ’Put them up."
1515,IV,"Come, put them up, you coward, here I be.’"
1516,IV,"And Jim, eleven stone, what chance had he"
1517,IV,Against fourteen? but what he could he did;
1518,IV,"Ern swung his right: ’That settles you, my kid.’"
1519,IV,
1520,IV,"Jimmy went down and out: ’The kid,’ said Ern."
1521,IV,"’A kid, a sucking puppy; hold the light.’"
1522,IV,"And Anna smiled: ’It gave me such a turn,"
1523,IV,"You look so splendid, Ernie, when you fight.’"
1524,IV,"She looked at Jim with: ’Ern, is he all right?’"
1525,IV,"’He’s coming to.’  She shuddered, ’Pah, the brute."
1526,IV,What things he said’; she stirred him with her foot.
1527,IV,
1528,IV,"’You go inside,’ said Ern, ’and bolt the door,"
1529,IV,I’ll deal with him.’  She went and Jimmy stood.
1530,IV,"’Now, pup,’ said Ern, ’don’t come round here no more."
1531,IV,"I’m here, not you, let that be understood."
1532,IV,"I tell you frankly, pup, for your own good.’"
1533,IV,"’Give me my hat,’ said Jim.  He passed the gate,"
1534,IV,"And as he tottered off he called, ’You wait.’"
1535,IV,
1536,IV,"’Thanks, I don’t have to,’ Shepherd Ern replied;"
1537,IV,’You’ll do whatever waiting’s being done.’
1538,IV,"The door closed gently as he went inside,"
1539,IV,The bolts jarred in the channels one by one.
1540,IV,"’I’ll give you throwing bats about, my son."
1541,IV,Anna.’  ’My dear?’  ’Where are you?’  ’Come and find.’
1542,IV,"The light went out, the windows stared out blind."
1543,IV,
1544,IV,Blind as blind eyes forever seeing dark.
1545,IV,"And in the dim the lovers went upstairs,"
1546,IV,"Her eyes fast closed, the shepherd’s burning stark,"
1547,IV,"His lips entangled in her straying hairs,"
1548,IV,"Breath coming short as in a convert’s prayers,"
1549,IV,Her stealthy face all drowsy in the dim
1550,IV,And full of shudders as she yearned to him.
1551,IV,
1552,IV,"Jim crossed the water, cursing in his tears,"
1553,IV,"’By cripes, you wait.  My God, he’s with her now"
1554,IV,And all her hair pulled down over her ears;
1555,IV,"Loving the blaggard like a filthy sow,"
1556,IV,I saw her kiss him from the apple bough.
1557,IV,"They say a whore is always full of wiles,"
1558,IV,"O God, how sweet her eyes are when she smiles."
1559,IV,
1560,IV,"Curse her and curse her.  No, my God, she’s sweet,"
1561,IV,It’s all a helly nightmare.  I shall wake.
1562,IV,"If it were all a dream I’d kiss her feet,"
1563,IV,I wish it were a dream for Jesus’ sake.
1564,IV,"One thing: I bet I made his guzzle ache,"
1565,IV,"I cop it fair before he sent me down,"
1566,IV,I’ll cop him yet some evening on the crown.
1567,IV,
1568,IV,"O God, O God, what pretty ways she had,"
1569,IV,"He’s kissing all her skin, so white and soft."
1570,IV,She’s kissing back.  I think I’m going mad.
1571,IV,Like rutting rattens in the apple loft.
1572,IV,She held that light she carried high aloft
1573,IV,"Full in my eyes for him to hit me by,"
1574,IV,I had the light all dazzling in my eye.
1575,IV,
1576,IV,"She had her dress all clutched up to her shoulder,"
1577,IV,And all her naked arm was all one gleam.
1578,IV,"It’s going to freeze to-night, it’s turning colder,"
1579,IV,"I wish there was more water in the stream,"
1580,IV,"I’d drownd myself.  Perhaps it’s all a dream,"
1581,IV,And bye and bye I’ll wake and find it stuff;
1582,IV,"By crimes, the pain I suffer’s real enough.’"
1583,IV,
1584,IV,About two hundred yards from Gunder Loss
1585,IV,"He stopped to shudder, leaning on the gate,"
1586,IV,He bit the touchwood underneath the moss;
1587,IV,"’Rotten, like her,’ he muttered in his hate;"
1588,IV,"He spat it out again with ’But, you wait,"
1589,IV,"We’ll see again, before to-morrow’s past,"
1590,IV,In this life he laughs longest who laughs last.’
1591,IV,
1592,IV,"All through the night the stream ran to the sea,"
1593,IV,"The different water always saying the same,"
1594,IV,"Cat-like, and then a tinkle, never glee,"
1595,IV,A lonely little child alone in shame.
1596,IV,"An otter snapped a thorn twig when he came,"
1597,IV,"It drifted down, it passed the Hazel Mill,"
1598,IV,It passed the Springs; but Jimmy stayed there still.
1599,IV,
1600,IV,Over the pointed hill-top came the light
1601,IV,"Out of the mists on Ercall came the sun,"
1602,IV,"Red like a huntsman halloing after night,"
1603,IV,Blowing a horn to rouse up everyone;
1604,IV,"Through many glittering cities he had run,"
1605,IV,Splashing the wind vanes on the dewy roofs
1606,IV,With golden sparks struck by his horses’ hoofs.
1607,IV,
1608,IV,"The watchman rose, rubbing his rusty eyes,"
1609,IV,He stirred the pot of cocoa for his mate;
1610,IV,The fireman watched his head of power rise.
1611,IV,’What time?’ he asked.  ’You haven’t long to wait.’
1612,IV,"’Now, is it time?’  ’Yes.  Let her ripple.’  Straight"
1613,IV,"The whistle shrieked its message, ’Up to work!"
1614,IV,"Up, or be fined a quarter if you shirk.’"
1615,IV,
1616,IV,"Hearing the whistle, Jimmy raised his head,"
1617,IV,"’The warning call, and me in Sunday clo’es;"
1618,IV,"I’d better go; I’ve time.  The sun looks red,"
1619,IV,I feel so stiff’ I’m very nearly froze.’
1620,IV,"So over brook and through the fields he goes,"
1621,IV,"And up the line among the navvies’ smiles,"
1622,IV,’Young Jimmy Gurney’s been upon the tiles.’
1623,IV,
1624,IV,"The second whistle blew and work began,"
1625,IV,"Jimmy worked too, not knowing what he did,"
1626,IV,He tripped and stumbled like a drunken man;
1627,IV,"He muddled all, whatever he was bid,"
1628,IV,"The foreman cursed, ’Good God, what ails the kid?"
1629,IV,"Hi!  Gurney.  You.  We’ll have you crocking soon,"
1630,IV,You take a lie down till the afternoon.’
1631,IV,
1632,IV,"’I won’t,’ he answered.  ’Why the devil should I?"
1633,IV,"I’m here, I mean to work.  I do my piece,"
1634,IV,"Or would do if a man could, but how could I"
1635,IV,Then you come nagging round and never cease?
1636,IV,"Well, take the job and give me my release,"
1637,IV,"I want the sack, now give it, there’s my pick;"
1638,IV,Give me the sack.’  The sack was given quick.
1639,IV,
1640,IV,
1641,IV,
1642,IV,
1643,V,V
1644,V,
1645,V,
1646,V,Dully he got his time-check from the keeper.
1647,V,"’Curse her,’ he said; ’and that’s the end of whores’--"
1648,V,He stumbled drunkenly across a sleeper--
1649,V,’Give all you have and get kicked out a-doors.’
1650,V,He cashed his time-check at the station stores.
1651,V,"’Bett’ring yourself, I hope, Jim,’ said the master;"
1652,V,"’That’s it,’ said Jim; ’and so I will do, blast her.’"
1653,V,
1654,V,"Beyond the bridge, a sharp turn to the right"
1655,V,"Leads to ’The Bull and Boar,’ the carters’ rest;"
1656,V,An inn so hidden it is out of sight
1657,V,To anyone not coming from the west.
1658,V,The high embankment hides it with its crest.
1659,V,"Far up above the Chester trains go by,"
1660,V,The drinkers see them sweep against the sky.
1661,V,
1662,V,"Canal men used it when the barges came,"
1663,V,The navvies used it when the line was making;
