,Poem Title,line
588,II,"Nice-looking woman, too, and that, and clever;"
589,II,"We might go round one evening, p’raps, we two;"
590,II,"Or I might go, if it’s too far for you.’"
591,II,
592,II,"’No,’ said the mother, ’we’re not folk for that;"
593,II,"Meet at the fair and that, and there an end."
594,II,"Rake out the fire and put out the cat,"
595,II,"These fairs are sinful, tempting folk to spend."
596,II,Of course she spoke polite and like a friend;
597,II,"Of course she had to do, and so I let her,"
598,II,"But now it’s done and past, so I forget her.’"
599,II,
600,II,’I don’t see why forget her.  Why forget her?
601,II,She treat us kind.  She weren’t like everyone.
602,II,"I never saw a woman I liked better,"
603,II,"And he’s not easy pleased, my father’s son."
604,II,So I’ll go round some night when work is done.’
605,II,"’Now, Jim, my dear, trust mother, there’s a dear.’"
606,II,"’Well, so I do, but sometimes you’re so queer.’"
607,II,
608,II,She blinked at him out of her withered eyes
609,II,Below her lashless eyelids red and bleared.
610,II,"Her months of sacrifice had won the prize,"
611,II,Her Jim had come to what she always feared.
612,II,"And yet she doubted, so she shook and peered"
613,II,And begged her God not let a woman take
614,II,The lovely son whom she had starved to make.
615,II,
616,II,"Doubting, she stood the dishes in the rack,"
617,II,"’We’ll ask her in some evening, then,’ she said,"
618,II,’How nice her hair looked in the bit of black.’
619,II,And still she peered from eyes all dim and red
620,II,"To note at once if Jimmy drooped his head,"
621,II,"Or if his ears blushed when he heard her praised,"
622,II,And Jimmy blushed and hung his head and gazed.
623,II,
624,II,"’This is the end,’ she thought.  ’This is the end."
625,II,"I’ll have to sew again for Mr Jones,"
626,II,"Do hems when I can hardly see to mend,"
627,II,And have the old ache in my marrow-bones.
628,II,"And when his wife’s in child-bed, when she groans,"
629,II,"She’ll send for me until the pains have ceased,"
630,II,And give me leavings at the christening feast.
631,II,
632,II,"And sit aslant to eye me as I eat,"
633,II,"""You’re only wanted here, ma’am, for to-day,"
634,II,"Just for the christ’ning party, for the treat,"
635,II,Don’t ever think I mean to let you stay;
636,II,"Two’s company, three’s none, that’s what I say."""
637,II,Life can be bitter to the very bone
638,II,"When one is poor, and woman, and alone."
639,II,
640,II,"’Jimmy,’ she said, still doubting, ’Come, my dear,"
641,II,"Let’s have our ""Binger,"" ’fore we go to bed,’"
642,II,"And then ’The parson’s dog,’ she cackled clear,"
643,II,"’Lep over stile,’ she sang, nodding her head."
644,II,"’His name was little Binger.’  ’Jim,’ she said,"
645,II,"’Binger, now, chorus’ ... Jimmy kicked the hob,"
646,II,The sacrament of song died in a sob.
647,II,
648,II,Jimmy went out into the night to think
649,II,Under the moon so steady in the blue.
650,II,"The woman’s beauty ran in him like drink,"
651,II,The fear that men had loved her burnt him through;
652,II,The fear that even then another knew
653,II,All the deep mystery which women make
654,II,To hide the inner nothing made him shake.
655,II,
656,II,"’Anna, I love you, and I always shall.’"
657,II,He looked towards Plaister’s End beyond Cot Hills.
658,II,"A white star glimmered in the long canal,"
659,II,A droning from the music came in thrills.
660,II,"Love is a flame to burn out human wills,"
661,II,"Love is a flame to set the will on fire,"
662,II,Love is a flame to cheat men into mire.
663,II,
664,II,"One of the three, we make Love what we choose,"
665,II,"But Jimmy did not know, he only thought"
666,II,"That Anna was too beautiful to lose,"
667,II,"That she was all the world and he was naught,"
668,II,"That it was sweet, though bitter, to be caught."
669,II,"’Anna, I love you.’  Underneath the moon,"
670,II,’I shall go mad unless I see you soon.’
671,II,
672,II,The fair’s lights threw aloft a misty glow.
673,II,"The organ whangs, the giddy horses reel,"
674,II,"The rifles cease, the folk begin to go,"
675,II,"The hands unclamp the swing-boats from the wheel,"
676,II,There is a smell of trodden orange peel;
677,II,"The organ drones and dies, the horses stop,"
678,II,And then the tent collapses from the top.
679,II,
680,II,"The fair is over, let the people troop,"
681,II,"The drunkards stagger homewards down the gutters,"
682,II,"The showmen heave in an excited group,"
683,II,"The poles tilt slowly down, the canvas flutters,"
684,II,"The mauls knock out the pins, the last flare sputters."
685,II,"’Lower away.’  ’Go easy.’  ’Lower, lower.’"
686,II,’You’ve dang near knock my skull in.  Loose it slower.’
687,II,
688,II,’Back in the horses.’  ’Are the swing-boats loaded?’
689,II,"’All right to start.’  ’Bill, where’s the cushion gone?"
690,II,The red one for the Queen?’  ’I think I stowed it.’
691,II,"’You think, you think.  Lord, where’s that cushion, John?’"
692,II,"’It’s in that bloody box you’re sitting on,"
693,II,What more d’you want?’  A concertina plays
694,II,Far off as wandering lovers go their ways.
695,II,
696,II,Up the dim Bye Street to the market-place
697,II,"The dead bones of the fair are borne in carts,"
698,II,Horses and swing-boats at a funeral pace
699,II,After triumphant hours quickening hearts;
700,II,"A policeman eyes each waggon as it starts,"
701,II,"The drowsy showmen stumble half asleep,"
702,II,"One of them catcalls, having drunken deep."
703,II,
704,II,"So out, over the pass, into the plain,"
705,II,And the dawn finds them filling empty cans
706,II,"In some sweet-smelling dusty country lane,"
707,II,Where a brook chatters over rusty pans.
708,II,The iron chimneys of the caravans
709,II,Smoke as they go.  And now the fair has gone
710,II,To find a new pitch somewhere further on.
711,II,
712,II,"But as the fair moved out two lovers came,"
713,II,Ernie and Bessie loitering out together;
714,II,"Bessie with wild eyes, hungry as a flame,"
715,II,Ern like a stallion tugging at a tether.
716,II,"It was calm moonlight, and October weather,"
717,II,"So still, so lovely, as they topped the ridge."
718,II,They brushed by Jimmy standing on the bridge.
719,II,
720,II,"And, as they passed, they gravely eyed each other,"
721,II,And the blood burned in each heart beating there;
722,II,"And out into the Bye Street tottered mother,"
723,II,"Without her shawl, in the October air."
724,II,"’Jimmy,’ she cried, ’Jimmy.’  And Bessie’s hair"
725,II,"Drooped on the instant over Ernie’s face,"
726,II,And the two lovers clung in an embrace.
727,II,
728,II,"’O, Ern.’  ’My own, my Bessie.’  As they kissed"
729,II,Jimmy was envious of the thing unknown.
730,II,"So this was Love, the something he had missed,"
731,II,"Woman and man athirst, aflame, alone."
732,II,"Envy went knocking at his marrow-bone,"
733,II,"And Anna’s face swam up so dim, so fair,"
734,II,"Shining and sweet, with poppies in her hair."
735,II,
736,II,
737,II,
738,II,
739,III,III
740,III,
741,III,
742,III,"After the fair, the gang began again."
743,III,Tipping the trollies down the banks of earth.
744,III,"The truck of stone clanks on the endless chain,"
745,III,A clever pony guides it to its berth.
746,III,"’Let go.’  It tips, the navvies shout for mirth"
747,III,"To see the pony step aside, so wise,"
748,III,"But Jimmy sighed, thinking of Anna’s eyes."
749,III,
750,III,And when he stopped his shovelling he looked
751,III,"Over the junipers towards Plaister way,"
752,III,"The beauty of his darling had him hooked,"
753,III,He had no heart for wrastling with the clay.
754,III,"’O Lord Almighty, I must get away;"
755,III,"O Lord, I must.  I must just see my flower,"
756,III,"Why, I could run there in the dinner hour.’"
757,III,
758,III,"The whistle on the pilot engine blew,"
759,III,"The men knocked off, and Jimmy slipped aside"
760,III,"Over the fence, over the bridge, and through,"
761,III,"And then ahead along the water-side,"
762,III,"Under the red-brick rail-bridge, arching wide,"
763,III,"Over the hedge, across the fields, and on;"
764,III,The foreman asked: ’Where’s Jimmy Gurney gone?’
765,III,
766,III,"It is a mile and more to Plaister’s End,"
767,III,"But Jimmy ran the short way by the stream,"
768,III,"And there was Anna’s cottage at the bend,"
769,III,"With blue smoke on the chimney, faint as steam."
770,III,"’God, she’s at home,’ and up his heart a gleam"
771,III,"Leapt like a rocket on November nights,"
772,III,And shattered slowly in a burst of lights.
773,III,
774,III,"Anna was singing at her kitchen fire,"
775,III,"She was surprised, and not well pleased to see"
776,III,"A sweating navvy, red with heat and mire,"
777,III,"Come to her door, whoever he might be."
778,III,"But when she saw that it was Jimmy, she"
779,III,"Smiled at his eyes upon her, full of pain,"
780,III,"And thought, ’But, still, he mustn’t come again."
781,III,
782,III,People will talk; boys are such crazy things;
783,III,But he’s a dear boy though he is so green.’
784,III,"So, hurriedly, she slipped her apron strings,"
785,III,"And dabbed her hair, and wiped her fingers clean,"
786,III,"And came to greet him languid as a queen,"
787,III,"Looking as sweet, as fair, as pure, as sad,"
788,III,As when she drove her loving husband mad.
789,III,
790,III,"’Poor boy,’ she said, ’Poor boy, how hot you are.’"
791,III,She laid a cool hand to his sweating face.
792,III,’How kind to come.  Have you been running far?
793,III,I’m just going out; come up the road a pace.
794,III,"O dear, these hens; they’re all about the place.’"
795,III,"So Jimmy shooed the hens at her command,"
796,III,And got outside the gate as she had planned.
797,III,
798,III,"’Anna, my dear, I love you; love you, true;"
799,III,I had to come--I don’t know--I can’t rest--
800,III,"I lay awake all night, thinking of you."
801,III,"Many must love you, but I love you best.’"
802,III,"’Many have loved me, yes, dear,’ she confessed,"
803,III,"She smiled upon him with a tender pride,"
804,III,’But my love ended when my husband died.
805,III,
806,III,"Still, we’ll be friends, dear friends, dear, tender friends;"
807,III,Love with its fever’s at an end for me.
808,III,"Be by me gently now the fever ends,"
809,III,"Life is a lovelier thing than lovers see,"
810,III,"I’d like to trust a man, Jimmy,’ said she,"
811,III,"’May I trust you?’  ’Oh, Anna dear, my dear----"
812,III,"’Don’t come so close,’ she said, ’with people near."
813,III,
814,III,"Dear, don’t be vexed; it’s very sweet to find"
815,III,"One who will understand; but life is life,"
816,III,And those who do not know are so unkind.
817,III,"But you’ll be by me, Jimmy, in the strife,"
818,III,I love you though I cannot be your wife;
819,III,"And now be off, before the whistle goes,"
820,III,"Or else you’ll lose your quarter, goodness knows.’"
821,III,
822,III,"’When can I see you, Anna?  Tell me, dear."
823,III,To-night?  To-morrow?  Shall I come to-night?
824,III,"’Jimmy, my friend, I cannot have you here;"
825,III,But when I come to town perhaps we might.
826,III,"Dear, you must go; no kissing; you can write,"
827,III,And I’ll arrange a meeting when I learn
828,III,What friends are doing’ (meaning Shepherd Ern).
829,III,
830,III,"’Good-bye, my own.’  ’Dear Jim, you understand."
831,III,"If we were only free, dear, free to meet,"
832,III,"Dear, I would take you by your big, strong hand"
833,III,And kiss your dear boy eyes so blue and sweet;
834,III,"But my dead husband lies under the sheet,"
835,III,"Dead in my heart, dear, lovely, lonely one,"
836,III,"So, Jim, my dear, my loving days are done."
837,III,
838,III,But though my heart is buried in his grave
839,III,Something might be--friendship and utter trust--
840,III,"And you, my dear starved little Jim shall have"
841,III,Flowers of friendship from my dead heart’s dust;
842,III,Life would be sweet if men would never lust.
843,III,"Why do you, Jimmy?  Tell me sometime, dear,"
844,III,Why men are always what we women fear.
845,III,
846,III,"Not now.  Good-bye; we understand, we two,"
847,III,"And life, O Jim, how glorious life is;"
848,III,This sunshine in my heart is due to you;
849,III,"I was so sad, and life has given this."
850,III,"I think ""I wish I had something of his,"""
851,III,"Do give me something, will you be so kind?"
852,III,Something to keep you always in my mind.
853,III,
854,III,"’I will,’ he said.  ’Now go, or you’ll be late.’"
855,III,"He broke from her and ran, and never dreamt"
856,III,That as she stood to watch him from the gate
857,III,"Her heart was half amusement, half contempt,"
858,III,"Comparing Jim the squab, red and unkempt,"
859,III,"In sweaty corduroys, with Shepherd Ern."
860,III,She blew him kisses till he passed the turn.
861,III,
862,III,The whistle blew before he reached the line;
863,III,"The foreman asked him what the hell he meant,"
864,III,"Whether a duke had asked him out to dine,"
865,III,Or if he thought the bag would pay his rent?
866,III,And Jim was fined before the foreman went.
867,III,"But still his spirit glowed from Anna’s words,"
868,III,Cooed in the voice so like a singing bird’s.
869,III,
870,III,"’O Anna, darling, you shall have a present;"
871,III,"I’d give you golden gems if I were rich,"
872,III,And everything that’s sweet and all that’s pleasant.’
873,III,"He dropped his pick as though he had a stitch,"
874,III,"And stared tow’rds Plaister’s End, past Bushe’s Pitch."
875,III,"O beauty, what I have to give I’ll give,"
876,III,"All mine is yours, beloved, while I live.’"
877,III,
878,III,"All through the afternoon his pick was slacking,"
879,III,"His eyes were always turning west and south,"
880,III,"The foreman was inclined to send him packing,"
881,III,But put it down to after fair-day drouth;
882,III,"He looked at Jimmy with an ugly mouth,"
883,III,"And Jimmy slacked, and muttered in a moan,"
884,III,"’My love, my beautiful, my very own.’"
885,III,
886,III,So she had loved.  Another man had had her;
887,III,She had been his with passion in the night;
888,III,"An agony of envy made him sadder,"
889,III,Yet stabbed a pang of bitter-sweet delight--
890,III,O he would keep his image of her white.
891,III,"The foreman cursed, stepped up, and asked him flat"
892,III,What kind of gum-tree he was gaping at.
893,III,
894,III,"It was Jim’s custom, when the pay day came,"
895,III,To take his weekly five and twenty shilling
896,III,Back in the little packet to his dame;
897,III,"Not taking out a farthing for a filling,"
898,III,"Nor twopence for a pot, for he was willing"
899,III,That she should have it all to save or spend.
900,III,But love makes many lovely customs end.
901,III,
902,III,"Next pay day came and Jimmy took the money,"
903,III,"But not to mother, for he meant to buy"
904,III,"A thirteen-shilling locket for his honey,"
905,III,"Whatever bellies hungered and went dry,"
906,III,A silver heart-shape with a ruby eye.
907,III,"He bought the thing and paid the shopman’s price,"
908,III,And hurried off to make the sacrifice.
909,III,
910,III,"’Is it for me?  You dear, dear generous boy."
911,III,How sweet of you.  I’ll wear it in my dress.
912,III,"When you’re beside me life is such a joy,"
913,III,You bring the sun to solitariness.’
914,III,"She brushed his jacket with a light caress,"
915,III,"His arms went round her fast, she yielded meek;"
916,III,He had the happiness to kiss her cheek.
917,III,
918,III,"’My dear, my dear.’  ’My very dear, my Jim,"
919,III,How very kind my Jimmy is to me;
920,III,I ache to think that some are harsh to him;
921,III,"Not like my Jimmy, beautiful and free."
922,III,"My darling boy, how lovely it would be"
923,III,If all would trust as we two trust each other.’
924,III,And Jimmy’s heart grew hard against his mother.
925,III,
926,III,"She, poor old soul, was waiting in the gloom"
927,III,"For Jimmy’s pay, that she could do the shopping."
928,III,The clock ticked out a solemn tale of doom;
929,III,"Clogs on the bricks outside went clippa-clopping,"
930,III,The owls were coming out and dew was dropping.
931,III,"The bacon burnt, and Jimmy not yet home."
932,III,The clock was ticking dooms out like a gnome.
933,III,
934,III,’What can have kept him that he doesn’t come?
935,III,"O God, they’d tell me if he’d come to hurt.’"
936,III,"The unknown, unseen evil struck her numb,"
937,III,"She saw his body bloody in the dirt,"
938,III,"She saw the life blood pumping through the shirt,"
939,III,"She saw him tipsy in the navvies’ booth,"
940,III,She saw all forms of evil but the truth.
941,III,
942,III,At last she hurried up the line to ask
943,III,If Jim were hurt or why he wasn’t back.
944,III,She found the watchman wearing through his task;
945,III,Over the fire basket in his shack;
946,III,"Behind, the new embankment rose up black."
947,III,’Gurney?’ he said.  ’He’d got to see a friend.’
948,III,’Where?’  ’I dunno.  I think out Plaister’s End.
949,III,
950,III,"Thanking the man, she tottered down the hill,"
951,III,The long-feared fang had bitten to the bone.
952,III,The brook beside her talked as water will
953,III,"That it was lonely singing all alone,"
954,III,"The night was lonely with the water’s tone,"
955,III,And she was lonely to the very marrow.
956,III,Love puts such bitter poison on Fate’s arrow.
957,III,
958,III,"She went the long way to them by the mills,"
959,III,She told herself that she must find her son.
960,III,The night was ominous of many ills;
961,III,"The soughing larch-clump almost made her run,"
962,III,Her boots hurt (she had got a stone in one)
963,III,And bitter beaks were tearing at her liver
964,III,That her boy’s heart was turned from her forever.
965,III,
966,III,"She kept the lane, past Spindle’s, past the Callows’,"
967,III,"Her lips still muttering prayers against the worst,"
968,III,"And there were people coming from the sallows,"
969,III,Along the wild duck patch by Beggar’s Hurst.
970,III,"Being in moonlight mother saw them first,"
971,III,"She saw them moving in the moonlight dim,"
972,III,A woman with a sweet voice saying ’Jim.’
973,III,
974,III,"Trembling she grovelled down into the ditch,"
975,III,They wandered past her pressing side to side.
976,III,"’O Anna, my belov’d, if I were rich.’"
977,III,"It was her son, and Anna’s voice replied,"
978,III,"’Dear boy, dear beauty boy, my love and pride.’"
979,III,"And he: ’It’s but a silver thing, but I"
980,III,Will earn you better lockets by and bye.’
981,III,
982,III,"’Dear boy, you mustn’t.’  ’But I mean to do.’"
983,III,’What was that funny sort of noise I heard?’
984,III,’Where?’  ’In the hedge; a sort of sob or coo.
985,III,Listen.  It’s gone.’  ’It may have been a bird.’
986,III,Jim tossed a stone but mother never stirred.
987,III,"She hugged the hedgerow, choking down her pain,"
988,III,While the hot tears were blinding in her brain.
989,III,
990,III,"The two passed on, the withered woman rose,"
991,III,"For many minutes she could only shake,"
992,III,"Staring ahead with trembling little ’Oh’s,’"
993,III,The noise a very frightened child might make.
994,III,"’O God, dear God, don’t let the woman take"
995,III,"My little son, God, not my little Jim."
996,III,"O God, I’ll have to starve if I lose him.’"
997,III,
998,III,"So back she trembled, nodding with her head,"
999,III,"Laughing and trembling in the bursts of tears,"
1000,III,"Her ditch-filled boots both squelching in the tread,"
1001,III,"Her shopping-bonnet sagging to her ears,"
1002,III,Her heart too dumb with brokenness for fears.
1003,III,The nightmare whickering with the laugh of death
1004,III,Could not have added terror to her breath.
1005,III,
1006,III,"She reached the house, and: ’I’m all right,’ said she,"
1007,III,"’I’ll just take off my things; but I’m all right,"
1008,III,"’I’d be all right with just a cup of tea,"
1009,III,"If I could only get this grate to light,"
1010,III,The paper’s damp and Jimmy’s late to-night;
1011,III,"""Belov’d, if I was rich,"" was what he said,"
1012,III,"O Jim, I wish that God would kill me dead.’"
1013,III,
1014,III,"While she was blinking at the unlit grate,"
1015,III,"Scratching the moistened match-heads off the wood,"
1016,III,"She heard Jim coming, so she reached his plate,"
1017,III,And forked the over-frizzled scraps of food.
1018,III,"’You’re late,’ she said, ’and this yer isn’t good,"
1019,III,Whatever makes you come in late like this?’
1020,III,"’I’ve been to Plaister’s End, that’s how it is.’"
1021,III,
1022,III,’You’ve been to Plaister’s End?’
1023,III,’Yes.’
1024,III,’I’ve been staying
1025,III,For money for the shopping ever so.
1026,III,"Down here we can’t get victuals without paying,"
1027,III,"There’s no trust down the Bye Street, as you know,"
1028,III,And now it’s dark and it’s too late to go.
1029,III,You’ve been to Plaister’s End.  What took you there?’
1030,III,’The lady who was with us at the fair.’
1031,III,
1032,III,"’The lady, eh?  The lady?’"
1033,III,"’Yes, the lady.’"
1034,III,’You’ve been to see her?’
1035,III,’Yes.’
1036,III,’What happened then?’
1037,III,’I saw her.’
1038,III,’Yes.  And what filth did she trade ye?
1039,III,Or d’you expect your locket back agen?
1040,III,I know the rotten ways of whores with men.
1041,III,What did it cost ye?’
1042,III,’What did what cost?’
1043,III,’It.
1044,III,Your devil’s penny for the devil’s bit.’
1045,III,
1046,III,’I don’t know what you mean.’
1047,III,"’Jimmy, my own."
1048,III,"Don’t lie to mother, boy, for mother knows."
1049,III,"I know you and that lady to the bone,"
1050,III,"And she’s a whore, that thing you call a rose,"
1051,III,A whore who takes whatever male thing goes;
1052,III,A harlot with the devil’s skill to tell
1053,III,The special key of each man’s door to hell.’
1054,III,
1055,III,"’She’s not.  She’s nothing of the kind, I tell’ee.’"
1056,III,’You can’t tell women like a woman can;
1057,III,"A beggar tells a lie to fill his belly,"
1058,III,"A strumpet tells a lie to win a man,"
1059,III,Women were liars since the world began;
1060,III,"And she’s a liar, branded in the eyes,"
1061,III,"A rotten liar, who inspires lies.’"
1062,III,
1063,III,’I say she’s not.’
1064,III,"’No, don’t’ee Jim, my dearie,"
1065,III,"You’ve seen her often in the last few days,"
1066,III,She’s given a love as makes you come in weary
1067,III,To lie to me before going out to laze.
1068,III,"She’s tempted you into the devil’s ways,"
1069,III,"She’s robbing you, full fist, of what you earn,"
1070,III,"In God’s name, what’s she giving in return?’"
1071,III,
1072,III,"’Her faith, my dear, and that’s enough for me.’"
1073,III,"’Her faith.  Her faith.  O Jimmy, listen, dear;"
1074,III,"Love doesn’t ask for faith, my son, not he;"
1075,III,"He asks for life throughout the live-long year,"
1076,III,And life’s a test for any plough to ere
1077,III,"Life tests a plough in meadows made of stones,"
1078,III,"Love takes a toll of spirit, mind and bones."
1079,III,
1080,III,"I know a woman’s portion when she loves,"
1081,III,"It’s hers to give, my darling, not to take;"
1082,III,"It isn’t lockets, dear, nor pairs of gloves,"
1083,III,"It isn’t marriage bells nor wedding cake,"
1084,III,"It’s up and cook, although the belly ache;"
1085,III,"And bear the child, and up and work again,"
1086,III,And count a sick man’s grumble worth the pain.
1087,III,
1088,III,"Will she do this, and fifty times as much?’"
1089,III,’No.  I don’t ask her.’
1090,III,"’No.  I warrant, no."
1091,III,"She’s one to get a young fool in her clutch,"
1092,III,And you’re a fool to let her trap you so.
1093,III,"She love you?  She?  O Jimmy, let her go;"
1094,III,"I was so happy, dear, before she came,"
1095,III,And now I’m going to the grave in shame.
1096,III,
1097,III,"I bore you, Jimmy, in this very room."
1098,III,"For fifteen years I got you all you had,"
1099,III,"You were my little son, made in my womb,"
1100,III,"Left all to me, for God had took your dad,"
1101,III,"You were a good son, doing all I bade,"
1102,III,"Until this strumpet came from God knows where,"
1103,III,"And now you lie, and I am in despair."
1104,III,
1105,III,"Jimmy, I won’t say more.  I know you think"
1106,III,"That I don’t know, being just a withered old,"
1107,III,"With chaps all fallen in and eyes that blink,"
1108,III,And hands that tremble so they cannot hold.
1109,III,"A bag of bones to put in churchyard mould,"
1110,III,A red-eyed hag beside your evening star.’
1111,III,"And Jimmy gulped, and thought ’By God, you are.’"
1112,III,
1113,III,"’Well, if I am, my dear, I don’t pretend."
1114,III,"I got my eyes red, Jimmy, making you."
1115,III,"My dear, before our love time’s at an end"
1116,III,Think just a minute what it is you do.
1117,III,"If this were right, my dear, you’d tell me true;"
1118,III,"You don’t, and so it’s wrong; you lie; and she"
1119,III,"Lies too, or else you wouldn’t lie to me."
1120,III,
1121,III,Women and men have only got one way
1122,III,And that way’s marriage; other ways are lust.
1123,III,"If you must marry this one, then you may,"
1124,III,If not you’ll drop her.’
1125,III,’No.’  ’I say you must.
1126,III,Or bring my hairs with sorrow to the dust.
1127,III,"Marry your whore, you’ll pay, and there an end."
1128,III,"My God, you shall not have a whore for friend."
1129,III,
1130,III,"By God, you shall not, not while I’m alive."
